id,domain,title,authors,published,abstract,url,categories
2606.06340,Space,Minor Ions as a Diagnostic of Solar Wind Heating: Inverted Mass-to-Charge Scaling in Imbalanced Turbulence,"Michael F. Zhang, Evan L. Yerger, Matthew W. Kunz, Jonathan Squire",2026-06-04T16:13:26Z,"Alfvénic turbulence is vital to powering the solar wind and corona, yet eludes a comprehensive understanding of the kinetic processes by which it dissipates. Minor ions are sensitive tracers of these processes, showing extreme perpendicular temperatures and mass-weighted temperature trends that can either correlate or anticorrelate with mass-to-charge ratio, $A_i/Z_i$. We use a combination of quasilinear theory and 3D hybrid-kinetic simulations to explain these features and their correlations with properties of turbulence in the fast solar wind. When Alfvénic turbulence is imbalanced, its cascade to ion-Larmor scales is throttled by the helicity barrier. This barrier ultimately leads to high-frequency proton-cyclotron waves (PCWs), both oblique and parallel, the latter of which produce very flat electric-energy spectra ($\mathcal{E}_{E_{\perp}}\sim k_\parallel^{-η}$ with $η<2$) over the range of scales that are cyclotron resonant with minor ions. While steeper spectra lead to a positive correlation of heating with $A_i/Z_i$, the shallower spectra cause the dependence to invert, with $Q_i\propto Q_{\mathrm{p}}A_i(A_i/Z_i)^{η-2}$. Six simulations of balanced and imbalanced turbulence spanning $β_{\rm p0}=\{1,0.3,1/16\}$ corroborate this prediction, showing minor-ion heating rates that follow $(A_i/Z_i)^a$. Minor-ion heating is strongest and most perpendicular in our lowest $β_{\rm p0}=1/16$ simulation of imbalanced turbulence, reaching $T_{\perp{\rm O}^{5+}}/T_{\perp{\rm p}}\approx40$ and $T_{\perp{\rm O}^{5+}}/T_{\parallel{\rm O}^{5+}}\approx10$, consistent with low-coronal observations. Future minor-ion measurements should test whether intervals in which minor-ion thermal speeds decrease with increasing mass-to-charge ratio are associated with a history of large cross helicity, enhanced power in parallel PCWs, and a steep transition-range spectrum.",https://arxiv.org/abs/2606.06340v1,"astro-ph.SR, physics.plasm-ph, physics.space-ph"
2606.06305,Space,A micronova burst in the intermediate polar IGR J17014-4306,"Alexandre S. Oliveira, D. C. Souza, G. J. M. Luna, C. V. Rodrigues",2026-06-04T15:44:29Z,"We report the detection of a short optical burst in TESS data of IGR J17014-4306, the eclipsing intermediate polar with the longest known orbital period. The burst lasts 1.56 d and shows multiple peaks, reaching $(9.3 \pm 0.2) \times 10^{33}$ erg s$^{-1}$, and releases a total energy of $(3.25 \pm 0.01) \times 10^{38}$ erg. The burst parameters are consistent with those of a micronova eruption, currently understood as a thermonuclear runaway in the magnetically-confined accretion column. From its energy, we infer a burned column mass of $\sim 1.6 \times 10^{-11}$ M$_\odot$, which implies a recurrence time of $\sim 20$ d. Our search for similar events in long-term Gaia, ASAS-SN, and AAVSO light curves reveals 16 possible fast brightenings over $\sim 11$ yr, suggesting that micronova events may be frequent in IGR J17014-4306. Timing analysis of the TESS data shows that the white-dwarf spin period remains stable before and after the burst. During the burst, however, the power spectrum becomes more complex and exhibits multiple peaks. The classification of IGR J17014-4306 as a micronova brings the total number of confirmed systems to eight. Its extreme orbital period and eclipsing nature make it an ideal test-bed for further studies of magnetically confined thermonuclear burning on white dwarfs.",https://arxiv.org/abs/2606.06305v1,"astro-ph.HE, astro-ph.SR"
2606.06237,Space,Sensitivity Limits and Operational Threshold Calibration for DINOv2-based Gravitational-Wave Glitch Characterization: A Strain-Domain Mock Data Challenge on LIGO O4a,Luca Cirfeta,2026-06-04T14:41:36Z,"We present a Mock Data Challenge (MDC) to characterize the sensitivity limits of the gravi-signal-ml pipeline (Cirfeta 2026) for unsupervised gravitational-wave glitch detection. Strain-domain synthetic injections of eight morphological families into public LIGO O4a L1 data reveal two threshold-dependent sensitivity regimes. With a session-adaptive dynamic threshold (tau_dyn = mu_bg - 2.5 * sigma_bg), the pipeline recovers visually anisotropic morphologies (Butterfly, ZSweep) at matched-filter SNR >= 70, reaching Recall = 1.0, though the False Positive Rate (FPR) remains uncontrolled across sessions. Characterization of the full O4a embedding distribution (N = 188,142 segments) reveals extreme non-Gaussianity (skewness = -4.12, excess kurtosis = 15.38, Shapiro-Wilk p-value near 0), with the left tail best modeled by a Generalized Extreme Value (GEV) distribution. Under a statistically rigorous operational threshold (tau_op = 0.874) calibrated at the empirical 5x10^-5 quantile (FPR < 0.01%), the MDC yields Recall = 0 for all eight morphologies at all tested SNR levels, including narrowband structures (HarmonicComb, NarrowChirp) and impulsive transients (AsymBlip) at SNR up to 430. We trace this insensitivity to the global average pooling of the DINOv2 [CLS] token, which dilutes signals occupying a small fraction (<5%) of the spectrogram's 37x37 patch grid. The null result of Cirfeta (2026) is conditionally reinterpreted: it confirms the absence of novel macro-structures but cannot exclude localized micro-structures. These findings provide a quantitative roadmap for next-generation ViT-based pipelines using patch-level scoring and multi-scale windowing.",https://arxiv.org/abs/2606.06237v1,"astro-ph.IM, gr-qc"
2606.06234,Space,gr8stars II : judgement day for spectroscopic parameter model systematics,"Alix Violet Freckelton, Annelies Mortier, Megan Bedell, Michael Cretignier, Jared R. Kolecki, Andreas J. Korn, Sérgio G. Sousa, Maria Tsantaki, John M. Brewer, Lars A. Buchhave, Guy R. Davies, J. I. González Hernández, Sam Morrell, Martin B. Nielsen, Vera Maria Passegger, Andreas Quirrenbach, Arpita Roy, Nuno C. Santos, A. Suárez Mascareño, Christopher Allan Watson, Lily L. Zhao",2026-06-04T14:39:53Z,"Many areas of astrophysics, including exoplanetary studies, rely on precise and accurate stellar parameters. This demands that uncertainties on these parameters truly reflect all biases and systematics. Within this second work of the \texttt{gr8stars} collaboration, we take a set of 585 bright FGK dwarfs with high resolution, high signal-to-noise ratio spectra from the SOPHIE spectrograph. We determine stellar effective temperature, surface gravity, and metallicity using five different spectroscopic methods for each star, with an additional method used for comparisons. We find a typical scatter of 76 K in \teff, 0.14 dex in \logg, and 0.07 dex in \feh. These deviations are significantly larger than the average precision error on these parameters. We furthermore use isochrone fitting to determine mass, radius, and age for all 585 stars, using input from all results. We use the radii determined by SED fitting in the first \texttt{gr8stars} paper as a comparison to our isochronal radii from this work, in addition to comparing the isochronal \logg to spectroscopic \logg. The scatter in mass and radius from the use of different spectroscopic methods is investigated and propagated to exoplanetary parameters. The induced fractional uncertainties in planetary radius ($\lesssim$ 3 \%) and mass ($\lesssim$ 5\%) are found to be below those typically found in the literature. We estimate a lower limit on planetary equilibrium temperature fractional uncertainty of $\approx$ 4\%, a noise floor that is currently not sufficiently represented in the literature.",https://arxiv.org/abs/2606.06234v1,"astro-ph.SR, astro-ph.EP, astro-ph.IM"
2606.06230,Space,Peas and USPs: Can Stellar Spindown and Peas in a Pod Replicate Ultra-Short-Period Planet Characteristics?,"Adam Distler, Juliette Becker",2026-06-04T14:37:25Z,"Peas-in-a-Pod (PIAP) systems have been shown to be common across exoplanet systems, with regular planet spacings and similar planet sizes. In contrast, ultra-short-period planets have displayed distinct differences from PIAP systems, including higher mutual inclinations, ages, and planet sizes. Using Laplace-Lagrange secular theory, we investigate the ability of stellar spindown to decouple PIAP systems. We find that strictly PIAP systems with regular spacings cannot undergo secular resonance crossings for the expected stellar $J_2$ evolution, and that we instead require the inner planet to migrate inward to undergo this resonance crossing. As a result, there is no inner edge to PIAP systems where systems will always cross a secular resonance and decouple the inner planet. Using expected $J_2$ evolution tracks from stellar evolution models, we find a diversity of expected resonance crossing times, highlighting the ability to test migration pathways and initial stellar obliquities using this framework.",https://arxiv.org/abs/2606.06230v1,astro-ph.EP
2606.06213,Space,Probing a new subclass of llGRB-SN transients: Insights from EP250304a and its associated supernova,"L. Cotter, A. Martin-Carrillo, R. A. J. Eyles-Ferris, L. Izzo, D. B. Malesani, Y. Julakanti, G. Corcoran, A. Saccardi, P. G. Jonker, A. J. Levan, F. Carotenuto, P. T. O'Brien, J. H. Gillanders, J. N. D. van Dalen, M. E. Ravasio, S. Schulze, N. Sarin, F. E. Bauer, M. Fraser, J. Quirola-Vasquez, A. P. C. van Hoof, S. J. Smartt, C. Gall, A. Rest, C. T. Murphey, N. Tanvir, T. -W. Chen, S. Campana, C. Ashall, J. P. Anderson, J. A. Chacon, F. J. Cowie, V. D'Elia, L. Galbany, C. P. Gutierrez, D. H. Hartmann, P. Jakobsson, S. Kobayashi, A. H. Kong, P. Mazalli, T. E. Muller-Bravo, M. De Pasquale, L. Rhodes, A. Rossi, J. Sanchez-Sierras, J. Sollerman, A. Andersson, A. Aryan, T. de Boer, J. S. Bright, K. C. Chambers, M. Gromadzki, M. E. Huber, C. Inserra, T. Lowe, P. Minguez, G. S. Narayan, M. Nicholl, G. S. H. Paek, A. Sedgewick, K. W. Smith, J. W. Tweddle, S. Yang",2026-06-04T14:23:59Z,"With the advent of the Einstein Probe (EP) mission, we are entering a new era in the study of gamma-ray bursts (GRBs), enabling the detection of faint, low-luminosity transients that would previously have gone undetected. EP250304a was an event discovered by EP associated with the broad-lined type Ic supernova (SN) SN 2025fhm located at z = 0.2. Despite no gamma-ray emission being detected at the time of the EP trigger, we identify evidence for a relativistic outflow consistent with a GRB-like jet across multiple wavelengths. We present a detailed spectral and photometric analysis of EP250304a/SN 2025fhm, including multi-band light curve modelling performed with the Redback Python package. We find that this event closely resembles low-luminosity GRB-SNe (llGRB-SNe) such as GRB 060218/SN 2006aj, GRB 100316D/SN 2010bh, and GRB 171205A/SN 2017iuk, all of which exhibit early-time emission consistent with a thermal shocked cocoon. These similarities suggest that EP250304A/SN 2025fhm may belong to an emerging subclass of shocked cocoon-dominated llGRB-SNe, representing the low-luminosity end of a broader continuum of engine-driven GRB-SN explosions.",https://arxiv.org/abs/2606.06213v1,astro-ph.HE
2606.06198,Space,Hub-Aware Hybrid Search: Accelerating the Locally Aligned Ant Technique,"Simone Vilardi, Reynier Peletier, Felipe Contreras, Kerstin Bunte",2026-06-04T14:04:15Z,"Finding manifold structures in noisy and high-dimensional point clouds is a challenging but important problem. In astronomical observation survey and simulation data the detection of filaments, streams (1D), walls (2D) and clusters (3D) gives rise to deeper understanding of the evolution of our universe. The Locally Aligned Ant Technique (LAAT) uses biologically inspired agents to efficiently recover faint and multidimensional structures. However, very dense hubs (e.g. nodes or globular clusters) dominate the ants' activity, creating unnecessary computational overheads. In this paper we propose a two-stage solution. First a fast preprocessing step locates the hubs and replaces them with a tailored likelihood model. Subsequently, a mixed likelihood-pheromone strategy guides the ants to efficiently bridge the dense regions. We demonstrate improvements in detection efficiency and robustness of LAAT with synthetic and a large-scale astronomical N-body simulation of the cosmic web.",https://arxiv.org/abs/2606.06198v1,"cs.NE, astro-ph.CO, astro-ph.GA, astro-ph.IM"
2606.06141,Space,Mass-Orbital Period Distribution of Massive White Dwarfs Formed Through Stable Mass Transfer,"Rizhong Zheng, Hongwei Ge, Christopher A Tout, Hailiang Chen, Zhenwei Li, Dengkai Jiang, Chengyuan Li, Zhijia Tian, Bo Ma, Lifu Zhang, Jian Mou, Xuefei Chen, Zhanwen Han",2026-06-04T13:19:55Z,"White dwarfs (WDs) in binaries can form through either the stable mass-transfer process or common envelope evolution (CEE). Compared to CEE, the stable mass-transfer process can lead to a distinct mass-orbital period ($M_{\mathrm{WD}}-P_{\mathrm{orb}}$) relation. Thus, this relation of WDs contains the information about the evolution channels. We can study the relation in WD binary systems to determine whether their progenitors undergo a CEE. We use the stellar evolution code MESA as our primary computational tool and adopt the quasi-adiabatic criterion to ensure that our models satisfy the conditions for stable mass transfer. Our study considers different mass-transfer schemes, varying metallicities, and the relation for both low-mass and intermediate-mass progenitors. Previous studies have focused on the relation for low-mass progenitors, which cannot explain some long-period, high-mass WD binaries. Our results show that the relations for intermediate-mass progenitors whose cores remain non-degenerate prior to central helium burning can account for the formation channels of long-period and massive WD binaries.",https://arxiv.org/abs/2606.06141v1,astro-ph.SR
2606.06134,Space,Detectability of secondary images from flares near Sgr A* with mock GRAVITY data,"Fengting Xie, Qing-Hua Zhu, Xin Li",2026-06-04T13:17:35Z,"The orbital motion of near-infrared flares reported by the GRAVITY collaboration encodes information about both the dynamics of accretion matter and the underlying spacetime geometry. The centroid track of these flares, which corresponds to the flux-weighted center of light, incorporates contributions from primary, secondary and higher-order images. Thus, it potentially indicates distinctive signatures of the spacetime geometry, even when these individual multiple images remain unresolved. In this study, we explore the detectability of the secondary images from flares orbiting Sgr A* through mock data simulating future GRAVITY observations. Specifically, we compare the model in which the centroid coincides with the track of the primary images with another model in which the centroid incorporates flux-weighted contributions from both the primary and secondary images. Fitting these models to the mock data based on Bayesian framework, we quantify the conditions under which the signature of secondary images can be statistically distinguishable. We demonstrate that increasing the sample size by an order of magnitude alone could not yield strong evidence for distinguishing the secondary image. Robust detectability ($|Δ\text{BIC}| >7.9$) is achieved when both with the improved sample size and astrometric uncertainties reduced to 40\% of current uncertainties of GRAVITY astrometric data. Unlike the primary image, which is dominated by accretion flow physics, the secondary images originate from gravitational lensing in the strong-field regime. Their detection is an essential first step toward probing higher-order images and the photon rings.",https://arxiv.org/abs/2606.06134v1,"astro-ph.HE, gr-qc"
2606.06082,Space,Interaction of Fast Magnetoacoustic Wave with the Localized Coronal Null and Generation of the Energetic Alfvén Wave Packet,"Akash Bairagi, Abhishekh K. Srivastava, Sripan Mondal, T. V. Zaqarashvili, Astrid Veronig, P. Bourdin, Ding Yuan, Ryun-Young Kwon",2026-06-04T12:18:21Z,"In the present paper, we have performed 2.5D resistive magnetohydrodynamic simulations of the interaction of a fast magnetoacoustic wave with a localized coronal magnetic null point. As a result, an Alfvén wave packet is generated by the mode conversion when a fast magnetoacoustic perturbation interacts with the null point. The field-aligned plasma flows are also generated due to the non-linear effects. When the fast mode wavefront interacts with the null, some parts of this wavefront get refracted around it, while some other part is trapped at the null region. Subsequently, the velocity fluctuation out of the plane and in-phase magnetic field fluctuations have evolved and propagated with the local Alfvén speed along the separatrixes at one side of the coronal null region. The resulting disturbance behaves as an incompressible and energetic Alfvén wave packet. A secondary fast magnetoacoustic wave is also produced and propagates. In the synthetic SDO/AIA observations, no intensity fluctuations are evident in the region where the Alfvén wave packet propagates, while the fast magnetoacoustic wave fronts are clearly evident. Our results suggest that given the appropriate physical conditions at the null, when the fast mode wave is incident, Alfvén packets can be excited due to the mode conversion, further carrying substantial momentum and energy flux in the solar corona.",https://arxiv.org/abs/2606.06082v1,astro-ph.SR
2606.06023,Space,Morphological and mineralogical characterization of the Freundlich-Sharonov Basin: Implications for the lunar farside magmatism,"Tvisha Kapadia, Neha Panwar, Neeraj Srivastava, Rishitosh Sinha, Megha Bhatt, Anil Bhardwaj",2026-06-04T11:14:59Z,"Volcanism on the Moon is highly asymmetric, with the nearside having extensive mare emplacements and the farside exhibiting only sparse, localized volcanism. The Freundlich-Sharonov Basin (FS Basin), a preNectarian/Nectarian impact basin located on the central farside of the Moon (18.35N, 175.2E), hosts a limited volume of spatially restricted and isolated volcanic patches, which provide an ideal geological setting to investigate controls on the lunar magmatism in a thick, KREEP poor farside crust. In this study, detailed geological characterization of the FS Basin is provided for the first time, incorporating insights from morphological, chronological, and compositional analyses using high resolution datasets from missions such as Chandrayaan1 (Moon Mineralogy Mapper), Kaguya, and Lunar Reconnaissance Orbiter. The results of this study reveal a previously undetected ~192 km diameter inner depression ring, along with spatially aligned subsurface magmatic intrusions, and exposures of PAN and orthopyroxenes along the basin rings. Compositional analyses indicate that the FS Basin experienced at least two volcanic eruptions dominated by exceptionally high-alumina basalts (~16 to 24 wt% Al2O3) around ~3.4 Ga and ~2.1 Ga. This is the highest reported alumina content in the lunar maria, also expanding the period of known high alumina volcanism on the Moon to the late phase. We propose that the limited extent of volcanic eruptions in the FS Basin is a result of the combined effects of composition-dependent magma buoyancy, reduced magma production, and impact modified crustal structures determining the magma extrusion sites.",https://arxiv.org/abs/2606.06023v1,astro-ph.EP
2606.05944,Space,Simulations of interaction between outflow and surrounding broken power-law circumnuclear medium: implications for different radio light curves of TDEs,"Xiangli Lei, Qingwen Wu, Chang Zhou, Wei-Hua Lei, Ya-Ping Li, Jiancheng Wu, Weibo Yang",2026-06-04T09:46:14Z,"The complex radio light curves of tidal disruption events (TDEs) challenge our understanding of the properties of both the outflows and the circumnuclear medium (CNM) surrounding supermassive black holes. In this work, we explore outflow-CNM interactions across a broad parameter space using three-dimensional hydrodynamic simulations, adopting a broken power-law CNM density profile with a transition near the Bondi radius. The outflow-CNM interaction inside Bondi radius produces an early radio flare (\(\lesssim 2\) yr) once the emitting region becomes optically thin. A second radio rebrightening can appear a few years later if the outflow decelerates beyond Bondi radius. We also find that either a very dense inner CNM, which causes rapid deceleration, or a rarefied outer CNM suppresses the late rebrightening that will produces a single early-peaked flare. In contrast, a rarefied CNM inside the Bondi radius suppresses the early flare and yields a single late-peaked event. For the case of very dense CNM at large radii, the interaction will trigger a sharp late-time rise as observed in some TDEs. We further explore the interaction of a relativistic jet with a broken power-law CNM, which can reproduce the characteristic light curves as observed in jetted TDEs without invoking complex jet structure.",https://arxiv.org/abs/2606.05944v1,astro-ph.HE
2606.05934,Space,Planet engulfment in the chemically anomalous HD 129171/HD 129209 pair,"Anne Rathsam, Jorge Meléndez, Rodolfo Smiljanic, Fan Liu, Lorenzo Spina",2026-06-04T09:37:48Z,"Binary systems composed of stars with similar parameters should have identical chemical composition. However, many chemically anomalous pairs have been found in the literature, such as the binary HD 129171/HD 129209. It is still unclear whether these anomalies originate from inhomogeneities of protostellar clouds, with important implications for chemical tagging and theories of star formation, or if they are caused by a planet engulfment event suffered by one binary component. In this work, we measure precise differential abundances for the system HD 129171/HD 129209 to explore the planet engulfment hypothesis proposed in the literature. We focus particularly on the Be abundance, showing that this element can serve as a diagnostic of engulfment events for solar-type stars. Atmospheric parameters were determined imposing spectroscopic equilibrium of iron lines. Masses and ages were estimated with the isochronal method. Li, Be, N and O abundances were determined via spectral synthesis. Other elemental abundances (up to Zn) were determined by equivalent width measurements. The spectra adopted in the analysis were gathered using UVES/ESO. We confirm the large difference in [Fe/H] (0.120 $\pm$ 0.004 dex) and A(Li) (-1.00 $\pm$ 0.02 dex) among the members of the pair, and the trend between differential abundances and condensation temperature of the elements. The binary system also shows detectable differences in Be abundances (-0.20 $\pm$ 0.04 dex). The abundance pattern of the pair is reasonably reproduced by an engulfment model of 11.2 M$_\oplus$ of rocky material. The difference in chemical abundances of the HD 129171/HD 129209 pair provides strong evidence in favor of the planet engulfment scenario. In this context, the detection of a Be difference among chemically inhomogeneous binary systems can be used as a diagnostic of rocky material ingestion suffered by a member of the pair.",https://arxiv.org/abs/2606.05934v1,"astro-ph.SR, astro-ph.EP"
2606.05910,Space,Modeling Gamma-Ray Burst Spectra with Convolutional Neural Networks: Fast-Cooling Synchrotron Emission in a Decaying Magnetic Field,"Jia-Ming Chen, Ke-Rui Zhu, Shan Chang, Zhao-Yang Peng, Yong-Gang Zheng, Li Zhang",2026-06-04T09:16:14Z,"The radiation mechanism of gamma-ray burst (GRB) prompt emission remains uncertain. Although the fast-cooling synchrotron model in a decaying magnetic field can account for the characteristic nonthermal spectral shape, its computational cost has limited its use in systematic observational fitting and statistical model comparison. We develop a convolutional neural network (CNN)-based spectral emulator for this physical model and train it on a large synthetic data set generated over a physically motivated parameter space. The trained network reproduces the numerical spectra with high fidelity while reducing the cost of spectral evaluation to the millisecond level. We then incorporate the emulator into a Bayesian spectral-analysis framework and apply it to the time-resolved spectra of GRB 231020A observed by Fermi/GBM. In most time intervals, the decaying-field fast-cooling synchrotron model provides better fits and smaller Bayesian information criterion values than the standard fast-cooling synchrotron model. These results suggest that a radially decaying magnetic field provides a plausible and more physically motivated interpretation of the prompt-emission spectrum of this burst, while also indicating that the emulator offers a practical route for large-sample Bayesian inference and systematic comparisons of GRB prompt-emission models.",https://arxiv.org/abs/2606.05910v1,astro-ph.HE
