id,domain,title,authors,published,abstract,url,categories
2606.06255,Robotics,RadiusFPS: Efficient Farthest Point Sampling on CPUs and GPUs via Spherical Voxel Pruning,"Ziyang Yu, Xiang Li, Qiong Chang, Jun Miyazaki",2026-06-04T14:57:05Z,"Point clouds are a primary sensory representation for robotic perception, underpinning LiDAR-based autonomous driving, simultaneous localization and mapping (SLAM), and navigation. Within these pipelines, Farthest Point Sampling (FPS) is the most well-known downsampling operator, as its uniform coverage preserves the geometric structure on which downstream perception relies. However, the large time complexity of classical FPS scales poorly with the million-point-per-second rates of modern 3D sensors, making it a dominant latency bottleneck that conflicts with the real-time and limited onboard compute budgets of robotic systems. Therefore, we propose RadiusFPS, an FPS acceleration framework based on spherical voxel pruning that preserves the standard FPS update rule under the same initialization and tie-breaking policy. By indexing the point cloud with spherical voxels, RadiusFPS derives a conservative geometric bound that prunes redundant distance computations in each iteration, complemented by a coordinate-wise point-skip test that removes residual updates. We further introduce RadiusFPS-G, a warp-level GPU implementation that fuses voxel selection, pruning, and distance update into memory-coalesced kernels, eliminating costly global-memory round-trips. On indoor (S3DIS, ScanNet) and outdoor LiDAR (SemanticKITTI) benchmarks, RadiusFPS-G attains up to 2.5x speedup over GPU-based FPS and matches or exceeds QuickFPS among the evaluated methods while using roughly half its GPU memory, with comparable segmentation accuracy. When coupled with the learning-based FastPoint sampler, the resulting pipeline achieves the fastest End-to-End inference among all evaluated configurations. These properties make high-quality FPS-style sampling practical for latency- and memory-constrained robotic vision.",https://arxiv.org/abs/2606.06255v1,"cs.RO, cs.CV, cs.DC"
2606.06250,Robotics,Breaking Time: A Fully Gaussian Framework for Distributed and Continuous-Time SLAM,"Davide Ceriola, Simone Ferrari, Luca Di Giammarino, Leonardo Brizi, Giorgio Grisetti",2026-06-04T14:52:25Z,"Continuous-time SLAM provides a principled framework for fusing heterogeneous sensors while estimating smooth trajectories, and is particularly well-suited for handling heterogeneous, asynchronous sensor streams with non-uniform readout patterns, such as rolling shutter cameras, LiDAR scanners, radar sweeps, or event-based sensors. In this work, we introduce G-solver, a fully Gaussian and distributed framework that combines Gaussian Belief Propagation (GBP) with Gaussian Process (GP) motion priors for continuous-time trajectory estimation. Our GP model provides a probabilistic representation of the trajectory, enabling consistent interpolation and the use of data-driven hyperparameters, while GBP offers a scalable message-passing formulation well-suited for decentralized settings. The resulting solver naturally extends to multi-camera scenarios without specialized synchronization or engineering effort. We evaluate the approach on synthetic and real data, including rolling shutter and distributed multi-camera optimization, demonstrating accurate and stable estimation with runtimes comparable to existing continuous-time methods. An open-source implementation is released.",https://arxiv.org/abs/2606.06250v1,cs.RO
2606.06245,Robotics,MPCoT: Reward-Guided Multi-Path Latent Reasoning for Test-Time Scalable Vision-Language-Action,"Boyang Zhang, Lianlei Shan",2026-06-04T14:48:44Z,"Vision-Language-Action (VLA) policies remain brittle in long-horizon and high-uncertainty control, where one-pass action decoding provides limited inference-time deliberation. Explicit chain-of-thought can increase reasoning depth, but introduces token latency and an indirect text-to-action interface. We propose MPCoT, a reward-guided multi-path latent reasoning framework that initializes $M$ hypotheses, refines them for K weight-tied steps, and softly aggregates them before action decoding. A training-only path-preference objective evaluates candidate action branches with expert-action consistency, world-model/VLM-based progress, and success feedback to align the latent path scorer with downstream execution quality. MPCoT preserves the original 8-step action interface, generates zero reasoning tokens, and exposes configurable inference controls (K,M). Under matched protocols on LIBERO and CALVIN, MPCoT improves long-horizon performance, with ablations confirming depth-width effects, confidence-weighted aggregation, and reward-guided path supervision.",https://arxiv.org/abs/2606.06245v1,"cs.RO, cs.AI"
2606.06219,Robotics,CLEAR: Cognition and Latent Evaluation for Adaptive Routing in End-to-End Autonomous Driving,"Yining Xing, Zehong Ke, Zhiyuan Liu, Yanbo Jiang, Wenhao Yu, Jianqiang Wang",2026-06-04T14:32:10Z,"End-to-end autonomous driving models often struggle to balance multi-modal maneuver generation with real-time inference constraints. While diffusion models successfully capture diverse driving behaviors, their iterative denoising process incurs unacceptable latency for safety-critical deployment. To address this, we propose CLEAR (Cognition and Latent Evaluation for Adaptive Routing), a framework that combines ultra-fast generative planning with deep semantic reasoning. CLEAR employs Drive-JEPA as the visual encoder and replaces the multi-step denoising chain with a single-step conditional drift in a VAE latent space, introducing a conditioning coefficient to balance diversity and expert precision. Meanwhile, we fully fine-tune Qwen~3.5~0.8B on driving QA pairs to extract scene-aware hidden states. These states guide both an Adaptive Scheduler, which selects the conditioning coefficient $α$ and sample count $N$ from a discrete set of predefined schemes, and a cross-attention scorer that selects the optimal trajectory from candidates. On the NAVSIM v1 benchmark, CLEAR achieves a state-of-the-art PDMS of 93.7. Our results demonstrate that high-fidelity, multi-modal planning can be executed efficiently without dense geometric annotations or iterative sampling.",https://arxiv.org/abs/2606.06219v1,"cs.RO, cs.AI"
2606.06218,Robotics,TAM: Torque Adaptation Module for Robust Motion Transfer in Manipulation,"Dongwon Son, Florian Shkurti, Jason Lee, Naman Shah, Beomjoon Kim, Dieter Fox",2026-06-04T14:31:54Z,"A policy tuned for one robot often behaves differently on another, whether due to the sim-to-real gap, unknown payloads, or the differing dynamics of two instances of the same robot. In contact-rich, dynamic manipulation, even small motion discrepancies can result in failure to track reference motion, since they disrupt the timing and modes of contact. Common remedies, such as domain randomization or system identification, either produce overly conservative task policies or require data that must be recollected for each robot or payload. We introduce the Torque Adaptation Module (TAM), a learned module that adapts the torque commands sent to the robot to match the behavior of an ideal robot. TAM operates between the low-level controller that tracks the policy's actions and the robot's torque interface. It includes a history encoder that embeds proprioceptive history into a latent state and a torque adaptor that computes residual torque corrections. Because TAM depends only on proprioceptive history and not on policy observations, or the action space, the same TAM weights can be reused to adapt policies with different action spaces (joint targets, end-effector targets, or direct torques). The policies themselves do not need to be trained with domain randomization of robot parameters. Instead, we offload the need for domain randomization to TAM by training it entirely in randomized simulation, using multi-robot pretraining followed by a robot-specific fine-tuning step that still requires no real-robot data. We evaluate TAM zero-shot on a real Franka Panda robot across dynamic manipulation tasks that include a vision-based box pushing policy (from RL), a flip policy (from BC), and an MPC ball-on-plate balancing. Our experiments show that TAM improves zero-shot real-robot execution compared to online system identification and RMA baselines and enables robust dynamic manipulation performance.",https://arxiv.org/abs/2606.06218v1,"cs.RO, cs.AI"
2606.06194,Robotics,ActiveMimic: Egocentric Video Pretraining with Active Perception,"Xingyao Lin, Guojin Zhong, Tianyi Lu, Ziyi Ye, Yichen Zhu, Zuxuan Wu, Yu-Gang Jiang",2026-06-04T14:01:01Z,"Egocentric human video offers a scalable alternative to robot data for pretraining, yet models pretrained on such video consistently underperform those pretrained on robot data. We attribute this gap to a missing signal, the active perception behavior in egocentric videos, where humans continuously reposition their viewpoint during manipulation, inducing camera motion that standard pipelines treat as noise. To address this, we present ActiveMimic, a pretraining framework that recovers synchronized camera and wrist trajectories from a single body-worn RGB camera, models camera motion as a viewpoint action, and jointly learns active perception and manipulation from in-the-wild egocentric human video before adapting to a target robot. Empirically, real-world experiments across tasks with diverse active perception demands show that ActiveMimic consistently surpasses baselines pretrained on human video and matches state-of-the-art models pretrained on robot data. Further analysis provides evidence that active perception capability originates from egocentric human video pretraining rather than robot-specific fine-tuning, confirming active perception as the key to unlocking egocentric human video for robot pretraining.",https://arxiv.org/abs/2606.06194v1,"cs.RO, cs.CV"
2606.06155,Robotics,AffordanceVLA: A Vision-Language-Action Model Empowering Action Generation through Affordance-Aware Understanding,"Qize Yu, Jiadi You, Yuran Wang, Jiaqi Liang, Bowen Ping, Yang Tian, Yue Chen, Minghong Cai, Zeying Gong, Ruihai Wu, Yinchuan Li, Junwei Liang, Yingcong Chen",2026-06-04T13:28:51Z,"Vision-Language-Action (VLA) models leverage the rich world knowledge of pretrained vision-language models (VLMs) to enable instruction-following robotic manipulation. However, the structural mismatch between VLM semantic spaces and embodied control policies often hinders the learning of precise perception--action mappings. To address this challenge, we propose \textbf{AffordanceVLA}, a unified framework that introduces structured affordance forecasting as a task-oriented intermediate representation to establish a more precise and robust perception--action mapping. Specifically, we progressively model manipulation priors through three complementary components: 1) \textbf{Which2Act} for object-centric grounding via visual latent prediction to suppress distractions; 2) \textbf{Where2Act} for 2D interaction localization via affordance map estimation; and 3) \textbf{How2Act} for 3D geometric reasoning to guide manipulation policies. These affordance cues provide spatially grounded, semantically conditioned, and action-coupled intermediate representations, thereby naturally bridging vision, language and action. We integrate these modules into a Mixture-of-Transformer (MoT) architecture with specialized experts and train the model using a three-stage training strategy with a progressive data curriculum. To overcome the scarcity of dense affordance labels in robotic datasets, we also develop a robust automated data augmentation pipeline. Extensive experiments on simulation and real-world demonstrate that AffordanceVLA achieves strong performance across diverse manipulation scenarios.",https://arxiv.org/abs/2606.06155v1,"cs.RO, cs.CV, cs.MM"
2606.06139,Robotics,MotionDisco: Motion Discovery for Extreme Humanoid Loco-Manipulation,"Ilyass Taouil, Michal Ciebelski, Shafeef Omar, Haizhou Zhao, Angela Dai, Aaron M. Johnson, Majid Khadiv",2026-06-04T13:19:49Z,"We present MotionDisco, a framework that discovers contact-rich, long-horizon humanoid loco-manipulation motions from scratch, without relying on teleoperation or motion retargeting from human demonstrations. This is challenging because the space of possible contact interactions grows combinatorially with the task horizon and the number of objects in the scene. MotionDisco enables rapid discovery of novel motions by coupling a large language model (LLM) guided evolutionary search over sequences of interactions with an efficient sequential kinodynamic trajectory optimizer and pruning strategy, enabling the rapid discovery of novel skills. Through extensive ablation studies, we show that our LLM-guided search discovers successful whole-body trajectories across several challenging long-horizon tasks. Finally, by training reinforcement learning tracking policies on the discovered trajectories, we transfer the motions to a real humanoid robot. This is the first work to discover and deploy long-horizon humanoid loco-manipulation skills entirely through automated evolutionary search. Supplementary videos of the experiments are available at: https://youtu.be/DHiVz34QYlw.",https://arxiv.org/abs/2606.06139v1,cs.RO
2606.06130,Robotics,Towards Realistic 3D Sonar Simulation,"Youssef Attia, Davide Costa, Francesco Wanderlingh, Filippo Campagnaro, Enrico Simetti",2026-06-04T13:16:32Z,"As underwater robotics research increasingly addresses complex 3D perception and autonomous navigation, the fidelity of sonar simulation has become a key factor in algorithm development. Current simulation frameworks typically rely on geometry-driven rendering, approximating 3D sonar as an underwater equivalent to LiDAR, which fails to account for fundamental acoustic phenomena such as refraction, multi-path interference, and phase-dependent signal formation. This paper proposes a modular architecture for realistic 3D sonar simulation that integrates GPU-accelerated graphics engines with physically grounded acoustic propagation principles. We implement a volumetric 3D sonar model within the NVIDIA Isaac Sim environment, modeled after the Water Linked 3D-15 sensor, and integrate it into a comprehensive underwater simulation framework. The system is validated through a hardware-in-the-loop configuration, where a modified FastLIO2 SLAM pipeline, executed on an NVIDIA Jetson Orin Nano, performs sensor fusion using synthetic 3D sonar, DVL, IMU, and pressure data. Finally, a qualitative comparison between simulated outputs and real-world data from harbor sheet-pile inspections is provided, characterizing the remaining sim-to-real gap and establishing a roadmap toward fully acoustics-driven volumetric sensing.",https://arxiv.org/abs/2606.06130v1,cs.RO
2606.06077,Robotics,3D Underwater Path Planning via Generative Flow Field Surrogates,"Zachary Cooper-Baldock, Paulo E. Santos, Russell S. A. Brinkworth, Karl Sammut",2026-06-04T12:14:59Z,"Autonomous underwater vehicle (AUV) launch and recovery (LAR) into the hull of an advancing host platform requires traversal of a complex, three-dimensional propeller wake whose hydrodynamic structure cannot be characterised by a uniform current model. High-fidelity Reynolds-Averaged Navier-Stokes (RANS) Computational Fluid Dynamics (CFD) simulations resolve this structure with sufficient accuracy for path planning, but their computational cost renders them impractical for onboard use. We address this gap by integrating two conditional generative adversarial network (cGAN) architectures -- a regularised PatchGAN and a 2D3DGAN with self-attention -- as drop-in replacements for RANS CFD data within a three-dimensional, energy-weighted A* path planning framework. Both generators are driven by a hierarchical pipeline that synthesises full $128^3$ voxel flow field volumes from scalar operating condition inputs alone, with end-to-end inference times of approximately 28-146 $μ$s, compared to hours for a single RANS computation. We benchmark all four environmental knowledge levels: uniform current, ground-truth CFD, PatchGAN, and 2D3DGAN~SA across 19,800 independently generated trajectories spanning 550 distinct flow conditions. Full CFD wake knowledge reduces energy expenditure by 5.7-12.5% and high-velocity wake-core encounters by up to 77.8% relative to uniform-current planning, with both benefits scaling with operating severity. The cGAN surrogates recover approximately 45-60% of the CFD energy benefit and high-velocity cell avoidance benefit while operating at inference speeds compatible with edge device use. These results provide the first systematic quantification of the downstream path planning value of cGAN-predicted hydrodynamic fields in a three-dimensional maritime robotics application.",https://arxiv.org/abs/2606.06077v1,"cs.RO, cs.LG"
2606.06061,Robotics,A Conversational Framework for Human-Robot Collaborative Manipulation with Distributed Generative AI models,"Arash Ghasemzadeh Kakroudi, Roel Pieters",2026-06-04T12:00:41Z,"This paper presents a distributed conversational framework for human-robot collaborative manipulation that integrates local language and vision-language models (VLMs) with a Robot Operating System 2 (ROS 2)-based execution stack. Language understanding, visual grounding, orchestration, and motion execution run as separate ROS 2 nodes, enabling flexible deployment across distributed hardware while maintaining a responsive control loop. From free-form user commands, the system generates structured action requests for pick, place, and handover. It uses a VLM to return image-space targets, which are converted into metric robot-frame goals using depth and calibration. A web dashboard exposes intermediate intent and grounding overlays (pixel, depth, and robot-frame) and requires explicit operator confirmation before any motion is executed. Experiments on a Franka FR3 platform evaluate end-to-end task reliability and latency under increasing working table scene ambiguity and compare alternative LLM/VLM configurations in the same pipeline. Code and full documentation are available at [github.com/cogrob-tuni/franka-llm](https://github.com/cogrob-tuni/franka-llm).",https://arxiv.org/abs/2606.06061v1,cs.RO
2606.06049,Robotics,L-SDPPO: Policy Optimization of Spiking Diffusion Policy for Intra-vehicular Robotic Manipulation,"Liwen Zhang, Dong Zhou, Guanghui Sun, Yifei Zheng, Yuhui Hu, Kaihong Ouyang, Zuoquan Zhao",2026-06-04T11:45:37Z,"Intra-vehicular robots in spacecraft help reduce astronaut workload and improve mission efficiency. Recent research focuses on using deep learning methods to achieve the acute control required for operations in these complex environments. However, objects exhibit unpredictable, unconstrained drift without gravitational damping. These factors demand robustness against complex multimodal action distributions. Diffusion policies (DP) can model these complex actions, but their iterative sampling process consumes too much energy for the limited power budgets of spacecraft. We therefore propose a low-energy intra-vehicular robotic manipulation framework, L-SDPPO, in which the Spiking Diffusion Policy (SDP) is optimized with a reinforcement learning (RL) algorithm. Furthermore, to address the insufficient perception of dynamic spatiotemporal features in microgravity, we propose the statedependent latency injection (SDLI) mechanism, which mimics biological neural delays to dynamically regulate the timing of input information. Evaluation on five representative intra-vehicular daily tasks (e.g., hatch opening and precision container capping) shows that our method consistently achieves higher success rates and lower energy consumption, compared to the state-of-the-art robotic manipulation methods. These results demonstrate our method is a viable intra-vehicular robotic manipulation method.",https://arxiv.org/abs/2606.06049v1,cs.RO
2606.06041,Robotics,Sample-efficient Low-level Motion Planning for Robotic Manipulation Tasks via Zero-shot Transfer Learning,"Yuanzhi He, Victor Romero-Cano, José J. Patiño, Juan David Hernández, William Sawtell, Gualtiero Colombo",2026-06-04T11:34:50Z,"As robotic systems become more sophisticated, the growing complexity of their motion planning models and the longer training times pose substantial challenges. Evolutionary algorithms such as the Sample-efficient Cross-Entropy Method (iCEM) have recently demonstrated promising potential for low-level real-time planning by leveraging efficient knowledge reuse strategies to improve performance. Although effective in many control tasks, iCEM's performance can be constrained in more complex scenarios, particularly those requiring stacking, sliding, and shelf placement. In this work, we propose a novel iCEM+TL framework that explicitly leverages Transfer Learning (TL), where key iCEM parameters are transferred from simpler upstream tasks to guide more complex downstream tasks. Additionally, we applied Reward Redesign (RR) through task decomposition for stacking objects and shelf placement to optimize task-specific performance. Results from the simulation show that our framework achieves success rate improvements of up to 23%. The framework is further validated on a real Franka Emika robot in a stacking task, demonstrating its practical feasibility for real-world deployment.",https://arxiv.org/abs/2606.06041v1,"cs.RO, cs.AI, cs.NE"
2606.06040,Robotics,Gotta Grow Fast: Design and Benchmarking of a Tip Mount for High-Speed Vine Robots,"Antonio Alvarez Valdivia, Robert Reeve, Ankush Dhawan, Ciera McFarland, Chad Council, Margaret McGuinness, Nathaniel Hanson",2026-06-04T11:34:06Z,"Soft, growing vine robots extend through tip eversion, a mechanism that enables navigation through cluttered environments. However, integrating cameras and other sensors at the tip is uniquely challenging because the material forming the tip is constantly renewed as the robot grows. This continual material turnover, combined with friction between internal layers, added tip weight, and fabric constriction, complicates sensor and tool mounting. These limitations hinder the deployment of vine robots for inspection and search tasks, where rapid growth while carrying tip-mounted sensors is essential. In this work, we present a triangular roller tip mount that reduces internal resistance during growth by rolling rather than sliding against the robot body. The design was refined through iterative failure analysis, enabling, for the first time, consistent eversion on a TPU-coated ripstop nylon vine robot. To quantitatively evaluate mount performance, we introduce a custom testbed that isolates tip mounting effects by measuring tail tension during eversion. Comparative experiments across multiple mount variants, including prior designs, show that our triangular roller mount achieves the lowest tail tension and most repeatable growth performance. These results establish both a validated tip mount design and a repeatable benchmarking framework for advancing sensor and tool integration in soft growing robots. CAD for the mount and testbed is available at: https://sprout-mitll.github.io/tip_mounts/.",https://arxiv.org/abs/2606.06040v1,"cs.RO, eess.SY"
2606.06033,Robotics,RealDexUMI: A Wearable Universal Manipulation Interface for Dexterous Robot Learning,"Chaoyi Xu, Yixuan Jiang, Jiahui Huan, Yuhui Fu, Haoyu Zhou, Weitian Yuan, Jiayi Yu, Wanpeng Zhang, Haoqi Yuan, Zongqing Lu",2026-06-04T11:28:23Z,"Learning dexterous manipulation requires demonstrations that preserve fine hand-object interactions while remaining executable at deployment. Existing pipelines either lose deployable dexterity through retargeting or embodiment conversion, or rely on robot-specific teleoperation that is costly to scale and often lacks intuitive, contact-aware control for dexterous data collection. We present RealDexUMI, a wearable universal manipulation interface built around a shared dexterous end-effector module that integrates a lightweight dexterous hand, in-hand vision, and fingertip tactile sensing. A palm-side isomorphic teleoperation glove maps human finger inputs to robot-hand joint commands, enabling real-time, retargeting-free, intuitive, and precise hand control. The shared hand and sensing modules yield zero-gap end-effector data, with matched in-hand observations, tactile signals, contacts, and hand actions between collection and deployment. Across eight real-robot tasks spanning fine-grained, contact-rich, long-horizon, and bimanual manipulation, policies trained on RealDexUMI data achieve an average success rate of 88.75%, generalize to unseen initial poses, and transfer across three embodiments. Website: https://research.beingbeyond.com/realdexumi",https://arxiv.org/abs/2606.06033v1,cs.RO
