id,domain,title,authors,published,abstract,url,categories
2605.00121,Robotics,Predictive Spatio-Temporal Scene Graphs for Semi-Static Scenes,"Miguel Saavedra-Ruiz, Charlie Gauthier, Kumaraditya Gupta, Shima Shahfar, Kirsty Ellis, Steven Parkison, Liam Paull",2026-04-30T18:21:13Z,"We have seen tremendous recent progress in our ability to build ""spatio-semantic"" representations that enable robots to perform complex reasoning across geometry and semantics. However, the vast majority of these methods lack any ability to perform reasoning across time. This is a desirable property in situations where a robot repeatedly observes an environment where instances may change in between observations, but in a structured way. Consider as an example a home environment where the location of a mug typically moves from the cupboard to a countertop to the sink and then back to the cupboard on a daily basis. We should be able to learn this cyclic behavior and use it to predict the state of the mug in the future. In this work, we propose a method that is able to perform this type of tempo-spatio-semantic reasoning. Underpinning the method is a filter, Perpetua$^*$, that performs Bayesian reasoning on the states of the environment that are observed over time. This filter is integrated within a 3D scene graph structure that we call PredictiveGraphs, where nodes represent objects and edges function as Perpetua$^*$ filters encoding spatio-semantic relationships. We validate the method in both simulation and real-world dynamic navigation tasks, where our real world experiments consist of an environment that is undergoing semi-static changes at a bi-hourly frequency over a period of three weeks. In both settings, we demonstrate that our method outperforms baselines in predicting future environment states, even in the presence of distributional shifts.",https://arxiv.org/abs/2605.00121v1,cs.RO
2604.28197,Robotics,OmniRobotHome: A Multi-Camera Platform for Real-Time Multiadic Human-Robot Interaction,"Junyoung Lee, Sookwan Han, Jeonghwan Kim, Inhee Lee, Mingi Choi, Jisoo Kim, Wonjung Woo, Hanbyul Joo",2026-04-30T17:59:58Z,"Human-robot collaboration has been studied primarily in dyadic or sequential settings. However, real homes require multiadic collaboration, where multiple humans and robots share a workspace, acting concurrently on interleaved subtasks with tight spatial and temporal coupling. This regime remains underexplored because close-proximity interaction between humans, robots, and objects creates persistent occlusion and rapid state changes, making reliable real-time 3D tracking the central bottleneck. No existing platform provides the real-time, occlusion-robust, room-scale perception needed to make this regime experimentally tractable. We present OmniRobotHome, the first room-scale residential platform that unifies wide-area real-time 3D human and object perception with coordinated multi-robot actuation in a shared world frame. The system instruments a natural home environment with 48 hardware-synchronized RGB cameras for markerless, occlusion-robust tracking of multiple humans and objects, temporally aligned with two Franka arms that act on live scene state. Continuous capture within this consistent frame further supports long-horizon human behavior modeling from accumulated trajectories. The platform makes the multiadic collaboration regime experimentally tractable. We focus on two central problems: safety in shared human-robot environments and human-anticipatory robotic assistance, and show that real-time perception and accumulated behavior memory each yield measurable gains in both.",https://arxiv.org/abs/2604.28197v1,"cs.RO, cs.CV"
2604.28192,Robotics,LaST-R1: Reinforcing Action via Adaptive Physical Latent Reasoning for VLA Models,"Hao Chen, Jiaming Liu, Zhonghao Yan, Nuowei Han, Renrui Zhang, Chenyang Gu, Jialin Gao, Ziyu Guo, Siyuan Qian, Yinxi Wang, Peng Jia, Chi-Wing Fu, Shanghang Zhang, Pheng-Ann Heng",2026-04-30T17:59:52Z,"Vision-Language-Action (VLA) models have increasingly incorporated reasoning mechanisms for complex robotic manipulation. However, existing approaches share a critical limitation: whether employing explicit linguistic reasoning that suffers from latency and discretization, or utilizing more expressive continuous latent reasoning, they are predominantly confined to static imitation learning that limits adaptability and generalization. While online reinforcement learning (RL) has been introduced to VLAs to enable trial-and-error exploration, current methods exclusively optimize the vanilla action space, bypassing the underlying physical reasoning process. In this paper, we present \textbf{LaST-R1}, a unified VLA framework that integrates latent Chain-of-Thought (CoT) reasoning over physical dynamics prior to action execution, along with a tailored RL post-training paradigm. Specifically, we propose \textbf{Latent-to-Action Policy Optimization (LAPO)}, a novel RL algorithm that jointly optimizes the latent reasoning process and the action generation. By bridging reasoning and control, LAPO improves the representation of physical world modeling and enhances robustness in interactive environments. Furthermore, an \textbf{adaptive latent CoT mechanism} is introduced to allow the policy to dynamically adjust its reasoning horizon based on environment complexity. Extensive experiments show that LaST-R1 achieves a near-perfect 99.8\% average success rate on the LIBERO benchmark with only one-shot supervised warm-up, significantly improving convergence speed and performance over prior state-of-the-art methods. In real-world deployments, LAPO post-training yields up to a 44\% improvement over the initial warm-up policy across four complex tasks, including both single-arm and dual-arm settings. Finally, LaST-R1 demonstrates strong generalization across simulated and real-world environments.",https://arxiv.org/abs/2604.28192v1,"cs.RO, cs.CV"
2604.28161,Robotics,RopeDreamer: A Kinematic Recurrent State Space Model for Dynamics of Flexible Deformable Linear Objects,"Tim Missal, Lucas Domingues, Berk Guler, Simon Manschitz, Jan Peters, Paula Dornhofer Paro Costa",2026-04-30T17:47:44Z,"The robotic manipulation of Deformable Linear Objects (DLOs) is a fundamental challenge due to the high-dimensional, non-linear dynamics of flexible structures and the complexity of maintaining topological integrity during contact-rich tasks. While recent data-driven methods have utilized Recurrent and Graph Neural Networks for dynamics modeling, they often struggle with self-intersections and non-physical deformations, such as tangling and link stretching. In this paper, we propose a latent dynamics framework that combines a Recurrent State Space Model with a Quaternionic Kinematic Chain representation to enable robust, long-term forecasting of DLO states. By encoding the DLO as a sequence of relative rotations (quaternions) rather than independent Cartesian positions, we inherently constrain the model to a physically valid manifold that preserves link-length constancy. Furthermore, we introduce a dual-decoder architecture that decouples state reconstruction from future-state prediction, forcing the latent space to capture the underlying physics of deformation. We evaluate our approach on a large-scale simulated dataset of complex pick-and-place trajectories involving self-intersections. Our results demonstrate that the proposed model achieves a 40.52% reduction in open-loop prediction error over 50-step horizons compared to the state-of-the-art baseline, while reducing inference time by 31.17%. Our model further maintains superior topological consistency in scenarios with multiple crossings, proving its efficacy as a compositional primitive for long-horizon manipulation planning.",https://arxiv.org/abs/2604.28161v1,cs.RO
2604.28156,Robotics,"FlexiTac: A Low-Cost, Open-Source, Scalable Tactile Sensing Solution for Robotic Systems","Binghao Huang, Yunzhu Li",2026-04-30T17:43:07Z,"We present FlexiTac, a low-cost, open-source, and scalable piezoresistive tactile sensing solution designed for robotic end-effectors. FlexiTac is a practical ""plug-in"" module consisting of (i) thin, flexible tactile sensor pads that provide dense tactile signals and (ii) a compact multi-channel readout board that streams synchronized measurements for real-time control and large-scale data collection. FlexiTac pads adopt a sealed three-layer laminate stack (FPC-Velostat-FPC) with electrode patterns directly integrated into flexible printed circuits, substantially improving fabrication throughput and repeatability while maintaining mechanical compliance for deployment on both rigid and soft grippers. The readout electronics use widely available, low-cost components and stream tactile signals to a host computer at 100 Hz via serial communication. Across multiple configurations, including fingertip pads and larger tactile mats, FlexiTac can be mounted on diverse platforms without major mechanical redesign. We further show that FlexiTac supports modern tactile learning pipelines, including 3D visuo-tactile fusion for contact-aware decision making, cross-embodiment skill transfer, and real-to-sim-to-real fine-tuning with GPU-parallel tactile simulation. Our project page is available at https://flexitac.github.io/.",https://arxiv.org/abs/2604.28156v1,"cs.RO, cs.AI, cs.LG"
2604.28148,Robotics,Design and Characteristics of a Thin-Film ThermoMesh for the Efficient Embedded Sensing of a Spatio-Temporally Sparse Heat Source,"Sajjad Boorghan Farahan, Ahmed Alajlouni, Jingzhou Zhao",2026-04-30T17:35:40Z,"This work presents ThermoMesh, a passive thin-film thermoelectric mesh sensor designed to detect and characterize spatio-temporally sparse heat sources through conduction-based thermal imaging. The device integrates thermoelectric junctions with linear or nonlinear interlayer resistive elements to perform simultaneous sensing and in-sensor compression. We focus on the single-event (1-sparse) operation and define four performance metrics: range, efficiency, sensitivity, and accuracy. Numerical modeling shows that a linear resistive interlayer flattens the sensitivity distribution and improves minimum sensitivity by approximately tenfold for a $16\times16$ mesh. Nonlinear temperature-dependent interlayers further enhance minimum sensitivity at scale: a ceramic negative-temperature-coefficient (NTC) layer over 973--1273~K yields a $\sim14{,}500\times$ higher minimum sensitivity than the linear design at a $200\times200$ mesh, while a VO$_2$ interlayer modeled across its metal--insulator transition (MIT) over 298--373~K yields a $\sim24\times$ improvement. Using synthetic 1-sparse datasets with white boundary-channel noise at a signal-to-noise ratio of 40~dB, the VO$_2$ case achieved $98\%$ localization accuracy, a mean absolute temperature error of $0.23$~K, and a noise-equivalent temperature (NET) of $0.07$~K. For the ceramic-NTC case no localization errors were observed under the tested conditions, with a mean absolute temperature error of $1.83$~K and a NET of $1.49$~K. These results indicate that ThermoMesh could enable energy-efficient embedded thermal sensing in scenarios where conventional infrared imaging is limited, such as molten-droplet detection or hot-spot monitoring in harsh environments.",https://arxiv.org/abs/2604.28148v1,"cs.RO, eess.IV, physics.ins-det"
2604.28115,Robotics,FreeOcc: Training-Free Embodied Open-Vocabulary Occupancy Prediction,"Zeyu Jiang, Changqing Zhou, Xingxing Zuo, Changhao Chen",2026-04-30T17:05:56Z,"Existing learning-based occupancy prediction methods rely on large-scale 3D annotations and generalize poorly across environments. We present FreeOcc, a training-free framework for open-vocabulary occupancy prediction from monocular or RGB-D sequences. Unlike prior approaches that require voxel-level supervision and ground-truth camera poses, FreeOcc operates without 3D annotations, pose ground truth, or any learning stage. FreeOcc incrementally builds a globally consistent occupancy map via a four-layer pipeline: a SLAM backbone estimates poses and sparse geometry; a geometrically consistent Gaussian update constructs dense 3D Gaussian maps; open-vocabulary semantics from off-the-shelf vision-language models are associated with Gaussian primitives; and a probabilistic Gaussian-to-occupancy projection produces dense voxel occupancy. Despite being entirely training-free and pose-agnostic, FreeOcc achieves over $2\times$ improvements in IoU and mIoU on EmbodiedOcc-ScanNet compared to prior self-supervised methods. We further introduce ReplicaOcc, a benchmark for indoor open-vocabulary occupancy prediction, and show that FreeOcc transfers zero-shot to novel environments, substantially outperforming both supervised and self-supervised baselines. Project page: https://the-masses.github.io/freeocc-web/.",https://arxiv.org/abs/2604.28115v1,"cs.RO, cs.CV"
2604.28111,Robotics,GSDrive: Reinforcing Driving Policies by Multi-mode Trajectory Probing with 3D Gaussian Splatting Environment,"Ziang Guo, Chen Min, Xuefeng Zhang, Yixiao Zhou, Zufeng Zhang, Dzmitry Tsetserukou",2026-04-30T16:59:07Z,"End-to-end (E2E) autonomous driving presents a promising approach for translating perceptual inputs directly into driving actions. However, prohibitive annotation costs and temporal data quality degradation hinder long-term real-world deployment. While combining imitation learning (IL) and reinforcement learning (RL) is a common strategy for policy improvement, conventional RL training relies on delayed, event-based rewards-policies learn only from catastrophic outcomes such as collisions, leading to premature convergence to suboptimal behaviors. To address these limitations, we introduce GSDrive, a framework that exploits 3D Gaussian Splatting (3DGS) for differentiable, physics-based reward shaping in E2E driving policy improvement. Our method incorporates a flow matching-based trajectory predictor within the 3DGS simulator, enabling multi-mode trajectory probing where candidate trajectories are rolled out to assess prospective rewards. This establishes a bidirectional knowledge exchange between IL and RL by grounding reward functions in physically simulated interaction signals, offering immediate dense feedback instead of sparse catastrophic events. Evaluated on the reconstructed nuScenes dataset, our method surpasses existing simulation-based RL driving approaches in closed-loop experiments. Code is available at https://github.com/ZionGo6/GSDrive.",https://arxiv.org/abs/2604.28111v2,cs.RO
2604.28057,Robotics,Framework for Collaborative Operation of Autonomous Delivery Vehicles Within a Marshaling Yard,"James O'Hara, Karl Wunderlich, Gregory Stevens",2026-04-30T16:02:59Z,"As autonomous vehicles slowly deploy into urban roads for limited use cases with significant edge case issues, closed facilities like marshaling yards provide a ripe case for combining lower-level vehicle autonomy with fixed infrastructure to create full autonomy without similar edge case concerns. Within a delivery marshaling yard, electric fleet vehicles complete a set of sequential tasks (charging, inspection, cleaning, and loading) before exiting the yard with their new load of deliveries. Hybrid automation of the vehicles and infrastructure can allow these vehicles to reach full autonomy and navigate the facility without the need of a driver, allowing for quicker movement between tasks increasing vehicle throughput. However, isolated autonomous operations based on static rules are prone to gridlock causing facility failures that temporarily shut down operations. Our orchestrated autonomy solution uses decentralized, dynamic priority scoring of vehicles based on the current status of the marshaling yard to optimally assign vehicles to tasks to increase vehicle throughput. Using a simulated facility with three marshaling yard sizes (small, medium, and large) and three demand levels (low, medium, high), we demonstrated that our orchestration solution increases vehicle throughput above static, isolated autonomy for all combinations of yard size and demand, while reducing facility failures at high demand levels.",https://arxiv.org/abs/2604.28057v1,"cs.RO, cs.MA"
2605.00815,Energy,Revealing the origin of XMCD in an altermagnet via three-dimensional control of spins,"Daire Mallon, Zixuan Wu, Jheng-Cyuan Lin, Ruiwen Xie, Bo Zhao, Charles Godfrey, Qing He, Lucia Iglesias, Pierluigi Gargiani, Manuel Valvidares, Peter Bencok, Francesco Maccherozzi, Larissa S. I. Veiga, Paul Steadman, Manuel Bibes, Hongbin Zhang, Paolo G. Radaelli, Hariom Jani",2026-05-01T17:55:10Z,"Altermagnets are an emerging class of collinear antiferromagnets that exhibit unconventional spin-polarised electronic bands, potentially unlocking new functionalities that do not rely on spin-orbit coupling (SOC). Experimental signatures traditionally associated with spin polarisation, like X-ray magnetic circular dichroism (XMCD), are thus being used as a validation of altermagnetism. However, unlike altermagnetic spin-splitting, these responses require SOC and are not invariant under spin-space rotations. This brings into question the extent to which they can be considered direct signatures of altermagnetism. Here, we exploit the g-wave altermagnet $α$-Fe$_{2}$O$_{3}$ to demonstrate that XMCD is governed precisely by the spin-direction-induced symmetry breaking that altermagnetic spin groups are designed to ignore. Strikingly, the XMCD is highly anisotropic and is decoupled from the weak magnetic canting. We show that this anomalous XMCD can be described by on-site Faraday tensors capturing the locally uncompensated spin-orbital anisotropies - a scenario that can be applied to other altermagnets. Leveraging this, we reconstruct complete vectorial maps of nanoscale textures in $α$-Fe$_{2}$O$_{3}$ thin films, including domain walls and topological solitons, which are promising for building future spintronics and magnonics devices.",https://arxiv.org/abs/2605.00815v1,"cond-mat.mtrl-sci, cond-mat.mes-hall, cond-mat.other"
2605.00802,Energy,Determination of Density Functional Tight Binding Models for Cerium Allotropes,"Nir Goldman, Artem Samtsevych, Chiara Panosetti",2026-05-01T17:40:40Z,We have developed Density Functional Tight Binding (DFTB) models for cerium that accurately predict both the electronic band structure and energetic ordering of different allotropes. We show that global optimization of the electronic confining potentials minimize the errors in the predicted Kohn-Sham energies while facilitating determination of a many-body repulsive energy. Our results illustrate the ability of DFTB to accurately reproduce complex f-electron interactions for multiple phases while leveraging minimal Density Functional Theory data.,https://arxiv.org/abs/2605.00802v1,cond-mat.mtrl-sci
2605.00801,Energy,Oxygen Vacancies at Dislocation Core Modulate Plasticity in Strontium Titanate,"Min-Chul Kang, Chunxu Yan, Alexander Frisch, Xufei Fang, Liming Xiong, Lin Zhou",2026-05-01T17:39:50Z,"Dislocation core chemistry in oxides critically influences mechanical behavior and functionality; yet the evolution of core chemistry during the dislocation motion in them has not been directly observed. Here, using SrTiO3 as a model material, we combine aberration-corrected scanning transmission electron microscopy and electron energy-loss spectroscopy with atomic-level molecular dynamics (MD) simulations to correlate the <110>{1-10} dislocation core structure, oxygen vacancy density, charge state, and mobility with each other. We find that the mechanically induced dislocation loops exhibit dissociated cores, whose oxygen vacancy density depends on the gliding distance: short loops are Ti-reduced and oxygen-deficient at the edge dislocation core, whereas longer loops remain close to stoichiometry in both the edge and screw components. MD simulations reveal that kink-assisted edge dislocation glide in SrTiO3 leaves oxygen-deficient trails behind, modulating the oxygen content inside the edge core. These results demonstrate that oxygen-vacancy evolution at the dislocation core intrinsically couples with plasticity in ionic crystals, suggesting a mechanism for oxygen vacancy-dependent dislocation mobility in plastically deformed oxides.",https://arxiv.org/abs/2605.00801v1,cond-mat.mtrl-sci
2605.00703,Energy,TrueEBSD in MTEX: automatic image matching for correlative microscopy applications,"Vivian Tong, Stefan Olovsjö, Rachid M'Saoubi, Mathias Grabner, Manuel Petersmann, Liam Wright",2026-05-01T14:46:25Z,"TrueEBSD is an open-source MATLAB program for image alignment and spatial distortion correction of images and electron backscatter diffraction (EBSD) maps. We have re-implemented TrueEBSD as an add-on to MTEX, an established toolbox for EBSD data analysis. Spatial alignment enables correlative analysis methods, such as augmenting EBSD orientation maps with data from other imaging modes. The augmented EBSD maps can then be analysed further using MTEX. We demonstrate TrueEBSD on two example case studies: one for measuring Co phase fraction and WC contiguity in a WC-Co composite, and another for determining the relative susceptibility of grain boundaries to void formation in a copper polycrystal. In both examples, the EBSD map was augmented with scanning electron microscopy (SEM) image data. This enabled quantitative crystallographic measurements which would not be possible from analysing the EBSD maps and images separately.",https://arxiv.org/abs/2605.00703v1,cond-mat.mtrl-sci
2605.00639,Energy,Born-Qualified: An Autonomous Framework for Deploying Advanced Energy and Electronic Materials,"Steven R. Spurgeon, Milad Abolhasani, Frederick Baddour, Ryan B. Comes, Vinayak P. Dravid, Hilary Egan, Patrick Emami, Robert W. Epps, Davi M. Fébba, Renae Gannon, E. Ashley Gaulding, Ayana Ghosh, Kenny Gruchalla, Grace Guinan, Taro Hitosugi, Michael Holden, Sergei V. Kalinin, Yangang Liang, John S. Mangum, Matthew J. Olszta, Nathaniel H. Park, Axel Palmstrom, Michelle A. Smeaton, Brooks Tellekamp, Nicholas E. Thornburg, Raymond R. Unocic, Daniela Ushizima, Rama K. Vasudevan, Robert White, Andrew Young, Andriy Zakutayev",2026-05-01T13:21:25Z,"Autonomous science is transforming how we discover materials and chemical systems for advanced energy technologies. However, many initially promising systems never reach deployment. This ""valley of death"" stems from optimization that prioritizes laboratory metrics over industrial viability. We propose a new strategy: ""born-qualified"" autonomous development, which embeds manufacturability, cost, and durability constraints from the outset. This approach is enabled by four pillars, including the development of multi-objective metrics, causal models, a modular infrastructure, and embedding manufacturing in the discovery loop. Realizing this vision will require sustained, community-wide commitment, but the potential return on that investment is commensurate with the scale of the challenge.",https://arxiv.org/abs/2605.00639v1,"cond-mat.mtrl-sci, cs.AI"
2605.00609,Energy,Coordination Engineering of Dual-Atom Catalysts for Overall Water Splitting: Mechanistic Insights from Constant-Potential First-Principles and Machine Learning,"Jiahang Li, Suhang Li, Chong Yan, Jiajun Yu, Qinzhuang Liu, Ruo-Ya Wang, Dongwei Ma",2026-05-01T12:20:22Z,"The rational design of bifunctional electrocatalysts for the hydrogen evolution reaction (HER) and oxygen evolution reaction (OER) is essential for achieving efficient and cost-effective overall water splitting. Atomically dispersed transition-metal catalysts, including single-atom catalysts and dual-atom catalysts (DACs), have emerged as a prominent class of heterogeneous catalysts, in which coordination engineering plays a decisive role in tuning catalytic performance. Herein, we explore coordination-engineered bifunctional overall water splitting electrocatalysts using graphene-supported DACs (TM1TM2-C6-xNx) as model systems. By tuning C/N coordination and dual-metal combinations (Fe, Co, Ni, and Cu), a library of 228 structures was constructed. A three-step screening strategy, combining constant-charge and constant-potential density functional theory with kinetic analysis of proton-coupled electron transfer (PCET), identifies 24 highly active candidates (TM1TM2 = CoNi, CoCu and Co2) with mixed C/N coordination for OER. These catalysts exhibit overpotentials comparable to that of IrO2 and low PCET barriers (lower than 0.40 eV), among which 22 also show high HER activity. Machine learning reveals clear coordination-dependent structure-performance relationships. Such bifunctionality arises from coordination engineering that enables the simultaneous optimization of OER intermediate adsorption and the hydrogen binding strength for HER. This work establishes coordination engineering as an effective strategy for designing high-performance bifunctional dual-atom electrocatalysts for overall water splitting.",https://arxiv.org/abs/2605.00609v1,cond-mat.mtrl-sci
