id,domain,title,authors,published,abstract,url,categories
2606.21587,AI,FAST: A Framework for Aligned Sampling and Training in Parallel Reinforcement Learning for Autonomous Driving,"Bonan Wang, Letian Tao, Bin Shuai, Jiaxin Gao, Wenxin Zhao, Wei Xiong, Kehua Sheng, Bo Zhang, Yang Guan, Shengbo Eben Li",2026-06-19T16:44:18Z,"Deep reinforcement learning is pivotal for closed-loop autonomous driving yet remains constrained by severe bottlenecks in sampling efficiency. Standard parallel sampling mitigates this but suffers from the straggler effect, where the premature termination of a single environment necessitates a synchronized batch re-initialization, leading to suboptimal sample utilization and prohibitive re-initialization latency. To address this, we propose FAST, a synchronous parallel framework tailored for closed-loop simulation. Specifically, FAST employs Dynamic Parallel Sampling Alignment (DPSA) to maintain vectorization synchronization by extending terminated episodes via virtual continuation, thereby decoupling the sampling loop from individual terminations. By dynamically triggering global truncation based on the termination rate of parallel clips, FAST effectively eliminates the bottleneck of premature resets without sacrificing data diversity. Furthermore, to strictly preserve theoretical consistency, we incorporate a Scaled Mask-Padding Optimization (SMPO) that leverages validity masking and adaptive loss normalization to nullify the bias from auxiliary padding data. Empirical evaluations demonstrate that FAST achieves at least a 1.78 times wall-clock speedup over the single-clip baseline while preserving statistical unbiasedness.",https://arxiv.org/abs/2606.21587v1,"cs.LG, cs.AI"
2606.21585,AI,The Cost Geometry of Belief: finite-resource inference under noisy observation,Laurent Caraffa,2026-06-19T16:41:28Z,"We equip the space of beliefs with a cost geometry (what it costs to pass from one belief to another): optimal transport in Wasserstein space, reweighted conformally by Fisher information (the price of the precision at stake), distinct from the Fisher-Rao metric. In the setting we consider, a finite machine maintains a digital twin of a system; observing the territory through finite, noisy sensors, we model its coherent output as a belief: a probability density over states, the Bayes posterior. Certainty (the perfect twin) is denied twice, by observation and by physics, both read off the Fisher information. On the conformal class, essentially location-scale, three results emerge, all invariants of one change of cost unit. A wall: a well-posed inference rejects certainty to infinite distance as soon as the cost dominates the Fisher information (necessity conjectured beyond power laws). An honesty: an honest (eikonal) cost, each nat the same length everywhere, selects the geometries proportional to the Fisher information. A rigidity: these geometries are hyperbolic, and the Stam bound crowns the Gaussian, the most hyperbolic location-scale belief. Changing the unit dilates the geometry yet preserves the wall, the curvature ordering, and the extremality of the Gaussian: an absolute cost says nothing, only relative cost carries meaning, the value -1/4 being one of its images. The cost of reaching a given precision then has a geometric floor diverging at certainty. Thermodynamics fixes the cost unit and motivates this framework; the results are geometric, in nats.",https://arxiv.org/abs/2606.21585v1,"cs.LG, cs.IT, math.DG, math.ST"
2606.21579,AI,The Unreasonable Effectiveness of VLMs for Zero-shot Procedural Mistake Detection,"Serdar Ozsoy, Lars Doorenbos, Federico Spurio, Gianpiero Francesca, Juergen Gall",2026-06-19T16:31:44Z,"Procedural mistake detection is important for quality control and user assistance across many disciplines. Recent work in this field has achieved significant gains by using the reasoning capabilities of Video-Language Models (VLMs) as components within multi-stage pipelines, which consist of separate modules for supervised temporal action segmentation, error detection, and explainability. Consequently, they remain dependent on tailored training datasets and require task-specific training, limiting their wider applicability. To remedy this, we introduce zero-shot procedural mistake detection and propose a unified Zero-shot Procedural Mistake detection (ZeProM) framework that jointly solves procedural mistake detection and temporal action segmentation with a single pre-trained VLM. By evaluating our framework on two canonical mistake detection benchmarks, EgoPER and CaptainCook4D, we find that ZeProM can perform these tasks successfully, while approaching, or even outperforming, the performance of fully supervised methods. For instance, we achieve a 4.4 point improvement in EDA and a 2.0 point improvement in F1@.5 on average over all five EgoPER tasks compared to the strongest supervised methods. Overall, our results show the potential of unified methods for procedural mistake detection, and we hope this will steer the field away from highly complex pipelines and toward more generally applicable solutions.",https://arxiv.org/abs/2606.21579v1,"cs.CV, cs.AI"
2606.21565,AI,Composing Verifiable Conceptual Models via Building Blocks: Towards Design-Time Verification of Agentic AI Workflows,"Noe Y. Flandre, Alexander C. Nwala, Philippe J. Giabbanelli",2026-06-19T16:03:53Z,"Agentic AI systems orchestrate multiple LLM-based agents through workflow architectures that coordinate decisions, tools, and external actions. While current platforms emphasize runtime safeguards, little support exists for verifying workflows during system design. From a Modeling \& Simulation perspective, this gap is analogous to composing conceptual models without verifying whether their building blocks interact coherently. We propose a design-time verification approach that models agentic workflows as compositions of reusable building blocks and checks their compatibility through twelve structural rules. We implemented these rules in a software prototype and evaluated them using two openly released datasets: 48 workflows with known design flaws and 168 variants that preserve workflow logic but alter graph structure. Results show that our verifier reliably detects violations even when flawed designs are obscured through structural transformations such as splitting tasks between agents. Future works could combine our verification with community repositories of building blocks to compose safe agentic workflows.",https://arxiv.org/abs/2606.21565v1,cs.AI
2606.21564,AI,LIG: Layer-wise Integrated Gradients for Within-Layer Flow Analysis in Transformers,"Eight Suzuki, Hideitsu Hino, Noboru Murata",2026-06-19T16:02:22Z,"Transformers achieve strong performance, but their internal computations remain opaque. We view each Transformer layer as a dynamic graph whose nodes are token representations and per-head attention outputs, with Multi-Head Attention (ATT) and MLP as module boundaries. On this graph we use LIG (Layer-wise Integrated Gradients), which applies set-to-set Integrated Gradients (IG) at nonlinear module boundaries. Set-to-set IG applies IG to a map from a set of input token representations to a set of output representations, evaluating token-to-token contributions, which is not standard in prior IG applications. This extends IG from the usual scalar-objective setting to set-to-set maps via an L2 scalarization, and composes within-layer contributions in the spirit of Layer-wise Relevance Propagation (LRP), with IG completeness playing the role of LRP-style conservation at each boundary. We use LIG to analyze (i) the agreement between module-wise composition and layer-whole attribution under an L2 criterion, and (ii) within-layer information flow by tracing separated ATT and MLP contributions. On BERT-base and PTB, configurations that best preserved within-layer consistency used the target token's embedding as the ATT baseline and either the ATT output at a=0 or Zero as the MLP baseline. We therefore present LIG as a diagnostic XAI tool at module-boundary granularity, without model-specific retraining or per-operation interpreter design. Code is available at https://github.com/eightsuzuki/layer-wise-integrated-gradients.",https://arxiv.org/abs/2606.21564v1,cs.LG
2606.21562,AI,Compressing Observation History into Agent Memory: Distilling Transformers into Recurrent Transformers,"Philippe Weinzaepfel, Christian Wolf, Bülent Mert Sariyildiz, Guillaume Bono, Gianluca Monaci",2026-06-19T15:58:36Z,"Transformers are AI's workhorse with strong performance in modeling sequential data, but their computational cost becomes prohibitive when processing long sequences. We target long-horizon streaming vision and robotics applications like map-free pose estimation, where it is particularly impractical to store and maintain a history of observations. Recurrent Transformers address this limitation by maintaining fixed-size memory but their performance lags behind that of transformers operating over the full observation history. We argue that this gap does not stem from architectural limitations, but from differences in how these models learn to compress past information. Without access to an observation history, recurrent models must explicitly decide what to retain in memory at each step, a significantly harder learning problem. In this work, we propose a distillation approach that transfers the compression strategy of a classical full-history transformer to a recurrent variant. We enable this by designing a teacher model that explicitly compresses its observation history into a fixed-size bottleneck representation. By directly supervising the student's memory with this bottleneck representation, we align the two compression mechanisms. We show that this approach allows to train a recurrent latent robotic memory with linear-time complexity while substantially narrowing the performance gap to full-history transformers.",https://arxiv.org/abs/2606.21562v1,"cs.CV, cs.LG"
2606.21559,AI,Rubric-as-Experts: Case-Specific MQM Rubrics for Translation Quality Evaluation,"Weilu Xu, Yunzhi Shen, Xinye Wang, Ranfei Dang, Shujian Huang",2026-06-19T15:56:16Z,"Large language models (LLMs) have shown strong potential in fine-grained translation quality evaluation (QE), yet existing MQM-based approaches typically rely on fixed rubric configurations shared across all translation samples. However, translation instances often differ substantially in error complexity, ambiguity, and required evaluation granularity, making static rubric allocation suboptimal for span-level error detection. We find that larger MQM subtype spaces improve error coverage but also introduce more false positives, while different translation instances prefer different rubric granularities, suggesting that evaluation spaces should be allocated dynamically for each case. Motivated by these observations, we propose a case-specific dynamic rubric framework that adaptively constructs MQM evaluation spaces for individual translation instances. Unlike fully free-form rubric generation methods, our framework remains grounded in the predefined MQM taxonomy while dynamically selecting suitable subtype spaces and evaluation granularity for different cases. Experiments on WMT span-level QE benchmarks across multiple model scales demonstrate that the proposed framework consistently improves MCC and produces cleaner span-level error localization compared with static rubric settings. Our results suggest that combining structured MQM rubrics with case-specific adaptive allocation is an effective strategy for fine-grained LLM-based translation evaluation.",https://arxiv.org/abs/2606.21559v1,cs.CL
2606.21557,AI,PeerMathDial: A Middle School Dialogue Dataset for Student Collaborative Math Problem Solving,"Murong Yue, Desmond Alexander Mcglone, Emily Slutz, Wenhan Lyu, Yixuan Zhang, Jennifer Suh, Ziyu Yao",2026-06-19T15:55:18Z,"Collaborative Problem Solving (CPS) is a core skill in education, where the process of peer interaction is highly important. However, existing educational dialogue datasets mostly focus on classroom instruction or tutoring (i.e., teacher/tutor-student interaction), yet datasets centering small-group, student-student interaction are limited. This thus leaves research with limited resources for studying how students interact, coordinate, and solve problems together in real educational settings. To address this, we introduce PeerMathDial, the first dataset of peer CPS dialogues collected from authentic middle school math classrooms. It contains 55 dialogues from 27 students, totaling 6,406 turns. To facilitate research on CPS discourse analysis, we further build a corpus-grounded dialogue act taxonomy assisted by LLMs. Using the dataset and the dialogue act taxonomy, we demonstrate the practical applications of PeerMathDial across three use cases. First, we track how dialogues evolve over time and measure the impact of teacher interventions. Second, we align dialogue actions with student surveys to reveal the connection between students' traits (e.g., confidence, leadership) and their actual behaviors. Third, by evaluating LLMs on dialogue act prediction, we glimpse at the potential of LLMs for student simulation in educational applications. Our dataset and source code will be released to the community.",https://arxiv.org/abs/2606.21557v1,cs.CL
2606.21553,AI,Dissecting Agentic RAG: A Component Ablation for Multi-Hop QA with a Local 7B Model,Sheroz Shaikh,2026-06-19T15:50:35Z,"Agentic retrieval-augmented generation (RAG) systems combine iterative reasoning loops, query decomposition, and adaptive retrieval to tackle multi-hop question answering. However, the contribution of each component remains poorly understood, particularly under resource-constrained settings using only local language models. Many agentic designs add adaptive retrieval routing and deeper retrieval loops on the assumption that the added complexity helps. To test whether it does, we run a controlled ablation study of a full agentic RAG pipeline evaluated on 5,000 questions from the HotpotQA distractor development set using a local 7B parameter model (Qwen2.5-7B-Instruct). Our full pipeline achieves EM=53.2% and F1=61.6%, compared to a single-pass dense-retrieval baseline of EM=43.1% and F1=54.0%. Across eight ablation conditions, we find that: (1) fixed hybrid retrieval via reciprocal rank fusion consistently outperforms rule-based adaptive routing (+1.8 EM, +1.9 F1), as the routing heuristic over-routes to BM25 by firing on named entities present in nearly all multi-hop sub-questions; (2) two retrieval iterations over the decomposed sub-questions capture 95% of the gains of five, with no meaningful benefit from deeper loops; and (3) query decomposition and cross-encoder reranking each contribute statistically significant but smaller gains (p<0.01 and p<0.001 respectively). Taken together, on a fixed local-model budget, the simpler and fixed choices turn out to be competitive with or better than their adaptive versions: most of the gain comes from running a short retrieval loop, not from adaptive routing or from many iterations. We use no proprietary APIs or large-scale compute.",https://arxiv.org/abs/2606.21553v1,"cs.CL, cs.IR"
2606.21550,AI,AI Alignment From Social Choice Perspectives,"Daniel Halpern, Evi Micha, Ariel D. Procaccia, Benjamin Schiffer, Itai Shapira, Shirley Zhang",2026-06-19T15:47:01Z,"Alignment from human feedback uses human judgments about model outputs to steer the behavior of language models after pretraining. When those judgments reflect conflicting views of desirable behavior, the learned objective becomes an aggregate determination of what the model should prefer. We survey recent work that has studied this aggregation problem through the lens of social choice theory. We illustrate how the social choice perspective helps identify failure modes in the feedback aggregation layer and reveals a broader design space for handling disagreement in explicit and principled ways.",https://arxiv.org/abs/2606.21550v1,cs.AI
2606.21540,AI,Memory Is No Longer a Bottleneck: Memory-Efficient Graph Filtering for Scalable Collaborative Filtering,"Jin-Duk Park, Won-Yong Shin",2026-06-19T15:39:24Z,"Graph convolutional networks (GCNs) have demonstrated significant success in capturing complex user-item relationships for collaborative filtering (CF). However, due to their reliance on extensive model training, training-free graph filtering (GF)-based CF methods have emerged as a promising alternative, offering computational efficiency by smoothing graph signals via matrix operations. In particular, polynomial GF-based approaches demonstrate improved accuracy through their ability to design more expressive and flexible filtering functions. Despite these advantages, existing GF methods suffer from a critical memory bottleneck: they necessitate storing the full item similarity graph, incurring prohibitive memory costs for large-scale datasets, which limits their practical applicability. To tackle this challenge, we propose Mem-GF (Memory-efficient GF), a new GF-based CF method that departs from conventional designs by principally leveraging the structure of Krylov subspaces as a core mechanism for approximating polynomial graph filters without explicitly storing the item similarity graph. We theoretically analyze the minimum Krylov subspace size that guarantees lossless approximation. Through extensive experiments, we demonstrate that Mem-GF achieves up to 5.74$\times$ lower memory usage and 4.38$\times$ speedup in runtime, while consistently exceeding the recommendation accuracy of state-of-the-art GF and GCN-based methods. Mem-GF robustly scales to datasets with tens of millions of interactions, establishing itself as a practically viable and theoretically grounded solution for efficient CF.",https://arxiv.org/abs/2606.21540v1,"cs.LG, cs.AI, cs.IR, cs.IT, cs.SI"
2606.21528,AI,Accelerated and Stable Convergence with Anchored Optimistic Method,"Motahareh Sohrabi, Jianxin You, Simon Lacoste-Julien, Eduard Gorbunov, Gauthier Gidel",2026-06-19T15:26:10Z,"We study first-order methods for solving monotone variational inequalities arising in min-max optimization. Classical approaches such as the extragradient method rely on two gradient queries per iteration, which limits their analysis and applicability in the online and stochastic settings. We propose a family of Generalized Optimistic Methods with Anchoring (GOMA), which combine two-time-scale optimistic updates with an anchoring term inspired by Halpern iteration. In the deterministic setting, GOMA achieves the optimal accelerated last-iterate rate $O(1/k^2)$ on the squared gradient norm for monotone Lipschitz operators. In the stochastic setting with unbounded variance, a simplified single-call variant of GOMA achieves a last-iterate convergence rate of $O(1/\sqrt{k})$ on the squared gradient norm. To the best of our knowledge, this is the first such guarantee for stochastic monotone Lipschitz variational inequalities in the unconstrained setting without variance reduction or growing batches.",https://arxiv.org/abs/2606.21528v1,"math.OC, cs.GT, cs.LG"
2606.21525,AI,Backpropagating Through Simulation: Analytic Policy Gradients for Sample and Learning Efficient Differentiable Continuous Control,Yueci Deng,2026-06-19T15:22:51Z,"Model-free reinforcement learning algorithms such as Proximal Policy Optimization (PPO) treat the environment as a black box, estimating policy gradients from sampled rewards; this process demands millions of interactions and relies on high-variance advantage estimates. When environment dynamics are differentiable, the return is an end-to-end differentiable function of the policy parameters, enabling exact gradient computation via backpropagation through simulation. We term this approach Analytic Policy Gradients (APG) and evaluate it against PPO on four continuous control tasks of increasing dynamical complexity: a one-dimensional point-mass target-reaching task, a 2D point-mass navigation task with obstacle avoidance, a 2D rigid-body T-block pushing task, and a 7-DOF Franka FR3 end-effector reaching task. Both algorithms share identical model architectures, observation normalization, and optimizer settings. To decouple sample efficiency from compute efficiency, we design a multi-axis evaluation protocol that records performance against environment steps and gradient steps. We report a segmented backpropagation scheme with MC and critic-based bootstrap modes that mitigates gradient degradation on long-horizon tasks, and present ablations over segment length and bootstrap strategy.",https://arxiv.org/abs/2606.21525v1,"cs.LG, cs.AI"
2606.21517,AI,"MedHal-Loc: Are ""Explainable-by-Architecture"" Medical Hallucination Detectors Faithful Localizers? A Localization Benchmark","Minmin Chen, Daojian Lu, Yining Dai, Jvyu Cai, Fengdan Chen",2026-06-19T15:11:37Z,"Detecting hallucinations in clinical text is increasingly framed as an explainability problem: systems should not merely flag an unreliable response but point to the offending span. Architectures built around knowledge-graph (KG) triple decomposition are marketed for exactly this auditability, yet their localization ability is typically assumed rather than measured. We introduce MedHal-Loc, a benchmark and metric for localization faithfulness -- whether a detector's top-ranked error unit actually overlaps the erroneous span. The controlled subset comprises 300 PubMedQA-derived statements with single, span-level errors injected across four localizable types (entity substitution, relation error, mechanism misattribution, invention), yielding gold spans by construction; a complementary natural subset documents that real hallucinations are dominated by diffuse conclusion-flips that resist span localization (a human expert accepted 1/18 candidate spans). Evaluating four fine-grained paradigms, we find that NLI-per-clause, consistency-per-sentence, and the dedicated span detector FAVA all localize well above chance, whereas an elaborate KG-triple pipeline localizes no better than chance (+3.3pp, n.s.), bottlenecked by ~59% entity-extraction coverage -- despite competitive detection F1 (0.609). Detection competence does not imply faithful localization; architectural explainability must be validated, not presumed.",https://arxiv.org/abs/2606.21517v1,cs.CL
2606.21514,AI,Towards Understanding the Power and Limits of the Muon Optimizer: A River-Valley Perspective,"Tianqi Shen, Jinji Yang, Runze Shi, Jianhao Ma, Jiaye Teng, Ziye Ma",2026-06-19T15:10:20Z,"Recently, Muon has gained substantial attention as an appealing alternative to Adam-like optimizers, with many works highlighting its advantages through spectral normalization and improved conditioning. Yet this positive theoretical narrative contrasts with its empirical performance in large language model (LLM) training, where Muon's gains over Adam/AdamW are often mixed, schedule-sensitive, and not uniformly superior. To address this gap, we develop a trajectory-level theory characterizing both the strengths and limitations of Muon. We introduce a mixed-spiked matrix sensing model whose sensing operator decomposes into signal, spike, and bulk components, capturing a mixture of anisotropic structure and long-tail information reminiscent of LLM training. On top of it, we adopted a river-valley perspective in which we view the landscape as composed of a river direction flowing to the desired solution and hill directions encoding nuisance or task-irrelevant information. In the momentum-free setting, we show that Muon moves faster along the information-bearing river direction during early optimization, but can converge much more slowly near the river bottom than gradient descent. We then extend the river-valley perspective to general nonconvex objectives with momentum by studying points on the spectral river. There, while Muon converges faster early on, its orthogonalized update removes residual scale information, making it prone to overshooting and oscillation near the target solution. Together, these results suggest that our characterizations extend beyond spiked matrix sensing and motivate switching to GD-like refinement optimizers in the final phase, rather than relying only on a fixed learning-rate schedule for Muon. We also provide preliminary evidence supporting this two-stage approach in language model training experiments.",https://arxiv.org/abs/2606.21514v1,cs.LG
