id,domain,title,authors,published,abstract,url,categories
2606.02462,Bio,APLSuite: An Integrated Suite for CD4+ T Cell Epitope Prediction via Antigen Processing Likelihood,"Jiarui Li, Marco K. Carbullido, Jai Bansal, Samuel J. Landry, Ramgopal R. Mettu",2026-06-01T16:35:12Z,"Computational epitope prediction is a critical tool for exploring and understanding CD4+ T cell-mediated immune responses, a key aspect of adaptive immunity. While existing computational methods primarily focus on supervised learning approaches, they often overlook the essential role of antigen processing in determining binding specificity. To address this limitation, our group developed Antigen Processing Likelihood (APL), an algorithm that integrates crystallographic B-factor, solvent accessible surface area (SASA), hydrogen exchange protection factors (COREX), and sequence entropy.   In this paper we introduce APLSuite, a comprehensive and lightweight software suite designed to streamline APL-based epitope prediction. APLSuite integrates distributed RESTful API services, a Python client for data aggregation and processing, a data science tool for efficient epitope computation, and a user-friendly graphical user interface for non-coding users. It provides a seamless and efficient pipeline for APL calculation and epitope prediction that can be finished in minutes with GPU-acceleration, which has not been implemented by existed tools. This flexible and extensible software suite is deployable on desktop and cloud environments, offering both guided and customizable workflows to meet diverse research needs in immunology research and immunotherapy development.",https://arxiv.org/abs/2606.02462v1,q-bio.BM
2606.02408,Bio,Structure-Informed Multiple Sequence Alignment: A Formal Model and Hardness Results,"Yoshiki Kanazawa, Naphan Benchasattabuse, Michal Hajdušek, Rodney Van Meter",2026-06-01T15:52:22Z,"We formulate a structure-informed multiple sequence alignment problem, denoted MSA-S. The model abstracts biological sequences as strings and structural information as designated position-pairs. It augments a fixed pairwise string score, defined by a fixed non-gap symbol-pair scoring rule and fixed affine gap penalties, with a binary overlap score on designated position-pairs, which can be interpreted as a contact-map overlap score in structural applications. This yields a fixed-score, integer-valued optimization model suitable for complexity-theoretic analysis.   Under this formulation, we show that the decision problem MSA-S-DEC is NP-complete for a broad class of fixed pairwise string scoring schemes. We also show that NP-hardness persists even under the restriction that every designated position-pair set is nonempty and the pair-overlap threshold is strictly positive. For the associated scalarized optimization problem MSA-S-OPT(lambda) with any fixed rational constant lambda >= 1, we further show that, under the canonical unit scheme for the non-gap symbol-pair scoring rule, MSA-S-OPT(lambda) admits no polynomial-time approximation scheme (PTAS) even for two input strings (k = 2), unless P = NP.   These results establish a formal complexity-theoretic baseline for structure-informed multiple sequence alignment.",https://arxiv.org/abs/2606.02408v1,"cs.CC, q-bio.QM"
2606.02386,AI,AgentPLM: Agentic Protein Language Models with Reasoning-Augmented Decoding for Protein Sequence Design,"Sahil Rahman, Maxx Richard Rahman",2026-06-01T15:35:02Z,"Protein language models (PLMs) are passive oracles: they generate sequences in a single forward pass with no mechanism to consult external biophysical feedback or redirect generation when a candidate violates thermodynamic or structural constraints. We introduce AgentPLM, which addresses this by equipping a pre-trained PLM with i) Reasoning-Augmented Decoding (RAD), which interleaves autoregressive generation with tool calls (ESMFold, FoldX, AutoDock Vina), and ii) Contrastive Agent Policy Optimisation (CAPO), a trajectory-level extension of direct preference optimisation that trains the policy end-to-end to learn when oracle feedback is informative rather than merely imitating high-fitness sequences. We evaluate AgentPLM on benchmark tasks spanning de novo enzyme design, antibody optimisation, thermostability, PPI interface design, and zero-shot fitness prediction with standardised oracle APIs and controlled sequence-identity splits. AgentPLM achieves state-of-the-art results with a gain in antibody top-10% hit rate over the strongest passive baseline, providing mechanistic evidence of online error correction without explicit backtracking.",https://arxiv.org/abs/2606.02386v1,"cs.AI, q-bio.QM"
2606.01816,Bio,Site4Drug: Predicting Drug-Binding Target Sites with an AI Agent,"Taehan Kim, Sarrah Rose Mikhail Leung, Bharat Mekala, Jeongbin Park",2026-06-01T07:32:02Z,"Selecting where to intervene on a protein (i.e., choosing a targetable site) is often a more ambiguous and failure-prone bottleneck than selecting what binds, especially for membrane proteins where accessibility, topology, and post-translational modifications (PTMs) constrain actionable regions. We present Site4Drug, a modality-aware site-finding agent that outputs a ranked list of targetable regions with explicit constraints, evidence summaries, risk flags, and a traceable decision log.   Rather than requiring users to specify the drug modality upfront, Site4Drug can recommend a binding modality (e.g., antibody/peptide-like vs small-molecule) from the same evidence used for site discovery, including topology, hydropathy, PTM propensity, disulfides, domain context, and sequence. Importantly, this evidence is applied consistently across modalities, including small-molecule pocket discovery, to avoid selecting chemically plausible but biologically occluded sites.",https://arxiv.org/abs/2606.01816v1,"q-bio.BM, cs.LG"
2606.01661,Health,Feature leakage and the identifiability of direct-dependency entropy models of neural activity,"Houman Safaai, Bernardo L. Sabatini",2026-06-01T04:15:49Z,"Biological neurons receive thousands of synaptic inputs on branching, electrically excitable dendrites, yet population activity is often modeled with direct input-output rules in which each input contributes independently to a scalar drive. We study what successful prediction by such models does, and does not, reveal about neural computation. For conditional maximum-entropy models that match output rates and pairwise output-input coactivities, the entropy explained by a direct model is a prediction measure under the sampled input distribution, not a mechanism-identification test. A restricted MaxEnt fit is an information projection: omitted interaction, temporal, or hidden-state terms can be absorbed into fitted first-order parameters whenever they are correlated with the included sufficient statistics. For sparse correlated binary inputs, this absorption has an explicit coskewness form. We introduce diagnostics that separate in-distribution prediction from recovery of the response rule: state reweighting that holds P(y|x) fixed while changing P(x), conditional log-odds contrasts for local additivity, and temporal leakage controls. In ground-truth simulations, purely higher-order responses can pass first-order entropy and raw coactivity tests under leakage-prone sampling, but are correctly classified after reweighting. Applied to selected, leakage-enriched local tables from CA1 hippocampal recordings, approximately half of tables that appear first-order under empirical weights become distribution-sensitive under balanced reweighting, far above a matched additive-surrogate null. Thus direct entropy-explained fractions and raw coactivity predictions should be interpreted as predictions under the observed state distribution, not as evidence that mechanisms outside the direct model are absent or small.",https://arxiv.org/abs/2606.01661v1,"q-bio.NC, q-bio.QM, stat.ME"
2606.01628,Bio,Demystifying Multimodal Biomolecular Co-design With Intrinsic Geodesic Coupling,"Keyue Qiu, Xintong Wang, Zhilong Zhang, Hao Zhou, Wei-Ying Ma",2026-06-01T03:25:17Z,"Biomolecules such as proteins and small-molecule ligands play a central role in biological systems, arising from the tight interplay between sequence and three-dimensional structure. Recent generative models for biomolecular co-design aim to capture this interplay by jointly modeling coupled modalities. However, existing approaches largely adopt a parallel execution of marginal generative processes, implicitly enforcing fixed synchronous coupling. We argue that a critical but overlooked degree of freedom lies in how these marginal processes are temporally coupled during training and generation, where inappropriate coupling can introduce high-variance supervision and inconsistent intermediate states, affecting modality consistency. To address this, we introduce GeoCoupling, a systematic framework that optimizes for temporal couplings between heterogeneous modalities. Empirical results across structure-based drug design and unconditional protein design demonstrate the learned couplings consistently outperform synchronous and randomly coupled baselines, yielding biomolecules with improved physical validity and diversity.",https://arxiv.org/abs/2606.01628v1,"q-bio.BM, cs.AI"
2606.01611,Bio,Peptide Structure Prediction Using Counter-Diabatic Quantum Approximate Optimization Algorithm (CD-QAOA),"Sung Won Yun, Yeon Gyo Seo, Seong Hun Jang, Suhyun Park, Joonwoo Bae, Sangwook Wu",2026-06-01T03:00:50Z,"In this study, we predicted the structure of the heptapeptide APRLRFY, a neuropeptide sequence, on a tetrahedral lattice using a Quantum Approximate Optimization Algorithm (QAOA). QAOA is based on the adiabatic approximation and has been successfully applied to a wide range of optimization problems. However, relatively slow convergence during ground-state searches has frequently been reported. To overcome this limitation, we employed the Counter-Diabatic Quantum Approximate Optimization Algorithm (CD-QAOA), which introduces an additional counter-diabatic driving term into the adiabatic framework to accelerate convergence toward the ground state during peptide structure prediction. In the heptapeptide structure prediction, intermolecular interactions were modeled using two different approaches. In the first approach, only the interaction between the second residue, proline (P), and the seventh residue, tyrosine (Y), was included in the optimization. In the second approach, all residue-residue interactions within the heptapeptide were modeled using the Miyazawa-Jernigan (MJ) interaction matrix. To validate the peptide structures predicted using CD-QAOA, we additionally employed several classical computational methods, including quantum chemistry-based Hartree-Fock (HF) calculation and Density Functional Theory (DFT) calculation, conventional molecular dynamics (MD) simulation, and Hamiltonian replica exchange molecular dynamics (H-REMD) simulation. The structural similarities among the conformations obtained from these different approaches were systematically analyzed. CD-QAOA is highly effective for predicting the structures of short peptides. In particular, we demonstrate that a quantum-classical hybrid framework can significantly improve both the efficiency and accuracy of peptide structure prediction.",https://arxiv.org/abs/2606.01611v1,q-bio.BM
2606.02650,Bio,Using Machine Learning to Enhance Hyperparameter Optimization in Pandemic Modeling: Case study of COVID-19 Dynamics in Ghana,"Thomas Izgin, Andreas Meister, Isaac Azure",2026-05-31T20:12:54Z,"In this study, five distinct COVID-19 models developed in different countries, each designed to reflect the prevailing epidemiological condition at the time of formulation, are examined. The models are reformulated while still maintaining their original structure, using their common transmissions from one compartment to the other. Modified Patankar-Runge-Kutta (MPRK) methods are then applied to approximate the solutions of the resulting system of nonlinear ordinary differential equations (ODEs) representing each model to produce unconditionally positive approximations and to preserve the conservative part of the ODEs. In particular, we incorporate the numerical solution into a cost function to improve the estimates for the non-autonomous model hyperparameters. In a first step we obtain piecewise constant parameters that fit real data. Later we perform a WENO reconstruction in a post-process to approximate the true time-dependent coefficients inside the ODEs. As a proof-of-concept, we apply our approach to improve the parameters of a paper concerned with modeling COVID-19 in Ghana, where we can make 5-day predictions within a 10% error range.",https://arxiv.org/abs/2606.02650v1,q-bio.QM
2606.01357,Bio,Hypergraphs from multivariate connectivity: caCoh-based EEG/MEG representation,"Daniil Vlasenko, Irina Saranskaia, Denis Zakharov",2026-05-31T17:29:31Z,"Hypergraphs provide a natural framework for representing neurophysiological interactions distributed across sets of sensors. A key methodological question is how hyperedges should be defined from frequency-resolved electroencephalography/magnetoencephalography (EEG/MEG) data. We demonstrate a construction strategy in which hyperedges are obtained from canonical coherence (caCoh), an extension of coherence that estimates coupling between multidimensional signal spaces. To our knowledge, this is the first work to construct hypergraphs directly from a multivariate connectivity measure specifically designed for frequency-resolved neurophysiological analysis. We propose two caCoh-based representations: a one-to-space hypergraph, where each external signal defines a hyperedge over the EEG/MEG sensor space, and a space-to-space hypergraph, where two multidimensional signal spaces are represented by a single hyperedge. We evaluate the approach in controlled simulations with known coupling frequencies and varying signal-to-noise ratio (SNR). Compared with graphs based on magnitude-squared coherence (MSC), caCoh-based hypergraphs showed statistically higher target-baseline contrasts at almost all SNR levels, indicating stronger recovery of coupling frequencies. They also recovered sensor-level spatial patterns associated with the simulated sources. In addition, one-to-space and space-to-space representations reduced 610 MSC edges per frequency to 10 and 1 hyperedges, respectively. These results establish multivariate spectral connectivity as a natural methodological basis for EEG/MEG hypergraphs.",https://arxiv.org/abs/2606.01357v1,"q-bio.QM, physics.data-an, q-bio.NC"
2606.01329,AI,Conditioned free-energy density of proteins using unbalanced solutions to constraint satisfaction problems,"Pratik Worah, Subhash Khot, Srinivasa Varadhan",2026-05-31T16:31:16Z,"We show that computing the log-partition function (free-energy) of conditioned inhomogeneous Curie--Weiss spin Hamiltonians reduces to an unbalanced $2 \to 1$ norm computation, and design a polynomial-time SDP algorithm for this problem with a lower bound proof for the amount of unbalance achieved. Applied to the protein Ubiquitin, the framework starts from a known crystal structure, explores alternative backbone conformations across the free-energy landscape, and identifies flexible regions of the protein while preserving its native secondary structure.",https://arxiv.org/abs/2606.01329v1,"cs.LG, q-bio.BM"
2606.01193,Bio,Modulation-Reaction Networks,"Leo Lobski, Yoàv Montacute",2026-05-31T12:13:39Z,"Biochemical systems involve both the flow of matter, in which entities transform into one another via reactions, and the flow of information, in which entities regulate which reactions may occur. Boolean networks capture the latter; reaction networks capture the former. Yet no unified qualitative formalism treats regulated reactions as its principal objects of study, despite their prominence in standards such as the Systems Biology Graphical Notation Process Description (SBGN-PD) language. We introduce modulation-reaction networks (MR-networks), a mathematical framework in which entities modulate reactions through activations and inhibitions, and study their synchronous Boolean semantics. To reason about MR-networks we develop Modulation-Reaction Logic (MRL), a hybrid modal $μ$-calculus whose modalities reason about the structure of the network and whose fixed-point operators capture temporal evolution of the computation. We establish a collection of validities, including a complete characterisation of the one-step update rule, and demonstrate the expressive power of MRL by formalising properties of biological interest such as reachability, sustained production, and presence of attractors. We show that MRL admits model-checking via an evaluation game, and introduce a bisimulation relation for MR-networks, which is proved to be invariant for all MRL-formulas. As a step towards a biologically more realistic computational model, we sketch the asynchronous semantics of MR-networks, and outline how the developments for the synchronous case transfer to the study of the asynchronous one.",https://arxiv.org/abs/2606.01193v1,"cs.LO, q-bio.MN, q-bio.QM"
2606.00955,AI,CryoProt: A Protein Pretraining Framework with Cross-Box Interactions on Cryo-EM Density Maps,"Dan Luo, Xuan Lin, Peng Zhou, Junwen Zhu, Tengfei Ma, Xiangxiang Zeng, Yiping Liu",2026-05-31T02:13:04Z,"Despite the growing availability of cryo-electron microscopy (cryo-EM) density maps, effectively leveraging them for protein representation remains challenging. First, current methods lack a general-purpose protein pretraining framework tailored for cryo-EM density maps, designed for protein-related property prediction. Second, existing approaches typically partition density maps into local box regions and model them independently, overlooking interactions across boxes which are essential for capturing global structural context in cryo-EM density map. To address these challenges, we propose CryoProt, a protein pretraining framework designed for cryo-EM density maps. CryoProt introduces a Map Encoder based on multi-head latent attention (MLA), where box-level representations interact through a shared latent space, enabling explicit modeling of cross-box dependencies within the density map. Furthermore, we adopt a multi-task pretraining strategy to learn generalizable representations that can be effectively transferred to diverse downstream tasks, such as protein flexibility prediction, where cryo-EM density maps are not required and can be inferred implicitly by the pretrained model. Experimental results demonstrate that CryoProt consistently outperforms existing state-of-the-art methods across multiple benchmarks, achieving up to 12% improvement over the best-performing baselines, highlighting the importance of modeling cross-box interactions in cryo-EM data. The source code is publicly available at https://anonymous.4open.science/r/CryoProt.",https://arxiv.org/abs/2606.00955v1,"cs.LG, q-bio.QM"
2606.00568,AI,On the Recoverability of Causal Relations from Bulk Gene Expression Data,"Gongxu Luo, Boyang Sun, Kun Zhang",2026-05-30T06:42:19Z,"Bulk gene expression profiling, which aggregates pooled RNA across cells within a biological sample, remains important in the single-cell era because it is typically less noisy, more sensitive, and more cost-effective than single-cell assays. Accordingly, a growing body of computational methods seeks to recover causal relations among genes from bulk expression data. However, aggregation is a lossy, non-invertible coarsening of the underlying cellular system, and it remains unclear whether and under what conditions causal relations are recoverable from aggregated bulk gene expression data. To answer this, we formalize recoverability under aggregation through two notions of consistency: functional-form consistency and conditional-independence consistency. We then derive necessary and sufficient conditions for recoverability, showing that these properties are preserved only under linear aggregations (e.g., sum/mean) coupled with affine structural equations. To assess the practical plausibility of these conditions, analyses of four bulk and four single-cell gene expression datasets further reveal that the estimated pairwise regulatory functions among genes deviate from linearity in both data types, providing limited empirical support for the linearity assumptions required for recoverability. Together, these results caution against recovering causal relations from aggregated bulk expression data without strong additional assumptions.",https://arxiv.org/abs/2606.00568v1,"cs.LG, q-bio.GN"
2606.00555,AI,Probe Before You Edit: Probing-Guided Molecular Optimization for LLM Agents in Structure-Based Drug Design,"Zaifei Yang, Weiyu Chen, Yaqing Wang, James Kwok",2026-05-30T06:06:51Z,"Structure-based drug design increasingly employs LLM agents to iteratively refine ligands against a target pocket, yet a viable ligand must satisfy two often-conflicting objectives -- binding affinity and druggability -- which single optimization steps rarely improve together. To quantify this difficulty, we introduce two diagnostic metrics: the first measures how often a single edit improves both objectives, and the second measures how often a gain on one objective comes with a loss on the other. Applying these diagnostics to current LLM-agent pipelines exposes a consistent failure mode: the agent performs molecular editing without knowing how the pocket-ligand complex responds to local modifications, thus rarely achieving joint improvement. Inspired by medicinal chemists, who probe the pocket-ligand complex with controlled analog edits before choosing an optimization direction, we propose \textbf{PROBE}, an optimization framework built around edit-response probing. PROBE first decomposes the ligand into editable sites and builds a pocket-specific \textbf{site map} that flags where joint gains are plausible, where the two objectives are likely in tension, and where liability substructures should be changed; it then performs controlled probe edits whose responses are distilled into an \textbf{EditManual}. Guided by the site map and EditManual, PROBE runs an iterative multi-agent loop in which an affinity agent, a druggability agent, and a co-optimization agent jointly produce edits. On the CrossDocked2020 benchmark, PROBE achieves state-of-the-art performance and substantially mitigates the failure modes exposed by our diagnostics metrics.",https://arxiv.org/abs/2606.00555v2,"cs.AI, q-bio.BM"
2606.02629,Bio,Enhancing Protein-Protein Interaction Prediction with Hierarchical Motif-based Multimodal Protein Embedding,"Zaifei Yang, Samuel Ping-Man Choi, James Kwok",2026-05-30T05:26:17Z,"Protein-protein interactions (PPIs) are essential for many biological processes. However, existing PPI prediction approaches suffer from two major limitations: they overlook the hierarchical organization of proteins, particularly meso-scale motifs that critically regulate PPIs, and fail to effectively integrate sequence, structure, and function modalities. To address these limitations, we propose MMM-PPI, a Hierarchical Motif-based Multi-Modal protein Encoder for PPI Prediction that constructs PPI embeddings in a bottom-up multi-modal manner across three scales. At the micro-scale, we encode three modal residue features; at the meso-scale, a novel multimodal motif encoder aggregates residues into spatially-informed motif embeddings; at the macro-scale, a multimodal protein encoder integrates motifs into protein embeddings by jointly modeling motif importance and inter-modal correlations. The pre-trained encoder can be used off-the-shelf for large-scale PPI prediction. Extensive experiments on multiple PPI datasets show that MMM-PPI outperforms state-of-the-art multi-label PPI prediction models, particularly under challenging data partitions and limited data scenarios. Codes are in https://github.com/yzf-code/MMM-PPI.",https://arxiv.org/abs/2606.02629v1,"q-bio.QM, cs.AI, cs.LG"
