id,domain,title,authors,published,abstract,url,categories
2605.00820,AI,HyCOP: Hybrid Composition Operators for Interpretable Learning of PDEs,"Jinpai Zhao, Nishant Panda, Yen Ting Lin, Eirik Valseth, Diane Oyen, Clint Dawson",2026-05-01T17:57:48Z,"We introduce HyCOP, a modular framework that learns parametric PDE solution operators by composing simple modules (advection, diffusion, learned closures, boundary handling) in a query-conditioned way. Rather than learning a monolithic map, HyCOP learns a policy over short programs - which module to apply and for how long - conditioned on regime features and state statistics. Modules may be numerical sub-solvers or learned components, enabling hybrid surrogates evaluated at arbitrary query times without autoregressive rollout. Across diverse PDE benchmarks, HyCOP produces interpretable programs, delivers order-of-magnitude OOD improvements over monolithic neural operators, and supports modular transfer through dictionary updates (e.g., boundary swaps, residual enrichment). Our theory characterizes expressivity and gives an error decomposition that separates composition error from module error and doubles as a process-level diagnostic.",https://arxiv.org/abs/2605.00820v1,"cs.CE, cs.LG, math.NA"
2605.00817,AI,When LLMs Stop Following Steps: A Diagnostic Study of Procedural Execution in Language Models,"Sailesh Panda, Pritam Kadasi, Abhishek Upperwal, Mayank Singh",2026-05-01T17:55:47Z,"Large language models (LLMs) often achieve strong performance on reasoning benchmarks, but final-answer accuracy alone does not show whether they faithfully execute the procedure specified in a prompt. We study this question through a controlled diagnostic benchmark for procedural execution, where models are given a step-wise arithmetic algorithm and two numeric inputs, and must return the final computed value. The benchmark uses simple arithmetic operations but increases complexity through algorithm length and look-back dependencies over intermediate variables. Across 14 models and 55 datasets, average first-answer accuracy drops from 61% on 5-step procedures to 20% on 95-step procedures. Generation-level analysis shows that failures often involve missing answers, premature answers, self-correction after an initial error, under-executed traces, and hallucinated extra steps. These findings suggest that apparent reasoning ability can mask substantial weaknesses in faithful instruction execution.",https://arxiv.org/abs/2605.00817v1,cs.CL
2605.00814,AI,Persistent Visual Memory: Sustaining Perception for Deep Generation in LVLMs,"Siyuan Huang, Xiaoye Qu, Yafu Li, Tong Zhu, Zefeng He, Muxin Fu, Daizong Liu, Wei-Long Zheng, Yu Cheng",2026-05-01T17:54:37Z,"While autoregressive Large Vision-Language Models (LVLMs) demonstrate remarkable proficiency in multimodal tasks, they face a ""Visual Signal Dilution"" phenomenon, where the accumulation of textual history expands the attention partition function, causing visual attention to decay inversely with generated sequence length. To counteract this, we propose Persistent Visual Memory (PVM), a lightweight learnable module designed to ensure sustained, on-demand visual perception. Integrated as a parallel branch alongside the Feed-Forward Network (FFN) in LVLMs, PVM establishes a distance-agnostic retrieval pathway that directly provides visual embeddings for precise visual perception, thereby structurally mitigating the signal suppression inherent to deep generation. Extensive experiments on Qwen3-VL models demonstrate that PVM brings notable improvements with negligible parameter overhead, delivering consistent average accuracy gains across both 4B and 8B scales, particularly in complex reasoning tasks that demand persistent visual perception. Furthermore, in-depth analysis reveals that PVM can resist length-induced signal decay and accelerate internal prediction convergence.",https://arxiv.org/abs/2605.00814v1,"cs.CV, cs.AI"
2605.00803,AI,Can Coding Agents Reproduce Findings in Computational Materials Science?,"Ziyang Huang, Yi Cao, Ali K. Shargh, Jing Luo, Ruidong Mei, Mohd Zaki, Zhan Liu, Wyatt Bunstine, William Jurayj, Somdatta Goswami, Tyrel McQueen, Michael Shields, Jaafar El-Awady, Paulette Clancy, Benjamin Van Durme, Nicholas Andrews, William Walden, Daniel Khashabi",2026-05-01T17:42:12Z,"Large language models are increasingly deployed as autonomous coding agents and have achieved remarkably strong performance on software engineering benchmarks. However, it is unclear whether such success transfers to computational scientific workflows, where tasks require not only strong coding ability, but also the ability to navigate complex, domain-specific procedures and to interpret results in the context of scientific claims. To address this question, we present AutoMat, a benchmark for evaluating LLM-based agents' ability to reproduce claims from computational materials science. AutoMat poses three interrelated challenges: recovering underspecified computational procedures, navigating specialized toolchains, and determining whether the resulting evidence supports a claim. By working closely with subject matter experts, we curate a set of claims from real materials science papers to test whether coding agents can recover and execute the end-to-end workflow needed to support (or undermine) such claims. We then evaluate multiple representative coding agent settings across several foundation models. Our results show that current LLM-based agents obtain low overall success rates on AutoMat, with the best-performing setting achieving a success rate of only 54.1%. Error analysis further reveals that agents perform worst when workflows must be reconstructed from paper text alone and that they fail primarily due to incomplete procedures, methodological deviations, and execution fragility. Taken together, these findings position AutoMat as both a benchmark for computational scientific reproducibility and a tool for diagnosing the current limitations of agentic systems in AI-for-science settings.",https://arxiv.org/abs/2605.00803v1,"cs.SE, cs.AI, cs.CL"
2605.00800,AI,Generating Statistical Charts with Validation-Driven LLM Workflows,"Pavlin G. Poličar, Andraž Pevcin, Blaž Zupan",2026-05-01T17:39:00Z,"Generating diverse, readable statistical charts from tabular data remains challenging for LLMs, as many failures become apparent after rendering and are not detectable from data or code alone. Existing chart datasets also rarely provide fully aligned artifacts, such as executable code, dataset context, and question-answer pairs. We present a structured LLM-based workflow that decomposes chart generation into dataset screening, plot proposal, code synthesis, rendering, validation-driven refinement, description generation, and question-answer generation. By incorporating rendered-output validation, the workflow addresses visualization-specific failure modes such as readability and semantic mismatch. It treats chart generation as an inspectable process rather than a one-shot prompt-to-code task, retaining each chart with its code, dataset context, description, and question-answer pairs. Applied to UCI datasets, the workflow produces 1,500 charts from 74 datasets, spanning 24 chart families and paired with 30,003 question-answer pairs. We evaluate 16 multimodal LLMs (MLLMs) on these chart-question pairs. The results show that chart-syntax questions are nearly saturated, while value extraction, comparison, and reasoning remain more challenging, illustrating the workflow's utility for diagnostic studies of chart-grounded multimodal reasoning.",https://arxiv.org/abs/2605.00800v1,cs.LG
2605.00798,AI,RunAgent: Interpreting Natural-Language Plans with Constraint-Guided Execution,"Arunabh Srivastava, Mohammad A., Khojastepour, Srimat Chakradhar, Sennur Ulukus",2026-05-01T17:29:45Z,"Humans solve problems by executing targeted plans, yet large language models (LLMs) remain unreliable for structured workflow execution. We propose RunAgent, a multi-agent plan execution platform that interprets natural-language plans while enforcing stepwise execution through constraints and rubrics. RunAgent bridges the expressiveness of natural language with the determinism of programming via an agentic language with explicit control constructs (e.g., \texttt{IF}, \texttt{GOTO}, \texttt{FORALL}). Beyond verifying syntactic and semantic verification of the step output, which is performed based on the specific instruction of each step, RunAgent autonomously derives and validates constraints based on the description of the task and its instance at each step. RunAgent also dynamically selects among LLM-based reasoning, tool usage, and code generation and execution (e.g., in Python), and incorporates error correction mechanisms to ensure correctness. Finally, RunAgent filters the context history by retaining only relevant information during the execution of each step. Evaluations on Natural-plan and SciBench Datasets demonstrate that RunAgent outperforms baseline LLMs and state-of-the-art PlanGEN methods.",https://arxiv.org/abs/2605.00798v1,"cs.LG, cs.CL, cs.MA"
2605.00796,AI,When RAG Chatbots Expose Their Backend: An Anonymized Case Study of Privacy and Security Risks in Patient-Facing Medical AI,"Alfredo Madrid-García, Miguel Rujas",2026-05-01T17:29:09Z,"Background: Patient-facing medical chatbots based on retrieval-augmented generation (RAG) are increasingly promoted to deliver accessible, grounded health information. AI-assisted development lowers the barrier to building them, but they still demand rigorous security, privacy, and governance controls. Objective: To report an anonymized, non-destructive security assessment of a publicly accessible patient-facing medical RAG chatbot and identify governance lessons for safe deployment of generative AI in health. Methods: We used a two-stage strategy. First, Claude Opus 4.6 supported exploratory prompt-based testing and structured vulnerability hypotheses. Second, candidate findings were manually verified using Chrome Developer Tools, inspecting browser-visible network traffic, payloads, API schemas, configuration objects, and stored interaction data. Results: The LLM-assisted phase identified a critical vulnerability: sensitive system and RAG configuration appeared exposed through client-server communication rather than restricted server-side. Manual verification confirmed that ordinary browser inspection allowed collection of the system prompt, model and embedding configuration, retrieval parameters, backend endpoints, API schema, document and chunk metadata, knowledge-base content, and the 1,000 most recent patient-chatbot conversations. The deployment also contradicted its privacy assurances: full conversation records, including health-related queries, were retrievable without authentication. Conclusions: Serious privacy and security failures in patient-facing RAG chatbots can be identified with standard browser tools, without specialist skills or authentication; independent review should be a prerequisite for deployment. Commercial LLMs accelerated this assessment, including under a false developer persona; assistance available to auditors is equally available to adversaries.",https://arxiv.org/abs/2605.00796v1,"cs.CR, cs.AI, cs.CL"
2605.00793,AI,Unsupervised Denoising of Real Clinical Low Dose Liver CT with Perceptual Attention Networks,"Jingxi Pu, Tonghua Liu, Zhilin Guan, Siqiao Li, Yang Ming, Zheng Cong, Wei Zhang, Fangwei Li",2026-05-01T17:19:15Z,"With the development of deep learning, medical image processing has been widely used to assist clinical research. This paper focuses on the denoising problem of low-dose computed tomography using deep learning. Although low-dose computed tomography reduces radiation exposure to patients, it also introduces more noise, which may interfere with visual interpretation by physicians and affect diagnostic results. To address this problem, inspired by Cycle-GAN for unsupervised learning, this paper proposes an end-to-end unsupervised low-dose computed tomography denoising framework. The proposed framework combines a U-Net structure for multi-scale feature extraction, an attention mechanism for feature fusion, and a residual network for feature transformation. It also introduces perceptual loss to improve the network for the characteristics of medical images. In addition, we construct a real low-dose computed tomography dataset and design a large number of comparative experiments to validate the proposed method, using both image-based evaluation metrics and medical evaluation criteria. Compared with classical methods, the main advantage of this paper is that it addresses the limitation that real clinical data cannot be directly used for supervised learning, while still achieving excellent performance. The experimental results are also professionally evaluated by imaging physicians and meet clinical needs.",https://arxiv.org/abs/2605.00793v1,"eess.IV, cs.AI, cs.CV"
2605.00789,AI,Make Your LVLM KV Cache More Lightweight,"Xihao Chen, Yangyang Guo, Roger Zimmermann",2026-05-01T17:11:39Z,"Key-Value (KV) cache has become a de facto component of modern Large Vision-Language Models (LVLMs) for inference. While it enhances decoding efficiency in Large Language Models (LLMs), its direct adoption in LVLMs introduces substantial GPU memory overhead due to the large number of vision tokens processed during the prefill stage. To tackle this problem, we propose LightKV, a novel approach that reduces KV cache size by exploiting the redundancy among vision-token embeddings. Guided by text prompts, LightKV employs cross-modality message passing to aggregate informative messages across vision tokens and progressively compress them during prefill. This prompt-aware guidance distinguishes our method from prior vision-only compression strategies. We evaluate LightKV on eight open-source LVLMs across eight public benchmark datasets, e.g., MME and SeedBench. Experimental results demonstrate that with only 55% of the original vision tokens, LightKV (a) halves the vision-token KV cache size, (b) reduces computation by up to 40%, and (c) preserves general-purpose performance while significantly outperforming existing baselines.",https://arxiv.org/abs/2605.00789v1,"cs.CV, cs.AI, cs.LG"
2605.00787,AI,SAVGO: Learning State-Action Value Geometry with Cosine Similarity for Continuous Control,"Stavros Orfanoudakis, Pedro P. Vergara",2026-05-01T17:09:58Z,"While representation and similarity learning have improved the sample efficiency of Reinforcement Learning (RL), they are rarely used to shape policy updates directly in the action space. To bridge this gap, a geometry-aware RL algorithm that explicitly incorporates value-based similarity into the policy update, State-Action Value Geometry Optimization (SAVGO), is proposed. In detail, SAVGO learns a joint state-action embedding space in which pairs with similar action-value estimates exhibit high cosine similarity, while dissimilar pairs are mapped to distinct directions. This learned geometry enables the generation of a similarity kernel over candidate actions sampled at each update, allowing policy improvement to be guided directly toward higher-value regions beyond local gradient-based updates. As a result, representation learning, value estimation, and policy optimization are unified within a single geometry-consistent objective, while preserving the scalability of off-policy actor-critic training. The proposed method is evaluated on standard MuJoCo continuous-control benchmarks, demonstrating improvements over strong baselines on challenging high-dimensional tasks. Ablation studies are done to analyze the contributions of value-geometry learning and similarity-based policy updates.",https://arxiv.org/abs/2605.00787v1,cs.LG
2605.00782,AI,GeoContra: From Fluent GIS Code to Verifiable Spatial Analysis with Geography-Grounded Repair,"Yinhao Xiao, Rongbo Xiao, Yihan Zhang",2026-05-01T16:58:24Z,"Reliable spatial analysis in GIScience requires preserving coordinate semantics, topology, units, and geographic plausibility. Current LLM-based GIS systems generate fluent scripts but rarely enforce these geographic rules at scale. We present GeoContra, a verification and repair framework for LLM-driven Python GIS workflows. It represents each task as an executable geospatial contract-including natural-language questions, schemas, CRS metadata, expected outputs, spatial predicates, topology, metrics, required operations, and forbidden shortcuts. Generated programs undergo static rule inspection, runtime validation, and semantic verification, with violations fed back into a bounded repair loop. Evaluated on 7,079 real geospatial tasks across 15 Boston-area zones, 9 task families, and 11 open-source models (600 runs each), GeoContra improves spatial correctness on closed models from 47.6% to 77.5% for DeepSeek-V4 and from 57.7% to 81.5% for Kimi-K2.5. Across 11 open models, average correctness rises by 26.6%. GeoContra turns fluent code production into verifiable spatial analysis, catching negative travel times, CRS/field-schema violations, missing predicates, and brittle output casts that otherwise yield executable but geographically invalid results.",https://arxiv.org/abs/2605.00782v1,"cs.SE, cs.AI"
2605.00778,AI,Observable Performance Does Not Fully Reflect System Organization: A Multi-Level Analysis of Gait Dynamics Under Occlusal Constraint,"Jacques Raynal, Pierre Slangen, Jacques Margerit",2026-05-01T16:48:00Z,"In biomechanical systems, observable performance is often used as a proxy for underlying system organization. However, this assumption implicitly presumes a correspondence between output metrics and internal system states that may not hold in adaptive systems. In this study, the vertical dimension of occlusion (VDO) is considered as a constraint applied to an adaptive neuromechanical system, enabling the exploration of system-level responses under controlled variations. A single-case design in a patient with Parkinson's disease allows an intra-individual analysis across repeated conditions.The analysis is structured across three complementary levels: (i) aggregated linear metrics describing observable performance, (ii) a dynamical systems framework describing temporal organization in state space, and (iii) a latent space representation obtained through unsupervised embedding. The results show that conditions with comparable observable performance may correspond to different organizations in both state space and latent space representations. This dissociation highlights a limitation of aggregated metrics and suggests that similar outputs may arise from non-equivalent system states. A fourth level is proposed as a purely conceptual extension describing potential relationships between system states. This level is not implemented and is not derived from experimental data. These observations are strictly exploratory and non-causal. The proposed framework does not establish mechanistic, predictive, or directional relationships, but provides a structured approach for analyzing constraint-driven systems across multiple levels of representation.",https://arxiv.org/abs/2605.00778v1,"cs.LG, q-bio.NC"
2605.00777,AI,LASE: Language-Adversarial Speaker Encoding for Indic Cross-Script Identity Preservation,Venkata Pushpak Teja Menta,2026-05-01T16:46:25Z,"A speaker encoder used in multilingual voice cloning should treat the same speaker identically regardless of which script the audio was uttered in. Off-the-shelf encoders do not, and the failure is accent-conditional. On a 1043-pair Western-accented voice corpus across English, Hindi, Telugu, and Tamil, WavLM-base-plus-sv loses 0.082 absolute cosine similarity when the same voice changes script and ECAPA-TDNN loses 0.105. On a 1369-pair Indian-accented voice corpus, the gap shrinks to 0.006 (WavLM-SV) and 0.044 (ECAPA-TDNN). The leak is largest where it matters most for cross-script TTS: when a system projects a non-Indic-trained voice into Indic scripts. We present LASE (Language-Adversarial Speaker Encoder), a small projection head over frozen WavLM-base-plus trained with two losses: a supervised contrastive loss over voice identity, and a gradient-reversal cross-entropy against a 4-language classifier that pushes the embedding to be language-uninformative while remaining speaker-informative. Trained on 1118 quality-gated cross-script pairs synthesised from 8 commercial multilingual voices, LASE's residual gap is consistent with zero on both corpora (Delta = 0.013 Western, Delta = 0.026 Indian; both bootstrap 95% CIs include zero) and amplifies the cross-script-vs-floor margin 2.4-2.7x over both baselines. An ECAPA+GRL ablation shows the GRL objective improves either backbone but the WavLM choice contributes too. In synthetic multi-speaker diarisation, LASE matches ECAPA-TDNN on cross-script speaker recall (0.788 vs 0.789) with ~100x less training data. We release the r1 checkpoint, both corpora, and the bootstrap recipe.",https://arxiv.org/abs/2605.00777v1,"cs.SD, cs.CL, eess.AS"
2605.00776,AI,"Directed Social Regard: Surfacing Targeted Advocacy, Opposition, Aid, Harms, and Victimization in Online Media","Scott Friedman, Ruta Wheelock, Sonja Schmer-Galunder, Drisana Iverson, Jake Vasilakes, Joan Zheng, Jeffrey Rye, Vasanth Sarathy, Christopher Miller",2026-05-01T16:45:31Z,"The language in online platforms, influence operations, and political rhetoric frequently directs a mix of pro-social sentiment (e.g., advocacy, helpfulness, compassion) and anti-social sentiment (e.g., threats, opposition, blame) at different topics, all in the same message. While many natural language processing (NLP) tools classify or score a text's overall sentiment as positive, neutral, or negative, these tools cannot report that positive and negative sentiments coexist, and they cannot report the target of those sentiments. This paper presents the Directed Social Regard (DSR) approach to multi-dimensional, multi-valence sentiment analysis, comprised of a pair of transformer-based models that (1) detects span-level targets of sentiment in a message and then (2) scores all spans within the message context along three (-1, 1) axes of regard that are motivated by social science theories of moral disengagement and moral framing. We present a data collection and annotation strategy for DSR dataset construction, a transformer-based architecture for span-level scoring, and a validation study with promising results. We apply the validated DSR model on six third-party datasets of online media and report meaningful correlations between DSR outputs and the labels and topics in these pre-existing social science datasets.",https://arxiv.org/abs/2605.00776v1,"cs.CL, cs.AI"
2605.00768,AI,Characterizing the Expressivity of Local Attention in Transformers,"Jiaoda Li, Ryan Cotterell",2026-05-01T16:30:52Z,"The transformer is the most popular neural architecture for language modeling. The cornerstone of the transformer is its global attention mechanism, which lets the model aggregate information from all preceding tokens before generating the next token. One common variant of attention is called local attention, which restricts each token to aggregating information from a bounded window of predecessors, reducing the quadratic cost of global attention to linear. Although this restriction is usually motivated by efficiency, it has also been found to improve model quality, a phenomenon that has so far lacked a satisfactory explanation. We provide a formal account of this phenomenon in terms of recognizer expressivity. It has been shown that fixed-precision transformers with global attention correspond to a fragment of linear temporal logic containing a single past operator. We additionally prove that adding local attention introduces a second temporal operator, strictly enlarging the class of recognizable regular languages. Moreover, global and local attention are expressively complementary: neither subsumes the other, and combining them yields the richest fragment. Experiments on formal language recognition and natural language modeling corroborate the theory, showing that hybrid global--local transformers outperform their global-only counterparts.",https://arxiv.org/abs/2605.00768v1,cs.CL
2605.00762,AI,Meritocratic Fairness in Budgeted Combinatorial Multi-armed Bandits via Shapley Values,"Shradha Sharma, Swapnil Dhamal, Shweta Jain",2026-05-01T16:20:43Z,"We propose a new framework for meritocratic fairness in budgeted combinatorial multi-armed bandits with full-bandit feedback (BCMAB-FBF). Unlike semi-bandit feedback, the contribution of individual arms is not received in full-bandit feedback, making the setting significantly more challenging. To compute arm contributions in BCMAB-FBF, we first extend the Shapley value, a classical solution concept from cooperative game theory, to the $K$-Shapley value, which captures the marginal contribution of an agent restricted to a set of size at most $K$. We show that $K$-Shapley value is a unique solution concept that satisfies Symmetry, Linearity, Null player, and efficiency properties. We next propose K-SVFair-FBF, a fairness-aware bandit algorithm that adaptively estimates $K$-Shapley value with unknown valuation function. Unlike standard bandit literature on full bandit feedback, K-SVFair-FBF not only learns the valuation function under full feedback setting but also mitigates the noise arising from Monte Carlo approximations. Theoretically, we prove that K-SVFair-FBF achieves $O(T^{3/4})$ regret bound on fairness regret. Through experiments on federated learning and social influence maximization datasets, we demonstrate that our approach achieves fairness and performs more effectively than existing baselines.",https://arxiv.org/abs/2605.00762v1,"cs.LG, cs.AI, cs.MA"
