id,domain,title,authors,published,abstract,url,categories
2606.21223,Robotics,Ultra-Fusion: A Resilient Tightly-Coupled Multi-Sensor Fusion SLAM Framework under Sensor Degradation and Spatiotemporal Perturbation for Intelligent Transportation Systems,"Yihong Tian, Junjie Zhang, Liuyang Li, Deteng Zhang, Yunfei Zuo, Jie Yin",2026-06-19T08:40:04Z,"Reliable localization is essential for intelligent transportation systems (ITS), including autonomous vehicles, quadruped last-mile carriers, and infrastructure-inspection unmanned aerial vehicles (UAVs). Although tightly-coupled multi-sensor fusion improves accuracy in favorable conditions, deployed systems remain vulnerable to sensor degradation -- poor illumination, LiDAR degeneracy, wheel slippage, and GNSS outage -- and to spatiotemporal calibration errors. These failures are common in urban canyons, tunnels, and high-speed corridors, where localization drift can degrade route tracking, tunnel passage continuity, and local map alignment. This paper presents Ultra-Fusion, a tightly-coupled multi-sensor localization framework based on a unified sliding-window estimator. Asynchronous measurements are timestamp-ordered and converted into optional factors within one optimization window, supporting WIO, VIO, LIO, and LVIO with optional wheel and GNSS augmentation. Observability-aware initialization selects the bootstrap mode, factor-wise reliability scheduling gates degraded measurements, and online LiDAR--IMU spatiotemporal calibration refines temporal offsets and rotational extrinsics during operation. We extend the M3DGR benchmark with simulation trajectories and evaluate more than 60 open-source SLAM systems on M3DGR, M2DGR-Plus, KAIST, GrandTour, and MARS-LVIG. The results show competitive accuracy across wheeled, legged, and aerial platforms under long-duration and high-speed operation, degradation, and calibration perturbation, improving localization availability for road-level autonomy, campus and warehouse mobility, and low-altitude aerial inspection. To benefit the industrial and academic community, we will release source code and datasets upon paper acceptance.",https://arxiv.org/abs/2606.21223v1,cs.RO
2606.21222,Robotics,FleetAgent: Teleoperation Assistant for Autonomous Fleets via Vectorized V2N Messages,"Juntong Peng, Qi Chen, Deyuan Qu, Takayuki Shimizu, Yaobin Chen, Ziran Wang",2026-06-19T08:39:46Z,"Large-scale autonomous fleets rely on teleoperation to resolve rare failures, yet streaming raw sensor data from many vehicles is costly, and remote operators can only monitor a limited number of vehicles at a time. We introduce FleetAgent, a cloud-hosted multimodal large language model (MLLM) assistant that consumes compact vectorized vehicle-to-network (V2N) messages, such as map elements, detected objects, and the ego planned path. It provides a structured natural-language response (including narration, explanation, and evaluation of the plan and scene), along with an intervention urgency score for operator prioritization. To make structured messages compatible with token-based MLLMs, we propose VecFormer, a vector-to-embedding interface with differentiable top-K context selection that bounds context length and GPU KV-cache growth, enabling more efficient batch processing, which is important under the context of cloud-hosted large-scale fleet management. We also construct VecEval, a nuScenes-derived dataset with paired human and synthetic imperfect plans and human-verified language labels, to facilitate the training and evaluation of our proposed system. Our proposed system can reduce uplink payload by up to 625 times compared with raw images and reduce KV-cache memory by 16.54 times compared with original text descriptions. On VecEval, FleetAgent improves Lingo-Judge score by 16.8% and reduces intervention failure rate by 19.9%, compared with Qwen2.5-VL-7B using language descriptions. These results demonstrate that FleetAgent can utilize compact structured V2N messaging to enable efficient, explainable teleoperation monitoring for autonomous fleets.",https://arxiv.org/abs/2606.21222v1,"cs.RO, cs.AI"
2606.21220,Robotics,A UAV-Mounted Sensor Network for Close-Range Inspection of Wind Turbine Rotor Blades,"Jost Wittmann, Ahmed Abdullahi Hassan, Nils Kömpe, Andreas Nüchter",2026-06-19T08:37:42Z,"Inspection of offshore wind turbine rotor blades is critical for predictive maintenance to maximise efficiency and extend operational lifetime. However, it remains a challenging task due to remote locations, large structural dimensions, and the limitations of current UAV-compatible sensor systems. While existing approaches can detect certain types of surface anomalies, reliable classification of defect types often remains a manual and error-prone process.   This paper presents the design of a UAV-mounted multimodal sensor network combining an industrial RGB camera, a passive thermal infrared camera, and an in-house developed 3D scanner. All sensors are co-calibrated into a common coordinate frame, enabling spatial superimposition of geometric, colour, and thermal data. The system is designed to operate at close range, addressing three fundamental sensing challenges: platform motion, large field of view, and millimetre-level measurement accuracy. Preliminary laboratory results demonstrate synchronised multi-sensor acquisition and initial point cloud reconstructions, forming the basis for future airborne inspection trials.",https://arxiv.org/abs/2606.21220v1,cs.RO
2606.21216,Robotics,A scalar per patch from pre-trained ViTs enables fast moving navigation in the real world,"Steeven Janny, Leonid Antsfeld, Christian Wolf",2026-06-19T08:32:24Z,"Trained policies for real-world robotics rely on computer vision components, typically in the form of pre-trained visual encoders. These encoders are an essential component and it has been shown that their power does not emerge from training on robotics downstream losses alone. Pre-training with auxiliary losses in the form of computer-vision pre-text tasks is a defining factor and heavily conditions agent performance in robotics tasks. In this unprecedented large-scale study, we ran 966 navigation episodes of static point goal navigation in a real-world building for 24km and asked which components really matter for the computer vision aspects of robotics: we evaluate state-of-the art visual encoders in realistic conditions. We explore the usefulness of heterogeneous multi-teacher distillation leading to encoders with multiple different and complementary skills. We investigate how much information from these encoders is necessary for robotics by bottlenecking them in a principled and spatially useful way and we show that this leads to the emergence of interpretable features linked to affordances. We also argue that training policies on RGB data alone does not lead to an optimal usage of visual features and show this by finetuning policies pre-trained on privileged information. All in all, we paint a more complete picture of what aspects of computer vision are relevant for real-world navigation.",https://arxiv.org/abs/2606.21216v1,cs.RO
2606.21205,Robotics,Discrete Geometric Modeling and Extended State Estimation of Continuum Robots,"Maximilian Herrmann, Leander Pfeiffer, Paul Kotyczka",2026-06-19T08:17:32Z,"In this paper, we present a fully discrete approach for the accurate and numerically efficient dynamical modeling and state estimation of continuum robots. The model is based on geometrically exact beams in a minimal, strain-based formulation and derived in the framework of Lie group variational integrators, allowing to preserve important geometric properties that we exploit to achieve high accuracy and numerical efficiency. We then propose a disturbance observer based on an extended Kalman filter formulation that reliably estimates system states as well as model uncertainties and external disturbances. Experiments on a real system validate the accuracy and efficiency of the proposed model and observer.",https://arxiv.org/abs/2606.21205v1,"eess.SY, cs.RO"
2606.21188,Robotics,Remember what you did?: Learning Behavioral Memories for Partially Observable Object Manipulation,"Kuancheng Wang, Seungho Yeom, Jinglin Cao, Yuheng Zhi, Nikhil Shinde, Michael Yip",2026-06-19T07:56:58Z,"Long horizon, contact-rich manipulation is inherently partially observable. This is as a single visual observation rarely captures a robot's full action context, including prior attempts, interactions, or progress. Consequently, standard visuomotor policies or vision-language-action models are prone to struggle in such tasks due to a lack of memory. To address this, we introduce Compressed Action Memory Policy (CAMP) based on the insight that a robot's own action history serves as a highly informative, self-supervised signal, enabling the policy to learn a robust, compact history representation. In our approach, we train a memory module to maintain a compressed representation of past actions, forcing it to encode a latent behavioral memory of all the robot's past interactions that can then be used to better contextualize future actions. This allows our approach to implicitly track generalized task progress and learn from failed attempts without any additional supervision, or external oversight. We evaluate CAMP across four real-robot setups and two novel simulation benchmarks: Memory-T-Bench and Memory-Manip-Bench. By demonstrating substantial gains over state-of-the-art baselines, CAMP is, to our knowledge, the first policy to demonstrate substantial success on contact-rich partially observable manipulation tasks purely through learned memory.",https://arxiv.org/abs/2606.21188v1,cs.RO
2606.21165,Robotics,OmniV2X: A Generative Foundation Planner for Efficient End-to-End Cooperative Driving,"Juntong Peng, Juanwu Lu, Yupeng Zhou, Can Cui, Yaobin Chen, Ziran Wang",2026-06-19T07:00:14Z,"We present OmniV2X, a generative foundation model for vehicle-to-everything (V2X) cooperative driving. The model directly interprets independent context sequences comprising multi-modal and multi-agent observations. The new design mitigates the computational cost of dense 3D perception, the vulnerability to data scarcity in cooperative scenarios, and the poor compliance with standardized messaging in existing methods that fuse multi-modal inputs into a shared representation. For training, we present an end-to-end supervised pipeline using a downstream trajectory generation loss, in which a high-capacity generative sequence planner implicitly learns to steer the model and leverage multi-modal inputs via cross-attention injection. As a foundation model, we demonstrate that OmniV2X pre-trained on large-scale single-agent planning datasets can efficiently adapt to cooperative environments by integrating the conditioning context with lightweight, standard-compliant V2X tokens. Evaluated on the DAIR-V2X-Seq dataset, OmniV2X outperforms existing end-to-end cooperative driving baselines, achieving state-of-the-art performance with less than 10% of the fine-tune V2X dataset and less than 1% of the communication bandwidth. We conduct comprehensive evaluations to demonstrate its computational efficiency and robustness under real-world constraints.",https://arxiv.org/abs/2606.21165v1,"cs.RO, cs.AI"
2606.21159,Robotics,DPLAN: Minimal Connectivity to Floorplan Generation,"Rohit Lohani, Krishnendra Shekhawat",2026-06-19T06:51:56Z,"Automated floor plan generation is an important problem in computational architectural design. The goal is to construct a floor plan from user-defined room numbers and door requirements. The user specifies which rooms must share a door and which rooms must not be adjacent. However, these requirements do not determine the exact placement or shape of the rooms. The task is therefore to arrange the rooms in a single floor plan so that all required door connections are satisfied and no rooms overlap. To address this problem, we propose DPLAN (Door Connectivity to Floor Plan Generation), a graph-based prototype that generates floor plans from door and non-adjacency constraints.   The framework operates in three stages. First, the user-defined graph is examined and, if disconnected, additional edges are added to connect its components. Second, a bi-connected plane triangulation is constructed to ensure the existence of a floor plan without overlapping rooms or empty spaces. Third, the triangulated graph is transformed into floor plans. For rectangular floor plans (RFPs), separating triangles are removed by modifying edges without adding new vertices, thereby avoiding the creation of extra rooms. For orthogonal floor plans (OFPs), separating triangles are removed by introducing additional vertices, allowing rectilinear room shapes.   By enforcing both door and non-adjacency requirements, the framework generates floor plans that satisfy the given constraints. The method is implemented in Python and includes a prototype for interactive constraint specification and floor plan visualization. Currently, the framework supports rectangular plot boundaries. Future work includes support for non-rectangular plots, dimension-based scaling, and circulation modeling.",https://arxiv.org/abs/2606.21159v1,"cs.CG, cs.GR, cs.RO, math.CO"
2606.21148,Robotics,Pose-Agnostic Robotic Functional Grasping via Observation-Action Canonicalization,"Le Qiu, Cole Harrison, Jiankai Sun, Yao Liu, Suning Huang, Qianzhong Chen, Yang You, Marco Pavone",2026-06-19T06:37:43Z,"Functional robotic grasping requires a policy that generalizes across diverse object geometries and poses while maintaining task-specific contact precision. We study this challenge through mug-handle grasping, where thin handles, instance variation, and upright or inverted placements make both perception and control sensitive to object configuration. Grasp pose detection methods operate open-loop and are sensitive to estimation errors on thin handle structures. Learned visuomotor policies must implicitly learn to handle the coupled variation in visual appearance and action direction induced by different object placements, limiting generalization. We propose AnyMug, a canonicalized visuomotor reinforcement learning framework for functional grasping that trains a single closed-loop policy entirely in simulation and deploys it zero-shot on a real robot. AnyMug introduces observation-action canonicalization, which transforms both the depth observation and the predicted end-effector action into a shared object-centric frame. The policy therefore sees a consistent mug-centered view and emits actions in a canonical direction regardless of mug placement, allowing the same grasping behavior to be reused across configurations. A handle-aware reward further encourages precise approach, gripper alignment, and opposing-finger placement, while a pose curriculum and domain randomization improve training stability and sim-to-real transfer. In simulation, AnyMug achieves over 93% success rate on both unseen upright and inverted mugs and transfers zero-shot to a real Franka Panda, reaching 80% success rate on 5 held-out physical mugs across both pose categories.",https://arxiv.org/abs/2606.21148v1,cs.RO
2606.21139,Robotics,PoLAR: Factorizing Extent and Mode in Latent Actions for Robot Policy Learning,"Youngjoon Jeong, Jihwan Yu, Minsoo Jo, Junha Chun, Taesup Kim",2026-06-19T06:24:05Z,"Latent action pretraining learns representations of visual change from pairs of observations, but existing methods typically encode each transition as a single unstructured representation that entangles transition extent and transition mode. We introduce Polar Latent Actions with Radial structure (PoLAR), which imposes a radial-direction structure on latent actions, encouraging radius to encode transition extent and direction to retain transition mode. PoLAR uses temporal offset between two observations as a weak proxy for transition extent, encouraging latent action from observation pairs separated by larger temporal gaps to occupy larger radii. We instantiate this structure in hyperbolic space, whose expanding volume with radius offers a natural fit for more diverse transition modes at larger extents. Across in-task and large-scale pretraining settings, PoLAR improves downstream policy performance in simulation and real-world robot experiments, outperforming latent action baselines and strong pretrained VLAs. These results suggest that the geometry of the latent action space is an important design choice for transferring visual pretraining to downstream robot policy learning.",https://arxiv.org/abs/2606.21139v1,"cs.RO, cs.AI, cs.LG"
2606.21580,Energy,Assessing Majorana states and qubits through quantum capacitance,"Rodrigo A. Dourado, Ramón Aguado, Jeroen Danon, Martin Leijnse, Rubén Seoane Souto",2026-06-19T16:34:18Z,"Quantum capacitance (QC) has recently emerged as a promising tool for parity readout in topological qubits based on Majorana bound states (MBSs). Here, we show that this capability can be extended further: by employing an auxiliary quantum dot (QD) as a sensor, we demonstrate that QC measurements simultaneously resolve two fundamental figures of merit of the device, the ground-state energy splitting and the MBS overlap, thus providing direct access to the underlying internal degrees of freedom. Using a low-energy effective model, we provide analytic expressions for these two figures of merit that can be determined from the relative position and magnitude of the QC maxima in the even and odd parity sectors as functions of the auxiliary-QD energy. We further validate these results with a microscopic model of QD-based Kitaev chains and qubits, demonstrating their applicability in a wide range of MBS-based devices. Our results establish QC as a probe of MBS quality and a tool for topological-device optimization that preserves fermion parity.",https://arxiv.org/abs/2606.21580v1,"cond-mat.mes-hall, cond-mat.supr-con"
2606.21552,Energy,Perspective: Highly stable vapor-deposited glasses,M. D. Ediger,2026-06-19T15:48:20Z,"This article describes recent progress in understanding highly stable glasses prepared by physical vapor deposition and provides perspective on further research directions for the field. For a given molecule, vapor-deposited glasses can have higher density and lower enthalpy than any glass that can be prepared by the more traditional route of cooling a liquid, and such glasses also exhibit greatly enhanced kinetic stability. Because vapor-deposited glasses can approach the bottom of the amorphous part of the potential energy landscape, they provide insights into the properties expected for the ideal glass. Connections between vapor-deposited glasses, liquid-cooled glasses, and deeply supercooled liquids are explored. The generality of stable glass formation for organic molecules is discussed along with the prospects for stable glasses of other types of materials.",https://arxiv.org/abs/2606.21552v1,"cond-mat.soft, cond-mat.mtrl-sci"
2606.21545,Energy,Mirror-Symmetry-Enforced Photonic Altermagnet,"Chong Cao, Xiong-Xiong Xue, Yee Sin Ang, Haiyu Meng",2026-06-19T15:42:18Z,"Altermagnets host momentum-dependent spin splitting without net magnetization, a symmetry-enforced band phenomenon whose photonic analogues have so far been realized only in square lattices governed by fourfold rotation. Here we introduce a photonic altermagnet on a hexagonal lattice whose helicity splitting is governed by mirror rather than rotational symmetry. Elliptical chiral elements of alternating handedness, placed at the vertices of a regular hexagon, leave the two opposite-chirality sublattices connected only by chirality reversal combined with a mirror reflection. Full-wave simulations reveal mirror-related splitting of the two opposite-helicity branches in the band structure and isofrequency contours, with the channels exchanged when the ellipse orientation is reversed. In finite structures, this splitting separates a linearly polarized beam into handedness-resolved channels, enabling beam splitting and direction-selective helicity filtering with target-helicity output fractions above 0.85 and output paths continuously tunable through the ellipse rotation angle. These results extend photonic altermagnetism to a previously unexplored lattice-symmetry class and establish mirror-symmetric chiral textures as building blocks for altermagnetism-inspired chiral photonics.",https://arxiv.org/abs/2606.21545v1,"physics.optics, cond-mat.mtrl-sci, physics.app-ph"
2606.21507,Energy,Nontrivial Boundary-Mediated Superconducting Transport in a TRSB Topological Iron-Based Superconductor,"Wenyao Liu, Gabriel Natale, Camron Farhang, Michael Geiwitz, Qishuo Tan, Xingyao Guo, Mason Gray, Vincent LambertiJazzmin Victorin, Huairuo Zhang, James L. Hart, Vsevolod Belosevich, Xi Ling, Qiong Ma, Wan Kyu Park, Kenji Watanabe, Takashi Taniguchi, Judy J. Cha, Albert V. Davydov, Kin Chung Fong, Ethan Arnault, Genda Gu, Rui-Xing Zhang, Enrico Rossi, Jing Xia, Kenneth S. Burch",2026-06-19T15:01:26Z,"The interplay of superconductivity, band topology, and spontaneous time-reversal-symmetry breaking (TRSB) is expected to enable topological superconducting boundary states. FeTe0.55Se0.45 provides a promising single-material platform because it combines superconductivity, nontrivial band topology, and spontaneous magnetization in the superconducting state. Here we report evidence for a boundary-mediated superconducting transport response in exfoliated Fe(Te,Se) devices. Polar Kerr measurements show that TRSB emerges below TKerr < Tc and coexists with superconductivity across multiple compositions, providing an independent symmetry-breaking scale for transport. Using crystallographically sharp, continuous edges and side-surface-dominant contacts, we find that topological FeTe0.55Se0.45 exhibits an anomalous conductance plateau absent in topologically trivial FeTe0.40Se0.60 and Fe1.02Te0.55Se0.45 under comparable measurements. This plateau requires uninterrupted sharp edges connecting source and drain, persists over micrometer-scale separations far exceeding the bulk coherence length, shows strongly suppressed thermal broadening, and collapses when the drain is moved to the top surface. Its temperature evolution follows the TRSB scale: the plateau remains weakly broadened below T*Kerr and disappears near TKerr rather than Tc. These doping-selective, edge-geometry-dependent, TRSB-correlated, and long-range nonlocal signatures establish experimental criteria for identifying boundary-mediated superconducting transport in FeTe0.55Se0.45 and motivate phase-sensitive and theoretical studies of its microscopic origin.",https://arxiv.org/abs/2606.21507v1,"cond-mat.supr-con, cond-mat.str-el"
2606.21480,Energy,"Peripheral Nitrogen Topology as a Defect-Chemical Switch for Electronic and Magnetic States in Graphene: A First-Principles Study of Pyridinic, Pyridazinic, Pyrrolic, and Pyrazolic Configurations","Md. Moktadir Billah Tahmid, Indranil Rudra, Jahid Emon, Mohammad Jane Alam Khan",2026-06-19T14:32:56Z,"Defect and heteroatom engineering offer powerful routes for tuning the electronic and magnetic properties of graphene, yet the role of specific peripheral nitrogen topologies around graphene voids remains insufficiently understood. Here, spin-polarized first-principles calculations were performed to investigate how four heterocyclic -- like peripheral nitrogen configurations -- pyridinic, pyridazinic, pyrrolic, and pyrazolic modify the structural stability, charge redistribution, electronic structure, and magnetic response of graphene containing a central void. Among the four peripheral N configurations, the pyridinic N provides the most favorable structural-energetic balance among the investigated motifs. Bond-length analysis reveals that nitrogen topology strongly controls local lattice reconstruction. Charge-density, charge-density-difference, and Bader analyses demonstrate that the peripheral N atoms act as electron-accumulating centers and reshape the local electronic environment around the vacancy rim. Spin-resolved band structures show that pyridinic, pyridazinic, and pyrrolic configurations retain metallic or near-metallic defect-state character, whereas pyrazolic graphene opens a narrow band gap. Magnetic analysis further reveals that pyrazolic graphene is spin-compensated, with zero net magnetization, unlike the other systems, which possess finite spin-polarized moments. Spin-density and SPDOS analyses indicate that the magnetism originates from N-modulated vacancy-edge states involving both N 2p and neighboring C 2p orbitals. These findings establish peripheral nitrogen topology not merely as a structural defect descriptor, but as a deterministic defect-chemical switch, offering a metal-free route to pattern active spintronic and semiconducting domains directly into the graphene lattice through controlled vacancy-edge nitrogen coordination.",https://arxiv.org/abs/2606.21480v1,cond-mat.mtrl-sci
