id,domain,title,authors,published,abstract,url,categories
2607.14767,Space,Empirical verification of principal mode orthogonality and relative phase calibration in photonic lanterns,"Adam K. Taras, Barnaby R. M. Norris, Christopher Betters, Daniel S. Dahl, Andrew Ross-Adams, Peter G. Tuthill, Jin Wei, Sergio Leon-Saval",2026-07-16T09:52:05Z,"Photonic lanterns efficiently map input spatial modes to single-mode outputs for applications like high angular resolution imaging and nulling interferometry. However, manufacturing limits prevent full control over the device's mode transfer matrix at the design stage, making empirical characterisation essential. In this work we further analyse a dataset of direct measurements of a photonic lantern's principal modes using digital off-axis holography over a 73 nm range near 1550 nm. By analysing the electric field directly, we find that the principal modes are significantly more orthogonal than random vectors in a space of the same size, as expected for near-adiabatic devices. We propose metrics for quantifying this effect, noting that mode converters with orthogonal principal modes provide better conditioned inverse solvers. We also simulate additional measurements that characterisation systems could take, where the orthogonality would be leveraged to determine the relative phase between principal modes.",https://arxiv.org/abs/2607.14767v1,"physics.optics, astro-ph.IM"
2607.14696,Space,Early Near-Infrared Excess and Rapid Disk-Corona Evolution in the Tidal Disruption Event 2024aepd,"Yongxin Wu, Yanan Wang, Thomas M. Reynolds, Shuyuan Wei, Shiyan Zhong, Zikun Lin, Megan Newsome, Sebastian Gomez, Iair Arcavi, Panos Charalampopoulos, Chun Chen, Rongfeng Shen, Ning-Chen Sun, David Aguado, Ismael Pérez-Fournon, Frédérick Poidevin, Zhongnan Dong, Niu Li, Weijian Guo, Hu Zou, Jingbo Sun, Nieves Castro-Rodríguez, Antonio Cabrera-Lavers, Ning Jiang, Hengxiao Guo, J. P. Anderson, Tomás E. Müller-Bravo, Seppo Mattila, Claudia P. Gutiérrez, Amit Kumar, G. Pignata, Xiangkun Liu, R. Dastidar, Brajesh Kumar, Xiaowei Liu, Bin Ma, M. Dennefeld, Francesca Onori, Lydia Makrygianni, Mariusz Gromadzki, Xuan Fang",2026-07-16T07:58:25Z,"We present multi-wavelength observations of the tidal disruption event (TDE) 2024aepd, spanning primarily the first $\sim$300 days after discovery. The X-ray spectrum is initially dominated by a thermal disk component accompanied by a hard excess. From $\sim$178 days onward, the spectrum becomes power-law dominated and subsequently hardens, indicating the rapid emergence and strengthening of a hot corona. A prominent near-infrared (NIR) excess is detected as early as $\sim40$ days. Its nearly flat power-law spectrum strongly deviates from the Rayleigh-Jeans tail of the UV-optical blackbody. Although a conventional dust-echo origin cannot be completely ruled out, free-free emission from a reprocessing photospheric envelope provides a more plausible explanation. Moreover, the UV-optical-to-NIR break shifts to higher frequencies as the density-profile index remains nearly constant, implying evolving reprocessing conditions within a broadly unchanged density structure. Together with AT2019azh and TDE 2025abcr, TDE 2024aepd is the third TDE reported to exhibit an early-time NIR excess. A larger sample with early-time NIR coverage is needed to determine whether such excesses are common among TDEs.",https://arxiv.org/abs/2607.14696v1,astro-ph.HE
2607.14670,Space,Cosmogenic photon fluxes at ultra-high energies,"Marcus Niechciol, Chiara Jane Papior, Markus Risse",2026-07-16T07:37:09Z,"During their propagation, ultra-high energy cosmic rays produce cosmogenic photons. The expected flux level of these photons may vary by orders of magnitude depending on parameters such as the spectrum and composition of cosmic rays at injection or the source distance. We investigate the photon yields for various assumptions on injection parameters. The photon yield is largest for proton-emitting sources at about 15 Mpc distance for cosmogenic photons above $10^{18}$ eV. While the photon yield from protons always exceeds the one from heavier nuclei of the same total energy, the differences are reduced for larger source distances. Then, we quantify the cosmogenic photon fluxes for different source scenarios. We regard mixed-composition scenarios that were found to provide a reasonable description of the data from the Pierre Auger Observatory. In addition, benchmark scenarios leading to comparably high (""maximum"") or low (""minimum"") photon fluxes are determined assuming pure proton or pure iron primaries. For the mixed-composition scenarios that do not contain initial protons, the predicted cosmogenic photon fluxes are below present experimental limits by more than 1.5 orders of magnitude. In case of a substantial fraction of protons at the highest energies, the related photon flux might be in reach. Certain parameter combinations of pure proton scenarios are constrained already by present photon limits.",https://arxiv.org/abs/2607.14670v1,astro-ph.HE
2607.14669,Space,Optical design of a direct fibre-fed MO-IFS for the NLOT,"Nitish Singh, S. Sriram, Totan Chand, Jurgen Schmoll, Bharat Kumar Yerra, Savitha M S",2026-07-16T07:36:48Z,"The initial optical design and performance analysis of a dual-channel fibre-fed Multi-Object Integral Field spectrograph (Mo-IFS) being designed for a future National Large Optical/Infrared Telescope (NLOT) in India. The front end will be a moveable lenslet+fiber based integral field unit. The spectrograph is designed to directly accept an f/4 beam from the approximately 200 optical fibers, each with a 100 um core diameter without additional fore-optics. The instrument consists of two optimized spectral channels covering wavelength ranges of 0.32-0.62 um (blue channel) and 0.60-1.00 um (red channel). The optical design aims to achieve moderate spectral resolutions of approximately R ~ 2700 in the blue channel and R ~ 2500 in the red channel while maintaining high throughput over a broad spectral range. The spectrograph architecture includes a fiber-fed entrance slit, collimator optics, dichroic beam splitting system, dispersive elements, and dedicated camera optics for each channel. Zemax simulations were carried out to evaluate image quality, spot size distribution, spectral resolution, and detector sampling across the full wavelength range. The current work presents the initial optical configuration, design methodology, and expected performance of the instrument.",https://arxiv.org/abs/2607.14669v1,astro-ph.IM
2607.14637,Space,Efficiency of Tidal Dissipation in Convective Flow Under Rapid Tidal Forcing,"Hongzhe Zhou, Dong Lai",2026-07-16T07:02:39Z,"For close binaries and star-planet systems, tidal interactions mediate the energy transfer between the orbital motion and the internal flows of the bodies involved, thus playing a central role in their evolution. For equilibrium tides, the associated energy transfer is commonly modeled through an effective viscosity acting on the tidal flow. However, the scaling of viscous dissipation efficiency with tidal frequency $ω_\text{T}$ remains debated, particularly when $ω_\text{T}$ greatly exceeds the convective eddy turnover frequency $ω_\text{c}$. Previous numerical studies have addressed this issue by subjecting a turbulent convective flow to an oscillating background shear mimicking equilibrium tides. In this work, we adopt a novel three-layered convective box -- designed to represent a stellar convection zone sandwiched between two stable layers -- driven by an external periodic forcing. We quantify tidal dissipation efficiency by the forcing power on the flow in steady state. Our results yield a shallower scaling of tidal power per unit mass with $ω_\text{T}$ than reported in earlier shear-flow simulations. This scaling is consistent with the prediction by \cite{Terquem2021}, suggesting that the effective turbulent viscosity depends only weakly on $ω_\text{T}$, although our simulations are restricted to $ω_\text{T}\lesssim 10ω_\text{c}$. Moreover, we find no evidence of inverse energy transfer (or ``negative viscosity''), a phenomenon observed in some prior shear-flow simulations. We further investigate the influence of rotation within the same local framework. Slow rotation ($Ω\lesssim ω_\text{T}$) tends to enhance the tidal power, whereas fast rotation ($Ω\gtrsimω_\text{T}$) significantly suppresses it. We discuss the limitations of our approach and the broader implications of our findings.",https://arxiv.org/abs/2607.14637v1,"astro-ph.SR, astro-ph.HE, physics.flu-dyn"
2607.14636,Space,On the CME productivity of solar active region 13664/8,"Lijuan Liu, Yuming Wang, Quanhao Zhang, Jingnan Guo, Yutian Chi",2026-07-16T07:01:07Z,"In May 2024, NOAA active region (AR) complex 13664/8 was one of the most productive regions of the current solar cycle, producing 12 X-class flares and over 20 coronal mass ejections (CMEs) and triggering the strongest geomagnetic storm since 2003. We investigate why this AR complex was so CME-productive. Using primarily SDO/AIA and SDO/HMI observations, we analyzed its photospheric magnetic evolution, eruption sources, eruption waiting times, and magnetic parameters in comparison with five other ARs. The region initially contained only AR 13664 and exhibited limited flare activity until AR 13668 emerged on May 4, after which clustered major flares and CMEs occurred. Rapid, complex flux emergence substantially increased the region's area, magnetic flux, complexity, and nonpotentiality. The increased complexity was manifested by at least 12 emerging bipoles and 6 collisional polarity inversion lines (cPILs) formed between nonconjugated polarities, all showing sustained collision and shearing and serving as eruption sources. Decay index distributions show systematically lower critical heights (<45 Mm) above CME source regions. The CME waiting time distribution exhibits two peaks, suggesting that multiple cPILs enhanced CME productivity by increasing both recurrent CMEs from the same source and disturbance-triggered CMEs from nearby sources. These results indicate that, in addition to sufficient nonpotentiality and rapid background-field decay, high magnetic complexity accompanied by dynamical collisional shearing at multiple cPILs was crucial for the extreme CME productivity of AR 13664/8.",https://arxiv.org/abs/2607.14636v1,astro-ph.SR
2607.14633,Space,Runaway OB stars within 1 kpc of the Sun,"Juan Martinez Garcia, Nicholas Wright, Alexis Quintana",2026-07-16T06:56:44Z,"Runaway stars are high-velocity stars ejected from their birth environments that can provide insights into the kinematic history of the stellar cluster they were ejected from. We derived runaway star probabilities for 40 O-type stars and $24,487$ B-type stars taken from a recently published volume-complete sample of OB stars within 1 kpc of the Sun. We fit a Galactic rotation model to the observed proper motions of these stars and identify runaway stars using both a fixed 2D peculiar velocity threshold of $23\,km\,s^{-1}$ and by comparing individual peculiar velocities to the dispersion of the whole sample. We find runaway fractions of $17.5^{+0.1}_{-2.5}\%$ for O-type stars and $6.9\pm0.1\%$ for B-type stars; both using the fixed velocity threshold method. These values are consistent with previous studies, but with differences that are largely attributable to the underlying samples of OB stars used in various studies to identify runaway stars and to variations in the methods used to select them.",https://arxiv.org/abs/2607.14633v1,"astro-ph.SR, astro-ph.GA"
2607.15210,Quantum,Counterexamples to additivity of minimum output $p$-Rényi entropy of quantum channels for $p>3/4$ and $0\leq p<1/4$,"Debbie Leung, Benjamin Lovitz, Peixue Wu",2026-07-16T17:08:47Z,"Additivity of minimum output entropies is a central problem in quantum information theory. Nonadditivity is known for every Rényi order $p>1$, at the von Neumann point $p=1$, and near $p=0$, while most of the interval $0<p<1$ has remained open. We prove that for every Rényi order $p$ satisfying either $p>3/4$ or $0\leq p<1/4$, there exist finite-dimensional projection-induced quantum channels such that additivity of the minimum output $p$-Rényi entropy fails. The proof combines two correlated random-projection constructions: a product-conjugate Bell-state witness for $p>3/4$, and a transpose-complement rank-defect witness for $p<1/4$. Thus the unresolved part of $0<p<1$ is reduced to $[1/4,3/4]$. Our estimates also improve the output dimension threshold for additivity violation of minimum output von Neumann entropy, first established in Belinschi, Collins and Nechida.",https://arxiv.org/abs/2607.15210v1,"quant-ph, math-ph, math.PR"
2607.15201,Quantum,Entanglement Detection for Two-Qubit and Three-Qubit Pure States via Unitary Transformations and Ancilla State Measurements,"Yu-Hang Liu, Yuan-Hong Tao, Yi-Wen Liu, Ying-Huan Zhou, Shao-Ming Fei",2026-07-16T16:57:50Z,"Quantum entanglement is the fundamental hallmark of quantum mechanics and a core resource for realizing long-distance quantum communication and scalable linear quantum computing. Accordingly, the precise detection and quantitative quantification of entanglement constitute a foundational and critical problem in quantum information theory. To date, researchers have proposed numerous sufficient conditions for entanglement detection as well as a variety of entanglement measures to characterize the entanglement strength of quantum states; nevertheless, efficient and direct measurement schemes for core entanglement parameters remain underdeveloped. Based on unitary transformations and auxiliary measurements, this paper proposes a set of quantum circuit schemes capable of directly measuring the bipartite concurrence and the tripartite 3-tangle entanglement measure. By introducing auxiliary qubits and constructing specific controlled unitary operations, the proposed scheme maps the analytical expressions of the two entanglement measures onto the measurement probabilities of output states from quantum circuits. It enables efficient and direct quantitative measurement of bipartite and tripartite entanglement without performing full quantum state tomography. This work provides a feasible technical route for the experimental characterization of entanglement properties and lays a groundwork for the practical deployment of multipartite entanglement resources in quantum information processing.",https://arxiv.org/abs/2607.15201v1,quant-ph
2607.15184,Quantum,Backpropagating Pauli Propagation,"Sheng-Hsuan Lin, Etienne Granet, Kevin Hémery, Henrik Dreyer",2026-07-16T16:35:38Z,"We develop a backpropagation algorithm for evaluating parameter gradients in quantum circuits using Pauli propagation simulation. The method has computational complexity comparable to that of standard sparse Pauli simulation techniques, while producing gradients whose accuracy is of the same order as the corresponding observable expectation values. By exploiting the reversibility of quantum circuits, the algorithm reduces the memory cost by a factor of $\mathcal{O}(n_\text{param})$ compared with conventional reverse-mode automatic differentiation, where $n_\text{param}$ denotes the number of parameters in the circuit. Compared with finite difference methods, the algorithm is $\mathcal{O}(n_\text{param})$ more efficient in function evaluations. These features enable efficient and accurate classical optimization of quantum circuits for applications such as state preparation and time-evolution compression, while also allowing operator-complexity measures such as the operator stabilizer Rényi entropy to be monitored and regularized during optimization. We demonstrate the method by optimizing low-energy state-preparation circuits for transverse-field Ising models in one, two, and three dimensions and for the three-dimensional Heisenberg model, and by compressing two-dimensional time-evolution circuits.",https://arxiv.org/abs/2607.15184v1,"quant-ph, cond-mat.str-el"
2607.15169,Energy,Driven-dissipative superconductivity in moiré heterostructure without attraction,"Tsung-Sheng Huang, Atac Imamoglu, Mohammad Hafezi, Sebastian Diehl",2026-07-16T16:17:45Z,"Dissipative preparation of quantum order offers a route to superconductivity that does not rely on enhancing attractive interactions. Here we propose a driven-dissipative protocol to prepare superconductivity as a stationary state of a two-dimensional moiré heterostructure. The key ingredient is a bilayer moiré platform in which the layer degree of freedom acts as a pseudospin, allowing the pseudospin structure required for pairing to be implemented through optically induced spatial operations. This preparation scheme requires local dissipation, which we show to arises naturally from weakly dispersive bosonic modes in the heterostructure. In contrast, in the opposite regime of collective dissipation, the same platform exhibits an early-time superradiant burst. Our results establish driven-dissipative moiré heterostructures as a promising platform for preparing superconductivity, while also revealing a connection between steady-state pairing and transient superradiance.",https://arxiv.org/abs/2607.15169v1,"cond-mat.str-el, cond-mat.mes-hall, cond-mat.mtrl-sci, cond-mat.supr-con, quant-ph"
2607.15160,Quantum,Parameter-Shift Rules for Gradients in Boson Sampling Experiments,"Marius Trudeau, Pierre-Emmanuel Emeriau, Nicolás Quesada",2026-07-16T16:04:15Z,"Using a robust photon loss model for photonic quantum experiments, we derive $n-$th order parameter-shift rules for computing gradients of Fock boson sampling transition probabilities where $n$ photons are sent into a lossy interferometer. We also show that in general it is not possible to generalize this gradient recipe to the case of Gaussian boson sampling. Only in the specific case where the transmission matrix of the interferometer can be factorized as a diagonal loss matrix premultiplied by a pure unitary it is possible to obtain parameter-shift rules with a finite order given by twice the total number of photons detected. We demonstrate the efficacy of the proposed method by comparing its performance against finite differences on real hardware.",https://arxiv.org/abs/2607.15160v1,quant-ph
2607.15159,Quantum,LDGM-Based Quantum Codes for Fault-Tolerant Quantum Computation,"Yumin Li, Kejing Liu, Hanqing Lou, Javier Garcia-Frias",2026-07-16T16:02:16Z,"We construct a new family of Calderbank-Shor-Steane (CSS) codes using the generator and parity-check matrices of Low-Density Generator Matrix (LDGM) codes, with row operations applied to both matrices in order to achieve the desired quantum rate. Decoding is performed in an iterative manner, by applying message passing over the associated graph, and discrete Density Evolution (DDE) is used to optimize performance in the depolarizing channel. The proposed construction offers high flexibility and easiness in the design, producing quantum codes that possess excellent error correction capabilities. By properly designing the structure of the code, we are able to control and bound the weight of the stabilizer generators to a small value, which results in codes particularly well suited for fault-tolerant quantum computation. At the same time, these codes achieve very good performance in terms of error correction capability.",https://arxiv.org/abs/2607.15159v1,"quant-ph, cs.IT"
2607.15158,Quantum,Fast two-dimensional tensor-network contraction via subspace iteration,"Yining Zhang, Philippe Corboz",2026-07-16T16:00:54Z,"The corner transfer matrix renormalization group (CTMRG) is one of the standard contraction methods for infinite projected entangled-pair states (iPEPS), but its computational cost is dominated by repeated truncated singular value decompositions (SVDs). We introduce subspace-iteration CTMRG (SI-CTMRG), a QR-based projector construction that replaces each large-matrix SVD with an SVD of a much smaller matrix. The resulting algorithm shifts the dominant cost from decompositions to tensor contractions, making it highly suited to GPU acceleration and yielding speedups of up to two orders of magnitude over standard CTMRG. We demonstrate the efficiency and accuracy of the method for the triangular-lattice Heisenberg antiferromagnet, reaching state-of-the-art iPEPS results on a single H100 GPU in approximately 10 hours of computation.",https://arxiv.org/abs/2607.15158v1,"cond-mat.str-el, quant-ph"
2607.15151,Quantum,Superadditivity for Entanglement-Assisted Communication,"Hao-Chung Cheng, Mario Berta",2026-07-16T15:52:04Z,"The entanglement-assisted capacity of a quantum channel admits an additive single-letter characterization, implying that joint encodings across channel uses cannot increase the ultimate communication rate. Here, we show that this additive picture does not extend to communication reliability. Specifically, we prove that the Petz-Rényi channel information can be strictly superadditive for every $α\in[1/2,1)$, yielding a genuine multi-copy enhancement of the entanglement-assisted random-coding error exponent, even though the entanglement-assisted capacity remains additive. We establish this phenomenon analytically already for measurement channels, which are entanglement-breaking and have additive unassisted capacity. Remarkably, this strict superadditivity is witnessed by a separable, classically correlated two-copy channel-input marginal, demonstrating that no entanglement between the transmitted systems is required. Our results show that, although correlations across channel uses cannot increase the ultimate rate of entanglement-assisted communication, they can enhance its reliability.",https://arxiv.org/abs/2607.15151v1,"quant-ph, cs.IT, math-ph"
2607.15132,Quantum,Periodic orbits and quantum many-body scars in integrable spin chains,"Elena Petrova, Maksym Serbyn, Marko Ljubotina",2026-07-16T15:41:37Z,"Quantum many-body scars provide an exception to generic thermalising dynamics, but their relation to integrability remains unclear. Here we apply the periodic-orbit framework to the integrable XYZ/XXZ spin-1/2 chain, developing an energy-resolved approach that enables us to locate and track periodic orbits across the spectrum. We identify families of scarred orbits and resolve their supporting eigenstates in terms of Bethe-ansatz quantum numbers, revealing a common string core dressed by zero-momentum magnon pairs. This allows us to reconstruct both the scarred eigenstates and the associated towers directly within the Bethe ansatz, and explain the equidistant tower spacing analytically from the decoupling of zero-momentum magnon pairs in the Bethe equations, providing a microscopic realisation of scar phenomenology in an integrable setting. We further show that this structure persists upon breaking integrability with a transverse field, with the periodic orbits continuing to govern the dynamics. Our results establish a direct connection between the periodic-orbit picture of quantum scarring and the algebraic structure of integrable models, showing that key features of scar dynamics can be understood analytically within the Bethe ansatz framework.",https://arxiv.org/abs/2607.15132v1,"quant-ph, cond-mat.stat-mech, cond-mat.str-el"
2607.15124,Quantum,On the origin of finite entanglement scaling,"Luke Hodgkiss, Laurens Lootens, Atsushi Ueda, Bram Vanhecke, Frank Verstraete",2026-07-16T15:33:30Z,"The concept of finite entanglement scaling forms one of the pillars on which the tensor network ecosystem is built. In this paper, we resolve the open problem of determining the actual perturbations induced by matrix product state approximations of critical systems, and we demonstrate that these can be quite different than the ones predicted by conformal field theory. To that aim, we develop a sparse linear solver to calculate the forward and backward derivatives of 2-dimensional tensor networks with respect to their defining parameters in an implicit way. This algorithm is of independent interest as it provides a primitive for the variational optimization of projected entangled pair states that circumvents the instabilities plaguing traditional automatic differentiation methods.",https://arxiv.org/abs/2607.15124v1,"quant-ph, cond-mat.str-el, hep-lat"
2607.15121,Quantum,Quantum Lock-In Detection via Successive Adiabatic Evolution,"Kangze Li, Siqi Chen, Hao Zhang, Jiazhao Tian, Liantuan Xiao, Gerardo Adesso",2026-07-16T15:29:48Z,"In recent years, quantum lock-in detection has emerged as a promising technique to accurately detect weak signals submerged in background noise. However, the signal-to-noise ratio of existing protocols is severely limited by spectral leakage resulting from control operations implemented in pulse form. Here, we propose a general protocol for realizing quantum lock-in detection by employing successive quantum adiabatic evolution. In our protocol, the signal modulation is achieved by adiabatically controlling the time evolution of the quantum probe, which enables the implementation of triangular modulation functions. The realization of triangular-wave modulation fundamentally solves the problem of spectral leakage and facilitates the extraction of the complete characteristics of the target signals. We present a practical implementation scheme of adiabatic quantum lock-in detection based on nitrogen-vacancy centers in diamond, and demonstrate that the proposed protocol possesses strong resilience against experimental imperfections. Our results establish adiabatic quantum lock-in detection as a robust and experimentally accessible approach to detection of weak alternating signals in noisy environments, thus promoting the advance of real-world quantum sensing technologies.",https://arxiv.org/abs/2607.15121v1,quant-ph
