id,domain,title,authors,published,abstract,url,categories
2604.25371,Bio,PhyloSDF: Phylogenetically-Conditioned Neural Generation of 3D Skull Morphology via Residual Flow Matching,"Kaikwan Lau, Gary P. T. Choi",2026-04-28T08:38:00Z,"Generating novel, biologically plausible three-dimensional morphological structures is a fundamental challenge in computational evolutionary biology, hampered by extreme data scarcity and the requirement that generated shapes respect phylogenetic relationships among species. In this work, we present PhyloSDF, a phylogenetically-conditioned neural generative model for 3D biological morphology that integrates two innovations: (1) a DeepSDF auto-decoder regularized by a novel Phylogenetic Consistency Loss that structures the latent space to correlate with evolutionary distances (Pearson $r=0.993$); (2) a Residual Conditional Flow Matching (Residual CFM) architecture that factorizes generation into analytic species-centroid lookup and learned residual prediction, enabling generation from as few as ~4 specimens per species. We evaluate PhyloSDF on 100 micro-CT-scanned skulls of Darwin's Finches and their relatives across 24 species. The model generates novel meshes achieving 88-129% of real intra-species variation at the code level, with all 180 generated meshes verified as non-memorized. Residual CFM surpasses denoising diffusion (which fails entirely at this scale), standard flow matching (which mode-collapses to 3-6% variation), and a Gaussian mixture baseline in both fidelity (Chamfer Distance 0.00181 vs. 0.00190) and morphometric Fréchet distance (10,641 vs. 13,322). Leave-one-species-out experiments across 18 species demonstrate phylogenetic extrapolation capability, and smooth latent interpolations produce biologically plausible ancestral skull reconstructions.",https://arxiv.org/abs/2604.25371v1,"q-bio.QM, cs.CV"
2604.25244,Bio,"Learning Structure, Energy, and Dynamics: A Survey of Artificial Intelligence for Protein Dynamics","Haocheng Tang, Liang Shi, Ya-Shi Zhang, Xixian Liu, Jian Tang, Jiarui Lu",2026-04-28T05:49:11Z,"Protein dynamics underlie many biological functions, yet remain difficult to characterize due to the high computational cost of molecular dynamics simulations and the scarcity of dynamic structural data. This survey reviews recent advances in artificial intelligence for protein dynamics from three perspectives: learning from structural ensembles and trajectories, learning from physical energy signals, and learning to accelerate molecular simulations. We summarize representative methods for conformation ensemble generation, trajectory generation, Boltzmann generators, physics-aware adaptation, machine learning potentials, coarse-grained modeling, and collective variable discovery. We further discuss available datasets and key open challenges, such as scalability, thermodynamic consistency, kinetic fidelity, and integration with experimental constraints.",https://arxiv.org/abs/2604.25244v1,"q-bio.BM, cs.LG"
2604.25233,Bio,A Combinatorial Optimisation Approach to Multi-factorial Gap-filling in Genome-scale Metabolic Models (GEMs),"Philip Kilby, Sevvandi Kandanaarachchi, Matthew J. Morgan, Amy M. Paten, Mariana Velasque, Andrew C. Warden, Juan P. Molina Ortiz",2026-04-28T05:29:03Z,"Genome-Scale Metabolic Models (GEMs) describe the interactions between genes, proteins, and the biochemical reactions that underpin an organism's metabolism aiming to computationally simulate functions at the cellular level. While many metabolic reactions can be inferred from genome analysis, constructing GEMs often involves incorporating reactions unsupported by genomic data to improve prediction accuracy. This is known as gap-filling, a process that can be performed manually (a time-consuming task) or computationally. Traditional computational gap-filling approaches aim to correct GEM predictions for a single environmental condition (medium) by solving a large Integer Linear Programming problem. Sequential application across multiple media can produce a more robust model, but often introduces unrealistic predictions in other media. They are also slow to run. In this paper, we study multi-factorial gap filling, which aims to gap-fill GEMs across typically 10 or more input media simultaneously, while improving their overall predictive accuracy and minimising unrealistic behaviour. We view the selection of the set of reactions as a combinatorial optimisation problem, and describe a method based on classic metaheuristic approaches which requires the solution of continuous Linear Programming problems only. This paper provides an introduction of this problem to an audience whose speciality lies outside biology, and suggests a practical first-cut solution method. We demonstrate the method gap-filling GEMs for three bacteria strains, selecting 3000 to 4000 reactions from a database of more than 11000 reactions, while attempting to match the empirically measured performance on 9 to 28 separate media conditions. We show that our method outperforms conventional approaches on multiple metrics, including Kendal Tau and RMS Error by an average of 7.3% and 13.3%, respectively.",https://arxiv.org/abs/2604.25233v1,"math.OC, q-bio.GN"
2604.25180,Bio,On a Keller-Segel type equation to model Brain Microvascular Endothelial Cells growth's patterns,"B Ambrosio, A Garroudji, S. Fitzsimons, H Zaag, F. M. Elahi",2026-04-28T03:38:04Z,"This article presents a partial differential equation (PDE) of Keller-Segel (KS) type that reproduces patterns commonly observed during the growth of brain microvasculature. We provide mathematical insights into the mechanisms underlying the emergence of these patterns. In addition, we derive a data-driven equation that ensures a consistent temporal evolution of the chemoattractant associated with the observed microvascular dynamics. Beyond numerical simulations, the aim of this study is to advance a comprehensive mathematical modeling framework, spanning blood flow in cerebral arterial networks to biochemical processes, in order to better understand how vascular impairments may contribute to neurodegenerative diseases.",https://arxiv.org/abs/2604.25180v2,"math.DS, q-bio.QM"
2604.26975,Bio,T-cell repertoire response in individuals with post-acute sequelae of COVID-19,"Zachary Montague, Rhea M Grover, Andrew Baumgartner, Assya Trofimov, Jennifer Hadlock, Armita Nourmohammad",2026-04-28T01:41:58Z,"T-cells are central to SARS-CoV-2 clearance and immunological memory, yet their contribution to the persistence of post-acute sequelae of COVID-19 (PASC) remains poorly understood. The immunological features that distinguish individuals who develop PASC from those who recover fully are unresolved, in part due to the phenotypic heterogeneity of the condition and the likely multiplicity of its underlying mechanisms. Here, we profiled longitudinal bulk TCR$β$ repertoires from 120 individuals in the INCOV cohort--71 with PASC and 49 without--sampled at two to three time points spanning the acute and post-acute phases of infection. Using robust statistical modeling of repertoire composition and clonal dynamics, we found that global statistics such as V, J gene usage and CDR3 length do not differ between groups, but that locally enriched sequence motifs and differentially dynamic clones reveal distinct T-cell signatures associated with PASC status. Clones contracting following the peak of the acute response were significantly enriched for SARS-CoV-2 specificity in both groups. Interestingly, Influenza A-specific TCRs were disproportionately enriched among contracting clones in PASC{$^+$} repertoires, implicating viral co-infection as a potential contributor to early disease severity and, possibly, PASC pathogenesis. Rare public TCR clones were markedly enriched for SARS-CoV-2 specificity, with PASC{$^+$} individuals harboring a modestly but significantly higher proportion than PASC{$^-$} individuals. Together, we identified over 1,000 candidate TCR$β$ receptors potentially discriminating PASC{$^+$} from PASC{$^-$} immune responses, opening a path toward the identification of disease-relevant T-cell specificities and the development of T-cell-based immunological biomarkers for long COVID.",https://arxiv.org/abs/2604.26975v1,q-bio.GN
2605.00778,Health,Observable Performance Does Not Fully Reflect System Organization: A Multi-Level Analysis of Gait Dynamics Under Occlusal Constraint,"Jacques Raynal, Pierre Slangen, Jacques Margerit",2026-05-01T16:48:00Z,"In biomechanical systems, observable performance is often used as a proxy for underlying system organization. However, this assumption implicitly presumes a correspondence between output metrics and internal system states that may not hold in adaptive systems. In this study, the vertical dimension of occlusion (VDO) is considered as a constraint applied to an adaptive neuromechanical system, enabling the exploration of system-level responses under controlled variations. A single-case design in a patient with Parkinson's disease allows an intra-individual analysis across repeated conditions.The analysis is structured across three complementary levels: (i) aggregated linear metrics describing observable performance, (ii) a dynamical systems framework describing temporal organization in state space, and (iii) a latent space representation obtained through unsupervised embedding. The results show that conditions with comparable observable performance may correspond to different organizations in both state space and latent space representations. This dissociation highlights a limitation of aggregated metrics and suggests that similar outputs may arise from non-equivalent system states. A fourth level is proposed as a purely conceptual extension describing potential relationships between system states. This level is not implemented and is not derived from experimental data. These observations are strictly exploratory and non-causal. The proposed framework does not establish mechanistic, predictive, or directional relationships, but provides a structured approach for analyzing constraint-driven systems across multiple levels of representation.",https://arxiv.org/abs/2605.00778v1,"cs.LG, q-bio.NC"
2605.00746,Health,Functional Connectivity-Guided Band Selection for Motor Imagery Brain-Computer Interfaces,"Natália Araújo do Carmo, Aarthy Nagarajan",2026-05-01T15:53:32Z,"Reliable control in motor imagery brain-computer interfaces (MI-BCIs) requires the precise decoding of user-specific neural rhythms, which vary significantly across individuals. The Common Spatial Pattern (CSP) algorithm is a cornerstone of MI-BCI decoding, yet its performance depends strongly on the spectral range of the input EEG data. Although Filter Bank CSP (FBCSP) extends this as a data-driven decoding framework, its frequency sub-bands are predefined rather than selected using subject-specific physiological criteria. This paper presents a proof-of-concept study of static functional connectivity (FC)-guided band selection for MI-BCI, demonstrated using a conventional FBCSP-based pipeline. The proposed method identifies the most discriminative spectral bands by calculating phase-based connectivity across four sensorimotor channels using wPLI, PLV, and PLI. Nine bands in a 4-40 Hz filter bank are ranked by the effect size of their hemispheric coupling differences and pruned to the top K bands for feature extraction and classification via FBCSP and a Support Vector Regressor. This framework was tested for K values ranging from 1 to 8 across the BCI Competition IV-2a (n = 9) and OpenBMI (n = 54) datasets. Performance was benchmarked against standard nine-band FBCSP and random ablation to determine the minimum number of bands (K*) required to maintain accuracy within a 2% baseline equivalence zone. Results show FC-guided selection can outperform random ablation and achieve near-baseline performance while reducing required CSP fits by 22.2% to 77.8%. PLV enables the most aggressive dimensionality reduction by prioritizing the μ and low-\b{eta} ranges, while wPLI demonstrates superior inter-session robustness by mitigating volume conduction. These findings establish FC-guided selection as a principled and interpretable alternative to heuristic filter bank designs.",https://arxiv.org/abs/2605.00746v1,"q-bio.NC, eess.SP, physics.optics"
2605.00465,Health,Intrinsic Brain Networks Underlying the Experience and Expression of Subclinical Anxiety,"Shruti Kinger, Mrinmoy Chakrabarty",2026-05-01T07:01:05Z,"Anxiety includes behavioural, physiological, and subjective components that do not always align, and it remains unclear whether these dimensions are supported by distinct intrinsic brain networks. Guided by the two-system framework, we tested whether resting-state functional connectivity (rsFC) differentiates these components in subclinical anxiety. Forty-seven young adults spanning a range of subclinical anxiety levels completed a threat anticipation task measuring behavioral responses (reaction time) and physiological arousal (skin conductance), along with the NIH Fear-Affect self-report of anxiety severity. These measures were related to rsFC using region-of-interest analyses. Higher subclinical anxiety was associated with faster responses under temporally uncertain threat, consistent with increased vigilance, while no association was found with physiological arousal. At the neural level, three connectivity patterns emerged and remained significant after sequential family-wise error correction. Behavioural responses modulated by subclinical anxiety were linked to stronger connectivity between the anterior cingulate cortex (ACC) and insula. Physiological modulation was associated with connectivity between the ACC and orbitofrontal cortex (OFC). Subjective anxiety was associated with increased connectivity between the hippocampus and insula. Additional connections were observed but did not survive stricter correction. Overall, the findings indicate that behavioural, physiological, and subjective aspects of subclinical anxiety map onto partially dissociable but overlapping intrinsic brain networks, extending prior task-based results to resting-state connectivity and informing future work on early neural markers of anxiety.",https://arxiv.org/abs/2605.00465v1,q-bio.NC
2605.00401,Health,SIMON: Saliency-aware Integrative Multi-view Object-centric Neural Decoding,"YuSheng Lin, Ji-Hwa Tsai, Chun-Shu Wei",2026-05-01T04:43:24Z,"Recent EEG-to-image retrieval methods leverage pretrained vision encoders and foveation-inspired priors, but typically assume a fixed, center-focused view. This center bias conflicts with content-driven human attention, creating a geometric-semantic dissociation between visual features and EEG responses. We propose SIMON, a saliency-aware multi-view framework for zero-shot EEG-to-image retrieval. SIMON combines foreground segmentation and saliency prediction to select fixation centers via Saliency-Aware Sampling (SAS), then generates foveated views that emphasize informative object regions while suppressing background clutter. On THINGS-EEG, SIMON achieves state-of-the-art performance in both intra-subject and inter-subject settings, reaching an average Top-1 accuracy of 69.7% and 19.6%, respectively, consistently outperforming recent competitive baselines. Analyses across sampling granularity, EEG channel topology, and visual/brain encoder backbones further support the robustness of saliency-aware multi-view integration. Our code and models are publicly available at https://github.com/simonlink666/SIMON.",https://arxiv.org/abs/2605.00401v1,"cs.CV, q-bio.NC"
2604.28007,Health,Multisensory learning recruits visual neurons into an olfactory memory engram,"Zeynep Okray, Nils Otto, Anna A. Cook, Clifford Talbot, Ashwin Miriyala, Martín Klappenbach, Ciara Stern, Kieran Desmond, Paola Vargas-Gutierrez, Scott Waddell",2026-04-30T15:28:58Z,"Associating multiple sensory cues with a single experience or object is a fundamental process that improves object recognition and memory performance. However, neural mechanisms that bind sensory features during learning and augment memory expression are unknown. Here we demonstrate multisensory appetitive and aversive memory in Drosophila. Combining colours and odours improved memory performance, even when each sensory modality was tested alone. Temporal control of neuronal function revealed visually-selective mushroom body Kenyon Cells (KCs) to be required for enhancement of visual and olfactory memory recall after multisensory training. Synapse-level connectomics suggests that valence-relevant dopaminergic reinforcement could permit the KC-spanning serotonergic DPM neurons to bridge between previously modality-selective KC streams. Consistent with this model, DPM transmission is uniquely required during multisensory memory formation and for enhanced expression of olfactory memory afterwards. In addition, signalling via the DopR1 dopamine receptor is required in APL neurons, suggesting that reinforcing dopamine could locally release GABA-ergic inhibition to permit bridging microcircuits to function. Cross-modal binding thereby expands the KCs representing the olfactory memory engram into those representing the colour. We propose that broadening of the engram improves memory performance after multisensory learning and permits a single sensory feature to retrieve the memory of the multimodal experience.",https://arxiv.org/abs/2604.28007v1,q-bio.NC
2604.27894,Health,On Agentic Behavioral Modeling,"Dirk Ostwald, Rasmus Bruckner, Franziska Usée, Belinda Fleischmann, Joram Soch, Sean Mulready",2026-04-30T14:09:09Z,"Integrating theoretical neuroscience, decision theory, and probabilistic inference offers a promising route to understanding human cognition, yet concrete methodological bridges between agentic AI models and behavioral data analysis remain formally underdeveloped. We advance this synthesis under the framework of agentic behavioral modeling (ABM), which treats artificial agents as latent, generative hypotheses about cognitive mechanisms and evaluates them by their statistical adequacy in explaining human behavior. After outlining its conceptual foundations, we apply the framework to two minimal laboratory paradigms: a binary perceptual contrast-discrimination task and a symmetric two-armed bandit learning task. We formalize each task-agent-data system as a joint probability model, derive explicit conditional log-likelihoods for behavioral inference, validate different model variants using model and parameter recovery simulations, and evaluate them in light of empirical data. Using these minimal examples, we provide an agent-centric interpretation of the psychometric function, derive optimal policies for both tasks, and show the equivalence between Rescorla-Wagner learning and Bayesian inference in symmetric bandits. More broadly, this work may serve as a conceptual and practical foundation for applying ABM to cognitive behavioral science.",https://arxiv.org/abs/2604.27894v1,q-bio.NC
2605.00067,Health,EPITIME: A Computational Framework for Integral Epidemic Models with Structure-Preserving Discretizations,"Bruno Buonomo, Eleonora Messina, Claudia Panico, Mario Pezzella, Gaetano Zanghirati",2026-04-30T09:35:40Z,"We present EPITIME (EPidemic Integral models TIMe profile Explorer), a computational framework for the simulation of two classes of integral epidemic models: an age of infection model and an information dependent behavioural model. The framework combines structure preserving Non-Standard Finite Difference discretizations with modular implementations in MATLAB and Python, together with routines for parameter handling, input validation, performance assessment, and graphical interaction. The proposed methods preserve key qualitative properties of the continuous problems, including positivity, boundedness, invariant regions, and correct long term behaviour, independently of the time step. We outline the numerical schemes for both model classes and their main analytical properties, including first order convergence. We then describe the software architecture and illustrate its use through numerical experiments on asymptotic behaviour, inverse reconstruction of an infectivity kernel from COVID 19 incidence data, and behavioural dynamics under different memory kernels. Overall, EPITIME provides a reliable and accessible computational environment for the numerical study of renewal epidemic models.",https://arxiv.org/abs/2605.00067v1,"q-bio.QM, q-bio.PE"
2604.27583,Health,Simulating Infant First-Person Sensorimotor Experience via Motion Retargeting from Babies to Humanoids,"Francisco M. López, Hoshinori Kanazawa, Ondrej Fiala, Yakov Balashov, Valentin Marcel, Lukas Rustler, Miles Lenz, Dongmin Kim, Yasuo Kuniyoshi, Jochen Triesch, Matej Hoffmann",2026-04-30T08:37:46Z,"Motion retargeting from humans to human-like artificial agents is becoming increasingly important as humanoid robots grow more capable. However, most existing approaches focus only on reproducing kinematics and ignore the rich sensorimotor experience associated with human movement. In this work, we present a framework for simulating the multimodal sensorimotor experiences of infants using physical and virtual humanoids. From a single video, our method reconstructs the infant's body configuration by extracting its skeletal structure and estimating the full 3D pose from each frame. Then we map the reconstructed motion onto several developmental platforms: the physical iCub robot and the virtual simulators pyCub, EMFANT and MIMo. Replaying the retargeted motions on these embodiments produces simulated multisensory streams including proprioception (joints and muscles), touch, and vision. For the best-matching embodiment, the retargeting achieves sub-centimeter accuracy and enables a rich multimodal analysis of infant development as well as enhanced automated annotation of behaviors. This framework provides a unique window into the infant's sensorimotor experience, offering new tools for robotics, developmental science, and early detection of neurodevelopmental disorders. The code is available at https://github.com/ctu-vras/motion-retargeting/.",https://arxiv.org/abs/2604.27583v1,"q-bio.NC, cs.RO"
2604.27520,Health,Incorporating the underuse problem in the tragedy of the commons,"Shota Shibasaki, Wakaba Tateishi, Shuhei Fujii, Ryosuke Nakadai",2026-04-30T07:22:39Z,"The tragedy of the commons has traditionally been framed as a problem of resource overuse driven by self-interested exploitation. In contrast, growing empirical evidence shows that insufficient use or abandonment of natural resources, known as underuse, can also lead to ecological degradation and loss of ecosystem services. Despite its relevance, underuse has rarely been examined within evolutionary theories of resource use. Here, we develop a simple eco-evolutionary model that integrates both provisioning and non-provisioning ecosystem services to analyze the evolution of resource-use strategies. Using adaptive dynamics, we investigate how individual resource use evolves while altering resource abundance. The model shows that overuse and underuse arise naturally as alternative evolutionary outcomes of the same underlying process, alongside intermediate use and evolutionary branching. We derive analytical conditions for the existence, number, and stability of evolutionarily singular strategies, and show that the qualitative evolutionary fate is primarily determined by the shape of provisioning benefits. Only when provisioning benefits increase in a concave manner does evolutionary dynamics converge to a unique intermediate strategy that is continuously stable. In contrast, convex increasing benefits generate a broader range of outcomes: overuse, underuse, bi-stability, and evolutionary branching. By explicitly comparing the continuously stable strategy with the socially optimal strategy, we further quantify how their deviations depend on the valuation of non-provisioning services. Our results provide a theoretical framework for viewing the common-pool resource dilemmas as intrinsically two-sided evolutionary problems, and offer a baseline for future studies exploring interventions to address overuse and underuse simultaneously.",https://arxiv.org/abs/2604.27520v1,q-bio.PE
2604.27312,Health,Epidemic Extinction in a Continuous SIRS Model with Vaccination,"Germano Hartmann Brill, Pablo Enrique Jurado Silvestrin, Sebastian Gonçalves",2026-04-30T01:51:19Z,"Epidemics have shaped human history, often with devastating consequences, motivating the development of mathematical models to understand and control their dynamics. Among the many aspects of epidemic behavior, the conditions that lead to epidemic extinction stand out as a central-if not the fundamental-question in epidemic modeling. In this work, we study epidemic extinction in a continuous SIRS (Susceptible-Infected-Recovered-Susceptible) model governed by a system of ordinary differential equations (ODEs). The model includes vaccination as a time-dependent process and considers the reinfection of recovered individuals through waning immunity. We analyze how different parameter regimes -- particularly infection, recovery, and immunity loss rates -- affect the persistence or extinction of the epidemic. Special attention is given to the limitations of continuous population models, in which the infected fraction can fall below the equivalent of a single individual, leading to nonphysical outcomes such as unrealistically long persistence or artificial secondary peaks. By comparing the continuous SIRS dynamics with expected real-world thresholds for extinction, we highlight the importance of incorporating stochasticity or discrete effects to accurately describe epidemic fade-out.",https://arxiv.org/abs/2604.27312v1,"q-bio.PE, physics.soc-ph"
