id,domain,title,authors,published,abstract,url,categories
2605.00154,Space,Confirmation of Fe I on MASCARA-5 b's Dayside Observed With EXPRES,"James T. Sikora, Joe Llama, Rachael M. Roettenbacher, Elisabeth M. Brann, Jean-Michel Désert, Alex S. Polanski, Malena Rice, Lily Zhao",2026-04-30T19:22:03Z,"MASCARA-5~b/TOI-1431~b is an ultra-hot Jupiter \citep[$P_{\rm orb}=2.650237\pm0.000003\,{\rm d}$, $T_{\rm eq}=2370\pm70\,{\rm K}$, $M_{\rm p}=3.12\pm0.18\,M_{\rm Jup}$, $R_{\rm p}=1.49\pm0.05\,R_{\rm Jup}$;][]{addison2021} orbiting a bright Am star ($V=8.0\,{\rm mag}$). Recent time-series observations obtained with PEPSI@LBT during the planet's post-eclipse phases have revealed Fe~{\sc i} emission lines indicative of a thermally inverted atmosphere. These observations demonstrate that MASCARA-5~b is well-suited to atmospheric characterization via emission spectroscopy, thereby motivating further follow-up observations covering additional orbital phases to constrain the planet's atmospheric chemistry, thermal structure, and dynamics. Here we present pre-eclipse time-series observations obtained with the high-resolution optical spectrograph EXPRES@LDT. Our analysis confirms the previous detection of gas-phase Fe~{\sc i} on MASCARA-5~b's dayside (with a $5.5σ$ significance obtained from two nights of observations) and the fact that the thermal profile is inverted with lower and upper temperatures $\sim2000\,{\rm K}$ and $\sim4500\,{\rm K}$, respectively. A search for Fe~{\sc ii} and Cr~{\sc i} did not yield any plausible detections. We also find that the pre-eclipse signal exhibits a non-negligible blueshift of $-3.2\pm1.4\,{\rm km/s}$ potentially caused by winds.",https://arxiv.org/abs/2605.00154v1,astro-ph.EP
2605.00153,Space,Radiation Total Dose for PRIMA: Cold Exposure with Alpha Particles,"Elijah Kane, Chris Albert, Andrew Beyer, Charles, Bradford, Pierre Echternach, Logan Foote, Jason Glenn, Henry, LeDuc, Hien Nguyen, Thomas Stevenson, Brian Zhu, Jonas Zmuidzinas",2026-04-30T19:21:14Z,"The Probe far-Infrared Mission for Astrophysics (PRIMA) is a far-infrared (24-261 micron wavelengths) probe-class space observatory currently under Phase A study, which promises orders-of-magnitude improvement in mapping speed over its predecessors. PRIMA will field exquisitely sensitive kilopixel arrays of kinetic inductance detectors (KIDs) for the Far-Infrared Enhanced Survey Spectrometer (FIRESS) instrument. PRIMA will orbit in space at the Sun-Earth L2 point, where Planck found the energetic particle flux to be about 300/min/cm2. Thus, the possible effect of a high fluence of energetic particles on the detector sensitivity must be characterized. Previous work has suggested that bombardment of KIDs by ions can reduce the quasiparticle lifetime (Barends et. al. 2009), but the conditions of the experiment were not representative of a detector which is continuously held at sub-Kelvin temperatures in the energetic particle environment of L2 orbit. To better replicate the damage which would be produced by energetic particles in this environment, we developed a fully cryogenic irradiation experiment in which a stepper motor controls a screen which can block or reveal an alpha particle emitter. This setup can be used to irradiate aluminum KID arrays fabricated for FIRESS to well-controlled dose levels. In this work, we calculate the damage dose expected for a 5-year mission in L2 orbit, and we irradiate an array to approximately 62 percent of this level. Before and after irradiation, we measure the quasiparticle lifetimes, resonant frequencies, and quality factors of the detectors.",https://arxiv.org/abs/2605.00153v1,astro-ph.IM
2605.00124,Space,Merger remnant and eccentricity dynamics surrogates for eccentric nonspinning black hole binaries,"Adhrit Ravichandran, Peter James Nee, Keefe Mitman, Tousif Islam, Scott E. Field, Vijay Varma, Michael Boyle, Andrea Ceja, Nils Deppe, Noora Ghadiri, Lawrence E. Kidder, Prayush Kumar, Marlo Morales, Jordan Moxon, Kyle C. Nelli, Harald P. Pfeiffer, Antoni Ramos-Buades, Katie Rink, Hannes R. Rüter, Mark A Scheel, Md Arif Shaikh, Leo C. Stein, Daniel Tellez, William Throwe, Nils L. Vu",2026-04-30T18:25:52Z,"Accurate models of merger remnants are increasingly important for gravitational-wave science, including precision tests of gravity with ringdown, inference of black-hole populations, and modeling hierarchical mergers. For eccentric binaries, remnant mass, spin, and recoil carry nontrivial imprints of eccentricity that are both physically informative and more challenging to model, yet remain less developed than in the quasi-circular case. We present two new models trained on numerical-relativity (NR) simulations of unequal-mass, non-spinning eccentric binary black holes: NRSurE_q4NoSpin_Remnant, which predicts remnant properties, and NRSurE_q4NoSpin_Dynamics, a time-domain surrogate for the evolution of eccentricity and mean anomaly. Both models are trained on NR simulations over a three-dimensional parameter space with mass ratios $q \leq 4$, eccentricity $e < 0.23$, and mean anomaly $\ell \in [0,2π)$ radians, where both $e$ and $\ell$ defined at $t=-1000M$ relative to peak amplitude and $M$ is the total mass. We highlight some applications, including the phenomenological impact of eccentricity on remnant properties and the enhancement or suppression of recoil. We also provide error estimates for all modeled quantities, supporting reliable use in current and future gravitational-wave parameter-estimation analyses. Both models will be made available through open-source codes.",https://arxiv.org/abs/2605.00124v1,"gr-qc, astro-ph.HE"
2605.00102,Space,Self-consistent numerical simulations for the formation and dynamics of solar prominences,"Lisa-Marie Zessner, Robert H. Cameron, Sami K. Solanki, Damien Przybylski",2026-04-30T18:00:10Z,"Solar prominences are cool and dense plasma structures floating in the hot solar corona. They are ubiquitous features in the solar atmosphere, but their formation mechanism is still unclear. Here we perform comprehensive fully three-dimensional numerical simulations of prominence formation including the physics necessary to describe all atmospheric layers of the sun. With appropriate initial conditions for the magnetic field, solar prominences form self-consistently in the simulations. The formation starts by the random ejection of a dense plasma seed from the chromosphere into the corona. Subsequently, the prominence is built up by a combination of plasma injections from the chromosphere and condensation of inflowing coronal plasma. The prominence properties qualitatively match those of observed prominences. Our findings demonstrate the importance of the dynamics at and below the solar surface in the formation and evolution of solar prominences. This suggests that subsurface dynamics should also be considered in the study of prominence eruptions, which can be associated with coronal mass ejections.",https://arxiv.org/abs/2605.00102v1,astro-ph.SR
2605.00100,Space,The dark and featureless surface of rocky exoplanet LHS 3844 b from JWST mid-infrared spectroscopy,"Sebastian Zieba, Laura Kreidberg, Brandon P. Coy, Aaron Bello-Arufe, Kimberly Paragas, Xintong Lyu, Renyu Hu, Aishwarya Iyer, Edwin S. Kite, Daniel D. B. Koll, Kay Wohlfarth, Emerson Whittaker, Heather Knutson, Robin Wordsworth, Caroline Morley, Laura Schaefer",2026-04-30T18:00:08Z,"JWST has opened a new era in the study of rocky exoplanets, enabling direct characterization of their surfaces with mid-infrared spectroscopy. Different types of rock have distinct spectral features that are diagnostic of the chemical composition and other physical properties like surface texture. Measurements of these features can provide valuable clues about a planet's geologic history and interior processes. Here we report a JWST 5-12 micron thermal emission spectrum for the rocky exoplanet LHS 3844 b. It is best matched by a dark, low-silica surface, such as basalt or other olivine-rich materials. The spectrum rules out fresh powder surfaces; however, space weathering can darken the powders and make them more consistent with the data. The data also disfavor trace concentrations of CO$_2$ or SO$_2$ gas (with 5-sigma and 3-sigma upper limits of 100 mbar and 10 microbar, respectively). Taken together, these results are well fit by an old, space-weathered surface with no evidence of accumulated volcanic gases.",https://arxiv.org/abs/2605.00100v1,astro-ph.EP
2605.00093,Space,A New Robust Constraint on the Self-interaction Cross-section of Dark Matter with Double Radio Relic Clusters,"M. James Jee, Dongak Park, Wonki Lee",2026-04-30T18:00:02Z,"Merging galaxy clusters are a promising laboratory for measuring the self-interaction cross-section (SICS) of dark matter. However, previous studies have focused on galaxy-mass offsets, which numerical simulations have shown to be intrinsically small because galaxies remain tightly coupled to the dominant dark matter potential even with significant self-interaction. Their interpretation is further complicated by unknowns of the merger phase, geometry, and initial conditions. In this paper, we overcome these obstacles by introducing the shock-to-shock distance, traced by double radio relics, as a merger chronometer that time-stamps the post-pericenter dynamical phase. Because the propagation speed of merger shocks is nearly independent of the SICS, while the halo-to-halo distance is depressed by SIDM-induced drag, the ratio of the two distances translates directly into a constraint on sigma/m. Applying this method to a gold sample of eleven cluster mergers hosting symmetric double radio relics, we determine a 68% upper limit on the SICS of sigma/m < 0.22 cm^2/g. This is the first constraint from cluster collisions that fully marginalizes over mass uncertainty, viewing angle, collision speed, merger phase, impact parameter, and gas profile slope.",https://arxiv.org/abs/2605.00093v1,"astro-ph.CO, astro-ph.HE, gr-qc, hep-ex, hep-th"
2604.28140,Space,Beyond the Separatrix: Analytic Continuation of Darwin Variables for Plunging Geodesics in Schwarzschild Spacetime,Francisco M. Blanco,2026-04-30T17:23:32Z,"We study geodesic motion of a test particle in Schwarzschild spacetime. Bound and scattering geodesics are commonly described using Darwin variables, which provide a convenient parametrization of the radial motion. However, this description breaks down at the separatrix and does not extend straightforwardly to plunging trajectories. We construct an analytic continuation of Darwin variables that yields a real parametrization of bound, scattering, and plunging Schwarzschild geodesics, thereby providing a unified kinematical description of all types of test-mass motion. As a proof of concept, we then apply these variables to a simple non-geodesic evolution in which the energy and angular momentum are driven by a constant external force. This toy model is not intended to represent a physical radiation-reaction model, but rather to illustrate how the extended variables can be used to follow an orbit through a transition to plunge using a single orbital phase variable across the separatrix.",https://arxiv.org/abs/2604.28140v1,"gr-qc, astro-ph.HE, astro-ph.SR"
2604.28135,Space,The Influences of Hydrogen-Silicate-Iron Miscibility on the Demographics of Sub-Neptunes and Super-Earths,"Edward D. Young, Aaron Werlen",2026-04-30T17:18:21Z,"Models based on variable miscibility among hydrogen, molten silicate, and molten iron, coupled with atmospheric escape, can reproduce the observed occurrence density structure of sub-Neptunes and super-Earths in mass-radius space. The models are also consistent with the radius gap and the observed radius-period relationship exhibited by these planets. The degree of overlap between predicted and observed planetary occurrences suggests that hydrogen-silicate-iron miscibility may serve as a unifying concept for the formation and evolution of these planet classes. The well-defined equilibrium conditions at the boundary between supercritical magma oceans and the overlying hydrogen-rich envelopes are important features of the models. Planets formed with less than ~1 % hydrogen by mass develop discrete, terrestrial-like metallic cores, while those accreting greater hydrogen concentrations are predicted to have fully miscible interiors and no discrete metal cores. Hydrogen-silicate-iron miscibility provides an overarching explanation for the full range of sub-Neptune and super-Earth architectures based on the accreted hydrogen mass fraction and the phase equilibria governing silicate, iron metal, and H$_2$ miscibility.",https://arxiv.org/abs/2604.28135v1,astro-ph.EP
2604.28074,Space,The faint voice of a radio-weak BL Lacertae: modeling the broadband emission of WISE~J141046.00+740511.2,"A. M. Carulli, F. L. Vieyro, M. M. Reynoso, E. J. Marchesini, I. Andruchow",2026-04-30T16:20:12Z,"The WISE source, J141046.00+740511.2, has been recently observed from radio to $γ$ rays. Although the optical spectrum is consistent with a BL Lacertae (BL Lac) object, the source displays unusually weak radio emission, which challenges standard interpretations. Our aim is to understand the origin of the broadband emission from J141046.00+740511.2, using a leptonic model of an extended jet. To obtain the distribution of electrons along the conical jet, we solved a steady-state convective transport equation. Emissivities were computed along the jet and integrated over the cone volume to obtain the observed flux. Our model successfully reproduces the observed multiwavelength spectral energy distribution from radio to $γ$ rays and naturally accounts for the source's low radio flux without invoking extra emission zones. We also reproduce the mid-IR emission within the same framework. These results demonstrate that extended jet leptonic models can robustly describe the broadband physics of radio-weak BL Lacs.",https://arxiv.org/abs/2604.28074v1,astro-ph.HE
2604.28062,Space,Semi-analytic bounds on axion-like-particle supernovae emission,"Ana Luisa Foguel, Eduardo S. Fraga",2026-04-30T16:08:15Z,"Core-collapse supernovae provide natural laboratories for the production of new light particles. In particular, axion-like particles (ALPs) can be constrained via SN1987A cooling arguments. However, significant astrophysical and nuclear uncertainties imply that such bounds may vary strongly depending on modeling choices, even when expensive simulations are employed. In this context, semi-analytic methods offer a simple and fast alternative for deriving new-physics constraints. Building on a previous semi-analytic framework, in which proto-neutron star (PNS) observables are expressed in terms of six global PNS parameters, we include a finite ALP mass in the calculation and derive bounds in the axion-nucleon coupling versus mass plane. The obtained bounds are in good agreement with previous results from numerical simulations, demonstrating the robustness of the method. We also illustrate the sensitivity of the bounds to different PNS parameter calibrations, nuclear effects and cooling exclusion criteria.",https://arxiv.org/abs/2604.28062v1,"hep-ph, astro-ph.HE"
2604.28012,Space,On the polarization position angle jumps in FRB 20240114A,"Ninisha Manaswini, Danté M. Hewitt, Laura G. Spitler, Jason W. T. Hessels, Ramesh Karuppusamy, Jeff Huang, Pranav Limaye, Lucas Guillemot, Ismaël Cognard",2026-04-30T15:31:16Z,"Fast radio bursts (FRBs), thought to originate from magnetars, exhibit diverse polarization properties that constrain their emission physics and local magneto-ionic environments. The polarization position angle (PPA) is particularly sensitive to magnetic-field geometry in the emitting region and propagation effects in the magnetosphere and beyond. In hyper-active repeaters, PPAs are typically stable within bursts and over timescales of hours to days.   Here, we present observations of the repeating source FRB~20240114A, which show significant burst-to-burst PPA variations. Using full-Stokes, high-time-resolution observations from the Nançay Radio Telescope (1.1--1.8\,GHz) and the Effelsberg 100-m telescope (1.3--1.5\,GHz) over $\sim1$~year, we measure rotation measures (RMs), polarization fractions, and time-resolved PPAs across 12 epochs.   The RMs remain stable, and the emission is predominantly highly linearly polarized, with $\sim81\%$ of bursts showing $L/I > 0.8$, while circular polarization is weaker ($\sim16\%$ with $|V/I| > 0.1$). We find no evidence for Faraday conversion.   The PPA exhibits rapid, stochastic variations from milliseconds to hours, spanning $\pm90^\circ$ during two active periods and $\pm50^\circ$ in a third. The distribution of PPA jumps shows that (1) there is no difference in the distribution of jumps on timescales shorter or longer than 1\,s; (2) positive and negative jumps are equally likely; and (3) a jump of $\pm90^\circ$, as expected from, e.g., orthogonal mode jumps, is not more common than any other value.   This combination of stable RM, high linear polarization, and extreme PPA variability is not seen in other hyper-active repeaters. These results disfavor emission from a single fixed region and instead suggest multiple emission regions and/or strong magnetospheric and foreground propagation effects, such as plasma lensing.",https://arxiv.org/abs/2604.28012v1,astro-ph.HE
2604.28000,Space,A common four-beam geometry reveals altitude-stratified GeV pulses in canonical young pulsars,"Paul K. H. Yeung, Takayuki Saito",2026-04-30T15:23:51Z,"Despite the diversity and energy dependence of $γ$-ray pulse morphologies in Crab, Vela and Dragonfly, the phaseograms of these three canonical young pulsars can be organised within a single four-beam geometric template. Using \textit{Fermi} Large Area Telescope data, we fit the 60~MeV--3~GeV phaseograms with a mechanism-agnostic, geometry-first parametric model that incorporates phase-dependent Doppler shifts and constrains the three-dimensional locations and bulk motions of four emission sites. In each pulsar, the phaseogram admits a decomposition into two altitude-separated beam pairs. The lower-altitude pair is produced by plasma with bulk motion close to azimuthal corotation, sharpening the main peaks. The higher-altitude pair shows a radially outward bulk-motion component, suggestive of inertial effects in a toroidally dominated magnetic field, and contributes bridge/shoulder emission and ripple-like modulations overlapping the main peaks. As a posteriori, the lower-altitude pair is consistent with curvature-dominated outer-magnetospheric emission, while the higher-altitude pair is consistent with synchrotron-dominated emission from a current-sheet-like outflow. Higher-altitude site heights vary from $\simeq 0.7$ (Crab, $\approx 1$~kyr) to $\simeq 1.1$--$1.4$ light-cylinder radii (Vela and Dragonfly, $\approx 10$~kyr). This unified four-beam, observation-driven geometry maps an altitude-dependent azimuthal tilt of pulsed $γ$-ray emission, providing an observationally anchored framework amenable to systematic tests and readily extensible to other young pulsars.",https://arxiv.org/abs/2604.28000v1,"astro-ph.HE, astro-ph.SR"
2604.27956,Space,Rotation-Induced Pressure Anisotropy in Newtonian White Dwarfs: Sequences and Applicability Criteria,"Aray Muratkhan, Saken Toktarbay, Hernando Quevedo",2026-04-30T14:52:18Z,"We introduce a fast, one-dimensional Newtonian {reduced model} to capture uniform rotation in cold white dwarfs, encoding centrifugal support as an effective pressure anisotropy. Using $Δ_{\rm rot}(r)=\frac{1}{3}ρ(r)Ω^2 r^2$ derived from the stationary Euler equation with $\langle\sin^2θ\rangle=2/3$, the model incorporates rotation into hydrostatic balance without a two-dimensional solver. Applying the Chandrasekhar degenerate-electron equation of state, we compute interior structures and global sequences for $ ρ_c \in [10^6, 10^{11}]~{\rm g\,cm^{-3}} $ with rotation proxies $f \le 0.35$, finding monotonic increases in limiting mass and radius, with a percent-level mass gain at $f = 0.35$. We quantify applicability using sub-Keplerian diagnostics evaluated on the rotating configurations, $\max(Ω/Ω_K)$ and $\max(ε)$, together with a bulk-interior smallness measure $A_{10^{-2}}\equiv \max_{p_r/p_c\ge 10^{-2}}(Δ_{\rm rot}/p_r)$. Within the scanned domain these diagnostics remain below unity. The model is therefore best viewed as a reduced Newtonian benchmark for slow-to-moderate rotation, not as a replacement for fully axisymmetric calculations of rotating stars.",https://arxiv.org/abs/2604.27956v1,"gr-qc, astro-ph.SR"
2605.00807,Quantum,Probability Distribution Analysis of the Cascaded Variational Quantum Eigensolver,"Yi-Hua Lai, John P. T. Stenger, Gloria Bazargan, Igor V. Schweigert, Daniel Gunlycke",2026-05-01T17:50:58Z,"The cascaded variational quantum eigensolver (CVQE) circumvents the need for iterative communication between the quantum and classical processing units that is necessary in the conventional VQE algorithm. While CVQE offers complete freedom to choose the guiding state as input, not all guiding states suffice for solution accuracy, as well as resource efficiency. Our work presents a process based on trapezoidal-state preparation for selecting guiding states that yield accurate many-electron ground-state solutions with minimal resource consumption. By analyzing the state probability distributions at different stages of the CVQE calculations, we determine the optimal guiding-state parameters for given resource constraints. We demonstrate the process by comparing electronic energies along the minimal-energy path for a prototypical bimolecular reaction, $\mathrm{H}_2 + \mathrm{H}_2^+ \rightarrow \mathrm{H}_3^+ + \mathrm{H}$, using Noisy Intermediate-Scale Quantum (NISQ) computing.",https://arxiv.org/abs/2605.00807v1,quant-ph
2605.00794,Quantum,Quantum Simulation of Differential-Algebraic Equations with Applications to Unsteady Stokes Flow,"Hsuan-Cheng Wu, Xiantao Li",2026-05-01T17:21:52Z,"Differential-algebraic equations (DAEs) arise naturally in constrained dynamical systems, but their algebraic constraints and hidden compatibility conditions make them more subtle than standard ordinary differential equations. This paper initiates a quantum-algorithmic study of constrained linear DAEs. We introduce a dilation framework that embeds the generally non-Hermitian constrained evolution into a projected Schrödinger-type dynamics on an enlarged Hilbert space, \[ i\frac{d}{dt}Ψ(t)=P\tH PΨ(t), \] where $\tH$ is Hermitian and $P$ is the orthogonal projector onto the lifted constraint subspace. This identifies the DAE evolution with a quantum Zeno-type dynamics and enables the use of block encodings, QSVT-based projector construction, and Hamiltonian simulation.   We apply the framework to structure-preserving discretizations of the unsteady Stokes equations, where the pressure enforces the discrete incompressibility constraint. We derive the corresponding projected Hamiltonian formulation, identify low-energy spectral cutoffs motivated by solution smoothness, and discuss the resulting quantum simulation cost in comparison with classical projection-type methods. The results provide a first step toward understanding the potential intersection of quantum algorithms, DAEs, and constrained PDE dynamics.",https://arxiv.org/abs/2605.00794v1,quant-ph
2605.00784,Quantum,The structure of gauge invariant Gaussian quantum operations on finite Fermion systems,Eric A. Carlen,2026-05-01T17:00:29Z,"Let ${\mathcal H}_1$ be a finite dimensional complex Hilbert space. Let $ψ\mapsto Z(ψ)$ be a canonical anti-commutation relations (CAR) field over ${\mathcal H}_1$ acting irreducibly on a Hilbert space ${\mathord{\mathscr K}}$. The $*$-algebra ${\mathscr A}_{{\mathcal H}_1}$ generated by the $Z(ψ)$, $ψ\in {\mathcal H}_1$, is simply all operators on ${\mathscr K}$.   However, the CAR field endows ${\mathscr A}_{{\mathcal H}_1}$ with additional structure, and we are concerned with quantum operations whose acting in harmony with this structure. In particular, there is a gauge automorphism group   generated by ``second quantizing'' $ψ\mapsto e^{it}ψ$. The fixed point algebra of the gauge group, ${\mathscr G}_{{\mathcal H}_1}$, is a sub-algebra of ${\mathscr A}_{{\mathcal H}_1}$ studied by Araki and Wyss. It contains the density matrices of an important class of states, the gauge invariant Gaussian states, ${\mathfrak S}_{GIG}$.   Our focus is on semigroups $\{e^{t{\mathscr L}}\}_{t\geq 0}$ of quantum operations on ${\mathscr A}_{{\mathcal H}_1}$ that map ${\mathfrak S}_{GIG}$ into itself. Each $e^{t{\mathscr L}}$ is one-to-one, and our first main result is a structure theorem forsuch quantum operations on ${\mathscr G}_{{\mathcal H}_1}$ that map ${\mathfrak S}_{GIG}$ into itself.   We apply this to study semigroups of quantum operations on ${\mathscr G}_{{\mathcal H}_1}$ that map ${\mathfrak S}_{GIG}$ into itself. Our second main result is a structure theorem showing that they are parameterized by pairs $(G,A)$ where $G$ is a contraction semigroup generator on ${\mathcal H}_1$, and $0 \leq A \leq -G -G^*$. We then show that each of these semigroups has a natural extension to the full CAR algebra ${\mathscr A}_{{\mathcal H}_1}$. Further results are obtained under further assumptions on the pair $(G,A)$.",https://arxiv.org/abs/2605.00784v1,"math.FA, quant-ph"
