id,domain,title,authors,published,abstract,url,categories
2607.15209,AI,Expanding the Lexicon of Ge'ez Based African Languages: A Comparative Study of Amharic and Tigrinya,"Hailay Kidu Teklehaymanot, Debela Desalegn Yadeta, Wolfgang Nejdl",2026-07-16T17:08:28Z,"Multilingual pre-trained language models (PLMs) exhibit degraded performance on low-resource, non-Latin-script languages, driven by high out-of-vocabulary (OOV) rates and excessive subword fragmentation that result from Latin-script-centric tokenizer training. We introduce VEXMLM, a vocabulary-extended variant of XLM-R targeting the two highest-resource Ge'ez-script languages, Amharic and Tigrinya, and further evaluated on 17 additional low-resource African languages (19 total). We train a language-specific SentencePiece tokenizer on curated Amharic and Tigrinya monolingual corpora, extend XLM-R's vocabulary with 30,000 Ge'ez-script subwords derived from this tokenizer, and initialize their embeddings by averaging the embeddings of their constituent subwords under XLM-R's original tokenizer. VEXMLM is trained in two stages: (1) continued masked language modeling over the extended vocabulary on the curated corpora, and (2) supervised fine-tuning on question answering (QA), named entity recognition (NER), and sentiment analysis (SA). On Amharic/Tigrinya QA, VEXMLM achieves 87.0 EM /90.0 F1, versus 66.0 EM/78.0 F1 for XLM-R and 74.0 EM/ 78.0 F1 for Glot500. On SA, VEXMLM reaches 80.0\% accuracy versus 77.0\% (XLM-R) and 46.0\% (Glot500). On NER, VEXMLM raises OOV-token entity accuracy from 81.4\% to 94.3\%, averaged over 11 of the 19 evaluated languages for which OOV analysis was possible. Our contributions are: (i) a vocabulary-extension and embedding-initialization procedure tailored to Ge'ez script; (ii) a two-stage training strategy under which vocabulary and continued-pretraining gains on Amharic/Tigrinya transfer to 17 typologically related, unaugmented African languages; and (iii) an evaluation spanning both intrinsic tokenization metrics (vocabulary coverage, fertility, OOV rate) and extrinsic task performance across all 19 languages.",https://arxiv.org/abs/2607.15209v1,cs.CL
2607.15208,AI,Delocalization of bias in unadjusted Hamiltonian Monte Carlo and underdamped Langevin,"Yifan Chen, Xiaoou Cheng, Jonathan Niles-Weed, Jonathan Weare",2026-07-16T17:07:42Z,"Unadjusted samplers such as unadjusted Hamiltonian Monte Carlo and underdamped Langevin are well-known to be biased. Metropolis--Hastings adjustment has been conventionally incorporated into Hamiltonian Monte Carlo to eliminate the bias. However, this adjustment can significantly increase the iteration complexity due to the small step size required for reasonable Metropolis acceptance rates. In this work, we extend the \emph{delocalization of bias} phenomenon, previously established for the overdamped Langevin algorithm, to these two unadjusted algorithms. We show that to control the $W_2$ bias of any $K$-dimensional marginal of a high-dimensional distribution, $O(\sqrt{K})$ integration steps suffice up to $\log d$ terms, assuming either weak or sparse interactions among variables. The discrete-time integrators here introduce technical difficulties beyond those of the overdamped setting, which we address through a broadly applicable matrix-polynomial framework that characterizes their propagators. Our result for the underdamped Langevin algorithm is valid for all large friction parameters, implying that the Leimkuhler-Matthews integrator for the overdamped Langevin dynamics also exhibits delocalization of bias.",https://arxiv.org/abs/2607.15208v1,"stat.CO, cs.LG, math.PR, stat.ML"
2607.15207,AI,BadWAM: When World-Action Models Dream Right but Act Wrong,"Qi Li, Xingyi Yang, Xinchao Wang",2026-07-16T17:04:15Z,"World-action models (WAMs) are emerging as a promising foundation for embodied control: rather than predicting actions alone, they learn representations that couple action generation with future world prediction. This coupling is often viewed as a source of robustness, interpretability, and safety, as a robot's action can in principle be checked against its imagined future. In this paper, we show that this assumption is fragile. We introduce BadWAM, a unified framework for modeling and evaluating World-Action Drift Attacks: a new class of WAM-specific adversarial attacks that use small visual perturbations to break the alignment between what a WAM imagines and what it executes. BadWAM characterizes this attack surface along two natural criteria: attack strength and stealthiness. When the adversary prioritizes disruption, BadWAM instantiates an action-only adversarial attack, which directly drives the model toward task-failing actions. When the adversary additionally prioritizes stealth, BadWAM instantiates an imagination-preserving adversarial attack, which seeks to induce harmful action shifts while keeping the model's predicted future close to its clean imagination. Together, these two attacks capture a spectrum of WAM-specific failures: from overt action hijacking to stealthier cases where the model appears to imagine a plausible future but executes a desynchronized action. We evaluate BadWAM across different variants of WAMs. Results show that our attacks substantially reduce task success rates under closed-loop execution. For example, our action-only attack reduces the model performance from 96.5% to 43.1% success. The results of our imagination-preserving attack further exposes a WAM-specific vulnerability: moderate future-preserving regularization can maintain strong attack performance while reducing future imagination drift.",https://arxiv.org/abs/2607.15207v1,"cs.LG, cs.RO"
2607.15205,AI,MM-IssueLoc: A Controlled Benchmark for Evaluating Visual Evidence in Multimodal Repository-Level Issue Localization,"Shaoxiong Zhan, Shi Hu, Boyu Feng, Hai Lin, Andrew Gong, Zhengda Zhou, Jiaying Zhou, Yunyun Hou, Hao Su, Hai-Tao Zheng",2026-07-16T17:02:25Z,"Real repository issues routinely include visual evidence such as screenshots, error dialogs, rendered UI states, and logs, yet repository-level issue localization is evaluated mostly as a text-only task. Existing multimodal SE benchmarks evaluate end-to-end repair, entangling localization with patch synthesis and obscuring whether visual input helped, hurt, or was ignored. We introduce \textbf{MM-IssueLoc}, a controlled benchmark and evaluation protocol for repository-level localization with visual evidence. MM-IssueLoc contains 652 issue-PR instances across 23 languages, with annotations for 7 image categories and 4 relevance levels. It provides file-level and function-level gold labels, paired text-only and with-image evaluation, and VCE-based diagnostics that convert images into structured textual evidence. We evaluate LLM-based and retrieval-based systems, including MM-IssueLoc-VL-Emb as a controlled multimodal retriever. Results show that existing systems remain far from reliable multimodal repository localization: the strongest agent reaches 38.96 file Acc@5 and 22.45 function Acc@10, while the strongest retriever reaches 33.86 function Acc@10. Cross-benchmark comparisons show that high localization scores on text-dominant SWE benchmarks do not transfer cleanly to multimodal issue localization. MM-IssueLoc turns visual evidence into an explicit evaluation variable, enabling future work to test whether systems improve by using visual evidence for localization, rather than by relying on text-only cues or downstream patch-generation effects.",https://arxiv.org/abs/2607.15205v1,"cs.SE, cs.AI"
2607.15202,AI,Self-Evolving Human-Centered Framework for Explainable Depression Symptom Annotation,"Hoang-Loc Cao, Van Pham, Truong Thanh Hung Nguyen, Phuc Truong Loc Nguyen, Phuc Ho, Veronica Whitford, Hung Cao",2026-07-16T16:59:54Z,"Annotation quality is a major bottleneck in building reliable and explainable artificial intelligence (XAI) systems for mental health research. In depression-related datasets, labels are often assigned without structured evidence, symptom-level justification, or traceable alignment with the criteria of the Diagnostic and Statistical Manual of Mental Disorders, Fifth Edition, Text Revision (DSM-5-TR), limiting both transparency and downstream model interpretability. We propose a self-evolving, expert-in-the-loop annotation framework for Major Depressive Disorder (MDD) that combines large language model (LLM)-assisted labeling with expert verification. The framework is intended to support the construction of explainable, DSM-5-TR-aligned datasets rather than to perform clinical diagnosis. It operates in three stages: candidate evidence selection from textual records, criterion-level DSM-5-TR analysis, and case-level synthesis that produces label-level diagnostic and severity annotations. A dual-memory architecture, composed of Example Memory and Reflection Memory, is designed to internalize expert feedback and iteratively improve future annotations without retraining. We describe this mechanism and leave its evaluation across multiple feedback cycles to future work. In addition to final labels, the framework exports clinical evidence, reasoning traces, and edit histories, enabling comprehensive auditability. In a pilot study using expert-reviewed samples, the proposed approach improves annotation consistency and explainability while reducing manual revision effort.",https://arxiv.org/abs/2607.15202v1,"cs.AI, cs.HC, cs.MA, cs.MM"
2607.15200,AI,Mask-Aware Policy Gradients for Diffusion Language Models,"Haran Raajesh, Kulin Shah, Adam Klivans, Philipp Krähenbühl",2026-07-16T16:57:34Z,"Reinforcement learning has proven effective for improving reasoning in large language models, but extending it to Masked Diffusion Language Models (MDLMs) remains challenging due to the intractability of the log-likelihood estimation. Existing approaches approximate this log-likelihood by modeling only the token predictions, ignoring the order in which positions are unmasked during generation. We observe that MDLM generation involves two decisions at each step: what tokens to place at each masked position and which positions to remask. We formalize this as a two-stage action MDP, showing that the policy gradient naturally decomposes into a token term and a masking term. Combining optimization of both terms leads to state-of-the-art outcomes on mathematical reasoning and coding benchmarks, with scores of 87.1% on GSM8K and 53.4% on MBPP.",https://arxiv.org/abs/2607.15200v1,"cs.CL, cs.AI, cs.LG"
2607.15196,AI,Subjective Risk Decomposition: A New View for Uncertainty Quantification,"Raghad Alamri, Michele Caprio, Gavin Brown",2026-07-16T16:52:54Z,"We present a novel viewpoint for uncertainty quantification. Uncertainty measures are not primitives, in need of axioms and argumentation, but instead consequences, of higher-level modelling decisions. We show how epistemic and aleatoric uncertainty measures can be derived via decomposition of a subjective risk, based on a strictly proper loss. Reverse cross-entropy provides a prominent example, where decomposition recovers the classic information-theoretic uncertainty terms. The same approach recovers numerous measures previously proposed across the UQ literature, providing them a common theoretical foundation. From a practical point of view, this suggests a new approach to UQ: given a modelling scenario and strictly proper loss, the corresponding epistemic and aleatoric terms are induced by the subjective-risk decomposition. We then extend our view to learning theory: we introduce and analyse subjective risk analogues of excess risk, approximation error, and estimation error, and identify the connections to UQ. We consider this a first step towards a full learning-theoretic framework for uncertainty quantification.",https://arxiv.org/abs/2607.15196v1,"stat.ML, cs.AI, cs.LG"
2607.15193,AI,Plover: Steering GUI Agents through Plan-Centric Interaction,"Madhumitha Venkatesan, Shicheng Wen, Jiajing Guo, Jorge Piazentin Ono, Liu Ren, Dongyu Liu",2026-07-16T16:48:39Z,"Graphical user interface (GUI) automation remains challenging in real-world environments, where dynamic layouts, unexpected dialogs, and evolving interface states can cause autonomous agents to drift from user intent. Recent vision-based multimodal agents improve flexibility by operating directly over screenshots and natural language instructions, but planning and adaptation often remain internal, limiting users' ability to inspect, supervise, or correct system behavior. We present Plover, a plan-centric vision-based GUI automation system that externalizes task plans and replanning as persistent, inspectable, and revisable artifacts. Through a planner--executor architecture, Plover supports explicit supervision of evolving execution, localized correction through editable plans, natural-language guidance, and screenshot-grounded interventions, while preserving prior progress during repair. A formative study with six participants informed the interaction design. We then evaluate Plover through benchmark failure-case repair and scenario-based workflow analyses. Our results show that many autonomous GUI-agent failures are structurally repairable when plans remain visible and interventions are localized, and that explicit replanning helps make GUI automation more transparent, controllable, and adaptable.",https://arxiv.org/abs/2607.15193v1,cs.AI
2607.15190,AI,Can We Trust Item Response Theory for AI Evaluation?,"Han Jiang, Sunbeom Kwon, Jinwen Luo, Ziang Xiao, Susu Zhang",2026-07-16T16:44:40Z,"AI benchmarks increasingly leverage item-level statistical models, particularly item response theory (IRT), to estimate model capabilities, rank systems, select informative examples, and diagnose benchmark quality. However, AI benchmark data often departs from the data regime of human testing, for which standard IRT estimation tools were originally developed: benchmarks typically involve fewer evaluated models, far more items, and capability distributions that may be skewed, clustered, or multimodal. We examine how these regime mismatches challenge the reliability of IRT modeling for AI evaluation. Using item parameters and capability distributions derived from six widely used LLM benchmarks, we simulate response matrices under three common IRT models and compare four estimation tools used in recent benchmark studies: marginal maximum likelihood, Markov chain Monte Carlo, variational inference, and a neural pseudo-Siamese estimator. Across 18,000 simulation conditions, we systematically evaluate computational feasibility, scalability, and the reliability of IRT inferences about model rankings, predicted performance, and item characteristics. Results show that classical estimators can become infeasible in large benchmark settings, whereas scalable estimators can produce unreliable item-level and ranking inferences with small or nonnormally distributed model sets. This study identifies when latent trait models reliably support or risk distorting AI benchmarking claims, and what sample sizes and diagnostics are needed for trustworthy use.",https://arxiv.org/abs/2607.15190v1,cs.AI
2607.15180,AI,RTS Smoother-Guided Learning of Physics-Based Neural Differential Models,"Ahmet Demirkaya, Georgios Stratis, Tales Imbiriba, Zachary D. Danziger, Deniz Erdogmus",2026-07-16T16:34:48Z,"Ordinary differential equations (ODEs) are widely used to model dynamical systems in physics, biology, neuroscience, and physiology, but in many applications some equations of the dynamics are unknown and only a subset of the state variables are measured. We propose a hybrid neural--physics framework in which the known components of the ODE are kept explicit and the missing components are represented by a neural network. The proposed method consists of two stages where we alternate between state and parameter estimation and iterate until a predetermined criterion is met. Specifically, in the first step, we treat the model parameters as being known and we infer the latent states from the available measurements using a Rauch--Tung--Striebel (RTS) smoother. In the second stage, we treat the smoothed trajectories as being known and use them to estimate the neural networks' parameters through backpropagation. We evaluate the method on benchmark systems spanning linear, nonlinear, and stiff dynamics under partial state observation. Across these settings, the proposed method learns missing ODE components from incomplete measurements while exploiting and retaining interpretable mechanistic structure and improving latent-state reconstruction and long-horizon prediction.",https://arxiv.org/abs/2607.15180v1,"cs.LG, eess.SY"
2607.15178,AI,T^2MLR: Transformer with Temporal Middle-Layer Recurrence,"Ziyang Cai, Xingyu Zhu, Yihe Dong, Yinghui He, Sanjeev Arora",2026-07-16T16:33:59Z,"Transformer reasoning is limited by autoregressive decoding, which repeat edly compresses rich hidden computation through token space and makes it difficult for intermediate reasoning states to persist across time. We in troduce Transformers with Temporal Middle-Layer Recurrence (T2MLR), a transformers-based latent reasoning architecture that fuses a cached middle layer representation from the previous token directly into an earlier layer of the current token position, enabling abstract intermediate computation to persist across decoding steps with little inference overhead. Across natural-language pretraining and multi-hop reasoning finetuning, T2MLR consistently outperforms data- and parameter-matched Transformer base lines. Moreover, applying recurrence to only a localized middle-layer block (as little as 20% of the network) often outperforms full-layer recurrence. Im portantly, T2MLR does not require pretraining from scratch: retrofitting the recurrent pathway into an existing pretrained 1.7B Transformer and briefly finetuning substantially improves math reasoning, lowering the barrier to practical adoption. These results suggest that effective latent reasoning in Transformers does not require looping over all layers as in previous works, but can instead emerge more strongly from targeted middle-layer recurrence.",https://arxiv.org/abs/2607.15178v1,"cs.CL, cs.AI"
2607.15176,AI,Benchmarking Multimodal Large Language Models for Scientific Visualization Literacy,"Patrick Phuoc Do, Chau M. Ta, Chaoli Wang",2026-07-16T16:29:34Z,"Multimodal large language models (MLLMs) are increasingly used to interpret visualizations, yet current evaluations remain largely chart-centric and provide limited evidence of understanding of scientific visualization (SciVis). We benchmark six MLLMs on the scientific visualization literacy assessment test, a standardized SciVis literacy assessment comprising 49 items based on 18 scientific visualizations and illustrations, spanning 8 techniques and 11 task types. We evaluate three closed-source and three open-source models under a closed-world protocol and compare their performance using data from 485 human participants. Results show that current MLLMs do not exhibit uniform SciVis literacy. Gemini is the strongest model overall, exceeding the human mean across the evaluated subsets, whereas the open-source models remain below the human baseline. Performance is highly uneven across techniques and tasks: models perform best on scientific illustration, search, and spatial understanding, but struggle on texture-based and integration-based visualizations and on quantitative estimation. Error analysis reveals recurring failures in fine-grained quantitative estimation, flow-direction interpretation, and grounded encoding interpretation. These findings position SciVis literacy as a necessary benchmark dimension for evaluating multimodal AI systems. Our code and model outputs are publicly available at https://github.com/patdmp/mllm-scivis-lit-benchmark.",https://arxiv.org/abs/2607.15176v1,"cs.AI, cs.CL, cs.HC"
2607.15175,AI,Linear representations of grammaticality in neural language models,"Jane Li, Najoung Kim",2026-07-16T16:23:56Z,"Whether neural language models (NLMs) possess the ability to distinguish strings on the basis of their grammaticality remains a debated topic in the computational linguistics literature. Existing evidence has largely relied on probability-based measures, testing whether models assign higher probabilities to grammatical than ungrammatical strings. However, probability comparisons have been criticized as a measure for grammatical knowledge based on the assumption that grammaticality is inherently entangled with likelihood. Model-assigned probability is a function of many related sentence properties, such as lexical frequency, plausibility, and world knowledge. In this work, we move beyond probability-based evaluations and investigate whether grammaticality is encoded in the internal representations of NLMs. Using mass-mean probing, we test whether grammatical and ungrammatical sentences are systematically separated in representational space. We further examine the extent to which these representations are independent of sentence properties that are correlated with grammaticality, as well as their generalization across grammatical phenomena and languages. Our results provide evidence that grammaticality is robustly encoded in sentence representations of a wide range of pretrained NLMs, yielding clear representational separation on the dimension of grammaticality that cannot be fully explained by alternative sentence-level factors. Moreover, this encoding generalizes across a broad range of grammatical phenomena and to some degree, across languages, suggesting that grammaticality constitutes a coherent representational dimension in contemporary NLMs. These findings contribute new evidence to debates about the nature of syntactic knowledge in language models and offer a complementary framework for evaluating grammatical competence that is not dependent on string probabilities alone.",https://arxiv.org/abs/2607.15175v1,cs.CL
2607.15166,AI,MedFailBench: A Clinician-Built Open-Source Benchmark for Medical AI Safety Boundary Inspection,Goktug Ozkan,2026-07-16T16:16:07Z,"Most medical AI benchmarks measure whether a model knows the correct answer. MedFailBench asks a different question: which safety boundary failed? We present a clinician-built synthetic benchmark and failure atlas that labels medical AI errors by severity (1--5) and safety gate type (missed urgent escalation, unsafe remote dosing, unsafe discharge reassurance, evidence fabrication, unsafe protocol execution, source support gap). The current public release (v0.2.1) contains 44 clinician-reviewed synthetic cases with severity annotations, a live HuggingFace leaderboard preview, a safety gate taxonomy, a clinical severity rubric, and an automated pipeline for archiving model-response screening runs. No patient data, clinical validation claims, or model rankings are included. MedFailBench is released under Apache-2.0 and CC-BY-4.0 and carries the Zenodo DOI 10.5281/zenodo.21205535.",https://arxiv.org/abs/2607.15166v1,"cs.AI, cs.CL"
2607.15164,AI,The Industrialization of Research ; On AI-Driven Science and Its Consequences,Emmanuel Jeannot,2026-07-16T16:14:12Z,"Artificial intelligence is transforming scientific research - not merely as a more powerful instrument, but as an autonomous participant in the research cycle itself. This transition constitutes, in the most precise sense of the term, the industrialization of research: a shift from a craft model, in which knowledge, method, and judgment are embedded in the researcher, to a pipeline model, in which these steps are decomposed, automated, and supervised. The US Department of Energy's Genesis Mission is the most ambitious current instantiation of this shift, but the fundamental questions it raises extend far beyond any single program. This essay examines seven such questions: the erosion of the intergenerational transmission of scientific competence; the growing opacity of AI-generated theories; the collapse of peer evaluation under a flood of machine-generated output; the unproven capacity of AI for paradigm-shifting discovery; the capture of the scientific agenda by political and industrial actors; the compounding of systematic errors in closed-loop pipelines; and the structural bifurcation of the global research community into incommensurable tiers. These concerns do not constitute an argument against AI-driven science - whose demonstrated potential is real and significant. They constitute the conditions under which that potential can be responsibly pursued.",https://arxiv.org/abs/2607.15164v1,"cs.AI, cs.CY"
