id,domain,title,authors,published,abstract,url,categories
2607.06497,AI,EntroPath: Maximum Entropy Path Ensemble Embedding for Manifold Learning,Przemysław Rola,2026-07-07T16:58:00Z,"We introduce EntroPath, a manifold learning method that recovers geodesic geometry from data graphs through ensembles of diffusion paths. Many existing graph-based embeddings rely either on locally normalised random walks or on shortest-path distances. The former can concentrate diffusion in densely sampled regions, while the latter are sensitive to spurious shortcut edges in the graph. EntroPath instead builds its dissimilarities from the maximum entropy random walk (MERW), which aggregates the full ensemble of k-step paths between points rather than relying on any single trajectory. We show that the resulting free-energy dissimilarity converges to squared geodesic distance in the short-time limit, via Varadhan's heat-kernel formula. The diffusion depth k interpolates smoothly between local neighbourhood structure and global manifold geometry, and the symmetrised kernel admits an exact Gram factorisation connecting EntroPath to kernel methods. We further provide scalable extensions via landmark projection and diffusion-potential pseudotime. Across synthetic manifolds and single-cell benchmarks, EntroPath consistently matches or outperforms diffusion- and shortest-path-based methods, while remaining competitive with neighbourhood-preserving embeddings (UMAP, t-SNE) on local-structure metrics. Its gains are most pronounced on manifolds with non-uniform sampling density and well-separated branching trajectories, where path-ensemble diffusion more faithfully preserves the underlying geodesic geometry.",https://arxiv.org/abs/2607.06497v1,"cs.LG, q-bio.QM, stat.ML"
2607.06225,Bio,Compiling Bioinformatics Recurrences,"Bala Vinaithirthan, Shiv Sundram, Sneha Goenka, Fredrik Kjolstad",2026-07-07T12:49:50Z,"Many bioinformatics algorithms, such as sequence alignment and structure prediction, can be expressed as recurrence equations over a dynamic programming matrix. Efficient implementations of these algorithms for large-scale biological data often require changing the order in which matrix cells are calculated and pruning ineffectual regions of the matrix from consideration altogether, but these techniques typically complicate implementation. We introduce FILTR, a domain-specific language (DSL) and compiler framework for bioinformatics recurrences. FILTR keeps the core recurrence rules separate from the pruning and scheduling strategies, where pruning acts as an approximation to limit where in the DP matrix cells are computed, and scheduling determines the iteration order for how cells are explored. FILTR compiles these high-level descriptions into optimized C++ code that matches the performance of hand-tuned implementations while enabling rapid exploration of new heuristics. FILTR is competitive with hand-optimized sequence-alignment libraries, ranging from 0.95x to 30x faster across biological benchmarks.",https://arxiv.org/abs/2607.06225v1,"cs.PL, q-bio.QM"
2607.06129,Bio,Characterization of DLBCL cell of origin-phenotypes based on tumor microenvironment features,"Stefano Ugliano, Martim Dias Gomes, Noémie Moreau, Marta Pistone, Marcel Kirchner, Alexandra Just, Adrian Georg Simon, Christian Kukat, Reinhardt Buettner, Katarzyna Bozek",2026-07-07T10:38:41Z,"Diffuse large B-cell lymphoma (DLBCL) is an aggressive form of non-Hodgkin lymphoma with a high recurrence rate. The molecular profiling of DLBCL tumors culminated in several immunohistochemistry algorithms for prognostic stratification. Among those, the Hans classifier is widely used for classifying DLBCL into germinal center B-cell-like (GCB) and non-germinal center/activated B-cell-like (non-GCB/ABC) subtypes. The Hans classifier primarily evaluates protein expression of tumor-associated markers, however the tumor microenvironment (TME) of DLBCL includes a myriad of immune and stromal cells, cytokines, and extracellular matrix components that contribute to tumor growth, immune evasion, and recurrence rate. Although the Hans classifier provides a practical method for subtype identification, incorporation of TME information may improve risk stratification and further refine patient groups. Here, we present an unbiased deep learning-based approach to extract meaningful features from TME of DLBCL tumors for the automated processing and analysis of multiplexed images of a DLBCL patient cohort. Our pipeline quantifies a range of features that describe tumor sample cell composition, morphology, and its spatial organization. We point to alterations in the proportions of several cell populations between GCB and ABC tumors including increased immune cell proportions of the ABC and its preferential interaction with the M2-macrophages. Our analysis offers an in-depth characterization of the DLBCL subtypes and is exemplary of how our pipeline can be used for detailed quantitative analysis of a tumor and its subtypes.",https://arxiv.org/abs/2607.06129v1,q-bio.QM
2607.05846,AI,AbICL: In-Context Learning for Antigen-Specific Antibody Affinity Ranking,"Zhiyuan Chen, Jing Hu, Junzhe Wang, Yueyang Huang, Xinyi Yang, Zhaoyang Wang, Feng Zhu",2026-07-07T05:06:53Z,"Accurate ranking of antibody candidates according to their binding affinity is essential for therapeutic antibody discovery. However, existing methods treat affinity comparisons independently and ignore the contextual information encoded in other labeled comparisons, limiting their ability to capture antigen-specific binding landscapes. For many target antigens, a small number of experimentally characterized affinity comparisons are often available. An important question is whether the model can exploit these existing comparisons to infer antigen-specific ranking patterns that facilitate subsequent affinity ranking. This form of learning from labeled demonstrations closely resembles the paradigm of In-Context Learning, motivating us to revisit antibody affinity ranking from an ICL perspective. To this end, we propose AbICL, an ICL framework for antigen-specific antibody affinity ranking. AbICL combines a pretrained structural encoder with a context ranking head and is trained with an episodic meta-training strategy that enables the model to leverage support demonstrations for test-time adaptation without gradient updates. Experiments on the AbRank benchmark demonstrate that AbICL consistently outperforms existing ranking baselines across almost all data splits and evaluation benchmarks. Further analysis shows that the value of contextual demonstrations depends on how well they match the target inference task, and becomes increasingly pronounced under distribution shift and fine-grained affinity discrimination. These findings highlight the potential of ICL as an effective paradigm for antigen-specific antibody affinity ranking, particularly in challenging settings where a single global ranking function is insufficient.",https://arxiv.org/abs/2607.05846v1,"cs.LG, cs.AI, cs.CE, q-bio.QM"
2607.05691,AI,"Where to cut, how deep: BPE and Unigram-LM on chemistry SMILES",Hunter Heidenreich,2026-07-06T23:16:51Z,"Every chemical language model reading SMILES begins with a tokenizer, yet the field has inherited byte-pair encoding (BPE) from natural language with little scrutiny. In natural language, BPE's principal alternative, Unigram-LM, is known to build structurally different vocabularies. Whether that contrast survives in chemistry was open. We report a controlled comparison of BPE and Unigram-LM over a fixed 165-token chemistry base, at the small vocabulary sizes where token embeddings are learnable, across three corpus typologies (diverse, drug-like, natural-products) and both pre-tokenization boundary policies. The two do not converge. In all 22 matched conditions they build near-disjoint subword vocabularies: cross-algorithm Jaccard overlap on the learned pieces never exceeds 0.161, and at most 0.05 once weighted toward the high-frequency pieces a model updates most. Unigram-LM also segments held-out molecules into 29-41% more tokens; the arms largely agree on where to cut but not how deeply, so BPE's segmentation is a strict coarsening of Unigram-LM's on 80-99% of molecules. The separation holds across corpus, boundary, and vocabulary size, persisting even at eight times that scale. The subword algorithm is therefore a modeling decision, not a free default. The study trains no language models.",https://arxiv.org/abs/2607.05691v1,"cs.CL, cs.LG, q-bio.BM"
2607.05607,Bio,ssys: Exact algebraic recasting of ODE models into S-system or GMA form,William S. Hlavacek,2026-07-06T20:07:01Z,"ssys is a Python package for exact algebraic recasting of supported ODE models into S-system or Generalized Mass Action form. It reads Antimony and SBML models, introduces auxiliary variables through symbolic lifting, and validates transformed systems using symbolic, numerical, and trajectory-based checks. The package provides command-line workflows, notebook generation, and benchmark evidence across curated models and BioModels examples, making classical power-law recasting practical for reproducible systems biology modeling.",https://arxiv.org/abs/2607.05607v1,q-bio.QM
2607.05153,AI,Geometric Causal Models,"Eli N. Weinstein, David M. Blei",2026-07-06T14:36:51Z,"Scientists often seek to draw causal inferences from structured data that is not independently and identically distributed, such as spatial data, network data, or molecular data. We develop geometric causal models (GCMs), a framework for causal inference from dependent data that exploits underlying symmetries of the data generating process. For example, in spatial data, we consider processes that are symmetric under translations, or in graph data, symmetric under permutations of the nodes. We show how symmetries, formalized with group theory, can enable causal identification and estimation. We deploy ergodic theory for amenable groups to establish identification, and combine geometric deep learning with scalable Bayesian inference for estimation. We recover i.i.d. causal models and do-calculus when the data is a sequence and the symmetry is permutation equivariance, and find novel types of causal models when we use alternate structures and symmetries. As an example, we construct a causal model that satisfies the symmetries of DNA. This GCM enables new estimators for the effects of genetic variation, combining deep functional genomics models to describe outcomes and DNA language models to describe propensities. We illustrate on semisynthetic data.",https://arxiv.org/abs/2607.05153v1,"stat.ML, cs.LG, q-bio.BM"
2607.05084,Bio,Rethinking Benchmarks and Models for Enzyme Specificity Prediction,"Elizabeth H. Mahood, Natália Komorníková, Tomáš Pluskal, Pranam Chatterjee",2026-07-06T13:48:02Z,"Artificial Intelligence has had a profound impact on the biological sciences, and in particular has accelerated research on protein form and function. Enzymes are no exception: a surge of predictive models have been recently developed to address a range of enzyme tasks. Models addressing enzyme-substrate (ES) or enzyme-reaction (ER) compatibility could be especially valuable for enzyme annotation, biosynthetic pathway elucidation, and biocatalyst retrieval, the central challenge of which is the identification of a true catalyst (or truly compatible reaction) among many similar candidates. While existing models report strong performance on alternative benchmarks, less is known about their capabilities in this regime. Herein, we benchmark four recently released ES and ER prediction models, using tasks and datasets tailored to this setting. We first show that two representative ES prediction models perform near random baselines across two enzyme families when considering enzymes and substrates not encountered during training. To evaluate additional models across a consistent dataset, we next assemble the largest cytochrome P450 (CYP) reaction dataset to date, 2,922 reactions across 768 enzymes, and construct a CYP ranking benchmark requiring the correct enzyme to be prioritized among all CYPs in its native organism. We again find that most models do not outperform sequence-based (BLAST) baselines even after fine-tuning. We finally adapt the bimolecular structure prediction model Boltz to ES prediction by training supervised classifiers on residue-ligand pair embeddings, and show that this approach consistently surpasses the BLAST baselines on our CYP ranking benchmark. Together, our results argue for more discovery-relevant benchmarking and suggest that interaction-aware representations from full biomolecular complexes may provide a promising basis for enzyme prioritization.",https://arxiv.org/abs/2607.05084v1,q-bio.BM
2607.04987,AI,Data-Driven Soft Labeling Scales DNA Read Classification to Whole-Body Cell-Type Deconvolution,"Dmytro Rizdvanetskyi, Nathan Roos, Pavlo Lutsik",2026-07-06T12:25:16Z,"Cell-type deconvolution, the task of estimating the proportions of constituent cell types in a heterogeneous biological sample, is a core problem in computational biology. Methods that rely on epigenetic marks such as DNA methylation typically operate on aggregated methylation estimates, discarding the pattern-level information carried by individual DNA reads. Existing read-level approaches that exploit this information are scarce, and all remain restricted to few-class settings; scaling them further is an open problem because, at scale, non-discriminative reads dominate and hard labels conflict with the many-to-many mapping between methylation patterns and cell types, preventing classifier convergence. To overcome this, we propose data-driven soft labels that estimate the conditional cell-type distribution for each read, and integrate this scheme into Syto, a new modular framework for read-level classification-based deconvolution. On a whole-body atlas of 39 human cell types, Syto reduces MSE by 2.56$\times$ over SoTA, with gains transferring to an out-of-distribution dataset spanning 16 tissues. Syto lays the foundation for modeling increasingly large cell-type panels, with improved applications in biology and healthcare. The proposed soft-labeling scheme is further translatable to any setting with a many-to-many signal-to-label mapping.",https://arxiv.org/abs/2607.04987v2,"cs.LG, q-bio.GN, q-bio.QM"
2607.04938,Bio,Parenclitic hypergraphs and their application in personalized cancer therapy,"K. K. H. Manjunatha, D. Aleja, F. Liu, M. Zhang, Y. Qi, L. Minati, G. -Q. Sun, S. Zhuang, C. Cai, J. Li, R. Criado, M. Romance del Rio, D. Papo, Y. -J. Ma, F. Fang, C. I. del Genio, Z. Zhao, H. Gao, S. Boccaletti",2026-07-06T11:10:41Z,"Understanding the differences between individual instances of the same complex system remains a central challenge, particularly in biological contexts. Parenclitic networks constitute a suitable means to detect deviations in correlations with respect to reference populations. Here, we introduce parenclitic hypergraphs, a general framework for identifying anomalies in higher-order correlations across arbitrary interaction orders. After validating the method on synthetic datasets and benchmark ones, we apply it to patient-derived cancer organoids, capturing temporal changes in gene expression between healthy and cancerous tissues as the disease progresses. Our approach not only reproduces known oncogenic signatures, but also reveals a previously unrecognized candidate therapeutic target. Since organoids are generated from individual patients, our method provides, for the first time, a viable protocol for personalized cancer therapy based on higher-order correlation patterns. These findings offer a novel, systems-level strategy for precision oncology grounded in complex systems theory.",https://arxiv.org/abs/2607.04938v1,"q-bio.QM, physics.soc-ph"
2607.09516,Health,A multi-ensemble mean-field reduction method for networks of globally coupled phase oscillators with arbitrary parameter distributions,"Richard Gast, Shotaro Takasu, Helmut Schmidt, Ann Kennedy",2026-07-10T15:27:57Z,"Understanding the dynamical properties of coupled phase oscillator systems with heterogeneous oscillator frequencies has been a long-standing challenge of complex systems theory. While the seminal work of Ott and Antonsen dramatically improved our theoretical understanding of coupled phase oscillators for a small family of oscillator frequency distributions, we here present a mean-field reduction method for arbitrary frequency distributions. Our method leverages the drastic dimensionality reduction obtained for Lorentzian frequency distributions, and combines it with a data-driven multi-ensemble approach. As such, the method renders the Ott-Antonsen equations directly applicable to empirical distributions of phase oscillator frequencies, often achieving a drastic dimensionality reduction and allowing to study real-world physical and biological systems by means of stability, sensitivity, and bifurcation analyses.",https://arxiv.org/abs/2607.09516v1,"cond-mat.dis-nn, nlin.CD, q-bio.NC"
2607.09420,Health,PesTwin: A modular agent-based framework for pest and vector population control,"Andrea De Antoni, Giovanni Iacca, Andrea Pugliese, Anna Strampelli, Gerard Terradas, Matteo Rucco, Andrew Hammond",2026-07-10T13:49:16Z,"Species-specific pest and vector control strategies, including the sterile insect technique, Wolbachia-based interventions, and genetic control technologies, offer powerful alternatives to broad-spectrum chemical control, with applications ranging from targeted crop protection to large-scale disease control. Among these, genetic control technologies are advancing rapidly, but the pace of technological development is outstripping the modelling tools needed to predict outcomes, guide technology design and its implementation, compare alternative strategies across different use settings, and support regulatory and operational decision-making. Here we present PesTwin, an agent-based modelling framework for simulating genetic control technologies across species, ecological settings, and deployment strategies within a common computational environment. PesTwin captures stochastic demographic effects, species-specific life-history traits, heterogeneous dispersal, and temporal variation in resource availability and infestation pressure. We validate PesTwin against published laboratory cage data from four genetic control systems, drawn from three studies, in two insect species, showing close agreement between predicted and observed population trajectories, including their replicate-to-replicate variability. We then illustrate how the same validated models extend beyond the cage to spatially explicit, field-scale scenarios, using PesTwin to explore how the timing, density and spatial placement of releases shape suppression and spread across heterogeneous landscapes. By making genetic control systems testable in silico before they are built or released, PesTwin can shorten the path from laboratory construct to field intervention: informing which constructs to prioritise, how to design the experiments that test them, where and when to release, and what evidence is needed to evaluate them.",https://arxiv.org/abs/2607.09420v1,q-bio.PE
2607.09278,Health,Structural Brain Predictors of Visual Attention Gradient Modulated by Trait Anxiety,"Suhail Rafiq Mir, Dolcy Dhar, Ishita Singh, Prakrati Gupta, Varsha Singh, Mrinmoy Chakrabarty",2026-07-10T10:47:18Z,"Dynamic allocation of attention across the visual field, quantified as a visuospatial attention gradient, is essential for maintaining perceptual breadth. Disruptions to this flexibility may contribute to altered spatial attentional bias and may be influenced by trait anxiety. We investigated whether individual differences in structural brain morphology predict spatial attentional deployment as a function of trait anxiety. Sixty participants, recruited based on an a priori sample size calculation, completed a visuospatial attention gradient task incorporating brief partial facial emotion cues. Although discrete emotional cues did not significantly modulate attention gradients, structural neuroimaging analyses revealed that greater grey matter volume in bilateral cerebellar lobule VI and increased cortical thickness in the left precentral gyrus and paracentral lobule were associated with reduced interaction between the magnitude of the spatial attention gradient (averaged across emotions) and trait anxiety. Machine-learning models further predicted individual attention-anxiety profiles from these neuroanatomical features. These findings suggest that greater structural integrity in cerebellar and sensorimotor regions is associated with more flexible spatial attentional deployment in individuals with lower trait anxiety. Together, the results highlight the contribution of cerebellar and sensorimotor regions, beyond their traditional motor functions, to individual differences in visual spatial attention and cognitive-affective interactions, while demonstrating the predictive utility of structural brain markers.",https://arxiv.org/abs/2607.09278v1,q-bio.NC
2607.09032,Quantum,Quantum Logic as the Logic of Contexts,"Haruki Emori, Atsushi Iriki, Andrei Khrennikov, Kazunori Kondo",2026-07-10T01:41:50Z,"Quantum logic is usually presented as a non-classical departure from ordinary reasoning forced on us by quantum mechanics, with classical logic kept as the secure starting point. We argue for the opposite order of explanation in a finite and fully computable setting. The free orthomodular lattice on two generators has ninety-six elements, the direct product of a six-element non-distributive factor and a sixteen-element Boolean factor. Reading the first factor as a register of contexts and the second as Boolean content, we obtain a calculus whose elements are context--bit-vector pairs and whose operations act component by component. With this calculus we establish three results. First, we classify the six layers by commutativity, identifying the central kernel of context-neutral propositions together with a dual central layer in which all complementary contexts are present. Second, we show that orthocomplementation rearranges the layers exactly as the complementation of the small factor rearranges its elements, which makes the duality among the layers rigid rather than accidental. Third, we prove that the operation forgetting the context is a surjective homomorphism of orthocomplemented lattices whose quotient is the classical Boolean algebra, so that classical logic is a six-to-one, information-losing image of the contextual calculus.",https://arxiv.org/abs/2607.09032v1,"quant-ph, cs.AI, math.LO, q-bio.NC"
2607.08855,Health,Spatial Neighboring Scattering Transform: A Cross-Channel Amplitude Coupling Measure for EEG Connectivity,"Md. Taksimul Ahsan Tawhid, Nasif Ahmed Rafe, Alif Tahmid Priyom, K. M. Mustafizur Rahman",2026-07-09T18:24:52Z,"The functional organization of the brain relies on coordinated activity across spatially distributed regions, making the analysis of inter-regional dependencies fundamental. Existing connectivity measures address this predominantly through phase synchronization, which is vulnerable to volume conduction artifacts and discards amplitude-domain coupling. This study introduces the Spatial Neighboring Scattering Transform, which extends the wavelet scattering transform to the multichannel setting, yielding two descriptors that jointly capture amplitude-envelope coupling between channels and its modulation across frequency scales. SNST was evaluated on the BCI Competition IV-2a motor imagery dataset using a bias-corrected, false-discovery-rate-controlled statistical pipeline, with the validation criterion defined as spatial consistency of significant coupling across subjects. The first-order descriptor identified statistically significant amplitude coupling within a central-parietal electrode neighborhood, reproduced consistently across all subjects and both imagery conditions. The second-order descriptor revealed that this coupling is periodically gated by slow rhythms, indicating a cross-frequency amplitude-modulation structure absent from single-frequency connectivity measures. Phase lag index and weighted phase lag index, computed under an identical correction procedure and verified robust to volume conduction, identified negligible significant coupling with zero overlap with SNST findings, demonstrating that amplitude envelope coupling constitutes a largely distinct connectivity signal. These results establish SNST as a cross-channel scattering-based connectivity descriptor that recovers amplitude-envelope and cross-frequency coupling structure systematically, applicable to any multichannel EEG analysis where amplitude-domain inter-regional dependence is of interest.",https://arxiv.org/abs/2607.08855v1,"q-bio.NC, eess.SP, stat.AP"
