id,domain,title,authors,published,abstract,url,categories
2606.21076,Space,Population-level correlations in Bayesian statistics: an illustrative model for gravitational-wave astronomy,"Caroline B. Owen, Alexandre Toubiana, Davide Gerosa",2026-06-19T03:55:04Z,"With increasingly large numbers of gravitational-wave events, population inference is now beginning to move beyond predictions of marginal distributions and to probe correlations between compact-binary parameters such as masses, spins, and redshifts. These correlations have strong constraining power for both astrophysics and tests of general relativity. In this paper, we present an idealized analytical model to study the interplay between single-event correlations, systematic biases, and population-level correlations. With this, we investigate the potential emergence of false-positive measurements of population-level correlations. We quantify how the presence of correlations at the single-event level between a pair of parameters increases the uncertainty of population-level correlations for those parameters, potentially obscuring the true underlying population correlation if present. We also find that if waveform systematics lead to biases that are correlated across the catalog (which is likely, because certain regions of the parameter space are more difficult to model), this can be effectively absorbed by a population analysis that targets correlations and can be misinterpreted as such. This simple Gaussian-based model may serve as a broad compass for future, more detailed explorations.",https://arxiv.org/abs/2606.21076v1,"gr-qc, astro-ph.HE"
2606.21035,Space,Quality Assessment of Spectroscopic Data Reduction Pipelines Using Artificial Intelligence: Scrutinizing Data Release 2 from the DESI Survey,"V. Torres-Gomez, J. Suarez-Perez, J. E. Forero-Romero, S. Bailey, A. Kremin, B. Dey, R. P. Nathan, S. Panda, J. Aguilar, S. Ahlen, D. Bianchi, D. Brooks, T. Claybaugh, A. de la Macorra, P. Doel, S. Ferraro, A. Font-Ribera, E. Gaztanaga, S. Gontcho A Gontcho, G. Gutierrez, K. Honscheid, C. Howlett, R. Joyce, S. Juneau, D. Kirkby, O. Lahav, M. Landriau, L. Le Guillou, M. E. Levi, M. Manera, A. Meisner, R. Miquel, J. Moustakas, S. Nadathur, N. Palanque-Delabrouille, W. J. Percival, F. Prada, I. Perez-Rafols, G. Rossi, L. Samushia, E. Sanchez, D. Schlegel, H. Seo, R. Sharples, J. Silber, G. Tarle, B. A. Weaver, H. Zou",2026-06-19T01:58:25Z,"Large spectroscopic surveys now collect data at a scale that makes traditional visual inspection impractical. We present an unsupervised pipeline for spectroscopic quality assessment that requires no labeled training data. The method combines Uniform Manifold Approximation and Projection for dimensionality reduction with Friends-of-Friends clustering to isolate anomalous spectra for targeted review. We apply this pipeline to 58,291,334 spectra across 14,199 tiles from DESI Data Release 2, processing each tile independently to produce a tile-level outlier catalog. In each tile, the pipeline separates a dense core of typical spectra from small, isolated components and singletons, yielding a total of 1,095,816 outlier candidates. The mean tile-level outlier fraction is about 1.96 percent overall, with values of 0.76 percent and 2.36 percent for the dark and bright main-survey programs, respectively. From the visual inspection of 391 outlier candidates from the dark and bright programs of the main survey, we find that 66.8 percent exhibit identifiable spectral anomalies consistent with known reduction and calibration effects. By contrast, only 4.1 percent carry a non-zero quality flag from the standard reduction pipeline. This shows that the method provides a complementary quality-assessment layer to existing pipeline diagnostics and recovers a substantial population of problematic spectra that standard diagnostics miss. Extrapolating to the main-survey catalog, we estimate that approximately 218,000 candidate outliers are free of identifiable reduction artifacts and may correspond to genuine atypical spectra in the context of DESI. The pipeline is scalable, reproducible, and directly comparable across successive data releases, making it a practical quality-assurance monitor for DESI and future multi-object spectroscopic surveys.",https://arxiv.org/abs/2606.21035v1,astro-ph.IM
2606.21017,Space,Classification of Eclipsing Binary Light Curves in Gaia DR3: A Machine Learning Approach,"Bedri Keskin, Özgür Baştürk",2026-06-19T01:02:33Z,"Gaia Data Release 3 (DR3) presents a unique dataset with approximately 2.1 million eclipsing binary star candidates. The unsustainability of manually classifying such a large volume of data has necessitated the development of reliable and scalable automated techniques. In this study, a novel multimodal deep learning model has been developed for the automated classification of approximately 2 million eclipsing binary stars in the Gaia DR3 archive based on their light curve morphologies (EA, EB, EW). The developed architecture simultaneously utilizes a Convolutional Neural Network (CNN) that extracts visual features from light curve images and a Multilayer Perceptron (MLP) that processes geometric model parameters. Noise-free synthetic light curves were used during the training process to ensure the model focuses on geometric shapes. Tests showed that the model achieved an accuracy rate of over 95% for all classes, exhibiting excellent separation performance, particularly in EA-type systems. As a result of the automated classification performed with the trained model, 40% of the Gaia DR3 eclipsing binaries were classified as EA, 30% as EB, and 30% as EW. This study provides a highly accurate and transferable classification framework for future large-scale sky surveys.",https://arxiv.org/abs/2606.21017v1,astro-ph.IM
2606.20992,Space,Two stages of magnetic filament formation in the solar convective zone,"Evgeny Kuznetsov, Evgeny Mikhailov, Vlada Khvoshchinskaia",2026-06-18T23:50:06Z,"This paper presents a brief overview of studies of magnetic filament formation in the solar convection zone. Two stages of magnetic filament formation and development are distinguished. The first stage can be described within the kinematic approximation for the MHD equation, since the average kinetic energy of convective motion exceeds the average magnetic field energy. Moreover, magnetic Reynolds number is on the order of $10^6$. Therefore, at the initial stage of magnetic filament formation, the magnetic field can be considered frozen-in. It turns out that at this stage, magnetic filaments begin to form at the boundaries of convective cells in hyperbolic regions of the flow. These regions act as attractors for the magnetic field. At the free boundary of the convective zone near the interfaces between convective cells, the magnetic field has a predominantly normal component relative to the boundary. As the magnetic field increases, the field's frozen-in nature in the filament is disrupted, and saturation occurs due to finite conductivity. It is important to note that the magnetic field growth and saturation in the filament at this stage can be determined by analyzing the behavior of the magnetic field at the free boundary, which, according to observations, can be considered flat. Moreover, the formation of magnetic filaments is independent of the internal structure of the convective cells and is determined by the behavior of the convective flow along the free surface. In the next stage, when the magnetic field in the filament is sufficiently strong, the magnetic field pressure gradient begins to impede the convective flow, leading to a shift of the hyperbolic regions toward the convective flow along the free surface. As a result, the transverse size of the filament increases and stops when the kinetic energy density and the magnetic field energy density become comparable.",https://arxiv.org/abs/2606.20992v1,"astro-ph.SR, math-ph"
2606.20979,Space,Globular Clusters in the Time of the JWST. I. Survey Design and First Results on Multiple Populations and Beyond,"A. P. Milone, A. F. Marino, G. Cordoni, E. Dondoglio, M. V. Legnardi, T. Ziliotto, E. Bortolan, F. Muratore, F. D'Antona, A. Renzini, G. Girardi, L. Gorza, A. Mastrobuono-Battisti, C. Ventura, P. Ventura, V. Altomonte, L. Bisigello, Y. Cavecchi, F. Dell'Agli, A. Dotter, E. P. Lagioia, C. Li, S. Lionetto, A. Marchuk, J. Qi, G. Rodrighiero, M. Tailo, H. Wirth",2026-06-18T22:58:36Z,"Globular clusters (GCs) host multiple stellar populations with distinct chemical compositions, but their properties among very low-mass stars remain poorly constrained. The James Webb Space Telescope (JWST) enables precise infrared studies that are highly sensitive to abundance variations in cool stars. We initiate a homogeneous survey of Galactic GCs, based primarily on deep JWST GO-8960 observations and complemented by archival JWST and Hubble Space Telescope data, to characterize multiple populations across a wide range of cluster properties. In this first paper, we present the survey and initial NIRCam results. We analyze eleven GCs, deriving high-precision photometry and astrometry to measure proper motions. Multiple populations are detected among low-mass stars in all clusters, with diverse behaviors. We find discrete main sequences in NGC 288, NGC 6723, and NGC 2808, and more continuous distributions in NGC 104 and the Type II clusters NGC 1851 and NGC 6656. The bulge clusters NGC 6528, NGC 6553, and NGC 6440 show patterns consistent with varying helium and oxygen abundances that do not scale simply with cluster mass. In Terzan 5 and Liller 1, we identify populations spanning different ages and helium variations within the old population of Terzan 5. We also detect an M-dwarf gap in NGC 104 around 0.35 solar masses, consistent with the Jao Gap of field stars and open clusters. This work establishes the foundation for a homogeneous JWST survey of Galactic GCs and provides a valuable dataset for studies of cluster evolution, Galactic stellar populations, and background extragalactic sources.",https://arxiv.org/abs/2606.20979v1,"astro-ph.GA, astro-ph.SR"
2606.20957,Space,Out-of-Equilibrium Effects in Non-Radial Relativistic Stellar Perturbations: A Model-Agnostic Formulation and Mode Analysis,"Takuya Katagiri, Victor Guedes, Kent Yagi",2026-06-18T21:46:38Z,"We present a systematic, model-agnostic analysis of out-of-equilibrium effects, including viscosity and thermal conductivity, in non-radial oscillations of relativistic stars. Extending the Lindblom-Detweiler formalism, we construct, to our knowledge, the first general framework for linear, non-radial relativistic stellar perturbations that incorporates generic nonequilibrium corrections to the perfect-fluid sector in both the even- and odd-parity channels. Our framework is formulated in terms of the tensorial structure and thermodynamic decomposition of generic corrections without relying on any specific constitutive relations, thereby allowing us to elucidate, at a structural level, how these effects enter the perturbation equations and contribute to geometric deformations and fluid fluctuations. As an application, we consider the Bemfica-Disconzi-Noronha-Kovtun fluid and perturbatively investigate shifts in the frequencies and damping times of modes connected to their perfect-fluid counterparts in the limit of vanishing transport coefficients. We also identify structural features of the closed eigenvalue problem that can give rise to additional mode families. Our formalism provides a unified framework for analyzing how different relativistic fluid theories modify the structure of non-radial stellar perturbations.",https://arxiv.org/abs/2606.20957v1,"gr-qc, astro-ph.HE"
2606.20885,Space,Radio Follow Up of a Sub-threshold GRB in the Sky Localization Area of GW241125,"Natalie Gottschlich, Alessandra Corsi, S. Bradley Cenko, Divyajyoti, James DeLaunay, Derek B. Fox, Tanner O'Dwyer, Samuele Ronchini",2026-06-18T19:25:33Z,"Since the Fermi satellite's identification of a candidate $γ$-ray burst (GRB) temporally coincident with GW150914, several tentative, and often debated, associations between electromagnetic (EM) transients and gravitational-wave (GW) signals from binary black hole (BBH) mergers have been reported. One such event, S241125n (later confirmed as GW241125_010116), was identified during the fourth observing run (O4) of Advanced LIGO and found to be spatially (within large GW localization uncertainty) and temporally coincident with a subthreshold GRB detected by the Swift Burst Alert Telescope Gamma-ray Urgent Archiver for Novel Opportunities (BAT-GUANO). Here, we present results from a radio follow-up campaign targeting the BAT-GUANO localization region, carried out with the Karl G. Jansky Very Large Array (VLA). We also re-analyze Swift/XRT observations of the field, and combine these results with optical upper limits. Our analysis constrains the isotropic kinetic energy of a putative relativistic jet launched in the BBH merger to $\lesssim 3 \times 10^{50}$ erg for $n_{ISM} = 1.0 cm^{-3}$. We also discuss both the challenges and the diagnostic power of radio follow up in assessing candidate BBH-GRB associations, and present projections for analogous radio studies in the LIGO-Virgo-KAGRA observing run 5 (O5), and in the era of next-generation ground-based instrumentation. The enhanced sensitivity and localization capabilities of detector networks such as Cosmic Explorer and the Einstein Telescope, paired with the enhanced sensitivity of next-generation radio interferometers such as the next-generation VLA and the Square Kilometre Array, will significantly strengthen coordinated multi-messenger follow-up of BBHs. These next-generation facilities are likely to provide an answer to whether BBHs host relativistic ejecta powered by mini-disk accretion.",https://arxiv.org/abs/2606.20885v1,"astro-ph.HE, gr-qc"
2606.20854,Space,Radio Spectral Imaging and MHD Modeling of a CME-Driven Shock: Connecting Solar Type II Radio Bursts with Shock-Surface Magnetic Geometry,"Peijin Zhang, Weihao Liu, Bin Chen, Ward B. Manchester, Surajit Mondal, Sijie Yu",2026-06-18T18:40:09Z,"Solar type II radio bursts are widely regarded as signatures of shock waves propagating in the solar corona and are of particular importance for understanding shock-driven particle acceleration processes. Type II radio bursts often exhibit complex multi-lane and split-band features. The detailed spectral, temporal, and spatial structures carry key information about the shock properties and evolution. However, the physical origin of the multi-lane and split-band features remains unclear, largely due to a lack of spatially resolved data and understanding of the concurrent shock morphology and its magnetic-field context. In this work, we combine radio imaging spectroscopy of a multi-lane, split-band type II burst event with a three-dimensional global magnetohydrodynamic simulation of the associated coronal mass ejection-driven shock using the Alfvén Wave Solar atmosphere Model-Realtime. In this event, the burst intensity evolves from fundamental-emission dominated to harmonic-emission dominated. Meanwhile, the preferential emission source region moves from the Earth-facing side to the limb or far side, coinciding with quasi-perpendicular shock regions with enhanced Mach numbers. The observed spatial offset between the fundamental and harmonic sources is generally aligned with the projected shock-surface magnetic field from the simulation, consistent with anisotropic scattering in a magnetized turbulent plasma. These results establish a physical connection between type II radio sources and coronal shock magnetic geometry, providing new insight into the origin of the multi-lane features and their diagnostics of coronal shocks.",https://arxiv.org/abs/2606.20854v1,astro-ph.SR
2606.20838,Space,Ground control to major time-lag: on-sky results of data-driven predictive wavefront control at Keck Observatory,"Jules Fowler, Rebeca Jensen-Clem, Sylvain Cetre, Maaike A. M. van Kooten, Maissa Salama, Antonin Bouchez, Avinash Surendran, Charlotte Guthery, Eduardo Marin, Mahawa Cisse, Max Service, Charlotte Z. Bond, Emiel Por, Nour Skaf, Will Gauvin",2026-06-18T18:24:36Z,"Directly imaging and characterizing exoplanets requires extreme adaptive optics (XAO), which achieves exquisite wavefront correction over a small (<5"") field of view. Temporal errors, where the wavefront evolves faster than the lag between wavefront sensing and control, are often a leading term in the error budget for these XAO systems. Predictive control mitigates temporal errors by predicting where the wavefront will be by the time the system correction is applied. In particular, empirical orthogonal functions (EOF) learn linear correlations in a wavefront using previous states in the wavefront sensor history. We present on-sky results of a new implementation of EOF built directly into the Keck-II real time controller. On-sky engineering tests at Keck Observatory of the predictive controller show a 20% performance improvement over a classic integrator according to wavefront residuals from the Shack-Hartmann Wavefront Sensor (SHWFS). Parameter optimization studies show that there is a clear improvement based on varying predictive filter hyper-parameters, but that within a reasonable regime, varying filter parameters does not degrade performance to notably worse than an integrator. NIRC2 imaging through the Brackett Gamma=2190nm filter shows comparable performance between an integrator and predictor, both comparing Strehl Ratio (SR) and coronagraph-free contrast. We also explore power in principal components, and find a modest improvement (on the order of 3% less area under the curve of component strength) from the predictor over the integrator. This work not only improves current observing for the Keck community, but also acts as a pathfinder for predictive control methods with extremely large telescopes.",https://arxiv.org/abs/2606.20838v1,"astro-ph.IM, astro-ph.EP"
2606.20836,Space,Old and Bright: The Remarkable Radio Brightening of the Engine-driven SN 2012au Several Years After Explosion Signals the Birth of a PWN,"Eli Wiston, Raffaella Margutti, A. J. Nayana, Brian D. Metzger, Kohta Murase, Dan Milisavljevic, Itai Sfaradi, Ryan Chornock, Deanne L. Coppejans, Joe Bright, Garrett K. Keating, Giacomo Terreran, Mattias Lazda, Maria R. Drout, Michael Stroh, Lauren Rhodes, Ben Margalit, Jonathan Granot, Fabio De Colle, Michael Bietenholz, Daichi Tsuna, Samantha Wu, Tanmoy Laskar, Edo Berger, Daniel Patnaude, Collin T. Christy",2026-06-18T18:21:39Z,"We present the results from an extensive broad-band (radio to X-rays) observing campaign of the engine-driven Type Ib SN 2012au in the first 13 years of evolution. The early-time ($δt\leq{190}$ d) radio and X-ray evolution is well-described by conventional models of a forward shock interacting with a wind-like circumstellar medium ($ρ_{\rm{CSM}}\propto{r}^{-2}$). However, starting at $δ{t}\approx{6.7}$ yr, we detect a significant radio re-brightening. This late-time emission is dominated by a luminous component characterized by a broad and rapidly evolving spectral peak and a shallow optically thin spectral slope, $F_ν\proptoν^{-0.31\pm0.02}$. These properties imply a compact emitting region ($R\lesssim{10}^{16}$ cm) expanding at a remarkably slow velocity ($\lesssim{500}$ km/s) into a high-density environment ($\geq{10}^4 \rm{cm}^{-3}$), accompanied by a hard electron power-law index $p\approx{1.6}$. No soft or hard X-ray emission is detected at any epoch, indicating that high-energy radiation is either strongly absorbed or intrinsically absent. In the context of aspherical shock-CSM interaction models, these observations imply extreme properties of the CSM (geometry, density, total mass) that lack clear astrophysical motivation. Instead, we show that the emergence of radiation from a newborn Pulsar Wind Nebula (PWN) naturally explains the radio spectral evolution and high-energy limits, where the emission is governed by the adiabatic expansion of a relic pair plasma. We conclude that SN 2012au represents the most compelling candidate for a young, newborn PWN discovered to date, a scenario that can be directly tested with pending Very Long Baseline Interferometry (VLBI) observations.",https://arxiv.org/abs/2606.20836v1,astro-ph.HE
2606.20832,Space,ReLaTS: a Reinforcement Learning-based method for dynamically determining the coupling Time Step in multi-scale simulations of self-gravitating systems,"Veronica Saz Ulibarrena, Simon Portegies Zwart",2026-06-18T18:19:32Z,"Astrophysical simulations frequently address multi-scale, multi-physics problems through subsystem decomposition, problem-tailored integration schemes, and coupling on fixed manually set timescales. Here we introduce ReLaTS, a reinforcement learning framework that dynamically selects the coupling time step to optimize the trade-off between accuracy and computational cost. We validate ReLaTS on star clusters containing a planetary system, and test the method by varying the number of stars $N_\star$ in the cluster and the number of planets ($N_{\rm planet}$) orbiting one of them. The method finds the optimal coupling time step that balances speed and accuracy without requiring expert knowledge. In addition, the trained network operates independently of the coupled \textit{N}-body algorithms, displaying stable performance across a range of setups. We observe that the method is less reliable for cases with infinitesimal masses, as their contribution to the total energy is negligible compared to that of the massive bodies, and the network is not capable of recognizing potential errors generated while integrating them. For long-time integration of large $N$ systems, the error accumulates. The reinforcement learning algorithm, however, manages to keep the energy error below a pre-set threshold. This approach substantially reduces energy errors relative to fixed-time step baselines without substantial additional computational overhead. Once trained, ReLaTS requires no expert tuning and generalizes across diverse astrophysical domains, enabling adaptive multi-scale simulations.",https://arxiv.org/abs/2606.20832v1,"astro-ph.IM, cs.LG"
2606.20822,Space,WST -- Wide-field Spectroscopic Telescope: The Next Leap in Wide-field Spectroscopy,"Roland Bacon, Olga Bellido, Philippe Dierickx, Paolo Franzetti, Roelof S. de Jong, David Lee, Vincenzo Mainieri, Sofia Randich, Richard I. Anderson, Henri Boffin, Julia Bryant, Richard Ellis, Gaston Gausachs, Alexandre Jeanneau, Laura Magrini, Arlette Pécontal, Anna Puglisi, Rodolfo Smiljanic, Stefano Zibetti, Bodo Ziegler, Matthew Colless, Matt Lehnert, Pietro Schipani, Laurence Tresse, Dimitri Buffat, Letizia P. Cassarà, Younes Chadid, Corentin Cudennec, Bianca De Caro, Laurane Fréour, Marco Fumana, Adriana Gargiulo, Matteo Munari, Aaron Omadutt, Peder Norberg, Marco Palla, Marco Scodeggio, Elmo Tempel, Nicholas A. Walton",2026-06-18T18:08:10Z,"The Wide-field Spectroscopic Telescope (WST) is a concept for a dedicated 12-m spectroscopic survey facility designed to address some of the most important questions in astrophysics in the 2040s. The WST will provide unprecedented spectroscopic survey capabilities by operating simultaneously over a 2-degree diameter field of view with 54 low-resolution spectrographs fed by 30,000 fibres, 8-16 high-resolution spectrographs fed by 2,000 fibres, and a large panoramic low-resolution integral-field spectrograph. Supported by Horizon Europe, the concept study has refined the science cases, facility architecture, operations model, sustainability strategy, and technology roadmap. The resulting reference design demonstrates that the WST is both scientifically transformative and technically feasible, while identifying the developments required to mitigate the remaining risks. The WST is designed as an ESO flagship facility for the post-ELT construction era and a key spectroscopic complement to the major imaging, time-domain, and multi-messenger facilities of the coming decades.",https://arxiv.org/abs/2606.20822v1,astro-ph.IM
