id,domain,title,authors,published,abstract,url,categories
2607.14457,Health,A Validated Data-driven Subject and Vehicle Specific Nonlinear Biodynamic Model for Predicting Upper-Body Response in Vehicle Ride,"Rahid Zaman, Ahmed Zubayer Raiyan, Md Navid Imtiaz Rifat, Mohammad Ibrahim Hossain, Ashfaq Adnan",2026-07-16T01:11:02Z,"A six-degree-of-freedom (6-DOF) nonlinear lumped-parameter biodynamic model of the seated human upper body is formulated to predict human response under different unknown loading conditions. The model consists of six anatomically partitioned cascade body segments: pelvis, lower torso, central torso, upper torso, neck, and head. The joints are connected through nonlinear viscoelastic joints incorporating strain-stiffening restoring forces consistent with the nonlinear constitutive behavior of biological soft tissue. Fifteen subject-specific mechanical parameters are considered as design variables. The design variables are six joint natural frequencies, six viscous damping ratios, one Rayleigh coefficient, one nonlinear stiffening scale, and one mass scale. The subject-specific design variables are identified from three distinct vehicular loading cases using a hybrid two-phase optimization strategy. Particle Swarm Optimization (PSO) globally searches on a frequency-domain surrogate and seeds a bounded Nelder-Mead refinement for the full nonlinear Ordinary Differential Equation (ODE) response. A rigorous parameter idealization methodology, based on error-weighted geometric mean in log space, was implemented to fuse the multi-case optima into a single subject-representative consensus parameter set. The idealized model retains physical interpretability across loading scenarios and is subsequently used in forward dynamics to predict and validate the subject's experimental response. The framework constitutes a complete subject-specific biodynamic pipeline, from experimental data through optimization, idealization, and forward prediction, suitable for occupational health assessment and protective equipment design across diverse loading scenarios.",https://arxiv.org/abs/2607.14457v1,q-bio.TO
2607.14360,Health,"Infectious Disease Induces Emergent Oscillations, Extinction and Changes in Community Persistence in a Food Chain","Hooman Saveh, Fakhteh Ghanbarnejad",2026-07-15T20:49:06Z,"Food webs have been extensively studied from both ecological and mathematical aspects. However, most of the models studied in this area do not capture the effects of infectious diseases simultaneously. Recently, the idea of including an infectious disease in a food web model has been investigated. We study and simulate a small food chain consisting of only prey, predators, and apex predators governed by the generalized Lotka-Volterra equations, and we implement the Susceptible-Infected-Recovered (SIR) model on only one of the species at a time in the food chain. To study the effects of an infectious disease on the food chain, we introduce a new parameter that increases the predation rate by a factor of $w$ and decreases the hunting rate by a factor of $1/w$ for infected species. When the infectious disease is present in predators, we observe that predators do not become extinct under any set of parameters; however, an oscillation in their population size occurs under some circumstances, which we do not observe in ordinary SIR or the generalized Lotka-Volterra equations alone. When an infectious disease is present in apex predators, oscillations in the population size do not happen; but if the set of parameters is in a specific range the apex predators may become extinct. Furthermore, the chance of survival of the community, known as community persistence, increases for the predators and decreases for the apex predators.",https://arxiv.org/abs/2607.14360v1,"q-bio.PE, nlin.CD, physics.soc-ph"
2607.14086,AI,Leveraging unlabelled data for generalizable neural population decoding,"Ximeng Mao, Nanda H. Krishna, Avery Hee-Woon Ryoo, Matthew G. Perich, Guillaume Lajoie",2026-07-15T17:58:00Z,"Robust and accurate neural decoders are integral to neurotechnologies such as brain-computer interfaces and closed-loop experiments. Recent work has shown that tokenizing neural data at the spike level facilitates multi-session pretraining and delivers state-of-the-art decoding performance. However, current spike-based models are restricted to supervised learning (SL), limiting training to datasets with paired behavioural labels. To address this limitation, we introduce MOJO (Masked autOencoder-based JOint training), a training framework for spike-tokenizing models that jointly leverages self-supervised learning (SSL) via masked autoencoding and SL objectives. We evaluate MOJO on three spiking datasets spanning monkey motor cortex during reaching tasks and multi-regional mouse recordings during vision and decision making tasks, demonstrating superior performance over purely SL-trained models. This improvement is especially pronounced when training with limited labelled data, particularly in few-shot finetuning, where only a small amount of labelled data from a new session is available. Incorporating SSL also yields more interpretable neuronal representations, improving performance on brain region classification and spike-statistics prediction without explicit optimization for these tasks. We further show that MOJO generalizes beyond spiking data to human electrocorticography during speech, where it continues to outperform purely SL-trained models and achieves performance comparable to neuro-foundation models (NFMs) designed specifically for continuous signals. Overall, augmenting spike-tokenizing models with SSL improves performance in label-impoverished settings and enables the use of unlabelled data across various tasks and species, while generalizing to other neural modalities. These results suggest a path towards more flexible and scalable data usage when training NFMs.",https://arxiv.org/abs/2607.14086v1,"cs.LG, q-bio.NC"
2607.14078,Health,"A modular state-space model of human perception, cognition, and decision dynamics","Sven Schoonebeek, Carlo Cenedese, Anahita Jamshidnejad",2026-07-15T17:50:28Z,"Human-centered adaptive systems require behavioral models that are both psychologically interpretable and mathematically analyzable. Many existing predictors either operate as black-box input-output mappings or provide limited access to latent internal dynamics. This paper addresses this gap by modeling behavior as a perception-cognition-decision pipeline. We propose a modular state-space model in which attentional selection, predictive inference, cognitive-state evolution, intention formation, and action selection are represented by coupled mathematical mappings. The model links sensory inputs to observable behavior through latent internal states while retaining interpretable connections to neuro-cognitive mechanisms. We establish sufficient conditions for boundedness, Lipschitz regularity, forward invariance, contraction of perceptual inference under constant input, and input-to-state stability of the cognitive state dynamics. Numerical sensitivity analyses show that the model yields interpretable changes in perceptual tracking, cognitive amplification, intention expression, and action decisiveness. We further demonstrate a closed-loop rehabilitation case study in which a receding-horizon controller uses the model to adapt movement difficulty from partial feedback. In this proof-of-concept setting, the model-based controller sustains simulated task participation and achieves lower realized cumulative cost than target-following and random baselines. Overall, the framework provides a white-box dynamical structure for estimation, validation, and model-based control in human-centered settings.",https://arxiv.org/abs/2607.14078v2,"eess.SY, q-bio.NC"
2607.14000,Health,Activity Regeneration from Silent States in Neuronal Networks with Transient Synaptic Memory,"Mozhgan Khanjanianpak, Alireza Valiadeh",2026-07-15T16:28:51Z,"Transient synaptic memory has emerged as a potential mechanism for maintaining short-term information even in the absence of persistent neuronal activity. However, it remains unclear whether the hidden synaptic state alone contains sufficient information to predict the future evolution of neuronal networks after activity has ceased. Here, we introduce a minimal neuronal network model with finite-lifetime synapses and investigate the mechanism underlying spontaneous activity regeneration following complete neuronal silence. We show that the residual synaptic configuration at the first silent state already determines whether network activity terminates after a single activation cycle or spontaneously regenerates an additional cycle. By analyzing this synaptic-memory snapshot, we identify the Latent Excitatory Recruitment (LER) capacity, quantified by the cumulative number of fresh excitatory neurons, as a near-perfect predictor of multi-cycle dynamics without continuing the subsequent network simulation. Remarkably, these distinct dynamical outcomes emerge in an otherwise homogeneous neuronal network, demonstrating that transient synaptic memory alone is sufficient to generate diverse future dynamics. Our findings provide a mechanistic explanation for activity regeneration from a residual synaptic state and suggest that short-term memory is encoded not only in ongoing neuronal activity but also in the latent synaptic configuration that preserves the network's capacity to recruit new neuronal assemblies. More broadly, the proposed snapshot-based framework offers a new perspective for predicting and potentially controlling the future evolution of neuronal networks.",https://arxiv.org/abs/2607.14000v1,"q-bio.NC, cond-mat.dis-nn, cond-mat.stat-mech"
2607.13644,Health,Evaluating Encoding Strategies for Closed-Loop Classification in Biological Neural Networks,"Martin Schottlender, Veronika Volkova, Pengjie Zhou, Ruifeng Zheng, Frank H. P. Fitzek, Pit Hofmann",2026-07-15T09:41:23Z,"Interfacing with Biological Neural Networks (BNNs) requires encoding information into stimulation patterns that can be effectively processed and that enable the underlying system to adapt. Nevertheless, the role of stimulation encoding remains poorly understood. In this work, we compare multiple encoding strategies, including rate-based, phase-based, burst-based, and time-to-first-spike temporal encodings, in a closed-loop neural classification task using cultured BNNs. We encode visual inputs as spatiotemporal stimulation patterns delivered via a Multi-Electrode Array (MEA) and evaluate classification performance for each encoding scheme. We find that burst-based temporal encoding yields the highest observed performance, achieving up to 95.6 % accuracy in a binary classification task, compared to substantially lower performance from rate- and phase-based approaches. We further show that performance is highly sensitive to the spatial distribution of stimulation, with suboptimal electrode selection significantly degrading accuracy. These findings indicate that effective interfacing with biological neural systems requires the joint optimization of temporal and spatial encoding strategies, and highlight temporal encoding as a key design dimension for bio-digital computing.",https://arxiv.org/abs/2607.13644v1,"cs.ET, cs.NE, q-bio.NC"
2607.13560,Health,Grounded world models in biological organisms and future embodied AI,"Giovanni Pezzulo, Davide Nuzzi, Marco D'Alessandro, Riccardo Proietti, Roberto Bottini, Paul Cisek",2026-07-15T08:02:19Z,"Recent advances in generative and embodied AI have been driven by large-scale predictive learning over multimodal data. However, the resulting systems remain largely based on passive training regimes where linguistic regularities create the scaffold onto which information from other modalities is attached. Conversely, neuroscience and cognitive science suggest that biological intelligence is organized in the opposite way, where grounded world models acquired through interaction with the environment provide the semantic scaffold to which language is attached. Here, we illustrate five examples of neural circuits supporting grounded world modelling, which underlie navigation in physical and conceptual spaces, affordance-based perception and interaction with objects, active perception and exploratory learning, allostatic control and emotion, and the distinction between self- and world-generated outcomes. These examples highlight several features largely missing from current embodied AI, including the role of intrinsic dynamics as a foundation for learning, the centrality of action in aligning these dynamics with the external world, the prominence of autonomous experience and open-ended learning over passive assimilation of externally provided data, and the fact that early predictive and control mechanisms scaffold higher cognitive abilities such as reasoning, conceptual navigation, planning, imagination, understanding others' minds, and communication. Finally, we discuss whether and how principles derived from biological systems may inform future embodied AI, including training regimes based on social interaction to construct world models that are not only grounded but also socially shared and aligned with human norms and values.",https://arxiv.org/abs/2607.13560v1,"q-bio.NC, cs.AI"
2607.13281,Health,Predator-dependent replicator dynamics or a predator-prey model with two prey types and frequency dependence,"Henrique M. Cruz, Armando G. M. Neves",2026-07-14T21:31:57Z,"Braga and Wardil [J. Phys. A: Math. Theor. 55 (2022) 025601] introduced a population model for two prey species that compete among themselves and are preyed upon by a single predator species. They showed the existence of 16 dynamic scenarios and stated sufficient conditions for the stable coexistence of the three species. The model, which can be seen as replicator dynamics with predator-dependent fitnesses for the prey, is based on two pay-off matrices: one for prey reproduction and one for interaction between prey and predators.   We argue that the model can also be seen as a Lotka-Volterra-type predator-prey model with a single prey species, logistic limitation for prey, and frequency-dependent reproduction and capture coefficients. Using this alternative viewpoint, we obtain conditions for the existence of equilibria with the three types of individuals. We also prove theorems on the stability or instability of equilibria with only two species and relate the stability change of these equilibria to the appearance or disappearance of equilibria with the three species.   When all parameters, except the one that regulates carrying capacities, are fixed, a rich cascade of bifurcations may appear. Solutions range from predator extinction due to insufficient prey to predators coexisting with one or two prey types. Sometimes stable limit cycles involving all species appear.",https://arxiv.org/abs/2607.13281v1,q-bio.PE
2607.13216,Health,"Classifying daily activities needs posture, reconstructing them needs motion","Arefeh Farahmandi, Gunnar Blohm",2026-07-14T19:21:32Z,"Humans recognize movements effortlessly, even from noisy and complex visual input. But what information in the stimulus allows humans to rapidly classify movements? No framework has systematically compared different strategies of movement analysis to address this question. Here, we used videos of 16 daily activities from the MoVi dataset and compared three strategies: Temporal Movement Primitives (TMPs), which decompose movements into weighted sums of temporally smooth basis functions; Legendre polynomial coefficients, which project joint-coordinate trajectories onto an orthogonal polynomial basis; and Autoencoder latent embeddings. Legendre coefficients and TMPs achieved the highest classifier accuracy, followed by autoencoders. We found two discriminative features for movement classification. The most informative is the general posture of the body, the average spatial configuration that distinguishes one activity from another. Additionally, we identified 9 critical joints that are most predictive for movement classification. Interestingly, good classification accuracy did not automatically lead to good movement generation: when we reconstructed movements for each activity, TMPs preserved the temporal dynamics and produced perceptually natural motion, whereas reconstructions from Legendre coefficients retained only the average posture and appeared frozen. These results reveal a dissociation in how movement information is organized: the static configuration of the body suffices to classify what activity is performed, but the temporal dynamics of movement are required to reconstruct how it unfolds. This distinction clarifies which features the visual system may rely upon for rapid action recognition, and suggests that postural features could enable efficient movement screening in clinical applications, while dynamic information remain essential wherever movement generation is the goal.",https://arxiv.org/abs/2607.13216v1,"q-bio.NC, cs.AI, cs.IR, cs.LG"
2607.12919,Health,On Tree-Network Distinguishability and Full Identifiability of Phylogenetic Networks,"Jari Brits, Niels Holtgrefe, Leo van Iersel, Samuel Martin",2026-07-14T15:54:43Z,"Phylogenetic networks generalize phylogenetic trees to evolutionary histories that include reticulate events such as recombination, horizontal gene transfer, and hybridization. Under a Markov model of nucleotide substitution, a phylogenetic network determines a distribution of leaf-patterns. Here, we study the identifiability of the network topology from this distribution under the Jukes-Cantor (JC), Kimura 2-parameter (K2P), and Kimura 3-parameter (K3P) models. Our first result is that the semi-directed network parameter of a level-1 phylogenetic network (modulo redirecting triangles) is fully identifiable under all three models, on a biologically reasonable parameter space in which substitution rates are probabilistic and mixing parameters are non-trivial (i.e., not 0 or 1). In contrast to the generic identifiability established in prior work, this holds at every point of the parameter space, not merely off of a measure-zero subset. Our second result distinguishes phylogenetic networks from phylogenetic trees, on the same parameter space, under JC and K2P. We prove that no phylogenetic network and phylogenetic tree can induce the same leaf-pattern distribution unless the network is a tree, possibly augmented with certain substructures called $2$-blobs. This means the presence of reticulate evolution creates, in most cases, a detectable signature in the leaf-pattern distribution. More broadly, these results have consequences for identifiability beyond the models and network classes studied here, including for several coalescent-based models.",https://arxiv.org/abs/2607.12919v1,q-bio.PE
2607.12909,Health,Real-time fall detection based on vision for low-power edge platforms,"Wenjun Xia, Zhicheng Peng, Haopeng Li, Zhengdi Zhang",2026-07-14T15:43:41Z,"Falling detection is vital for elderly care and intelligent surveillance; however, prevailing vision-based approaches predominantly frame it as static pose classification or discrete temporal pattern matching, fundamentally overlooking the instability dynamics of the human support system. This paper proposes a physics-informed falling detection framework that recasts falling as a stability-loss event in a coupled dynamical system. We introduce a novel dual-LTC architecture comprising a Center-of-Mass (CoM) subsystem and a Base-of-Support (BoS) subsystem, both instantiated as Liquid Time-Constant (LTC) neural networks to continuously model inertial trajectory evolution and ground-contact adjustment through adaptive time constants, Physical interpretability of falling motion. A learnable coupling module emulates physical interaction between the two subsystems, while a Stability Manifold classifier operates in the joint latent space to detect boundary crossing via Lyapunov-inspired stability metrics. Complementary counterfactual trajectory projection and Time-to-Collision (TTC) estimation further enable irreversibility assessment and early warning. The architecture is designed to support a three-state prediction paradigm (Normal, Falling, Fallen); in this preliminary study, we validate the core stability discrimination capability on a two-class dataset (Normal vs. Falling), leaving the full three-state temporal transition to future work. Unlike conventional CNN--RNN pipelines, the proposed formulation encodes continuous-time mechanical inertia, yielding a sub-50K-parameter network capable of real-time inference on resource-constrained edge devices. Extensive experiments demonstrate competitive accuracy with superior physical interpretability, validating its efficacy for low-compute visual fall detection.",https://arxiv.org/abs/2607.12909v1,"q-bio.NC, cs.AI, cs.CV"
2607.12864,Health,Can deleterious mutations surf deterministic population waves?,"Joao Luiz de Oliveira Madeira, Marcel Ortgiese, Sarah Penington",2026-07-14T15:15:56Z,"In spatially structured populations, rare neutral mutations can spread through large regions during a range expansion, a phenomenon known as gene surfing. Whether deleterious mutations can also surf remains poorly understood. To address this question, we study a deterministic version of the spatial Muller's ratchet, given by an infinite system of reaction-diffusion equations describing an asexual population subject to mutation, migration, and density-dependent reproduction and death. After establishing that the system of PDEs is well-posed, we analyse the distribution of deleterious mutations within the population. In the monostable regime, we derive quantitative bounds on the ratio between the density of individuals carrying a given number of mutations and the density of mutation-free individuals. Under a Fisher-KPP condition, we further determine the spreading speed of the population into an empty habitat, confirming non-rigorous computations of Foutel-Rodier and Etheridge. Finally, using a tracer dynamics approach, we show that deleterious mutations cannot surf deterministic waves: although they are present at the expansion front, they only arise as recent descendants of the wild type.",https://arxiv.org/abs/2607.12864v1,"math.AP, math.PR, q-bio.PE"
2607.12673,Health,Contrasting statistical patterns in melodic and molecular evolution reveal distinctive constraints in a culturally evolving system,"John M McBride, W Tecumseh Fitch",2026-07-14T12:03:02Z,"Evolved sequences can be used to infer the rules of evolution. Orally transmitted folk melodies are evolved sequences whose similarity to protein sequences (one-dimensional, drawn from a limited alphabet) invites application of bioinformatics methods to study cultural evolution. A major obstacle is that melodies encode rhythm, which breaks some assumptions of standard sequence-alignment algorithms. We develop a rhythm-aware alignment method and apply it to \num{40000} Irish dance tune variants, enabling the first large-scale automated melodic alignment. Four canonical bioinformatics analyses -- mutability, substitution matrices, positional conservation, and covariance -- reveal patterns distinct from those of molecular evolution, revealing the forces that shape each domain: biochemical and biophysical constraints for proteins; memory, motor, and social biases for melodies. Together the results show that bioinformatics provides a powerful framework -- conceptual as much as algorithmic -- for studying cultural evolution. Although the cultural transmission of music has been discussed for centuries, here we show how to analyze it at large scale.",https://arxiv.org/abs/2607.12673v1,"q-bio.PE, cs.SD, physics.soc-ph"
2607.12382,AI,Differentiable Clone-Structured Causal Graphs for End-to-End Cognitive Map Learning from Image Sequences,"Arash Nikzad, Sasan Sarbishegi, Ali Dasmeh, Muhammad Asif, Parsa Gharavi, Erik Husom, Sagar Sen, Andrew B. Lehr, Olivier Penacchio, Ana Clemente, Tristan M. Stöber",2026-07-14T05:54:39Z,"How can an agent build a structured map of its world from nothing but an ongoing sequence of raw sensory input and its own movements, especially when natural variation means exact sensory patterns rarely repeat? The Clone-Structured Causal Graph algorithm (CSCG), a normative hippocampus model, shows how an interpretable map can be learned from aliased observations. However, CSCG requires a predefined discrete alphabet, and its expectation-maximization formulation is not easily combined with existing neural network modules, preventing the end-to-end processing of raw image sequences. We remove this barrier by reformulating CSCG as a single, fully differentiable module, gradCSCG, and coupling it to a learned vector-quantized variational autoencoder (VQ-VAE) perceptual front-end. A soft emission forward pass allows the map-learning objective to flow back into perception, while a set of loss-balancing mechanisms mitigates module collapse during joint training. We demonstrate, first, that gradient training reproduces CSCG's results on original symbolic grid worlds by recovering room topology from heavily aliased observations. Second, we show that map recovery remains robust on MNIST image sequences, where each visit to a location yields a newly sampled image of its assigned digit. Across four heavily aliased environments, the end-to-end pipeline successfully uncovers the underlying adjacency graph with high edge precision and recall, directly from visual input. This work provides a proof of principle that CSCG can serve as a composable building block in a deep learning architecture.",https://arxiv.org/abs/2607.12382v1,"cs.LG, q-bio.NC"
