id,domain,title,authors,published,abstract,url,categories
2607.09185,Robotics,Causally Debiased Latent Action Model for Embodied Action Conditioned World Models,"Yufan Wei, Kun Zhou, Lingjun Mao, Zijun Zhang, Ziming Xu, Ziqiao Xi, Shuang Liang, Ruobing Han, Yuchen Yan, Xinyue Wang, Fan Feng, Biwei Huang",2026-07-10T08:20:27Z,"Action-conditioned world models (ACWMs) aim to simulate future observations conditioned on embodied actions, offering a promising foundation for robot planning, policy evaluation, and data augmentation. However, learning controllable ACWMs requires large-scale action-labeled data, which remains costly to collect in the real world. Latent action models (LAMs) mitigate this bottleneck by inferring latent actions from unlabeled videos, but existing LAMs are typically trained with reconstruction-only objectives and therefore entangle action-relevant dynamics with action-irrelevant visual factors such as backgrounds and untouched objects. In this work, we identify this action-irrelevant bias as a key obstacle to controllable ACWMs and introduce evaluation metrics to measure latent-action bias, action following, and robustness. We propose CD-LAM, a causally debiased framework for LAM-based ACWMs. CD-LAM introduces three efficient fine-tuning objectives: embodiment-centric reconstruction, action-centric contrastive learning, and latent space calibration, which together encourage embodiment-focused, action-aware, and calibrated non-collapsed latent action representations. Experiments on 2B and 14B ACWM backbones show that CD-LAM substantially improves latent-action controllability, downstream robot-action following, visual fidelity, and adaptation efficiency, requiring only 6k fine-tuning steps and more than 12$\times$ fewer robot-action adaptation updates than the baseline.",https://arxiv.org/abs/2607.09185v1,"cs.CV, cs.RO"
2607.09138,Robotics,BeyondSight: Object Permanence for End-to-End Autonomous Driving,"Sandro Papais, Letian Wang, Mudit Jain, Behnaz Rezaei, Steven L. Waslander",2026-07-10T06:50:14Z,"Autonomous driving operates in partially observable environments where actors may become fully occluded by other vehicles or infrastructure. Most end-to-end driving systems implicitly couple actor existence to instantaneous observations, causing actor hypotheses to degrade or disappear during prolonged occlusion and removing potentially critical agents from downstream prediction and planning. We introduce BeyondSight, a permanence-aware end-to-end driving framework that decouples actor existence from observability by maintaining persistent actor hypotheses over time. BeyondSight propagates actor queries temporally and updates them with observation-conditioned evidence, enabling joint perception, prediction, and planning to reason about actors even when they are temporarily unobservable. To enable principled training and evaluation of persistence-aware models, we further introduce nuScenes-Permanence, an extension of nuScenes that provides supervision and observability-conditioned evaluation for unobservable actors. Experiments show that BeyondSight substantially improves reasoning under occlusion, increasing detection performance for unobservable actors from 0 to 0.249 mAP while reducing planning error from 0.61 to 0.54 L2avg. These results highlight object permanence as an important modeling principle for robust end-to-end autonomous driving.",https://arxiv.org/abs/2607.09138v1,cs.RO
2607.09136,Robotics,Residual Physics-Informed Neural Networks for High-Fidelity BLDC Motor Modeling,Haitham El-Hussieny,2026-07-10T06:47:02Z,"Accurate dynamics modeling of Brushless DC (BLDC) motors is fundamental to high-performance robotic joint control. This paper presents a Physics-Informed Neural Network (PINN) with a deep residual (ResNet) backbone that learns a continuous-time surrogate of the full six-state BLDC motor dynamics. Given simulation time, applied three-phase voltages, and excitation parameters as inputs, the network directly predicts all motor state variables -- rotor angle, angular velocity, three-phase currents, and winding temperature -- while simultaneously satisfying the governing electromechanical and thermal ODEs through a composite physics-data loss. A curriculum scheduling strategy gradually activates the physics penalty to prevent premature convergence. Training runs are completed in under two minutes on a standard CPU. Crucially, once trained, PINN inference achieves latencies of 0.1--22, mu s per query, up to 118x faster than conventional ODE solvers, making it suitable for real-time observer and control applications.",https://arxiv.org/abs/2607.09136v1,cs.RO
2607.09130,Robotics,Vascular Geometry Characterization for AI-Based Endovascular Navigation,"Han-Ru Wu, Harry Robertshaw, Lisa Dwyer-Joyce, Thomas C Booth, Alejandro Granados",2026-07-10T06:37:34Z,"Mechanical thrombectomy (MT) is a time-critical intervention for acute ischemic stroke; however, access remains limited due to a shortage of neuroradiologists and specialized centers. Reinforcement learning (RL) offers potential to automate endovascular navigation and improve accessibility, yet current models lack standardized frameworks to assess navigation difficulty for model training and evaluation. This study aims to identify vascular metrics associated with navigation difficulty and to develop an automated pipeline for quantitative vascular feature extraction, enabling future complexity grading. Vascular trees were segmented from computed tomography angiograms from 61 patients, and vascular metrics including aortic arch type, presence of bovine arch, vessel length, tortuosity, take-off angle, number of reverse curves, were measured using a custom pipeline. A Soft Actor-Critic RL algorithm was used for 120 s autonomous navigation. Outcomes were analyzed using both mixed effects linear and logistic regression. On the left side, the presence of a bovine arch and aortic arch type II/III increased navigation time by 30.19 s and 37.92 s, respectively, while greater tortuosity (\b{eta} = 118.20) further prolonged the procedure and reduced success probability. On the right side, type II/III arches extended procedure time by 45.94 s, while each additional reverse curve was associated with 3.96 s longer navigation time and lower probability of success. These findings demonstrate for the first time that MT agent navigation difficulty is strongly influenced by vascular geometry. The proposed automated pipeline enables objective and quantitative characterization of vascular features, providing a foundation for future development of standardized complexity grading and RL model evaluation, without aiming to demonstrate clinically generalizable autonomous navigation.",https://arxiv.org/abs/2607.09130v1,cs.RO
2607.09078,Robotics,"Toward Active Object Detection for UAVs in the Wild: A Large-Scale Dataset, Benchmark and Method","Tianpeng Liu, Xinhua Jiang, Li Liu, Qinmu Shen, Siwei Tang, Zhen Liu, Yongxiang Liu",2026-07-10T03:49:45Z,"Object detection is a fundamental component in numerous Unmanned Aerial Vehicle (UAV) applications, yet it has long been plagued by hindrances like occlusion or target pixel scarcity. Active Object Detection (AOD) provides a novel paradigm to address these challenges via active vision, while UAV-based AOD research remains scarce due to the lack of high-quality datasets and benchmarks for algorithm development and evaluation. To fill this gap, this paper presents ATRNet-LUDO, the first large-scale real-world dataset for UAV-Ground Active Object Detection (UGAOD). It contains 121,000 multi-view panoramic multi-target aerial images and 1.21 million local single-target slices, covering 10 vehicle targets across 40 scenarios. It enables the construction of diverse training and testing environments for UAV agent interaction and active observation policy learning. Based on this dataset, we establish a comprehensive evaluation benchmark for AOD policy learning methods. Most existing AOD policies rely on Deep Reinforcement Learning (DRL) but suffer from poor generalization. Evaluations on our benchmark reveal a significant generalization gap between training and testing performance, highlighting an urgent need for solutions. To this end, we leverage the Joint Embedding Predictive Architecture (JEPA) to construct a world model that enhances state representation learning, and propose AOD-JEPA by incorporating AOD-specific prior knowledge. Extensive experiments validate its effectiveness and superiority. We hope ATRNet-LUDO and the benchmark will advance research in the UGAOD field. The dataset and code are soon available at https://github.com/Leo000ooo/LUDO_dataset.",https://arxiv.org/abs/2607.09078v1,"cs.CV, cs.RO"
2607.09060,Robotics,Dec-MARVEL: Decentralized Multi-Agent Exploration without Communication under Budget Constraints,"Janghyun Cho, Jimmy Chiun, Guillaume Sartoretti, Changjoo Nam",2026-07-10T03:06:08Z,"Multi-UAV exploration is often constrained by unreliable communication, limited field-of-view sensing (e.g., lightweight onboard camera), and finite travel budgets that require each robot to reserve enough budget to return to its base. We present Dec-MARVEL, a decentralized budget-aware exploration framework for communication-free teams with directional sensing. Rather than exchanging maps, goals, or messages, each robot coordinates through its incidental observations: any teammate trajectory within its field of view serves as a coordination signal. A graph-attention actor fuses local frontier geometry, teammate motion, and budget features to select return-feasible waypoint-heading actions. The actor is trained with phase-conditioned critics, a training-only task-oriented privileged critic, and a mixture-based budget curriculum. Across 900 held-out trials spanning three team sizes (2, 4, 8 robots) and three travel budgets (720, 800, 1024 meters) against four baselines, Dec-MARVEL achieves the highest or tied-highest exploration rate and lowest sensing overlap across all nine team-size budget configurations. Under our tightest 720m budget, it reaches 53%, 94%, and 100% success for 2, 4, and 8 robots, versus 37%, 83%, and 99% for the strongest baseline. Physical-robot experiments demonstrate successful sim-to-real transfer and real-world deployment of Dec-MARVEL.",https://arxiv.org/abs/2607.09060v1,cs.RO
2607.08974,Robotics,CLAP: Direct VLM-to-VLA Adaptation via Language-Action Grounding,"Yuri Ishitoya, Jeremy Siburian, Masashi Hamaya, Kuniaki Saito, Cristian C. Beltran-Hernandez, Mai Nishimura",2026-07-09T22:34:11Z,"Vision-language-action models (VLAs) inherit semantic capabilities from pretrained VLMs, yet large-scale post-training on robot data and architectural modifications can reshape the backbone so extensively that it becomes difficult to isolate what the VLM contributes to control. Directly converting pretrained VLMs into VLAs with minimal architectural change offers a more transparent path to understanding how VLM capabilities transfer across model scales. The core obstacle is output-distribution mismatch: predicting actions as bare numeric token sequences moves generation away from the VLM's pretrained language distribution, degrading the capabilities we seek to preserve. To address this, we propose CLAP (Causal Language-Action Prediction), which prepends each numeric action sequence with a natural-language action description, causally conditioning precise action-token prediction on a language-action plan without modifying the backbone architecture. With single-epoch fine-tuning alone, 2B CLAP achieves 90.8% on LIBERO (+14.9 pt over VLA-0) and improves robustness on LIBERO-PRO under language, object, and spatial perturbations. We will release CLAP at 0.8B, 2B, and 4B as an open-weight, multi-scale compact VLA family from a single VLM lineage, enabling controlled analysis of VLM-to-VLA capability transfer.",https://arxiv.org/abs/2607.08974v1,"cs.RO, cs.AI"
2607.08966,Robotics,Impedance-Guided Programmable Transmission of Localized Deformation in Modular Soft Metamaterials,"Weiyun Xu, Daewon Hong, Zhi Zhao, Rahul Dev Kundu, Xiaojia Shelly Zhang",2026-07-09T22:04:01Z,"Soft metamaterials provide a promising platform for robotics, biomedical devices, and flexible electronics. The localized mechanical responses by nonuniform excitation are ubiquitous in soft materials, yet their controlled transmission across assemblies remains largely overlooked in metamaterial design, which critically constrains nontrivial functionalities with end-to-end and long-range deformation transmission. Here, we introduce an impedance-guided design framework that enables programmable transmission of localized deformation in modular soft metamaterials, achieving behaviors unattainable by intuitive design. By establishing a nonlinear model considering position-dependent interactions and integrating the concept of mechanical impedance within metamaterials, we regulate assembly-level transmission solely through unit-cell topology optimization. The resulting framework enables effective synthesis of module families, allowing both homogeneous and heterogeneous assemblies to be custom-built with markedly enhanced transmission characteristics. Leveraging the highly combinatorial and extensible design space, we physically realize diverse on-demand displacement manipulation architectures, including obstacle-bypassing modular soft-metamaterial assemblies, defect-tolerant soft gripping, and embodied signal processing. Beyond deformation programming, the reconfigurability and reassemblability of these soft modules can embed electric logic signals, enabling energy-efficient and low-latency information processing through compliant-switch-controlled mechanical LED displays and wearable finger-motion-sensing controllers. Our method provides fundamental insights into localized deformation transmission in modular soft metamaterials and establishes a scalable route toward embodied-intelligence material systems, particularly for soft-metamaterial-centric actuation, sensing, and collective computing.",https://arxiv.org/abs/2607.08966v1,"cs.CE, cs.RO, math.OC"
2607.08948,Robotics,SplatCtrl: Perception-Action Coupling via Gaussian Scene Representations and Reactive Robot Control,"Siddarth Jain, Ho Jin Choi",2026-07-09T21:18:39Z,"Robotic manipulators excel in structured environments but face substantial challenges in unstructured and dynamic settings. This paper presents SplatCtrl, a unified framework for real-time scene reconstruction and reactive robot motion generation to enable collision-free robotic arm control in previously unseen and continuously changing environments. Building on 3D Gaussian Splatting (3D-GS), we introduce a hybrid voxel-based filtering and dynamic Gaussian relocation strategy that supports efficient scene reconstruction from RGB-D streams while accommodating environmental changes. For safe and reactive control, we further propose a method for deriving continuous signed distance functions from isotropic Gaussians, providing stable and differentiable collision probability estimates that bridge classical distance fields with the modern implicit representation. These continuous distance metrics are incorporated into control barrier functions, resulting in a unified perception-action coupling framework that supports smooth and reliable real-time motion generation in response to scene changes. Experimental validation in simulation, on physical robot, and within shared human-robot workspace demonstrates the framework's effectiveness, achieving integrated scene reconstruction and reactive control in uncertain, and dynamic environments.",https://arxiv.org/abs/2607.08948v1,"cs.RO, cs.CV"
2607.08942,Robotics,Adaptive MPPI with Online Disturbance Covariance Estimation: Provable Stability Tightening via Spatial Smoothing,"Hyung-Jin Yoon, Hunmin Kim",2026-07-09T21:12:40Z,"We study Model Predictive Path Integral (MPPI) control for nonlinear systems with additive process disturbances whose covariance is unknown, spatially varying, and slowly time-varying. A mismatched disturbance covariance produces a persistent penalty in closed-loop stability certificates, while online estimation can reduce this penalty as data are collected. We propose a cell-wise recursive covariance estimator with spatial diffusion and prove a finite-horizon error bound that separates stochastic-approximation error, spatial-smoothing bias, and temporal-drift effects. The diffusion kernel is chosen to be reversible with respect to the stationary visitation measure, making the diffusion operator dissipative in the weighted Lyapunov analysis. We then substitute the resulting covariance estimate into the MPPI sampling distribution and derive an adaptive stability certificate with an explicit learning penalty. The main result is a payoff theorem: after a computable crossover time, the adaptive controller achieves a strictly tighter certified stability bound than any fixed covariance choice whose mismatch exceeds the residual smoothing and drift allowance. Numerical experiments illustrate the estimator convergence and the resulting stability-tightening effect.",https://arxiv.org/abs/2607.08942v1,"eess.SY, cs.RO, math.OC"
2607.09572,Energy,A Cloud-Accessible Open-Source Framework for the Electromagnetic Modelling of Applied Superconductors,"Yusen Guo, Alberto Paganini, Harold S. Ruiz",2026-07-10T16:20:01Z,"We present the H-cloud formalism, a cloud-accessible and open-source finite-element framework for electromagnetic modelling of applied superconductors. The proposed method expresses the nonlinear electromagnetic response of type-II superconductors in a curl-conforming discretisation based on Nédélec finite elements, where the tangential applied-field boundary condition, nonlinear E-J power law, and fully implicit time-discrete residual are stated explicitly at the variational level, all within a scripted Python finite-element workflow. The weak form is used as the basis for forward simulation and for extension to adjoint differentiation and PDE-constrained optimisation, while keeping the governing assumptions, boundary conditions, and solver structure fully visible to the user. The implementation is realised in Firedrake with UFL and PETSc-backed nonlinear solvers, allowing the identical script to run on local machines and in browser-accessible environments such as Google Colab without reformulating the problem. The method is verified on the canonical magnetisation benchmark of a cylindrical superconductor under Bean-like penetration conditions and then benchmarked against an independently constructed COMSOL model for a practical high temperature superconducting Bi2212 wire. Across matched mesh studies, the open-source workflow reproduces the commercial-reference magnetisation loops to within approximately \(1\%\) , with relative peak errors below 1.5%, while cloud execution preserves the same numerical solution at rather modest additional runtime considering the use of (freely available) reduced hardware resources. The proposed framework provides a rigorous, reproducible, and portable route for superconducting simulation, benchmarking, and future optimisation-led modelling of applied and functional superconductors, shareable and executable into open cloud environments.",https://arxiv.org/abs/2607.09572v1,"cond-mat.supr-con, math-ph"
2607.09561,Energy,Delayed Arm Retraction Controls the Nonlinear Oscillatory Response of Long-Chain-Branched Polymer Melts,"Dario Nichetti, Alessio Zaccone",2026-07-10T16:05:27Z,"Long-chain branching profoundly modifies the nonlinear oscillatory response of entangled polymer melts by introducing arm-retraction pathways absent in linear polymers. We present a molecular tube theory that explains the characteristic maximum of the Nonlinearity Index (NLI) observed experimentally in long-chain-branched polymers. The theory extends the recently developed nonlinear tube-orientation description of linear polymers by incorporating branch-point force transmission and delayed arm retraction. The backbone initially develops nonlinear orientation as in the corresponding linear polymer, whereas long-arm retraction subsequently relaxes the stored branch-point tension and progressively erases backbone orientational memory. This competition produces a characteristic NLI maximum followed by a post-peak decay. The theory predicts two distinct nonlinear regimes corresponding to sparse and dense long-chain branching and introduces an architecture parameter governing the height and width of the nonlinear peak. The resulting framework provides a molecular interpretation of nonlinear Fourier rheology and directly links the nonlinear harmonic response to polymer architecture.",https://arxiv.org/abs/2607.09561v1,"cond-mat.soft, cond-mat.dis-nn, cond-mat.mtrl-sci, physics.chem-ph"
2607.09466,Energy,Unraveling atomic-resolution valence electron energy-loss spectroscopic imaging in a single-crystal CaNb2O6,"Sz-Chian Liou, Xiang-Lin Huang, Vladimir P. Oleshko, I-Ching Lin, Yin-Ping Lan, Hsin-An Chen, Guo-Jiun Shu",2026-07-10T14:40:57Z,"Despite advancements in electron optics and spectrometer design over the past twenty years, atomic-resolution valence-electron energy-loss spectroscopy imaging remains challenging due to the delocalization of inelastic electron scattering. In this study, we used an energy-filtered spectrometer equipped with a hybrid-pixel direct electron detector and spherical aberration-corrected scanning transmission electron microscopy to analyze many-electron excitations and interband transitions in a single-crystal calcium niobate, CaNb2O6, with spatial resolution ranging from the nanometers to the atomic scale. In the low-loss region above the bandgap at about 3.8 eV, we observed volume plasmons, around 6 eV and 15 eV energy loss, as well as a mix of strongly correlated plasmons and excitons, known as plexcitons, at approximately 7.3 eV energy loss. Additionally, we employed an on-axis EELS setup for atomic-resolution zero-loss peak (ZLP) imaging and visualized energy- and atom-resolved images of plexcitons and VPs, which showed contrast reversal relative to high-angle annular dark-field images. To investigate elastic contrast preservation, we also analyzed the effect of the collection angle and minimized its influence to produce delocalized VP images. In fact, the ZLP and VEELS images obtained using the weak-beam setup demonstrate that, in both cases, the contrast resembles Z-contrast. Moreover, we found that [NbO6] octahedra directly contributed to the lateral maps of interband transitions in the range from 3.2 eV to 3.5 eV energy loss. These findings demonstrate that Cs-STEM-EELS, which examines atomic-scale contrast associated with low-energy losses, can be a powerful tool for visualizing the structure, bonding, and electronic properties of complex crystalline nanostructures, including individual atomic sites, interstitial sites, and point defects.",https://arxiv.org/abs/2607.09466v1,cond-mat.mtrl-sci
2607.09437,Energy,Anisotropic Superconductivity with Enhanced Critical Field in Strained RuO2,"Younes Ghorbani, Samuel Poage, Xuehsi Gao, Luka Mitrovic, Neha Wadehra, Benjamin Gregory, Suchismita Sarker, Betul Pamuk, Andrej Singer, Darrell G. Schlom, Chun Ning Lau, Kaveh Ahadi",2026-07-10T14:06:43Z,"The superconductivity in RuO2 emerges under strain. RuO2 is also an altermagnet candidate. The nature of superconductivity and its relation with neighboring orders, however, are not understood. To address this problem, we grew epitaxial RuO2 films on TiO2(100) and TiO2(110) single crystal substrates and studied the electronic transport and emergent superconductivity along various crystallographic directions. We show that the superconducting transition strongly depends on the growth orientation and the crystallographic direction of the transport in the RuO2 films. We also observe a strong violation of Pauli paramagnetic limit with in-plane applied magnetic field which we attribute to strong spin-orbit scattering. These results offer opportunities for epitaxially engineered superconductors.",https://arxiv.org/abs/2607.09437v1,"cond-mat.supr-con, cond-mat.mtrl-sci"
2607.09425,Energy,Electronic manipulation of polar order in electron crystal,"Takashi Kikkawa, Ziyan Chen, Yuto Fujimoto, Takahiro Morimoto, Yuya Hirata, Hiroki Arisawa, Alexey A. Kaverzin, Satoshi Okamoto, Yoichi Okimoto, Naoshi Ikeda, Eiji Saitoh",2026-07-10T13:54:54Z,"When interaction among atoms or ions is strong enough, they often arrange periodically, forming a crystal. The arrangement patterns of atoms or ions can encode information, a concept that has enabled devices such as ferroelectric memories. It has been found that not only atoms or ions but also electrons in condensed matter can crystallize when Coulomb interaction is strong enough. Typical examples are charge-ordered states in solids, where different valences, or different electron numbers, of an ion spontaneously form a spatial pattern on the lattice. In such electron crystals, information is expected to be encoded into the electron-ordering patterns. Here, we demonstrate electronic manipulation and readout of charge-ordering directions in a paramagnetic semiconductor LuFe$_2$O$_4$. By applying current pulses at room temperature, we observed that the non-reciprocal resistivity of LuFe$_2$O$_4$ is modulated along with a sign reversal, which disappears above the charge-ordering temperature. A numerical calculation incorporating inter-band Berry curvature affected by the charge ordering is consistent with the experimental results. By applying the observed phenomenon, we also demonstrate a non-reciprocal resistance memory operation in the charge-ordered LuFe$_2$O$_4$. This result opens the door to realizing charge-ordering electronics.",https://arxiv.org/abs/2607.09425v1,cond-mat.mtrl-sci
