id,domain,title,authors,published,abstract,url,categories
2607.09662,Health,PHINN-EEG: Topological Time-Series Analysis of Dream-State EEG -- Dynamic Betti Curves for Dream Content Classification and Topology-Conditioned Neural Signal Synthesis,"Ren Takahashi, Emre Yusuf, Jayabrata Bhaduri",2026-07-10T17:59:45Z,"Current electroencephalography (EEG)-based dream detection relies on power spectral density (PSD) and statistical moment features, achieving a state-of-the-art area under the receiver operating characteristic curve (AUC) of approximately 0.70 on the DREAM database (Wong et al., 2025, Nature Communications). We introduce PHINN-EEG (Persistent Homology Inspired Neural Network for EEG), the first topological time-series framework for dream mentation analysis. Using sliding-window Takens delay embeddings and Vietoris-Rips filtrations on multichannel pre-awakening EEG epochs, we extract Dynamic Betti Curves that characterize the geometric architecture of neural activity, not merely its energy. These topological invariants, combined with topology-conditioned flow matching, are analytically projected to outperform existing PSD and catch22 benchmarks, targeting AUC = 0.82-0.90 on the 1,462-awakening open-access subset of the DREAM database (drawn from a full registry of 3,191 total awakenings from 263 participants across 20 independent laboratories). We further introduce a topology-conditioned rectified flow model for dream-state EEG synthesis-with a spectral-conditioned flow model of comparable feature dimensionality as an additional ablation baseline to isolate the value of topological conditioning specifically-and propose a set of candidate Betti transition archetypes linking topology to phenomenological dream report categories, presented as an exploratory hypothesis space pending empirical validation. If validated, this work represents a paradigm shift from spectral energy to phase-space geometry in neural rare-event detection, with potential future implications for wearable BCI dream monitoring.",https://arxiv.org/abs/2607.09662v1,"q-bio.NC, cs.AI, cs.LG, eess.SP, math.AT"
2607.09657,AI,Scalable Visual Pretraining for Language Intelligence,"Yiming Zhang, Zhonghan Zhao, Wenwei Zhang, Haiteng Zhao, Tianyang Lin, Yunhua Zhou, Demin Song, Kuikun Liu, Haochen Ye, Haian Huang, Yuzhe Gu, Haijun Lv, Qipeng Guo, Bin Liu, Gaoang Wang, Kai Chen",2026-07-10T17:57:03Z,"The rapid progress of large foundation models has been driven predominantly by pretraining on large-scale text corpora. However, many forms of knowledge are conveyed through visual representations, where figures, typeset equations, and page layouts carry rich information that cannot be faithfully or completely captured by text alone. Yet current pretraining approaches discard these visual cues by converting visually rich sources, such as documents and web pages, into plain text for learning language intelligence. This paper challenges the default assumption that language models must be trained on text-only representations and shows that Visual Pretraining is a scalable learner for foundation model intelligence. To this end, we conduct a systematic study of unsupervised visual pretraining paradigms that directly leverage visual documents without text extraction. Across multiple backbones and benchmarks, visual pretraining on the same underlying corpora consistently outperforms text-only pretraining, offering an efficient pathway to scalable language intelligence.",https://arxiv.org/abs/2607.09657v1,"cs.CV, cs.AI, cs.MM"
2607.09654,AI,Evolution of Accuracy and Visual-Cognitive Errors in a Decade of Vision-Language AI Models,"Shravan Murlidaran, Miguel P. Eckstein",2026-07-10T17:53:37Z,"Vision language models (VLMs) have made remarkable progress in visual reasoning during the last decade. Most evaluations have used simple scenes (MS-COCO) that do not showcase complex human interactions or behaviors, only a handful of non-curated human descriptions as a benchmark, and have not focused on understanding the model's error types. Here, we introduce the Complex Social Behavior (CSB) dataset, containing 100 images depicting complex social interactions/behaviors. We analyze the progression of scene descriptions over a decade (2017-2025) of VLMs (four pre-Multimodal Large Language Models, MLLMs, and five MLLMs). We evaluate the accuracy of the models and 20 human descriptions relative to a gold standard on the CSB dataset and on a sample from MS-COCO. We analyzed five visual-cognitive error types: object detection, recognition, hallucination, scene understanding, and spatial dependence. The CSB dataset showed a more pronounced improvement than MS-COCO in scene description accuracy, with pre-MLLMs achieving much lower accuracy than the bottom-ranked human descriptions and MLLMs attaining accuracies similar to the top-ranked human descriptions. We show that MLLMs have eliminated the gap in scene description accuracy between simpler MS-COCO scenes and scenes depicting complex behaviors (CSB). MLLMs have almost eliminated all error types in our tested datasets, except for occasionally relying on different image regions for scene descriptions than humans do (spatial dependence error). We also show that detection, recognition, and hallucination errors have the highest impact on scene description accuracy. Together, our findings provide a more thorough evaluation of how visual language models have advanced over the last decade.",https://arxiv.org/abs/2607.09654v1,"cs.CV, cs.AI"
2607.09653,AI,VEXAIoT: Autonomous IoT Vulnerability EXploitation using AI Agents,"Katherine Swinea, Kshitiz Aryal, Lopamudra Praharaj, Maanak Gupta",2026-07-10T17:52:29Z,"Internet of Things (IoT) systems are inherently vulnerable due to constrained hardware, outdated firmware, and insecure default configurations, creating a need for scalable and adaptive security testing approaches. While recent adoptions of Large Language Model (LLM) agents have demonstrated promise in penetration testing and Capture-the-Flag (CTF) environments, their application to IoT specific vulnerabilities remains unexplored. This paper presents an autonomous multi-agent framework, referred to as Vulnerability EXploitation using AI Agents (VEXAIoT), for vulnerability discovery and exploitation in IoT environments using LLM-based reasoning and offensive security tools. The framework combines a vulnerability detection agent and an attack execution agent to perform reconnaissance, plan attack sequences, and execute exploits against vulnerable IoT services. The system is evaluated in IoTGoat and Metasploitable environments across ten attack scenarios mapped to OWASP IoT vulnerabilities. Experimental results show attack success rate of up to 100% with low token overhead and average execution times under two minutes for most attacks. Across 260 attack executions, VEXAIoT achieves a 95.0% overall success rate, including 94.5% success in IoTGoat and 96.7% success in Metasploitable2. These results demonstrate the potential for LLM-driven agents to automate IoT vulnerability assessment and offensive security workflows in controlled environments",https://arxiv.org/abs/2607.09653v1,"cs.CR, cs.AI"
2607.09649,AI,ConceptSMILE: Auditing the Trustworthiness of Concept-Based Explainable AI,"Mohadeseh Mollapour, Koorosh Aslansefat, Zeinab Dehghani, Bhupesh Kumar Mishra, Tejal Shah, Zhibao Mian",2026-07-10T17:47:38Z,"Concept-based explainable artificial intelligence (AI) can make model reasoning more human-understandable, but concept-level outputs are not automatically trustworthy. We introduce ConceptSMILE, a model-agnostic perturbation-based auditing framework for evaluating the reliability of concept-based explanations. Rather than replacing SMILE, ConceptSMILE extends its perturbation-based logic from feature- or region-level attribution to the auditing of human-understandable concept explanations. The framework perturbs input regions, measures concept-response shifts, applies locality weighting, and fits an XGBoost surrogate to approximate local concept behaviour. Reliability is assessed through attribution accuracy, surrogate fidelity, faithfulness, stability, and consistency. We evaluate ConceptSMILE on retinal fundus images by comparing MedSAM-derived visual concepts with VLM-based semantic concepts. Results show that reliability varies across concepts and pathways: MedSAM achieves stronger spatial attribution and the highest surrogate fidelity ($R^2 = 0.8503$, $R_w^2 = 0.8465$), while the VLM pathway shows stronger vessel faithfulness and stronger stability under selected artefact conditions. ConceptSMILE provides an independent audit layer for evaluating the trustworthiness of concept-based XAI.",https://arxiv.org/abs/2607.09649v1,cs.AI
2607.09645,AI,Deep Gaussian Processes on Directed Acyclic Graphs,"Federico L. Perlino, Oliver Hamelijnck, Adam M. Johansen, Theodoros Damoulas",2026-07-10T17:41:11Z,"Many real-world processes can be represented as compositions of functions along a directed acyclic graph (DAG). In causal modelling, these correspond to the underlying mechanisms; in engineering, to multiple fidelity levels; and in gene-regulatory networks, to transcription factors. These functions are partially observed across the DAG, with noisy and heterogeneously sampled measurements, posing significant challenges for reconstruction, uncertainty propagation, and inference. To tackle these challenges, we place priors over functions and naturally arrive at Deep Gaussian Processes over DAGs. We theoretically study their prior-collapse behaviour, and the effect of graph topology and intermediate observations on the preservation of information. We obtain almost-sure lower bounds on the asymptotic frequency of depths at which the distinction between inputs is preserved, identify broad kernel classes for which these hold, and prove an observation by \cite{dunlop2018} on the role of input connections. We offer a structured variational approximation that retains graph dependencies, preserves compositional uncertainty, and captures the explaining-away behaviour of colliders. Finally, we empirically validate our theoretical results and our methodology, and model a latent-collider DAG, a protein signalling network, and a multi-fidelity heavy-ion collision emulation task, attaining state-of-the-art performance while recovering low-fidelity contributions and yielding interpretability of the simulator hierarchy.",https://arxiv.org/abs/2607.09645v1,"stat.ML, cs.LG, math.ST, stat.CO, stat.ME"
2607.09641,AI,Semantic Pareto-DQN: A Multi-Objective Reinforcement Learning Framework for Financial Anomaly Detection,"Cláudio Lúcio do Val Lopes, Lucca Machado da Silva",2026-07-10T17:39:00Z,"Financial anomaly detection suffers from extreme class imbalance, causing traditional single-objective algorithms to exhibit ``fraud collapse'', defaulting to the majority class and failing to balance anomaly interdiction with customer friction. To overcome this without distortive data resampling, we propose the Semantic Pareto-DQN, a multi-objective reinforcement learning framework. Our approach synthesizes heterogeneous transaction features into cohesive natural-language narratives, encoded by large language models, thereby producing a robust, scale-invariant state representation. The agent optimizes a vectorial reward that explicitly decouples financial efficacy, operational friction, and semantic discovery. By mapping the continuous Pareto frontier, the system dynamically navigates the asymmetric costs of missed anomalies versus false positives. Empirical evaluations across E-Commerce fraud and UCI Credit datasets show that semantic Pareto-DQN successfully shatters the zero-recall trap. It achieves superior minority-class recall compared to scalarized baselines, providing an alternative to trade bounded operational friction for financial anomaly discovery.",https://arxiv.org/abs/2607.09641v1,"cs.LG, cs.AI"
2607.09632,Quantum,Lean-QIT: Towards a Formal Infrastructure for Quantum Information Theory,"Chengkai Zhu, Ziao Tang, Guocheng Zhen, Yimeng Cao, Yusheng Zhao, Ranyiliu Chen, Xuanqiang Zhao, Lei Zhang, Xin Wang",2026-07-10T17:28:26Z,"Quantum information theory (QIT) characterizes the capabilities and fundamental limits of quantum information processing, underpinning quantum communication, computation, and error correction. Formalizing its coding theorems requires connecting finite-block protocols, analytic inequalities, and asymptotic limits within a unified machine-checked framework. Existing developments, however, lack a reusable operational layer that defines codes, error criteria, achievable rates, and capacities independently of their information-theoretic characterizations. In this work, we present LeanQIT, a Lean 4 library for finite-dimensional QIT. It provides composable, kernel-checked interfaces for quantum states and channels, source and channel codes, finite-block performance criteria, hypothesis testing, one-shot quantities, and asymptotic rate constructions. Using this infrastructure, we formalize Schumacher's quantum source-coding theorem, the Holevo--Schumacher--Westmoreland classical-capacity theorem, and the entanglement-assisted classical-capacity theorem together with its strong converse. By separating operational definitions from analytic characterizations and exposing reusable achievability, converse, and asymptotic components, Lean-QIT provides a machine-readable foundation for formal QIT and a compositional knowledge substrate for emerging AI-assisted formalization, automated proof search, and agentic reasoning in quantum information and computation.",https://arxiv.org/abs/2607.09632v1,"quant-ph, cs.AI"
2607.09629,AI,4DR360: State Reasoning for Joint 3D Detection and Occupancy Prediction in 4D Radar-Camera Full-Scene Perception,"Xiaokai Bai, Lianqing Zheng, Runwei Guan, Songkai Wang, Siyuan Cao, Hui-liang Shen",2026-07-10T17:26:19Z,"Reliable autonomous driving requires full-scene perception that couples foreground objects with dense semantic layout. Recently, 4D millimeter-wave radar has emerged as a robust and affordable sensor, yet its sparse returns make radar-camera fusion necessary for comprehensive scene understanding. Existing radar-camera methods mainly optimize detection, while dual-task systems usually decode boxes and occupancy with limited interaction. To address this gap and advance radar-based multi-task learning, we propose \method, a 4D radar-camera framework for 360$^\circ$ full-scene perception, which models semantic occupancy as a persistent scene state rather than a terminal output. \method{} follows a cross-modal state reasoning paradigm, where the occupancy state is modeled and propagated through stages for coarse-to-fine feature aggregation. Specifically, State-guided BEV Enhancement (SBE) strengthens intra-frame BEV representation, while Doppler-guided Temporal Fusion (DTF) preserves state evidence over longer temporal horizons. Beyond the model, we further extend ManTruckScenes with satellite-map-based generated occupancy labels and pair it with OmniHD-Scenes in a unified cross-dataset detection-and-occupancy protocol. The resulting experiments cover accuracy, robustness, ablation, and efficiency under one radar-camera multi-task evaluation framework. Code and labels will be released upon acceptance.",https://arxiv.org/abs/2607.09629v1,"cs.CV, cs.AI"
2607.09623,AI,Task-Specific Multimodal Question Answering Agents via Confidence Calibration and Incremental Reasoning for QANTA 2026,"Nirjhar Das, Md. Al-Mamun Provath",2026-07-10T17:22:49Z,"We present our submission to the QANTA 2026 shared challenge at the ICML 2026 Workshop on Efficient Multimodal Question Answering (EMM-QA). Quanta evaluates multimodal quizbowl systems that answer pyramid-style questions from incrementally revealed text and accompanying images while operating under realistic efficiency constraints. The challenge consists of two distinct tasks: Tossup questions, which require deciding when to answer under uncertainty, and Bonus questions, which emphasize accurate answer selection and human adoption. To address these differing objectives, we develop a task-specific two-agent architecture. Our Tossup agent utilizes a GPT-4o-mini-class model (referred to as GPT-4.1-mini in the competition logs) with confidence-calibrated answering and a domain-specific numeric reasoning policy that reduces overconfident predictions from isolated quantitative clues. Our Bonus agent uses GPT-4o-class model (referred to as GPT-4.1) with leadin-aware reasoning, structured relational reasoning, and multimodal evidence integration to improve exact answer selection. Rather than relying on a retrieval pipeline or model ensembles, our approach emphasizes efficient reasoning policies and confidence calibration within a hosted-only environment. Our system achieved the highest overall leaderboard score of 0.402, including a Tossup score of 0.238 and a Bonus Effect score of 0.164. The results demonstrate that lightweight, task-specific reasoning strategies can provide strong performance on resource-constrained multimodal question answering benchmarks.",https://arxiv.org/abs/2607.09623v1,"cs.CL, cs.AI"
2607.09616,AI,LLM for EDA in Front-End Design: Challenges and Opportunities,"Kangwei Xu, Bing Li, Ulf Schlichtmann",2026-07-10T17:15:54Z,"As chip complexity increases and time-to-market pressures grow, front-end design has become a critical bottleneck in chip development. Recently, Large Language Models (LLMs) have shown great potential in Electronic Design Automation (EDA). Beyond specification understanding, LLMs show the potential to serve as a unified intelligent interface for hardware description language (HDL) generation, testbench construction, and design space exploration. The rise of agentic AI, represented by pioneering systems such as OpenClaw, offers a strategic roadmap for the next generation EDA. From this perspective, this paper discusses the evolution of EDA from localized assistance to autonomous agentic execution. Then, we review representative advances of LLMs in front-end design, focusing on key tasks such as circuit and testbench generation from a shared specification, as well as design quality improvement in established workflows such as high-level synthesis. Finally, we discuss the key challenges and limitations of integrating LLMs into EDA, and outline future opportunities for advancing LLM-enabled front-end design, offering a systematic perspective for researchers interested in leveraging agentic AI technologies for EDA.",https://arxiv.org/abs/2607.09616v1,"cs.ET, cs.AR, cs.LG, eess.SY"
2607.09611,AI,Toward Real-Time Sentence-Level Sign Language Translation,Thanh-Hoang Nguyen Doan,2026-07-10T17:11:03Z,"Most sign language understanding systems operate at the level of isolated signs, limiting their usefulness in natural communication. We study sentence-level sign language translation (SLT) with the primary goal of real-time deployment rather than proposing a new translation architecture. We fine-tune a SHuBERT-ByT5 translation stack on a uniformly sampled 9,872-example subset of How2Sign, selected because of compute and storage constraints, using QLoRA while keeping SHuBERT frozen. The model obtains a validation BLEU of 16.7 and, on the test split, BLEU 15.9 and BLEURT 44.7. The main contribution is a hardware-aware streaming system: a Raspberry Pi 4B reference client provides camera capture, local text display, and speech output, while compute-intensive perception and translation run on a CPU/GPU backend. The capture protocol remains client-agnostic, so the same backend can serve a browser, phone, or laptop. Chunked ingestion, bounded queues, parallelized perception, temporal reordering, and a sentence-boundary state machine reduce mean post-finalization response latency from 1.873 to 1.354 seconds (27.71%) and P95 latency from 2.919 to 2.130 seconds (27.03%) over the complete 9,872-example working subset.",https://arxiv.org/abs/2607.09611v1,cs.CL
2607.09600,AI,Agora: Enhancing LLM Agent Reasoning Via Auction-Based Task Allocation,"Kaiji Zhou, Ales Leonardis, Yue Feng",2026-07-10T16:54:52Z,"Enhancing the reasoning capabilities of large language model (LLM) agents requires effective orchestration of diverse expert models and tools. However, existing frameworks typically call APIs based on coarse-grained matching between tasks and the functions of expert models or tools, while overlooking critical factors such as performance variability and cost efficiency among functionally similar alternatives. To address this, we propose Agora, a framework that introduces an incentive-compatible auction mechanism for dynamically allocating tasks to expert models and tools. By treating reasoning steps as tradeable items, Agora enables agents to bid based on their rectified competence-ensuring that critical logic is routed to the most capable solver rather than the most overconfident one. Evaluations across five benchmarks show that Agora improves over matched single-model, routing, and cascade baselines under comparable candidate pools, while exposing a controllable cost-quality trade-off through a single auction parameter.",https://arxiv.org/abs/2607.09600v1,"cs.AI, cs.CL"
2607.09598,AI,Tokenizer Transplantation: Mitigating Autoregressive Collapse in Edge-Efficient Bengali ASR,"Sanjid Hasan, Md. Abdur Rahman",2026-07-10T16:54:38Z,"Lightweight speech recognition models are critical for edge deployment, yet highly optimized architectures like Moonshine often fail on morphologically rich, non-Latin languages such as Bengali. This study identifies the root cause of this failure as the model's English-centric byte-level tokenizer, which fragments Bengali words into high-fertility byte chains and triggers catastrophic autoregressive collapse during inference. To resolve this, a novel vocabulary transplantation pipeline is proposed to replace the decoder vocabulary with the native-script BanglaBERT WordPiece vocabulary and resize the corresponding token embedding matrix. Experimental results demonstrate a reduction in token fertility from 9.16 to 1.30. By decreasing autoregressive sequence length by 85.8%, decoding instability is entirely mitigated. When evaluated on the 882-hour Lipi-Ghor dataset, the modified architecture achieves a competitive 21.54% Word Error Rate (WER) and a Real-Time Factor (RTF) of 0.0053. Ultimately, this research provides a scalable, reproducible blueprint for cross-script adaptation of compact ASR models without the need for resource-intensive pre-training.",https://arxiv.org/abs/2607.09598v1,cs.CL
2607.09590,Robotics,PAC-ACT: Post-training Actor-Critic for Action Chunking Transformers,"Yujie Pang, Zudong Li",2026-07-10T16:42:17Z,"Precision industrial contact manipulation requires reliable robot policies under pose perturbations and contact-force constraints. Vision-language-action models offer broad generalization but often introduce high inference latency and GPU-memory cost, while vision-action chunking policies are more suitable for real-time industrial control. However, these policies are usually trained by behavior cloning and suffer from distribution shift in contact-rich tasks. This paper proposes PAC-ACT, a reinforcement-learning post-training framework for pretrained Action Chunking Transformer policies. PAC-ACT reformulates policy optimization at the chunk level, constructs an ACT-transferred actor-critic architecture, and introduces a hybrid behavior-prior constraint to preserve the pretrained action distribution during online fine-tuning. Experiments on industrial precision-contact benchmarks show that PAC-ACT improves task success, contact stability, and force safety while retaining low latency and low GPU-memory usage. On the Contour task, PAC-ACT significantly reduces peak contact force and decreases the proportion of force readings above 60 N by 46 times. Sparse-reward ablations further show that the proposed behavior-prior constraint enables effective exploration under randomized initial poses.",https://arxiv.org/abs/2607.09590v1,"cs.RO, cs.AI"
2607.09586,AI,TrustX Agent Risk Classification Framework (ARC): Risk-Tiering Internally Created Agentic AI Systems,"Hannah M. Liu, Rhea Saxena, Shiv Asthana",2026-07-10T16:36:44Z,"The proliferation of agentic AI systems across enterprise and public-sector contexts has outpaced the capacity of general-purpose AI risk frameworks to classify and govern them. In this paper, we introduce the TrustX Agent Risk Classification Framework, a structured, repeatable instrument that can be applied to seven types of agentic AI systems and is grounded in foundational pre-existing AI governance frameworks. At the core of the framework is a twelve-dimension scoring rubric that robustly quantifies the risk. This rubric is combined with other components, such as the GPA + IAT classification model and the five-level autonomy framework derived from existing literature. These inputs produce a three-tier governance output with mapped control recommendations. A specialised Coding Assistant extension is also included to account for nuances specific to this type of agentic AI system. We then use an illustrative example to show our framework in practice. ARC is intended for AI governance practitioners, risk officers, developers, and regulators, and it will regularly undergo iteration as we continue to expand it and make it more robust. The community can access the interactive framework here: https://arc.responsible.ai/",https://arxiv.org/abs/2607.09586v1,cs.AI
