id,domain,title,authors,published,abstract,url,categories
2606.18640,AI,MetaboNet-Bench: A Multi-modal Benchmark for Glucose Forecasting in Type 1 Diabetes,"Nathaniel Jeffries, Miriam Wolff, Sam Royston, Elizabeth Healey, Caleb Mayer, David Klonoff, Michael Snyder, Tao Wang",2026-06-17T03:25:41Z,"Glucose forecasting algorithms are an important aspect of glycemic control management in type 1 diabetes. So far, the research community has developed numerous algorithms and models for forecasting. However, it is well-recognized that the lack of standardized model performance evaluation benchmarks makes fair comparison difficult and hinders further innovation, and thus benchmark standardization is in urgent need. Furthermore, many published glucose forecasting algorithms are limited to CGM data alone, ignoring other multimodal signals such as insulin dosing and carbohydrate intake. Here, we introduce MetaboNet-Bench, a benchmark for multimodal glucose forecasting for patients with type 1 diabetes that provides an extensible open-source evaluation framework for comparison of glucose forecasting algorithms that leverage glucose, insulin, and carbohydrate data. We then demonstrate its utility by benchmarking several recently published glucose forecasting models and a custom multimodal time-series model, representing different model architectures. The results show that the benefit of adding data modalities is conditioned on the complexity of the model and that incorporating more clinical metrics helps identify meaningful gaps to fill for future research.",https://arxiv.org/abs/2606.18640v1,"cs.LG, q-bio.QM"
2606.18575,Bio,Adaptive COVID-19 Trajectory Forecasting Using MAB-Inspired Ensemble Weighting,"Hamed Karami, Javier Redondo Anton, Geunsoo Jang, K. Selcuk Candan, Gerardo Chowell",2026-06-17T00:55:39Z,"Forecasting epidemic trajectories is important for public health decision-making, but no single model is consistently reliable across epidemic phases and forecasting settings. We evaluate Multi-Armed Bandit (MAB)-inspired adaptive weighting strategies for combining epidemic forecasting models when component-model performance changes over time. Using U.S. COVID-19 incidence data from three epidemic waves, we compare UCB, EXP3, and epsilon-greedy weighting rules under fixed short-window and growing calibration windows, with both deterministic and stochastic ensemble variants. The model pool includes SIR, SEIR, GLM, Gompertz, Richards, ARIMA, random walk with drift, simple exponential smoothing, Holt's linear trend method, and exponential growth. Adaptive ensembles are compared with individual models and with naive, unweighted, and inverse-WIS weighted ensemble benchmarks. Forecast performance is assessed using RMSE, weighted interval score (WIS), 95% prediction-interval coverage, and mean 95% prediction-interval width. Across waves, calibration windows, and forecast horizons, EXP3Stoch, EXP3Det, and EPSStoch achieved the lowest mean forecast WIS. The main gains were in probabilistic forecast quality, especially WIS and interval coverage, rather than uniformly lower point forecast error. Simple benchmarks, including the unweighted and inverse-WIS ensembles, remained competitive in several settings. These results suggest that MAB-inspired adaptive weighting is a useful complementary tool for epidemic forecasting, especially when model skill is time-varying and forecast uncertainty is substantial.",https://arxiv.org/abs/2606.18575v1,q-bio.QM
2606.18523,Bio,DART: A design-aware microfluidic chip paradigm for real-time live-cell image analysis,"Johannes Seiffarth, Matthias Pesch, Lukas Scholtes, Dietrich Kohlheyer, Hanno Scharr, Katharina Nöh",2026-06-16T22:38:19Z,"High-throughput microfluidic live-cell imaging generates rich single-cell data. Yet semi-automated procedures for locating regions of interest (RoIs), each containing one cell population, and removing surrounding microfluidic structures from recorded images, scale with the number of RoIs. This prevents real-time image analysis and delays time-to-insight by hours to days. We introduce the Design-Aware and Real-Time capable (DART) paradigm for microfluidic cultivation chips, which aligns the CAD blueprint with the physical chip and thereby enables throughput-independent localization of all RoIs and fully automated image processing across diverse RoI geometries and chip layouts. DART establishes this alignment through embedded fiducial markers and deep-learning-based marker detection. We validate DART using the Swiss Army Knife chip, which combines eight structurally distinct RoI designs across 1164 RoI locations. DART localizes all RoIs in five minutes, removes microfluidic structures from raw microscopy images in 40 ms, and performs fully automated image analysis, including cell segmentation, in under 1.1 s per image. Together, these capabilities establish DART as an end-to-end hardware-software paradigm with real-time-capable analysis that paves the way toward closed-loop and outcome-driven smart microscopy.",https://arxiv.org/abs/2606.18523v1,"q-bio.QM, cs.CV"
2606.18495,Bio,Bayesian Sampling of Structural Ensembles: The Role of Ensemble-Counting Measures,"Ivan Gilardoni, Giovanni Bussi",2026-06-16T21:08:15Z,"Structural ensemble refinement is widely used to integrate molecular simulations with experimental measurements. While most applications focus on the maximum-a-posteriori (MAP) ensemble, Bayesian sampling of the posterior distribution can provide uncertainty estimates and posterior averages for arbitrary observables. A notable step in this direction was introduced by the Bayesian Energy Landscape Tilting (BELT) framework, where sampling is performed on a family of maximum-entropy ensembles parametrized by Lagrange multipliers. Here, we show that Bayesian sampling in this setting requires an explicit choice of ensemble-counting measure. In particular, the flat measure in Lagrange-multiplier space used in the original BELT formulation leads to a posterior distribution that is formally non-normalizable for finite reference trajectories. We propose the Jeffreys measure as an invariant ensemble-counting prescription, restoring normalizability in the finite-sample situations considered here, and providing a consistent definition of posterior averages. Using both an analytically tractable Gaussian model and maximum-entropy refinement of RNA oligomer simulations, we compare different ensemble-counting measures and show that they can significantly affect Bayesian estimates. The resulting methodology has been implemented in the \texttt{MDRefine} software package.",https://arxiv.org/abs/2606.18495v1,"physics.chem-ph, physics.bio-ph, physics.comp-ph, q-bio.BM"
2606.18420,AI,Measurement noise limits the advantage of nonlinear models over linear models in biomedical prediction,"Marc-Andre Schulz, Kerstin Ritter",2026-06-16T19:15:08Z,"On biomedical tabular data, flexible models such as deep networks, gradient-boosted trees, and kernel methods are repeatedly matched or beaten by linear and logistic regression given the same features. The usual reaction is to treat this as a model-side shortfall, to be fixed with more data, a better architecture, or tuning, on the assumption that the nonlinear structure is there and the model has failed to capture it. We argue that these fixes cannot help when the binding limit is the measurement rather than the model, as it frequently is in biomedicine. Additive noise blurs the population-optimal predictor, and because blurring removes a function's fine, rapidly varying detail before its broad shape, it erases nonlinear structure faster than linear structure. A degree-$k$ interaction is attenuated by the $k$-th power of feature reliability, while the linear part is attenuated only once. At the reliabilities typical of biomedical measurement, the nonlinear advantage can vanish even when the underlying biology is strongly nonlinear, and what the noise removes cannot be recovered by a larger cohort or a more flexible model, only by better measurement. The nonlinearity is hidden, not absent, and a tie between linear and flexible models is not by itself a verdict on the biology. These pieces are classical, drawn from measurement-error statistics, psychometrics, and Gaussian analysis, and we assemble them into an exact excess-risk identity. Measurement reliability is one of three conditions, alongside sample size and feature representation, that must align for a flexible model to help, and together they leave only a narrow window that most biomedical tasks fall outside. Across 140 UK Biobank tasks, the gap between flexible and linear models, where it exists, carries the predicted noise signature, and the three conditions can be separated by intervention but not by a benchmark alone.",https://arxiv.org/abs/2606.18420v1,"cs.LG, q-bio.QM, stat.ML"
2606.18390,AI,MOLAR: Learning Multimodal Molecular Representations from Noisy Labels,"Yingxu Wang, Kunyu Zhang, Nan Yin, Yu Li, Eran Segal",2026-06-16T18:35:13Z,"Motivation: Noisy labels are a common challenge in molecular property prediction because molecular annotations are often obtained from assays, curated databases, or weak annotation pipelines rather than directly observed clean biological states. Treating recorded labels as reliable supervision can cause models to memorize corrupted observations and learn misleading molecular evidence. In multimodal molecular representation learning, this issue can be amplified by graph-text fusion or alignment, which may propagate label-induced errors across modalities. Results: We propose MOLAR, a noise-aware framework for learning multimodal molecular representations from noisy labels. MOLAR separates latent clean-property inference from recorded-label observation: graph and text views contribute residual evidence to a clean-property distribution, and a categorical label-observation channel maps this distribution to recorded labels for training. This formulation derives posterior label reliability and modality-specific molecular evidence from the model. Experiments on naturally noisy molecular benchmarks and controlled label-flipping benchmarks show that MOLAR consistently outperforms representative baselines. Visualization analyses further show that MOLAR provides interpretable reliability and modality-evidence diagnostics.",https://arxiv.org/abs/2606.18390v1,"cs.LG, q-bio.QM"
2606.18179,Bio,PyPeakRankR: Reproducible Peak-Level Feature Extraction for Regulatory Element Ranking,"Saroja Somasundaram, Nelson J. Johansen, Trygve E. Bakken, Jeremy A. Miller",2026-06-16T17:12:31Z,"High-throughput chromatin accessibility assays such as ATAC-seq generate thousands of candidate regulatory elements (peaks), yet no standardized tool exists for assembling the diverse quantitative features needed to prioritize peaks for functional validation. Here we present PyPeakRankR, an open-source Python package that extracts peak-level features, namely BigWig signal summaries, GC content, PhyloP conservation scores, distribution moments (kurtosis, skewness, bimodality), and cell-type specificity rankings, into a single reproducible peak by feature matrix stored as a tab-separated values (TSV) file. PyPeakRankR separates deterministic feature extraction from downstream ranking, enabling transparent benchmarking of prioritization strategies on the same upstream data. The package provides both a command-line interface and a matching Python API, supports cross-assembly scoring via liftOver, and runs in minutes on thousands of peaks. PyPeakRankR was validated in the Brain Initiative Cell Census Network (BICCN) community challenge, where its predecessor PeakRankR ranked among the top 3 of 16 methods for cell-type specific enhancer prediction. In a recent basal ganglia study, PyPeakRankR was used within the Cross-species Enhancer Ranking Pipeline (CERP) to identify enhancer-AAV tools achieving greater than 70% on-target specificity across cell types. PyPeakRankR is freely available under the MIT license at https://github.com/AllenInstitute/PeakRankR/tree/python-package.",https://arxiv.org/abs/2606.18179v1,q-bio.GN
2606.18058,Bio,Multiscale reconstruction of protein conformations from cryo-EM images,"David Y. W. Thong, Ozan Öktem, Joakim Andén",2026-06-16T15:35:31Z,"We present a novel multiscale algorithm for directly recovering the atomic model structure of a protein from single-particle cryo-EM data. Our algorithm is able to estimate protein structures to state-of-the-art accuracy for high-noise and low-contrast data. It is also robust to misspecifications in the TEM image formation model. These desirable properties are primarily due to the use of an explicit representation of the protein backbone in terms of bonds, torsion angles and bond angles, which supplies rich prior information to the structure recovery process. We apply our method on three protein cryo-EM datasets, generated using an electron microscope digital twin, and show that using a multiscale approach yields an improvement of the root-mean-square deviation (RMSD) and template modelling (TM) scores with respect to the ground truth. Furthermore, there is evidence that larger-scale structures are being prioritised with the multiscale algorithm, which reduces the possibility of convergence to bad local minima.",https://arxiv.org/abs/2606.18058v1,"eess.IV, q-bio.QM"
2606.17668,AI,ASTEROID: A Spatiotemporal Information Transformer for Forecasting Multi-Step Time Series of Molecular Dynamics,"Kexin Wu, Luonan Chen, Renxiao Wang",2026-06-16T08:30:27Z,"Molecular dynamics (MD) simulation is computationally demanding, particularly for large-scale systems requiring long-term analysis. Accurate forecast of the outcomes of a MD simulation is not only an attractive scientific challenge but also has substantial practical value. In this work, we developed a data-driven framework, termed ASTEROID (Advanced Spatiotemporal TransformER fOr Inferring Dynamics), that can directly predict multi-step atomic coordinates, avoiding conventional iterative integration. For this purpose, our ASTEROID reformulates MD trajectories as high-dimensional spatiotemporal sequences and integrates the Spatiotemporal Information (STI) Transformation equation into a Transformer architecture. The core innovation of ASTEROID lies in its ability to model multiscale spatiotemporal dependencies. In particular, for spatial dependencies, a local-global self-attention mechanism captures both short- and long-range interactions. For temporal dependencies, an encoder-decoder structure integrates global context with autoregressive forecasting. ASTEROID was evaluated on several quantum-mechanics derived molecular datasets. Our results indicate that ASTEROID achieved not only a higher level of accuracy in multi-step prediction than existing methods on various benchmarks, but also significantly reduced computational cost of conventional MD simulation. Moreover, the model supports iterative multi-step forecasting over an extended time scale. This work establishes a robust and generalizable data-driven paradigm for accelerating MD simulations.",https://arxiv.org/abs/2606.17668v1,"cs.LG, cs.AI, q-bio.QM"
2606.17420,AI,Feynman Kac Reweighted Schrödinger Bridge Matching for Surface-Based Tau PET Harmonization,"Jianwei Zhang, Xinyu Nie, Jiaxin Yue, Yonggang Shi",2026-06-16T02:06:36Z,"Tau PET imaging is central to tracking Alzheimer's disease progression, but systematic differences between scanners, protocols, and radiotracers across sites introduce nonbiological variability that inflates biomarker variance, reduces sensitivity to disease effects, and can bias downstream clinical assessments. Harmonization methods aim to remove these site-induced shifts while preserving biologically meaningful signal, yet existing approaches struggle when source and target cohorts differ in subgroup composition, risking conflation of site effects with biological variation such as tau-positivity status. We propose the Feynman Kac Reweighted Schröodinger Bridge Matching (FKRSBM) model to address this problem. Rather than routing data through a Gaussian noise prior as in diffusion-based methods, FKRSBM learns a direct stochastic transport process between source and target distributions via entropy-regularized optimal transport. To enforce biologically consistent transport, FKRSBM incorporates a subgroup-aware endpoint proposal derived from a Feynman Kac reweighting of the reference bridge measure, implemented entirely through stratified importance sampling at the data level and requiring no changes to the underlying bridge-matching solver or network architecture. For surface-based neuroimaging, FKRSBM employs a spherical convolutional backbone operating on cortical meshes to perform vertex-level harmonization. We evaluate the method on tau PET SUVR maps, harmonizing PI-2620 data from the HABS-HD cohort into the AV-1451 domain of ADNI. Compared against ComBat, CycleGAN, a diffusion-based method (DF), and unregularized Diffusion Schröodinger Bridge Matching (DSBM), FKRSBM achieves superior distributional alignment, reduced tau-positivity sign mismatch, stronger APOE subgroup alignment, and improved downstream disease classification performance.",https://arxiv.org/abs/2606.17420v1,"eess.IV, cs.AI, q-bio.QM"
2606.21508,Health,Adaptive conduction delays and phase locking in spiking Haken Lighthouse networks,"Stephen Coombes, Rüdiger Thul, Stefan Ruschel, Rachel Nicks",2026-06-19T15:01:54Z,"We develop a theory of phase-locked activity in delayed spiking networks using the Haken Lighthouse model as an analytically tractable event-based description of neural dynamics. For networks with fixed delays, we derive self-consistency conditions for phase-locked states and an associated linear stability theory formulated directly in terms of spike-time perturbations. The framework is illustrated for a delayed autapse, a reciprocally coupled two-cell network, and spatially structured rings with distance-dependent coupling and conduction delays, where circulant symmetry allows stability to be decomposed into Fourier modes. We then introduce an activity-dependent white matter plasticity rule in which myelination modulates axonal conduction speed and hence communication delay. This leads naturally to a slow--fast system with state-dependent delays, in which frozen phase-locked branches organise the adaptive dynamics. The plasticity rule selects commensurate delay--period relationships, providing a mechanism for the emergence of synchrony, other frequency-locked states, slow switching between competing phase-locked patterns, and the organisation of heterogeneous delays into discrete delay--period classes. Direct simulations of the event-driven network support the analytical predictions and illustrate how adaptive conduction can reshape the attractor structure of a delayed spiking network and generate long-timescale transitions. These results provide a tractable mathematical framework for studying how activity-dependent myelination may regulate temporal coordination, synchrony, and communication through coherence in spiking neural systems.",https://arxiv.org/abs/2606.21508v1,q-bio.NC
2606.21432,Health,Soliton-like Waves in a Two-Dimensional Recurrent Spiking Neural Network with Weighted Spike-Timing-Dependent Plasticity,Ch. Meessen,2026-06-19T13:47:27Z,"We construct a minimal but biologically plausible spiking neuron model operating in discrete time, combining multiplicative spike-timing-dependent plasticity (WSTDP), divisive normalization of synaptic integration, homeostatic threshold adaptation, and a one-step refractory period. We show that this normalization admits a biologically plausible dendritic implementation in which each binary junction operates using only locally available information.   Assembling excitatory-inhibitory pairs of such neurons into a two-dimensional recurrent network and applying periodic localized stimulation, we find that the network spontaneously gives rise to stable, self-propagating wave packets with the properties of dissipative solitons: they maintain a stable spatial profile, propagate at constant speed, and annihilate upon frontal collision. Their emergence requires a geometric asymmetry between excitatory and inhibitory connection radii, and initial inhibitory synapses stronger than excitatory ones. WSTDP engraves the direction of propagation into the synaptic weight profile, so that the network learns by itself to sustain propagation in one direction while suppressing the reverse. When two sources are active simultaneously, the resulting waves annihilate upon collision, defining a semi-persistent boundary whose position encodes the relative phase and frequency of the two sources.   These results provide a minimal computational framework for studying the emergence of cortical traveling waves, activity zone delimitation, and spatial memory from local plasticity rules alone.",https://arxiv.org/abs/2606.21432v1,"cs.NE, q-bio.NC"
2606.21351,Health,"Surveying the adaptive landscapes of 10,000 antibodies","Daniel PGH Wong, Aleksandra M. Walczak, Thierry Mora",2026-06-19T11:50:05Z,"Affinity maturation is the Darwinian process by which antibodies improve antigen binding through somatic hypermutation and selection. The adaptive landscape, which defines the set of antibody-specific mutations that improve functional characteristics like antigen binding, has been explored in only a handful of antibodies. Identifying the sites of adaptive mutations in a given antibody sequence, and how these sites vary across the antibody repertoire, can inform the design of therapeutic antibodies. We develop a parameter-free population genetic framework that leverages the statistics of convergent affinity maturation in B cell lineages sharing similar naive sequences, called public clonotypes, to identify beneficial mutations. Applying this framework to more than 10,000 public clonotypes represented by multiple lineages across 20 healthy individuals, we identify widespread signatures of clonotype-dependent selection of individual mutations. We estimate the prevalence and typical fitness effects of mutations across the V gene at the single-site level, uncovering a general tradeoff between prevalence and fitness effect. These inferred landscapes broadly reproduce the statistics of convergent mutation in antibodies specific to SARS-CoV-2 and influenza. Finally, we use our framework to benchmark predictions from existing antibody language models, and show that while these models are dominated by non-selective signatures, a simple renormalization procedure can expose signatures of clonotype-dependent positive selection consistent with our predictions.",https://arxiv.org/abs/2606.21351v1,q-bio.PE
2606.20844,Health,Relational Gaze Transitions During Encoding Predict Episodic Recall of Naturalistic Scenes,"Hugo Rydel, Alex Kafkas",2026-06-18T18:27:45Z,"Remembering a visual scene requires organizing distinct details into a cohesive event. This study investigates whether relation-guided gaze transitions provide a behavioural marker of this cognitive organization during episodic encoding and retrieval. By applying scene graph annotations to eye-tracking data, we measured whether gaze moved between objects that were meaningfully related within complex scenes. This approach allowed us to quantify relational scanning within naturalistic environments, moving beyond prior methods that relied on simplified displays or isolated relation types. Participants showed above-chance relational gaze during both initial viewing and blank-screen retrieval, indicating that gaze actively tracks scene structure during first viewing and at recall. Additionally, relational scanning at encoding predicted subsequent free recall of both object and relational details, even after accounting for salience, fixation frequency, meaning, and image-level differences. In contrast, relational scanning at retrieval did not predict recall success, suggesting that relational gaze is most functional to memory during its formation. Together, these findings show that relational gaze can be measured in complex scenes and may serve as a marker of episodic encoding during natural visual exploration.",https://arxiv.org/abs/2606.20844v1,q-bio.NC
