id,domain,title,authors,published,abstract,url,categories
2607.09286,Space,Enhancing the Cherenkov Telescope Array Observatory high-level performance through an event-type-based analysis,"Juan Bernete, Silvia García-Soto, Tarek Hassan, Orel Gueta, Maximilian Linhoff, Atreyee Sinha, Gernot Maier",2026-07-10T10:54:41Z,"The analysis traditionally employed by Imaging Atmospheric Cherenkov Telescopes involves optimizing quality cuts to select a sub-sample of high-quality events. These events are used for the scientific interpretation of the data, employing a single set of Instrument Response Functions (IRFs). All selected events are treated equally and assumed to be well represented by these IRFs, while the rest are discarded. An alternative approach, successfully applied in experiments such as Fermi-LAT, is an event-type-based analysis. This method divides datasets into subsamples, each containing events of a given expected reconstruction quality. IRFs are computed for each subsample independently, improving the accuracy with which IRFs represent the reconstruction quality of each event. The high-level analysis of these subsamples is performed treating them as independent observations, each with their own set of IRFs, and analyzed jointly. In this work we present a proof-of-concept implementation of an event-type-based analysis for the future CTAO using simulated data. A neural network (specifically a multi-layer perceptron) is trained to predict the direction reconstruction error of each event, and the simulated dataset is divided into event types based on this predicted variable. We compute IRFs for each event type and compare them with those from the standard analysis (without event types). Finally, we simulate observations using these event-type-wise IRFs and analyze them with high-level analysis tools to test the performance of both approaches. This implementation demonstrates notable improvements: 25% to 50% boost in spatial resolving power and ~25% in sensitivity. This boost in performance will have strong implications in the scientific exploitation of the CTAO data, especially in crowded regions such as the Galactic Plane or searching for spectral signatures like Dark Matter annihilation lines.",https://arxiv.org/abs/2607.09286v1,"astro-ph.IM, astro-ph.HE"
2607.09280,Space,In-medium hyperon potentials and the quarkyonic hyperon onset: charged $Σ$'s in $β$-equilibrium and the neutrino connection,Jaroslaw Nowak,2026-07-10T10:49:02Z,"Quarkyonic matter resolves the neutron-star hyperon puzzle statistically: neutrons fill low-momentum $d$-quark phase space, shifting the $S=-1$ threshold from $\muB=M_Y$ to $2M_Y-M_N$ and suppressing residual softening by $1/\Nc^3$ in the Fujimoto--Kojo--McLerran (FKM) mechanism. We dress FKM's IdylliQ model with in-medium potentials, constrained by hypernuclear data and neutrino-induced hyperon FSI, and find: (i) the dressed onset, $\muB^{\rm onset}=(2M_Y{-}M_N)+2U_Y-\UN$, carries $U_Y$ at weight 2, with $dn_{\rm onset}/dU_Y\simeq0.3\,\nz$ per $10\MeV$, twice the leverage. (ii) A self-consistent neutron potential enters at weight $-2$, so protection needs $\UN(n_{\rm onset})\lesssim+96\MeV$. (iii) With leptons in $β$ equilibrium, the $Σ^-$ ($dds$) onset becomes $\mue\ge258\MeV+\US-\UN$, never reached inside a $2\,\Msun$ core: $Σ^-$ switches from first hyperon to forbidden and the $Σ$ ordering inverts. (iv) The $\kY\ge\kbu$ continuation gives TOV softening below $0.05\,\Msun$ in the FKM ansatz family and below $0.025\,\Msun$ for the realistic interacting star, $4$--$8$ below hadronic models. In the family this is a ceiling; generally it is a floor, since hyperons above $\kbu$ are omitted. (v) In an interacting low-density sector calibrated to $\Mmax=2.12\,\Msun$, core strangeness is controlled by $(\UL(\nz),c_Λ)$: at $\UL(\nz)=-28\MeV$, the maximum-mass star is hyperon-free once the supra-saturation $YNN$ turn-over exceeds a few-MeV threshold $c^*_Λ$. Projected SBND+DUNE FSI precision pins $\UL(\nz)$ but leaves $c_Λ$ -- to which neutrino data are blind -- decisive: with the heavy-ion prior, $P({\rm hyperon\mbox{-}free\ core})=0.90$, versus $0.89$ from priors alone, prior-dominated rather than measured. The sharpest observable is differential: $d\Mmax/dU_Y$ is an order of magnitude smaller than in mean-field models, discriminating the two resolutions.",https://arxiv.org/abs/2607.09280v1,"nucl-th, astro-ph.HE, hep-ex, hep-ph"
2607.09273,Space,Neutrino-induced hyperon final-state interactions as constraints on the in-medium hyperon potential,Jaroslaw Nowak,2026-07-10T10:42:23Z,"Hyperon single-particle potentials $U_Y(ρ)$ control propagation in nuclei and hyperon onset in dense matter, where they soften the neutron-star equation of state and reduce the maximum mass -- the ``hyperon puzzle''. We show that charged-current accelerator (anti)neutrino interactions on $^{40}$Ar, producing $Λ$ and $Σ$ inside the nucleus, can constrain these potentials. At SBND and DUNE energies, the trapped-$Λ$ fraction and escaping-hyperon momenta vary monotonically with $U_Λ$ and $U_Σ$, with a kaon-vetoed FSI-$Σ^+$ tag adding sensitivity. Inserted in a GM1 relativistic mean-field equation of state at established hypernuclear/$Σ$-atom depths, the same potentials give $M_{\rm max} = 1.94\,M_\odot$ and $Λ_{1.4}=1034$, below the heaviest pulsars and above the GW170817 bound typical of GM1-class mean fields. A detector-level Fisher forecast yields $δU_Λ\simeq 0.3\,$MeV and $δU_Σ\simeq 3$-$4\,$MeV for fixed low-density exponent $γ$. Since hyperons are produced below saturation, $U_Λ(ρ_0)$ and $γ$ are 99.8\% anti-correlated; marginalising over $γ$ degrades the anchor to $δU_Λ\simeq 5.6\,$MeV ($1.3\,$MeV with a $\pm 0.2$ prior), while $δU_Σ$ is unchanged. For $U_Λ$, comparable systematics arise from hyperon-nucleon final-state cross sections ($-5/{+}2\,$MeV) and the exit-shift/gradient transport prescription ($-6\,$MeV). For $U_Σ$, the same $YN$ uncertainty biases the fit by $\mathcal{O}(150)\,$MeV; removing the $Σ^+$ tag does not cure this, because the $Λ$ momentum spectrum carries most $U_Σ$ information and is itself $YN$-sensitive. The low-density $U_Λ$ anchor is a robust handle, at several-MeV rather than sub-MeV precision. A joint fit with terrestrial and heavy-ion priors gives $M_{\rm max} = 2.21^{+0.04}_{-0.15}\,\,$Msun, set mainly by the external $c_Λ$ prior.",https://arxiv.org/abs/2607.09273v1,"nucl-th, astro-ph.HE, hep-ex, hep-ph"
2607.09272,Space,Structure of the Stellar Neighborhood of CQ Tau in the Presence of a Companion in an Elongated Orbit,Tatiana Demidova,2026-07-10T10:40:42Z,"There are indirect signs of the presence of a companion near the star CQ\,Tau. A period of 10\;years was found in the brightness changes. The image of the disk shows an extensive cavity with a size of about 25~AU, surrounded by a dust ring with a distribution maximum near 53~AU. A simulation of the interaction of dust and gas in the vicinity of the star with the CQ\,Tau parameters was carried out, assuming the existence of a companion in an orbit with a period of 10\;years. It was shown that an M-class star in a highly elongated orbit is capable of forming a region of reduced density around the center of mass of the system, with a size close to the observed one. However, the dust ring-like structure in this case is located noticeably closer to the star than observed. Evidence has been obtained that a massive planet in an outer, relatively binary orbit, could form a ring-shaped dust structure at a distance similar to that observed.",https://arxiv.org/abs/2607.09272v1,astro-ph.SR
2607.09255,Space,Accelerator neutrinos as a probe of in-medium hyperon potentials,Jaroslaw Nowak,2026-07-10T10:10:02Z,"Charged-current (anti)neutrino interactions create $Λ$ and $Σ$ hyperons \emph{inside} the nucleus, making hyperon final-state interactions a terrestrial probe of the in-medium potentials that govern hyperon onset in neutron stars. In the StrangeMC simulation the trapped-$Λ$ fraction, escaping hyperon momenta, and a kaon-vetoed $Σ^+$ tag respond monotonically to $U_Λ$ and $U_Σ$ at SBND and DUNE. Marginalised over the low-density slope, a forecast gives $δU_Λ\approx6\MeV$ with systematics distinct from hypernuclear data; $U_Σ$ is limited by hyperon--nucleon cross sections.",https://arxiv.org/abs/2607.09255v1,"nucl-th, astro-ph.HE, hep-ph"
2607.09208,Space,The impact of nuclear uncertainties on the p-process nucleosynthesis in Supernovae,"S. Martinet, S. Goriely, A. Choplin",2026-07-10T08:54:54Z,"The p-process is responsible for the production of the stable neutron-deficient nuclei heavier than iron observed in the solar system. However, important nuclear uncertainties still limit our understanding of this nucleosynthesis process. Among the most significant are the nuclear level densities (NLDs) and photon strength functions (PSFs) entering the calculation of photodisintegration rates under supernova conditions. We investigate both model (systematic) and parameter (statistical) uncertainties affecting NLDs and PSFs and quantify their impact on p-process nucleosynthesis in type-Ia and type-II supernovae. Correlated model uncertainties are estimated using several NLD and PSF models that reproduce available experimental observables. Uncorrelated parameter uncertainties are evaluated with a backward-forward Monte Carlo approach, in which parameter variations are constrained by measured reaction rates before being propagated to unknown cross sections of neutron-deficient nuclei. The resulting uncertainties are propagated through p-process calculations while preserving model correlations. To identify the reactions driving abundance uncertainties, we combine regularized linear-response modeling, stability analysis, and contribution and interaction decompositions. We find that photoneutron-emission uncertainties dominate the overall uncertainty budget. The leading source of uncertainty arises from local parameter variations still compatible with current experimental constraints, highlighting the lack of constraining nuclear data in the neutron-deficient region. For many p-nuclei, the dominant contribution originates either from the photoneutron emission of the p-nucleus itself or from a nearby $(γ,n)$ reaction along the same isotopic chain. While improved nuclear models remain important, many key reactions involve stable or near-stable nuclei and should be experimentally accessible.",https://arxiv.org/abs/2607.09208v1,"nucl-th, astro-ph.SR, nucl-ex"
2607.09178,Energy,Tunable responsivity and bandwidth in microwave kinetic inductance detectors via readout current nonlinearity,"Maclean Rouble, Peter Day, Matt Dobbs, Joshua Montgomery, Sofiia Savchyn, Graeme Smecher",2026-07-10T08:12:06Z,"Microwave kinetic inductance detectors (MKIDs) are generally read out with microwave readout tones of high enough amplitude to adequately suppress the noise contribution of the first-stage amplifier. At high readout power, the detector's resonant frequency is altered as a result of the dependence of the kinetic inductance on the internally circulating microwave current. With the tone placed below the resonant frequency, the nonlinear frequency shift results in a positive feedback effect that can significantly enhance the responsivity of the detector, to both optical and microwave power. We report a factor of 10 enhancement in optical response by tuning the readout power and frequency to close to the resonator's bifurcation point. A corresponding decrease in the bandwidth of the resonator is observed under these conditions. We show that the strength of the feedback effect can be easily selected by adjusting the excitation, and provide a map of possible operational states to do so. Operation of MKIDs in this mode could be used to improve sensitivity when non-intrinsic noise sources are significant.",https://arxiv.org/abs/2607.09178v1,"cond-mat.supr-con, astro-ph.IM"
2607.09148,Space,Masking Algorithm for CCD Bleeding in Korea Microlensing Telescope Network Images,"Jiseop Shin, Mankeun Jeong, Myungshin Im, Seo-Won Chang, Sang-Mok Cha, Seong-Kook Lee",2026-07-10T07:02:57Z,"Astronomical CCD images are often affected by bleeding from bright sources, producing column-aligned streaks that degrade source detection and photometry. We present a pixel-level masking algorithm for bleeding in Korea Microlensing Telescope Network (KMTNet) images, in which these streaks extend along detector columns away from the readout register. The algorithm identifies bleed-generating pixels using a conservative bleeding threshold and a bleeding index that quantifies excess signal along the expected bleeding direction. The extent of each bleed trail is then determined by termination criteria based on a background-relative detection threshold and a continuity condition. To optimize these termination parameters, we generate multiple candidate masks and evaluate them with an F-beta-like score that favors high purity while preserving recovery of sources whose photometry is biased by bleeding. Using the final mask, we apply interpolation-based cleaning and assess the performance in terms of completeness and photometric accuracy in a crowded KMTNet field, using Gaia DR3 as a reference. The source completeness improves from 94.08% to 98.61%, primarily by enabling proper aperture placement that was previously hindered by bleeding. For selected bleeding-affected sources, the root-mean-square photometric offset decreases from 0.623 mag to 0.068 mag. These results demonstrate that the algorithm provides a practical framework for mitigating bleeding artifacts in KMTNet images. We further examine the stability of the algorithm across different observing conditions and discuss limitations of the current masking and cleaning procedure.",https://arxiv.org/abs/2607.09148v1,astro-ph.IM
2607.09131,Space,Minimal Majoron Dark Matter from a Discrete $Z_N$ Gauge Symmetry,"Subaru Fujisawa, Qiuyue Liang, Shigeki Matsumoto, Michiru Uwabo-Niibo, Tsutomu T. Yanagida",2026-07-10T06:38:44Z,"We investigate majoron dark matter in a minimal setup, where the Standard Model is extended by three right-handed neutrinos and a complex scalar field. The theory is defined by an exact discrete gauge symmetry, $Z_N\subset U(1)_{B-L}$, while the global $U(1)_{B-L}$ symmetry emerges only as an accidental symmetry at low energies. For nontrivial choices of the discrete symmetry $Z_N$, such as $Z_5$, $Z_7$, $Z_{11}$, and $Z_{13}$, Planck-suppressed operators explicitly break this accidental symmetry and generate a small majoron mass, making the resulting pseudo-Nambu--Goldstone boson a well-motivated dark matter candidate. We study its production via the misalignment mechanism after inflation, considering both radiation-dominated and early matter-dominated cosmological histories, and confront the viable parameter space with isocurvature bounds, cosmological constraints, and indirect dark matter searches. We find that the $Z_5$ model is excluded by limits on the dominant dark matter decay into neutrinos, whereas the other models remain viable. In particular, the $Z_7$ scenario predicts a majoron mass in the $1$--$10\,{\rm MeV}$ range and can be sensitively probed by future MeV gamma-ray observations, especially with COSI, through the 511$\,$keV line from the majoron decay into an electron--positron pair and the monochromatic gamma-ray line from its decay into two photons.",https://arxiv.org/abs/2607.09131v1,"hep-ph, astro-ph.HE"
2607.09119,Space,Effects of dark matter and magnetic field on neutron star properties in relativistic mean-field theory: A single-fluid approach,"Neeshu Rani, M. Mishra, Deepak Kumar, Arpan Das",2026-07-10T06:16:49Z,"Neutron stars, due to their extremely high matter density and strong magnetic field, provide the best environment for exploring new physics beyond the Standard Model of particle physics. In this work, we study the effect of pre-existing dark matter component and an internal magnetic field on the structural properties of neutron stars. We employed relativistic mean field theory based equations of state and used a single fluid approach for solving the Tolman-Oppenheimer-Volkoff (TOV) equation to compute properties like mass-radius, tidal deformability, compactness, and non-radial oscillation frequencies. We consider the following two scenarios for equation of state (EoS): (1) density-independent couplings along with non-linear interactions of mesons, and (2) density-dependent couplings, with only considering linear interactions for mesons. These mesons mediate the interactions between nucleonic constituents of a neutron star. In the dark matter sector we consider a massive fermionic dark matter which interacts with the nucleons through a Higgs portal interaction. We explore parameter regions for Fermi momentum of dark matter in the range $k_F = 0.01$ GeV - $0.06$ GeV, and two different values of the mass of fermionic dark matter, $M_χ= 200$ GeV and $300$ GeV. We consider two values of the central magnetic field, $B_c = 7\times10^{17}$ Gauss, $9 \times 10^{17}$ Gauss, for a magnetized neutron star. Finally, we compare the theoretical predictions with the observed mass-radius and tidal deformability data of pulsars obtained from gravitational wave observations.",https://arxiv.org/abs/2607.09119v1,"astro-ph.HE, gr-qc"
2607.09112,Space,Physics and Astrophysics of Black Holes with eXTP,Cosimo Bambi,2026-07-10T05:50:09Z,"The enhanced X-ray Timing and Polarimetry (eXTP) mission will combine spectral, timing, and polarimetric techniques to study accreting black holes, measure their masses and spins, and test Einstein's theory of General Relativity in the strong-field regime. In this contribution, I review the capabilities of eXTP to advance our current understanding of black hole physics and astrophysics.",https://arxiv.org/abs/2607.09112v1,"astro-ph.HE, gr-qc"
2607.09109,Space,Fast Radio Bursts Trace Cosmic Star Formation with Little Delay,"Yi-Ying Wang, Yin-Jie Li, Yi-Zhong Fan",2026-07-10T05:45:41Z,"The progenitor channels of fast radio bursts (FRBs) remain debated, with a central question being whether their cosmic rate traces star formation promptly or instead follows it with the long time-delay characteristic of compact-binary mergers. We perform a forward-modeling, hierarchical Bayesian analysis of the CHIME/FRB population, jointly fitting the catalog sample, baseband fluences, and localized host redshifts, while self-consistently incorporating the survey selection function through the injection framework. Across a range of delay-time models, the reconstructed FRB rate robustly peaks at the same redshift as the cosmic star-formation history, with a mean delay of only $0.1-0.3$ Gyr that remains consistent with a prompt, zero-delay origin at the $2σ$ level. For dominant FRB population, this finding rules out the multi-Gyr delays reported previously and interpreted as the evidence for compact binary merger origin, and instead points toward progenitor systems linked to young stellar remnants, most notably magnetars formed in core-collapse supernovae.",https://arxiv.org/abs/2607.09109v1,"astro-ph.HE, astro-ph.CO"
2607.09040,Space,Effects of Differential Rotation on the Maximum Mass of Neutron Stars,"Hyukjin Kwon, Jinho Kim, Kazuyuki Sekizawa",2026-07-10T02:11:48Z,"The maximum mass of neutron stars provides a key constraint on the equation of state (EoS) of dense matter. Recent observations, including the ${\approx}2 M_{\odot}$ pulsar PSR~J0740+6620, have placed strong constraints on a large class of soft EoSs, while the possible existence of a compact object with a mass of $2.50$ - $2.67$ $M_{\odot}$ in GW 190814 further challenges our understanding of dense matter. Moreover, the inclusion of hyperonic degrees of freedom generally softens the EoS, making it difficult to support massive neutron stars even when the $2$ $M_{\odot}$ constraint is satisfied (a problem known as the hyperon puzzle). In this work, we investigate whether differential rotation can enhance the maximum mass of neutron stars constructed with an EoS including hyperons, thereby addressing the maximum-mass constraints imposed by current observations. We employ the Cook-Shapiro-Teukolsky (CST) approach, a numerically improved reformulation of the Komatsu-Eriguchi-Hachisu (KEH) scheme, to construct equilibrium configurations of differentially rotating neutron stars. For the nuclear matter EoS, we adopt a relativistic mean-field (RMF) model incorporating hyperonic degrees of freedom through an SU(6) symmetric coupling scheme. We find that differential rotation can substantially increase the maximum mass, yielding configurations consistent with the mass range inferred from GW 190814. However, a sufficiently soft EoS fails to satisfy the constraint from PSR~J0740+6620 (346 Hz) even with differential rotation applied. We also present a systematic analysis of the internal structure of the resulting equilibrium configurations. Furthermore, we demonstrate the existence of quasi-toroidal configurations and present equilibrium sequences incorporating the full baryon octet under extreme differential rotation.",https://arxiv.org/abs/2607.09040v1,"astro-ph.HE, gr-qc, nucl-th"
2607.09036,Space,In the Eye of the Storm: The Third Giant X-ray Outburst of the Extreme Changing-look AGN IC 3599,"D. Grupe, S. Komossa, W. Zheng, A. V. Filippenko, T. G. Brink, N. Schartel, J. Wang, V. Oknyansky, A. V. Dodin, S. Wolsing, E. Elien, C. Tapper, P. Lynam",2026-07-10T01:57:15Z,"We report the discovery and multiwavelength follow-up observations of a giant (factor >100) X-ray outburst of the exceptional changing-look active galactic nucleus (AGN) IC 3599. This is the third such outburst after two previous ones serendipitously discovered in 1990 and 2010. Based on our dedicated long-term monitoring of IC 3599 with {\it Swift}, the third outburst was detected while it was happening, and we triggered multiple follow-up observations within days to weeks for the first time. The Swift outburst spectra are supersoft and almost no photons are detected beyond 2.5 keV. The XMM-Newton short-term light curve shows a remarkable apparent oscillatory pattern that is reminiscent of quasiperiodic oscillations (QPOs). The optical high-state spectra reveal a multitude of bright coronal emission lines that have dramatically brightened and were absent or much fainter in low-state spectra. The new results eliminate outburst scenarios that require a constant time interval of repetitions (like certain variants of repeat tidal stripping, or of an orbiting supermassive black hole impacting the inner accretion disk), but remain in excellent agreement with an accretion disk radiation-pressure instability when assuming that local conditions in the disk of this long-lived AGN affect the onset time of each new instability. The combination of recurrent, giant, supersoft outbursts on decadal timescales, the exceptional emission-line response, and the rapid, candidate quasiperiodic, short-term variability on an hours timescale makes IC 3599 unique among AGN, and establishes it as a key system for studying accretion physics under extreme conditions and at the Eddington limit.",https://arxiv.org/abs/2607.09036v1,"astro-ph.GA, astro-ph.HE"
2607.09004,Space,Interplanetary scintillation-informed heliospheric modelling for the MeerKAT Pulsar Timing Array 4.5 yr dataset,"Saurav Mishra, Daniel J. Reardon, Andrew Zic, Matthew Bailes, John Morgan, Atharva D. Kulkarni, Matthew T. Miles, Ryan M. Shannon, Caterina Tiburzi, Mark Cheung, Michael Kramer, Ruoyao Ni",2026-07-10T00:15:17Z,"Heliospheric density variations impart delays on pulse times of arrivals from millisecond pulsars. Improper modelling of these variations may affect gravitational wave detection and characterisation by pulsar timing arrays (PTAs). Currently, PTAs typically employ a time-varying, spherically symmetric heliosphere model, which does not capture the full spatial and temporal complexity of the heliosphere. Instead, we investigate whether a three-dimensional, time-dependent model of the inner heliosphere from interplanetary scintillation (IPS) measurements - the IPS-UCSD model - can be employed to mitigate the solar wind in PTA analyses. We applied the IPS-UCSD model to the MeerKAT PTA 4.5-year dataset to assess whether it could correct for heliospheric density variations, and the impact on GW sensitivity compared to a spherically-symmetric model. We find that the model does not accurately correct for heliosphere-induced timing distortions, leading to bias in recovered GW parameters. Using simulations, we show that the spherically symmetric heliosphere model also fails to fully capture heliospheric density variations like those in the IPS-UCSD model. However, if interstellar dispersion measure (DM) variations are also modelled, then the heliospheric model errors are partially absorbed by DM variations, reducing contamination of the GW signal. Therefore we find that a time-varying spherically symmetric model is sufficient to mitigate the effect of heliospheric time delays on recovered GW results at typical PTA radio frequencies, provided other signal components are also modelled. We propose that the most precisely timed pulsars may be used to improve data-driven heliospheric density models in the future.",https://arxiv.org/abs/2607.09004v1,"astro-ph.HE, astro-ph.SR, gr-qc"
