id,domain,title,authors,published,abstract,url,categories
2607.14943,Robotics,Steering Robustness into World Action Models via Mechanistic Interpretability and Optimal Control,"Jihoon Hong, Julian Skifstad, Qiyue Dai, Alice Chan, Glen Chou",2026-07-16T12:52:49Z,"World Action Models (WAMs) enable semantically- and physically-informed control but are brittle under distribution shift. In this work, we use mechanistic interpretability to study how robustness-relevant perturbations are represented in WAM activation space. Comparing activations across successful and unsuccessful rollouts, we find some WAM architectures exhibit low-dimensional linear separability for robustness-critical features, while others do not. This motivates the use of contrastive activation directions for training-free WAM steering. We also show that local linearity in WAM activation dynamics enables efficient feedback steering via model-based optimal control, yielding World-Action Linear Quadratic Regulator (WA-LQR), a minimally-invasive reduced-order LQR controller. Via mechanistic evaluations, we predict strong steerability in the Cosmos-Policy and DiT4DiT models but weak steerability in LingBot-VA, consistent with steering intervention results. On Cosmos-Policy and DiT4DiT, WA-LQR generalizes contrastive directions to new tasks and improves robustness to camera, gripper, and visual-noise perturbations over unsteered and prompt steering baselines.",https://arxiv.org/abs/2607.14943v1,"cs.RO, cs.AI, cs.LG, eess.SY, math.OC"
2607.14919,Robotics,Human-Robot Interaction in GenAI Architectures via the Agent-Client Protocol,"Jesus Moncada-Ramirez, Jose-Raul Ruiz-Sarmiento, Javier Gonzalez-Jimenez",2026-07-16T12:38:48Z,"Recent advances in Generative Artificial Intelligence (GenAI), particularly Large Language Models (LLMs), are driving robotic architectures toward agent-based high-level orchestration, in which natural-language instructions can be translated into context-aware action sequences. While the integration of these agents and robotic capabilities is increasingly converging toward standardization through the Model Context Protocol (MCP), the upper Human-Robot Interaction (HRI) layer remains fragmented by proprietary, ad hoc interfaces that hinder real-time human-in-the-loop collaboration.   To address this fragmentation, this paper proposes the adoption of the Agent-Client Protocol (ACP) -- a communication standard originally introduced for coding agents in software engineering -- as a unified communication contract for the HRI layer in agent-based robotic systems. By combining ACP at the interface-agent link and MCP at the agent-execution link, we formulate a fully decoupled three-layer architecture that separates human interaction, deliberative orchestration, and physical execution. This topology removes rigid architectural dependencies, enabling heterogeneous user interfaces to connect to the same robotic system and allowing the underlying robotic platform to be replaced without requiring client-specific integration changes. Moreover, it provides native support for collaborative HRI capabilities such as real-time observability, explicit human authorization, and immediate task interruption. We experimentally evaluate the proposed architecture on a physical mobile robot, demonstrating interoperability across three heterogeneous user interfaces and validating real-time human-in-the-loop workflows with negligible latency overhead.",https://arxiv.org/abs/2607.14919v1,cs.RO
2607.14899,Robotics,OASIS-Map: Object-Level Change Detection in Multi-Session Mapping using Semantic Correspondence Matching,"Haedam Oh, Yifu Tao, Nived Chebrolu, Maurice Fallon",2026-07-16T12:16:52Z,"Map representations which are consistent across repeated visits to a real-world semi-static environment are very useful for long-term robotic inspection. In such settings, the scene may evolve while the robot is absent, with objects appearing, disappearing, moving, or being replaced, quickly making a static map outdated. Existing change-detection methods reason through geometry, category-level semantics, or object persistence. However, achieving reliable object association across revisits remains a key challenge, especially under partial views, occlusion, and imperfect segmentation. In this work, we propose OASIS-Map, a multi-session mapping system that maintains a spatio-temporally consistent object-level map by establishing dense patch-level semantic correspondences between temporal observations. These correspondences detect where the scene has changed and incrementally associate objects across revisits as the robot re-observes the environment. We demonstrate OASIS-Map on three challenging real-world scenarios: object rearrangements in 3RScan, visually similar car replacements in a car park, and large-scale scene changes in an outdoor market. We achieve 0.783 F1 on change detection in a car replacement scenario in a car park and 0.667 F1 on moved object association in 3RScan. https://dynamic.robots.ox.ac.uk/projects/oasis-map/",https://arxiv.org/abs/2607.14899v1,cs.RO
2607.14853,Robotics,Modeling and Validation of Quality of Control for Edge-Offloaded Collaborative Navigation,"Neelabhro Roy, Mikael Hammarling, Victor Nan Fernandez-Ayala, Gourav Prateek Sharma, Mani H. Dhullipalla, Dimos V. Dimarogonas, James Gross",2026-07-16T11:22:18Z,"Collaborative control in complex environments is severely challenged by stochastic wireless delay and reliability variations, which can degrade navigation, tracking, and collision avoidance. These network-induced uncertainties complicate the maintenance of energy efficiency during collaborative tasks, and can potentially lead to over-provisioning of resources. In this paper, for a navigation setup with dynamic collision avoidance, we address this challenge by expanding the quality of control (QoC) framework from prior works to practical robotic models. Our approach (i) models end-to-end network effects on closed-loop performance, (ii) systematically explores the impact of various control parameters dictating robotic motion on network latency-reliability (iii) validates these models through experiments on a private 5G testbed across varying delay, reliability and control configurations. Our analysis indicates the optimal control-communication co-design operating regimes for practical robots and also compares the QoC performance of standard ROS~2 quality of service (QoS) policies under real-world conditions and showing how RELIABLE QoS offers 51.5% better QoC than BEST-EFFORT under certain experimental settings.",https://arxiv.org/abs/2607.14853v1,"cs.RO, cs.MA, eess.SY"
2607.14852,Robotics,Towards Human-like Physical Intelligence: LifelongVision-Language-Action Learning for Robotic Manipulation,"Yao He, Gan Sun, Wenqi Liang, Fazeng Li, Yang Cong",2026-07-16T11:22:06Z,"Similar to the natural capabilities of humans to sequentially learn new tasks, robots with Vision-Language-Action (VLA) models should possess lifelong learning ability to learn a new task when deployed in open-world environments. However, most recently proposed lifelong learning models aim to effectively learn the current task (plasticity) or maintain high accuracy on previous tasks (stability), while the plasticity-stability trade-off remains largely unsolved in robotic manipulation models. To address this fundamental challenge, we propose a cache-efficient lifelong Vision-Language-Action learning framework for robotic manipulation (i.e., LifelongVLA), which alleviates the plasticity-stability trade-off with a dual-timescale adaptation mechanism while achieving low-cost robotic deployment with a cache-efficient replay strategy. More concretely, we propose a dual-timescale LoRA gating module to decompose VLA adaptation into two lightweight pathways: a short-term adapter for plasticity and a long-term adapter for stable consolidation. These pathways are integrated via a task-aware gate, enabling explicit control of the plasticity-stability trade-off. In the skill replay phase, a cache-efficient stochastic replay strategy is proposed to preserve more balanced retention signals without full-trajectory storage. Finally, experiments show that LifelongVLA outperforms existing baselines, demonstrating efficient skill expansion, robust retention of learned manipulation behaviors, and reduced reliance on retraining for real-world deployment on an xArm robot.",https://arxiv.org/abs/2607.14852v1,cs.RO
2607.14842,Robotics,KineFuse: Kinematic-Aware Haptic Fusion for In-Hand Occluded-Object Pose Tracking,"Chanyoung Ahn, Jaesung Lee, Sungwoo Park, Donghyun Hwang",2026-07-16T11:07:47Z,"Dexterous in-hand manipulation requires continuous 6D pose tracking, yet the manipulating fingers inevitably occlude the object from the camera. We study how to structure the sparse haptic signals already available on multi-fingered hands, including proprioception, proximal force/torque, and binary contact, to complement a pretrained visual pose tracker under occlusion. We propose a kinematic-aware finger-level encoder and systematically compare it against four alternative designs through three levels of evaluation: per-frame refinement, sequential open-loop tracking, and closed-loop manipulation. Our experiments reveal that (i) per-frame evaluation cannot distinguish encoder quality, while sequential tracking amplifies architectural differences by up to 15 times; (ii) the structured encoder learns task-specific cross-modal gating, using vision exclusively for translation and dedicating one attention head to haptics for rotation, without explicit supervision; and (iii) compact finger-level tokenization with 4 tokens outperforms both flat fusion and joint-level representations, which suppress vision through norm dominance. We validate that improved tracking yields higher success in a downstream reorientation task and provide qualitative real-world demonstrations. Our project page is available at https://cold-young.github.io/kine-fuse/.",https://arxiv.org/abs/2607.14842v1,cs.RO
2607.14826,Robotics,Interventional Causal Circuits for Safe Robot Action Testing and Failure Recovery,"Naren Vasantakumaar, Tom Schierenbeck, Michael Beetz",2026-07-16T10:41:20Z,"Safe physical AI for robot actions are required not only likely to succeed but tested to be safe before execution. In practice, however, formal testing of motion parameters is computationally expensive, and the cost scales poorly with the dimensionality of the action space. When a proposed action is rejected by a tester, the naive response is to resample blindly until a passing candidate is found. This is wasteful, uninformative, and offers no convergence. We argue that rejection should instead trigger causal diagnosis: a principled identification of which action parameter caused the failure and what corrective value maximises the probability of passing testing under the interventional probability distribution. We propose a closed-loop framework that couples a Joint Probability Tree (JPT) with a Causal Circuit derived from a Marginal-Deterministic Variable Tree, enabling exact polytime computation without retraining, or additional data collection. The framework validates tractability of all interventional queries before the robot begins operating, and out-of-support candidates are detected and excluded from correction automatically. We perform experiments in a ROS2 simulation environment, and the framework demonstrates complementary roles across quality of distribution: under a high-quality JPT, the Causal Circuit reduces failed attempts by 10.3% and under a degraded JPT, it reduces total failed attempts by 37%. Every rejected plan produces a structured, interpretable causal report naming the primary cause variable, its observed value, and the recommended corrective region, supporting operator oversight and autonomous recovery without a separately trained failure model.",https://arxiv.org/abs/2607.14826v1,"cs.RO, cs.AI"
2607.14781,Robotics,Curvature-Constrained and Constant-Speed Distributed Simultaneous Arrival Control for Multi-Robot Systems,"Zhouru Xiao, Yang Lu, Weijia Yao, Min Liu, Yaonan Wang",2026-07-16T09:59:16Z,"The simultaneous arrival of multiple mobile robots at a target point is crucial for cooperation tasks such as cooperative encirclement, disaster relief, and environmental monitoring. Although the simultaneous arrival problem itself is already complex, the problem becomes more challenging when there are constraints on the robot trajectory curvatures and the speeds are required to be constant (possibly different for different robots), and the control law for robots needs to be distributed. These constraints are typical for a multi-robot system consisting of, e.g., fixed-wing UAVs. To address this challenge, this paper proposes a distributed switching control method based on the maximum consensus protocol. By exploiting the geometric properties of Dubins paths along with optimization principles, a virtual time variable is introduced, and a hybrid control law that combines optimal control with saturated proportional control is designed. Under the proposed control law, each robot is driven to approach the maximum virtual time among its neighbors, thereby achieving simultaneous arrival under some mild conditions. Furthermore, we prove that in certain cases the proposed method attains a theoretically optimal arrival time. The approach is scalable and real-time, with low communication overhead. Its effectiveness and robustness are validated through extensive simulations and experiments.",https://arxiv.org/abs/2607.14781v1,cs.RO
2607.14730,Robotics,"Hybrid Rigid-Soft Robotic Gripper with Shape Adaptation, Uniform Force Distribution, and Self-Locking Capabilities","Xi Chen, Yun Wang, Lichao Yang, Haitao Li, Ya Xiong",2026-07-16T08:55:33Z,"Conventional robotic grippers face a significant challenge in agricultural automation: the trade-off between compliant, adaptive grasping, pressure balancing among all joints, and high load capacity, often at the cost of high energy consumption. This paper presents a novel hybrid rigid-soft gripper that integrated low-cost, membrane-based pneumatic actuators with 3D-printed dual ratchet-pawl mechanisms to simultaneously achieve shape adaptation, uniform force distribution, and energy-free self-locking. The dual-ratchet structure assembled in an offset configuration significantly increased the angular resolution of the joint locking mechanism. Key experimental results demonstrated the gripper's superior performance: a remarkable maximum load capacity of 4200 g, far exceeding that of conventional soft grippers (45-210 g); more uniform force distribution across object sizes (1.75-35.29% difference ratio) compared to a rigid gripper (56.77-66.44%), with peak contact forces remaining below surface damage thresholds; and a 50.05% reduction in total energy consumption to 42.6 J per grasp cycle, achieved by eliminating the need for continuous pneumatic pressure through the self-locking mechanism, compared to 85.28 J for a conventional soft gripper. The combination of additive manufacturing for ratchets and commercially available materials for pneumatic chambers ensured a low-cost and easily fabricated design. These findings validated that the proposed gripper successfully bridged the gap between soft compliance and rigid reliability, offering a robust and efficient solution for scalable agricultural harvesting and manipulation tasks.",https://arxiv.org/abs/2607.14730v1,cs.RO
2607.14728,Robotics,VQ-Touch: A Data-Efficient Tactile Generation Framework Across Sensors and Scenarios,"Kailin Lyu, Long Xiao, Jianing Zeng, Di Wu, Lin Shu, Jie Hao",2026-07-16T08:53:41Z,"Tactile image generation significantly reduces the dependency on expensive and wear-prone sensors by synthesizing high-fidelity tactile data, offering an efficient solution for tactile information acquisition in robotic perception and human-machine interaction systems. However, existing methods depend on large-scale, diverse datasets from specific sensors and lack efficient data utilization and robust generalization capabilities, struggling in vision-limited environments. To address this, we introduce VQ-Touch, a tactile generation framework that supports both cross-sensor and multi-scenario applications. Specifically, to efficiently extract complex deformation and texture features from the data, we propose DM-VQGAN, an effective tactile representation learner. Furthermore, we introduce a discrete diffusion decoder with a unified conditioning interface, supporting multimodal generation tasks such as images and labels, and enhances the model's generalization capability through few-shot mixed training, thus achieving compatibility with current mainstream sensors and their variants. Experiments show that VQ-Touch surpasses state-of-the-art methods in multiple tasks.",https://arxiv.org/abs/2607.14728v1,"cs.CV, cs.RO"
2607.14725,Robotics,BridgeFlow: Fast and Robust SE(2)-Equivariant Motion Planning with Flow Matching,"Xinzhe Zhou, Xuyang Wang, Xiaoming Duan, Jianping He",2026-07-16T08:53:08Z,"In robotic motion planning, equivariance to rigid body transformations is crucial for robust spatial generalization. However, current learning-based planners face a critical dilemma: they either lack inherent equivariance, treating transformed tasks as novel scenarios, or enforce it via computationally expensive specialized architectures that bottleneck real-time inference. To break this trade-off, we propose BridgeFlow, a fast and strictly SE(2)-equivariant generative motion planning framework. Rather than relying on heavy equivariant networks, BridgeFlow achieves exact spatial equivariance via a lightweight task-centric canonicalization module, enabling generalization using standard architectures. To further accelerate inference, we pair a Brownian bridge informative prior with context-aware mini-batch optimal transport. This constructs a straightened vector field that minimizes transport costs and stabilizes training. Furthermore, environmental awareness is explicitly embedded via Classifier-Free Guidance. Evaluations in dense 2D environments and on a 7-DoF Franka manipulator demonstrate that BridgeFlow achieves up to a 15x inference speedup and a 2x higher valid trajectory rate over state-of-the-art diffusion baselines, alongside robust generalization to entirely unseen environments and arbitrary spatial transformations.",https://arxiv.org/abs/2607.14725v1,cs.RO
2607.14708,Robotics,"Reinforcement Learning for the Full Strawberry Harvesting Process: Obstacle Separation, Detachment, and Placement","Changyou Miao, Teng Li, Ya Xiong",2026-07-16T08:16:30Z,"Severe occlusions and deformable plant structures introduce complex contact dynamics that challenge robotic strawberry harvesting. A policy-driven reinforcement learning (RL) framework with heuristic phase coordination was developed, in which obstacle separation, fruit detachment, and placement were formulated as a sequential decision-making task. A shared interaction-aware policy generated Cartesian motions across all task phases, while lightweight heuristic logic coordinated task progression and gripper events. A shared structured observation space was used to represent target, obstacle, end-effector, and task-context information. A hierarchical architecture combined the high-level policy with low-level Cartesian impedance control for compliant interaction. To support zero-shot sim-to-real transfer, feasibility-first observation alignment and domain randomization were adopted. The policy achieved success rates of 89.7% in simulation and 82.0% in real-world experiments. As the occlusion level increased from 1 to 5, the average execution time increased from 12.99 s to 21.73 s, reflecting greater interaction complexity. These results demonstrated effective transfer of interaction-aware harvesting behaviors to a structurally different robotic platform.",https://arxiv.org/abs/2607.14708v1,cs.RO
2607.14698,Robotics,"Lights, Camera, Malfunction: When Illumination Robustness Leaves VLA Models Blind to Color","Marino Watanabe, Takami Sato, Kentaro Yoshioka",2026-07-16T08:01:49Z,"Vision-Language-Action (VLA) models have emerged as a powerful paradigm for general-purpose robot manipulation; however, their transition to real-world environments reveals vulnerabilities to minor environmental perturbations. We propose FLARE, an optimized physical spotlight attack framework that exploits these vulnerabilities via targeted illuminations, dropping baseline task success rates to zero without any access to model internals. While adversarial training is the standard countermeasure, we identify a critical and previously underestimated defensive pitfall: naive data augmentations incorrectly condition VLA models to discard color as noise, collapsing their visual perception into a purely shape-biased processor. We expose this degradation through a diagnostic grayscale evaluation, in which the defended model maintains high success rates on grayscale inputs, while its success rate on benign, color-dependent real-world tasks drops to at most 47.5%, well below the undefended baseline. To address this, we propose ChromaGuard, a chroma-preserving adversarial training method. On a physical 6-DoF robotic platform, we demonstrate that ChromaGuard achieves 97.5% and 92.5% success rates in benign and attacked color-dependent tasks, respectively.",https://arxiv.org/abs/2607.14698v1,cs.RO
2607.14695,Robotics,Reflex: Real-Time VLA Control through Streaming Inference,"Yuanchun Guo, Bingyan Liu",2026-07-16T07:56:43Z,"Flow matching Vision-Language-Action (VLA) models promise precise continuous control, but their iterative denoising nature introduces fundamental incompatibilities with real-time robotics: global timestep injection invalidates KV-caching, forcing a choice between slow $O(N^2)$ re-computation or mathematically incorrect cache reuse. We present \textbf{Reflex}, a framework that enables \textit{real-time streaming inference} for flow matching policies by exploiting the \textit{Timestep-Invariance Property} -- that perception encoders are functionally independent of the denoising loop. Reflex partitions the attention context into static, sliding, and dynamic regions, enabling $O(1)$ incremental cache updates while preserving full-batch-equivalent attention outputs for fixed inputs. To ensure stability under continuous high-frequency inference, we introduce \textit{AdaRMSNorm}, an adaptive normalization layer that prevents BFloat16 numerical collapse by gating on flow phase. We further maximize throughput through an \textit{async pipeline} that decouples visual encoding from action generation, combined with \textit{operator fusion} that reduces kernel overhead. On LIBERO and Kinetix benchmarks, Reflex achieves a 2.58$\times$ inference speedup and 50Hz stable streaming, reducing reaction latency by up to 54\% and enabling efficient deployment without performance degradation.",https://arxiv.org/abs/2607.14695v1,cs.RO
2607.14688,Robotics,MIND-CAVs: Multi-Intelligence Negotiation and Decision System for CAVs based on Intent-Driven Autonomy,"Mainak Mondal, Yihang Feng, Yangchao Luo, Han Song",2026-07-16T07:46:34Z,"Modern autonomous vehicles largely operate as isolated agents: they rely on on-board perception and decision modules and broadcast Basic Safety Messages (BSMs) that expose only low-level kinematic state. While existing cooperative driving frameworks enable limited sensor sharing, they rarely communicate high-level maneuver intentions, and edge computing is primarily used for content delivery rather than decision arbitration. As a result, current connected autonomy lacks a principled mechanism for making globally consistent, intent-aware coordination decisions across vehicles. To address this gap, we propose MIND-CAVs, a Multi-Intelligence Negotiation and Decision framework for connected autonomous vehicles (CAVs) based on intent-driven autonomy. Each vehicle abstracts raw sensor observations into structured intent representations, exchanges them over V2X links, and receives globally consistent coordination plans from roadside edge servers. Edge agents combine learned and rule-based arbitration mechanisms to negotiate conflicting intents among vehicles, while a cloud platform records decisions for auditing and continual retraining. We implement MIND-CAVs in a CARLA-based AI-in-the-loop platform and evaluate it in multi-lane highway scenarios involving conflicting maneuvers and route-constrained exits. Experimental results show improved maneuver completion time and reduced unsafe proximity and unnecessary braking compared with isolated autonomy, first-come-first-served arbitration, and multi-agent reinforcement learning baselines.",https://arxiv.org/abs/2607.14688v1,cs.RO
