id,domain,title,authors,published,abstract,url,categories
2606.00483,Bio,Annotation-Informed Block-Sparse Bayesian Modeling for cis-Expression Prediction,"Lei Huang, Hui Shen, Kuan-Jui Su, Chuan Qiu, Martha Isabel Gonzalez-Ramirez, Anqi Liu, Zhe Luo, Yun Gong, Yipu Zhang, Dawei Li, Chaoyang Zhang, Hong-Wen Deng",2026-05-30T02:24:11Z,"Genotype-based cis-expression prediction depends on accurately modeling local regulatory architecture. We present block-sparse Bayesian sparse linear mixed model (bsBSLMM), an extension of Bayesian sparse linear mixed model (BSLMM) that incorporates linkage disequilibrium (LD)-block spike-and-slab sparsity and a transcription start site (TSS)-informed SNP inclusion prior. Across 23,098 genes from GEUVADIS European-ancestry lymphoblastoid cell lines, bsBSLMM retained more predictable genes than BSLMM, LASSO, BLUP, TIGAR elastic net, and TIGAR Dirichlet-process regression under matched evaluation criteria. Compared with BSLMM, bsBSLMM improved held-out prediction performance for most shared genes, with gains driven primarily by LD-block sparsity and further enhanced by the TSS-informed prior. Variants selected by bsBSLMM showed stronger enrichment in GM12878 DNase and H3K27ac regulatory regions than variants selected by BSLMM. In transcriptome-wide association study (TWAS) analysis, bsBSLMM recovered established inflammatory bowel disease signals, including IL23R, and identified additional genome-wide significant genes not detected by BSLMM. Independent validation in the Louisiana Osteoporosis Study reproduced the increased prediction yield across ancestries and recovered biologically relevant bone mineral density pathways in downstream TWAS and gene set enrichment analyses. These results demonstrate that incorporating LD-block structure and biologically informed SNP priors improves cis-expression prediction and enhances downstream TWAS discovery.",https://arxiv.org/abs/2606.00483v1,"q-bio.GN, cs.LG"
2605.31539,AI,Automated Prediction of Postoperative Pancreatic Fistula Using Preoperative Computed Tomography,"Ashok Choudhary, Chris Varghese, Leo Y. Li-Han, Frank G. Lee, Ellen L. Larson, Elizabeth B. Habermann, Cornelius A. Thiels, Hojjat Salehinejad",2026-05-29T16:55:19Z,"Postoperative pancreatic fistula (POPF) is a serious complication after pancreatic resection, increasing morbidity, hospital stay, and healthcare costs. We present an automatic, end-to-end deep learning pipeline-from pancreatic segmentation to classification-for preoperative POPF risk estimation and stratification using preoperative CT scans. A data set with auto-segmented pancreas volumes and surgical outcomes was used to evaluate multiple architectures, including a custom lightweight 3D CNN baseline (CNN3D), R(2+1)D ResNet-18, and ResNet-MC3-18 models. Evaluation across multiple 3D architectures demonstrated promising predictive performance. This approach offers a clinically valuable tool and a methodological benchmark for pancreas-specific CT classification, supporting improved preoperative decision-making in pancreatic surgery.",https://arxiv.org/abs/2605.31539v1,"cs.CV, cs.LG, q-bio.QM"
2605.31522,AI,Chem-PerturBridge: a harmonized compendium of small molecule perturbation transcriptomic effects,"Artur Szałata, Olga Novitskaia, Maiia Shulman, Matthew Mella, Altynbek Zhubanchaliyev, Fabian J. Theis",2026-05-29T16:38:30Z,"Large perturbation models require training data encompassing chemical, cellular, and assay diversity. Current transcriptomic resources for small-molecule modeling, however, are fragmented across technologies, metadata conventions, controls, doses, and preprocessing pipelines. We introduce Chem-PerturBridge, a harmonized multi-dataset resource comprising over 37k compounds, 136 cellular contexts, and 1.25M transcriptomic samples across eight assay types, with standardized identifiers, metadata, and replicate-aware condition-level effects. We use the resource to evaluate matched-condition agreement across datasets and replicate agreement within datasets. Matched same-compound conditions generally show weak agreement in fine-grained logFC rankings and magnitudes across most dataset pairs, often falling below same-context different-compound baselines. In contrast, logFC direction agreement is substantially more stable and usually exceeds these baselines. We further evaluate Chem-PerturBridge as a pretraining resource for compound representation learning. Under a compound-held-out OP3 evaluation split, embeddings pretrained on Chem-PerturBridge improve over L1000-only embeddings, Morgan fingerprints, and the descriptor-free OP3 baseline across metrics. An extensive molecule-holdout evaluation across 11 datasets further shows that models trained on Chem-PerturBridge outperform or match those that are not. Chem-PerturBridge therefore supports both diagnostic evaluation of cross-dataset signature agreement and model-oriented reuse of heterogeneous perturbation transcriptomic data.",https://arxiv.org/abs/2605.31522v1,"cs.LG, q-bio.GN, q-bio.QM"
2605.31498,AI,Scalable Inference-Time Annealing with Surrogate Likelihood Estimators,"Daniel Peñaherrera, Rishal Aggarwal, David Ryan Koes",2026-05-29T16:20:59Z,"A long standing challenge in computational chemistry and biophysics is efficiently sampling the Boltzmann distribution of molecules. Advances in generative modeling have been proposed to address the limitations of conventional sampling techniques by eliminating the computational cost of simulation. A promising direction is iteratively finetuning diffusion models along a temperature ladder whereby training data is generated via importance sampling during inference-time annealing. Unfortunately, these methods require computing a divergence over the score field to estimate importance weights, rendering them intractable for larger systems. Here we present scalable inference-time annealing (SITA), which retrains flow-based models to generate samples at progressively lower temperatures using an energy-based model to facilitate fast surrogate likelihoods. We demonstrate state-of-the-art performance on both Alanine Dipeptide and Alanine Tripeptide while avoiding costly divergence terms. Our code is available at https://github.com/countrsignal/sita.git",https://arxiv.org/abs/2605.31498v2,"cs.LG, q-bio.BM"
2606.02625,Bio,DXA-Derived Skeletal Phenotypes and Hip Fracture Risk: A Backdoor-Adjusted Causal Analysis,"Zixin Shi, Chen Zhao, Meiling Zhou, Kevin A. Maupin, Joyce H. Keyak, Nancy E. Lane, Kuan-Jui Su, Hui Shen, Hong-Wen Deng, Kui Zhang, Weihua Zhou",2026-05-29T14:36:31Z,"Purpose: To compare dual-energy X-ray absorptiometry (DXA)-derived hip skeletal phenotypes in relation to hip fracture risk using prespecified confounder adjustment and to assess whether phenotypes ranked by their backdoor-adjusted average treatment effects (ATEs) improve risk stratification. Methods: We analyzed 21,098 UK Biobank participants with linked health records, hip DXA-derived skeletal measures, and prespecified covariates. Sixteen phenotypes spanning bone mineral content (BMC), bone mineral density (BMD), and T-score across hip-related regions were evaluated. Confounder selection was guided by a prespecified directed acyclic graph (DAG). Backdoor-adjusted ATEs were estimated on the absolute risk-difference scale per standard deviation (SD) increase. Effect heterogeneity was evaluated for total femur BMD, and downstream prediction was assessed using clinical variables combined with phenotypes ranked by ATE magnitude. Results: Among 21,098 participants, 115 had hip fractures. All 16 phenotypes showed negative backdoor-adjusted ATEs per SD increase. The largest ATEs were observed for total femur BMC and total femur BMD, each with a risk difference of -0.0047, corresponding to approximately 4.7 fewer hip fractures per 1,000 participants per SD higher phenotype value. Conditional effects of total femur BMD were stronger among older participants and those with lower BMI. In prediction, clinical variables plus the top 11 ATE-ranked phenotypes achieved higher AUC than FRAX with femoral neck BMD (0.842 vs. 0.709), with higher sensitivity (0.748 vs. 0.443) and similar specificity (0.793 vs. 0.777). Conclusion: DXA-derived hip skeletal phenotypes differed in their backdoor-adjusted ATEs. Phenotype-level causal evaluation may help identify informative DXA measures for risk stratification.",https://arxiv.org/abs/2606.02625v1,"q-bio.QM, cs.AI, cs.LG"
2605.31296,Bio,mRNAutilus: Multi-Objective-Guided Discrete Generation of mRNA with Optimized Therapeutic Properties,"Sawan Patel, Sophia Tang, Yesol Kim, Yinuo Zhang, Divya Srijay, Ping-Jung Lin, Shambhavi Shubham, Fengmei Pi, Cedric Wu, Sherwood Yao, Pranam Chatterjee",2026-05-29T13:32:39Z,"Therapeutic mRNA design requires coordinating multiple interacting sequence features across the full transcript, where codon usage, untranslated regions (UTRs), and their coupling jointly determine stability, translation efficiency, and protein expression. Here, we present mRNA generation via unrolled trajectories and informed latent updates (mRNAutilus), a framework for simultaneous codon optimization and de novo UTR design directly from sequence. mRNAutilus combines a masked discrete diffusion model trained on millions of full-length mRNAs with Monte Carlo Tree Guidance to generate Pareto-efficient sequences under multiple functional objectives, using lightweight regressors over model embeddings to predict half-life, translation efficiency, and protein abundance. Unlike recent methods that design coding sequences and UTRs separately or rely on post hoc assembly and screening, mRNAutilus generates complete transcripts in a single process optimized across properties. Across diverse targets, zero-shot mRNAs encoding P. pyralis luciferase achieve over 400-fold higher expression than wild-type and outperform commercial and machine learning-designed baselines, including zero-shot generative approaches. Zero-shot SARS-CoV-2 Spike mRNAs exceed clinically used and commercial constructs and match or surpass lab-optimized designs with improved durability. We further demonstrate generality in therapeutic settings, including prime editing (PEMax) and programmable proteome modulation, where mRNAutilus-designed constructs enhance expression of peptide-guided E3 ligases (uAbs) for beta-catenin degradation. These results establish a sequence-based, multi-objective framework for generating functional mRNAs tailored to diverse biological applications.",https://arxiv.org/abs/2605.31296v1,"q-bio.BM, cs.LG"
2605.31236,Bio,SwitchCraft: A Programmatic Framework for Designing State-Switching Proteins,"Bowen Jing, Mihir Bafna, Anisha Parsan, Heyuan Michael Ni, David Kwabi-Addo, Bryan Bryson, Adam Klivans, Bonnie Berger",2026-05-29T12:37:49Z,"Multistate mechanisms underlie many of the complex functions observed in natural proteins. The ability to rationally design multistate proteins would have transformative implications for many areas of biotechnology, yet lies beyond the capabilities of existing deep learning frameworks for protein design. To address this gap, we introduce SwitchCraft, a versatile and programmatic framework for designing state-switching proteins based on backpropagation through compositional design constraints parameterized by structure prediction models. In silico evaluations demonstrate success on a wide range of state-switching functional primitives, from allosteric regulation of motifs to discrimination of bound ligand identities. Using these primitives, we demonstrate an in silico strategy for de novo design of fluorescent biosensors to arbitrary small molecule analytes. These results position SwitchCraft at the inception of a powerful paradigm for higher-order functional protein design. Code is available at https://github.com/bjing2016/switchcraft.",https://arxiv.org/abs/2605.31236v1,q-bio.BM
2606.02624,Bio,TadA-Bench: A Million-Variant Benchmark for Future-Round Discovery Toward Agentic Protein Engineering,"Jin Gao, Juntu Zhao, Zirui Zeng, Jiaqi Shen, Junhao Shi, Dukun Zhao, Yuming Lu, Dequan Wang",2026-05-29T12:12:08Z,"AI for scientific discovery is entering an agentic era, where protein-engineering systems are expected to prioritize future wet-lab experiments rather than merely fit static measurements. We introduce TadA-Bench, a million-variant wet-lab replay benchmark from 31 TadA directed-evolution rounds for future-round discovery toward agentic protein engineering. TadA-Bench preserves the campaign chronology and defines a fixed-data replay task: given earlier experimental rounds, models rank variants that appear only in later rounds. It provides aligned DNA, RNA, and protein views, and uses Seq2Graph, a graph-based label-unification pipeline, to reconcile noisy enrichment measurements into consistent cross-round activity labels. Random-split controls show strong interpolation, but future-round ranking and finite-budget candidate selection are much weaker. Controlled analyses suggest that evolutionary coverage is more informative than local data density, positioning TadA-Bench as a reproducible wet-lab replay substrate for future-round discovery toward agentic protein engineering; the data and code are released on Hugging Face and GitHub.",https://arxiv.org/abs/2606.02624v1,"q-bio.QM, cs.AI, cs.LG"
2605.30963,Bio,AMix-2: Establishing Protein as a Native Modality in Large Language Models,"Keyue Qiu, Yixin Wu, Lihao Wang, Yawen Ouyang, Jixiang Yu, Zihan Zhou, Changze Lv, Dongyu Xue, Yuxuan Song, Xinbo Zhang, Hao Wang, Jiangtao Feng, Zhiqiang Gao, Lijun Wu, Xiaoqing Zheng, Ka-Chun Wong, Lei Bai, Ya-Qin Zhang, Wei-Ying Ma, Dahua Lin, Bowen Zhou, Hao Zhou",2026-05-29T07:58:08Z,"We present AMix-2, a protein-text foundation model that establishes protein as a native modality in large language models (LLMs), unifying protein understanding and sequence design within a single foundation model. AMix-2 is built upon two key ideas: (1) a unified protein-text formulation that embeds natural language and protein sequence in a shared token space, enabling one model to perform biological reasoning and conditional design instead of separate downstream task-specialized models; and (2) a block-wise diffusion language modeling backbone that combines causal generation across blocks with bidirectional context and iterative refinement within blocks. This scheme better matches the intrinsic nature of proteins than a strict left-to-right factorization. To evaluate protein foundation models under realistic generalization settings, we further introduce ProteinArena, a comprehensive benchmark with time-aware and homology-aware protocols across various understanding and design tasks, and with baselines covering classical bioinformatics tools, protein-specialized models and LLMs. On ProteinArena, AMix-2 outperforms frontier LLMs and demonstrates competitive performance to task-specific protein models. Controlled experiments further show that the diffusion-based paradigm generally surpasses its autoregressive counterpart, highlighting the advantage of flexible generation order for protein sequences. We release both AMix-2 and ProteinArena to facilitate open research in protein foundation models.",https://arxiv.org/abs/2605.30963v1,"q-bio.BM, cs.AI"
2605.30831,Bio,The Geometry of Activity Cliffs: Representation Dependence and Multi-Scale Characterization of Activity Landscapes,"Pawel Dabrowski-Tumanski, Bartosz Topolski, Dariusz Plewczynski, Tomasz Jetka",2026-05-29T04:37:00Z,"Activity cliffs, structurally similar compounds with large potency differences, are widely treated as intrinsic features of chemical datasets. We argue that apart from target biology, much of our cliff understanding is a consequence of the geometry induced by the chosen molecular representation, not a property of a molecule pair itself.   We designed a six-step pipeline to systematically test this hypothesis. The pipeline consists of: assessing pairwise distance geometry, cliff enrichment, activity gradient distribution, persistent homology of the cliff subspace, predictive benchmarking for a chosen pair of an embedding and a metric, and eventually, analysis of the matched molecular pairs and stereoisomers. We applied the pipeline to fifteen configurations of embeddings and metrics to build a benchmark across three distinctive datasets known of activity cliffs challenges.   No representation excels on all criteria: Morgan Tanimoto provides the strongest cliff enrichment and cross-scaffold generalization; MolFormer cosine provides the only meaningful stereochemical sensitivity; MACCS and RDKit Dice fingerprints are most sensitive to matched-molecular-pair transformations; ChemBERTa fails uniformly due to embedding collapse.   These findings are not a ranking. They reflect the fact that different representations encode different aspects of molecular recognition, and that choosing one implicitly defines what an activity cliff actually is.",https://arxiv.org/abs/2605.30831v1,"q-bio.QM, cs.LG, physics.chem-ph"
2605.30635,AI,CellBRIDGE: Learning Cellular Trajectories via Interaction-Aware Alignment,"Silas Ruhrberg Estévez, Nicolas Huynh, Tennison Liu, Roderik M. Kortlever, Gerard I. Evan, David L. Bentley, Mihaela van der Schaar",2026-05-28T22:37:54Z,"Inferring dynamics from population snapshots is a fundamental challenge in machine learning and biology. In scRNA-sequencing (scRNA-seq), destructive measurements preclude direct tracking of individual cells across time, making trajectory inference underdetermined. Optimal Transport (OT) provides a principled framework for snapshot alignment, but a long-standing modeling question is which cost functions yield biologically meaningful couplings. Standard OT approaches rely on gene-expression distances, implicitly treating cells as independent points and neglecting structured cell-cell communication mediated by ligand-receptor signaling. We introduce CellBRIDGE (Cell-Based Regularized Interaction-Driven Gene Expression), which augments feature-based OT with a directed, typed interaction cost derived from ligand-receptor activity. By explicitly modeling cell-cell communication, CellBRIDGE improves cross-snapshot couplings and downstream trajectory estimates across synthetic and real scRNA-seq datasets relative to feature-only baselines. Notably, CellBRIDGE enables mechanistically interpretable in silico perturbations: on lung cancer data, silencing specific ligand-receptor pairs induces trajectory shifts that recapitulate expected effects of targeted pathway inhibition.",https://arxiv.org/abs/2605.30635v1,"cs.LG, q-bio.GN"
2605.30591,Bio,Obesity and Sociodemographic Factors in Luminal Breast Cancer,"Vacanti Anderson, Paramahansa Pramanik, Haley K. Robinson",2026-05-28T21:38:06Z,"Luminal breast cancers represent the most prevalent molecular subtype of breast carcinoma, with Luminal A tumors generally associated with more favorable clinical outcomes than Luminal B tumors. Obesity-related inflammation and prolonged exposure to exogenous steroids have been implicated in the progression of luminal malignancies. This study evaluated 1,928 patients with Luminal A breast cancer and 1,610 patients with Luminal B breast cancer to examine associations among body mass index (BMI), age, ethnic background, menopausal status, and receptor expression, including estrogen receptor (ER), progesterone receptor (PR), and human epidermal growth factor receptor 2 (HER2). Patients with Luminal B tumors demonstrated a significantly greater mean BMI compared with those with Luminal A tumors. In addition, Luminal B tumors were more frequently observed among patients of African ancestry relative to White and Hispanic populations. Multivariable analyses revealed that elevated BMI and African ancestry were independently associated with increased odds of Luminal B carcinoma, whereas postmenopausal status was associated with lower risk. Mediation analysis further indicated that BMI partially explained the association between ancestry and Luminal B disease. These findings suggest that obesity and population-specific factors may contribute to the development of more aggressive luminal breast cancer phenotypes.",https://arxiv.org/abs/2605.30591v1,q-bio.QM
2605.30518,Bio,Gaussian Mixture Model-Based Focused Refinement for Enhanced Flexible Structure Determination in CryoEM and CryoET,Muyuan Chen,2026-05-28T19:55:17Z,"Dynamic conformational changes of proteins are crucial for their cellular functions. Here we present a unified refinement pipeline for flexible protein structures in both CryoEM and in situ CryoET. Using a Gaussian mixture model-based focused alignment procedure, we improve resolution of small domains in highly dynamic proteins and reveal intricate conformational changes. The method corrects the per-subunit motion of TRPV1 and captures the rotary dynamics of ATP synthase within mitochondria.",https://arxiv.org/abs/2605.30518v1,q-bio.QM
2605.30463,Bio,Meta-analysis of scRNA-seq data for choroidal endothelial cells in dry Age-related Macular Degeneration,"Kyle M. Veksler, Levi Dong, Timothy A. Blenkinsop, Aurelian Radu",2026-05-28T18:38:28Z,"The mechanisms that lead to dry Age-related Macular Degeneration are largely unelucidated, which prevents the introduction of effective therapies. Experimental support exists in the literature for the hypothesis that choroidal endothelial cell (ChEC) dysfunction precedes the loss of macular retinal pigmented epithelial (RPE), which may be only a secondary consequence of inadequate blood supply. If so, interventions at the level of ChEC could constitute an under investigated therapeutic strategy. Datasets regarding the transcriptional changes in early or intermediate dry AMD are publicly available, but for some some of them the information about ChECs have not been analyzed, or not analyzed using the most powerful and recent software tools. We present here new data generated by our bioinformatics analysis of these datasets. The main new finding is that angiogenesis is initiated in dry AMD, as it is in wet AMD. However, contrary to wet AMD, in dry AMD angiogenesis fails to execute, and therefore the blood supply that supports the RPE becomes gradually insufficient, leading to their dysfunctionality and death. The data support a unitary hypothesis of the origin / initiation / etiology of both dry and wet AMD, namely that both are initiated by ChEC dysfunction - either insufficient / abortive angiogenesis in dry AMD, or excessive angiogenesis in wet AMD. Pathway analysis also reveals as perturbed Notch and TNF signaling, endothelial to mesenchymal transition (EndoMT), mitochondria, ""fluid shear stress"", ""osteoclast differentiation"" and ""calcification/osteoporosis"". Overall, the new data provide a rationale for experimental studies, to validate and further characterize these perturbations, and investigate strategies to correct them.",https://arxiv.org/abs/2605.30463v1,q-bio.GN
2605.30275,AI,Digitally enriching a screening population for pancreatic cancer using routine blood-based measures and clinical histories,"Chris Varghese, Leo Y. Li-Han, Richa Bisht, Ellen Larson, Frank Lee, Ryan M. Carr, Tanios S. Bekaii-Saab, Shounak Majumder, John D. Halamka, Mark Truty, Ajit H. Goenka, Hojjat Salehinejad, Cornelius A. Thiels",2026-05-28T17:32:29Z,"Earlier detection of pancreatic cancer is key to enabling wider access to curative treatment and reducing cancer deaths; however, screening is presently not viable. Latent indicators of pathology are evident in an individual's disease and blood test trajectories and may predict the development of pancreatic cancer. Longitudinal sequences of coded diagnoses and blood test values accrued by patients throughout their clinical interactions were used to train a custom Transformer-based neural network with a multi-head attention mechanism to predict risk of pancreatic cancer with a multi-year lead time and risk-stratify populations for targeted screening. The cohort comprised 6,017 adults with pancreatic cancer and 177,081 controls (overall median age 75, 45% female) with median 12 years (interquartile range 6.9-16.2) of medical history prior to pancreatic cancer diagnosis. External validation via leave-one-site-out, out-of-sample testing predicting pancreatic cancer 1-, 2-, and 3-years prior to diagnosis demonstrated mean area under the receiver operating characteristic of 0.837 (95% confidence interval 0.827-0.848), 0.797 (95% confidence interval 0.782-0.813), and 0.760 (95% confidence interval 0.745-0.776), respectively. Estimated pancreatic cancer risks were well-calibrated (calibration plot slope 1.08, intercept of -0.077; Brier score 0.025), and a Bayesian population pancreatic cancer prevalence update allows estimated cancer risk outputs to be transportable across settings. At testing, a screening threshold of >3.3% risk of pancreatic cancer in 1-year offered a diagnostic odds ratio of 18.2. Our work therefore lays the foundation for a first population-level digital enrichment tool to widen access to curative-intent management of pancreatic cancer.",https://arxiv.org/abs/2605.30275v1,"cs.LG, q-bio.QM"
