id,source,title,url,author,posted_at,hn_score,hn_comments,fetched_at
npr:74f0799dfc47,npr,How aid cuts are hampering the frontline response to the Ebola crisis,https://www.npr.org/2026/05/31/nx-s1-5839197/ebola-crisis-outbreak-misinformation-democratic-republic-congo-uganda,Henry Larson,2026-06-01T02:11:19+00:00,,,2026-06-01T02:19:23+00:00
npr:fac4658c62c3,npr,The terrifying day the U.S.-Iran war reached a sleepy Sri Lankan town,https://www.npr.org/2026/05/31/nx-s1-5820634/the-terrifying-day-the-u-s-iran-war-reached-a-sleepy-sri-lankan-town,Diaa Hadid,2026-06-01T02:11:15+00:00,,,2026-06-01T02:19:23+00:00
npr:b86ef4808dcb,npr,Trump floats MAGA rally instead of concert after musicians drop out of Freedom 250,https://www.npr.org/2026/05/31/nx-s1-5841889/trump-america-250-state-fair-artists-rally,Chandelis Duster,2026-06-01T02:04:49+00:00,,,2026-06-01T02:19:23+00:00
npr:d96a4bfe5122,npr,"United Airlines flight to Spain pulls U-turn, apparently over Bluetooth device name",https://www.npr.org/2026/05/31/nx-s1-5841913/united-airlines-flight-diversion-bluetooth,Camila Domonoske,2026-06-01T01:29:34+00:00,,,2026-06-01T02:19:23+00:00
npr:89abc2279c9a,npr,"U.S. strike on alleged drug boat kills 3 in Pacific Ocean, in fourth attack this week",https://www.npr.org/2026/05/31/nx-s1-5841876/us-strike-drug-boat-kills-3-pacific-ocean,The Associated Press,2026-05-31T20:14:16+00:00,,,2026-06-01T02:19:23+00:00
npr:ce4ad22df268,npr,Israel seizes medieval castle as it expands major offensive in southern Lebanon,https://www.npr.org/2026/05/31/g-s1-125056/israel-seizes-medieval-beaufort-castle-southern-lebanon,Greg Myre,2026-05-31T18:33:36+00:00,,,2026-06-01T02:19:23+00:00
npr:eaf87f6c844d,npr,Experimental pill promises new hope for deadly pancreatic cancer,https://www.npr.org/2026/05/31/nx-s1-5841859/experimental-pill-new-hope-pancreatic-cancer,The Associated Press,2026-05-31T18:00:47+00:00,,,2026-06-01T02:19:23+00:00
npr:8506af2b9ab1,npr,"Israel is extending its footprint through war. For some, it's part of a greater plan",https://www.npr.org/2026/05/31/nx-s1-5837292/israel-is-extending-its-footprint-through-war-for-some-its-part-of-a-greater-plan,Daniel Estrin,2026-05-31T17:31:09+00:00,,,2026-06-01T02:19:23+00:00
npr:0e69e1ad0345,npr,The biggest permanent desert lake threatens with rising waters and hungry crocs,https://www.npr.org/2026/05/31/g-s1-122887/lake-turkana-kenya-climate-rising-waters-fishing-crocodiles,Text and photos by Tommy Trenchard,2026-05-31T17:24:28+00:00,,,2026-06-01T02:19:23+00:00
npr:2a1fe304e80d,npr,Democrats and Republicans think control of Congress runs through Iowa,https://www.npr.org/2026/05/31/nx-s1-5836408/iowa-primary-senate-governor-trump-democrats,Stephen Fowler,2026-05-31T16:00:00+00:00,,,2026-06-01T02:19:23+00:00
npr:03d3c209ea5b,npr,"After a Memorial Day break, Congress returns to the same problems they left behind",https://www.npr.org/2026/05/31/nx-s1-5841890/after-a-memorial-day-break-congress-returns-to-the-same-problems-they-left-behind,Eric McDaniel,2026-06-01T02:11:20+00:00,,,2026-06-01T02:19:23+00:00
npr:089beb1b8648,npr,"Politics chat: No progress on Iran peace deal, Trump offers to perform at festival",https://www.npr.org/2026/05/31/nx-s1-5838759/politics-chat-no-progress-on-iran-peace-deal-trump-offers-to-perform-at-festival,Tamara Keith,2026-05-31T17:09:25+00:00,,,2026-06-01T02:19:23+00:00
npr:a55f2071ec96,npr,Former DOJ official on why its criminal investigation into E. Jean Carroll is unusual,https://www.npr.org/2026/05/31/nx-s1-5838024/former-doj-official-on-why-its-criminal-investigation-into-e-jean-carroll-is-unusual,Ayesha Rascoe,2026-05-31T17:09:24+00:00,,,2026-06-01T02:19:23+00:00
npr:350c7afb79fc,npr,T.V. reality stars throw their hats into the ring for political office,https://www.npr.org/2026/05/31/nx-s1-5836675/reality-television-politics-candidates-minnesota-texas-la,Saige Miller,2026-05-31T14:00:00+00:00,,,2026-06-01T02:19:23+00:00
npr:9fa1df476568,npr,Immigrant detainees sue over 'horrific' conditions at Texas ICE facility,https://www.npr.org/2026/05/30/nx-s1-5841359/immigrant-detainees-sue-texas-camp-east-montana,Kristin Wright,2026-05-31T05:55:06+00:00,,,2026-06-01T02:19:23+00:00
npr:69414109b71d,npr,Judge agrees to review Trump's $1.8 billion 'anti-weaponization' fund,https://www.npr.org/2026/05/30/nx-s1-5839989/judge-review-trump-anti-weaponization-fund,Bobby Allyn,2026-05-31T02:32:28+00:00,,,2026-06-01T02:19:23+00:00
reuters_via_google:0ba1fe9e94fc,reuters_via_google,Oil prices rise more than 2% as Israel steps up incursion into Lebanon - Reuters,https://news.google.com/rss/articles/CBMiswFBVV95cUxPNVV2Sy0tWUhKZW9kSnhoNHNrc3lPOW5mRV9VMnplaDhRd0NJNURQUl9CX0w1d2c2dTR1TGd4VzB6MmVWb1VCd3V3N1BHblFJWFh5TGN6UC1yUGlnanlUSVotVWdIZklOZDV2WVUzT01wRHRkOHYyXzBCUnRuMkhYYnRJbzZwcWtxaWt6R3BqTm1nUjZaNHVFZWVPT2JlVVJtMU9xdmo0Skc5VEh1MDVmcWFIaw?oc=5,Reuters via Google (Top),2026-06-01T03:26:00+00:00,,,2026-06-01T02:19:23+00:00
reuters_via_google:f03e2ad4621d,reuters_via_google,Asia stocks count on AI boom to offset Gulf risks - Reuters,https://news.google.com/rss/articles/CBMigwFBVV95cUxPRk9ON041eXk2OUtrQ0NFZTdHeXJCVG8zemM5OHkzX18tSnA5aThmdlczZ1lnZ19vN0tSenhmVTV1b05RMEJGTzdvaDVUd1pMR2Mza1lhWWtFaHVHV3V5Y2NSV1prOUtGNTgzTU56aUdaT1ZJRC0xVWloakpndUFTdWpqRQ?oc=5,Reuters via Google (Top),2026-06-01T05:55:00+00:00,,,2026-06-01T02:19:23+00:00
reuters_via_google:1ae758d06aea,reuters_via_google,Nvidia CEO to kick off and dominate Computex gathering in Taipei - Reuters,https://news.google.com/rss/articles/CBMipAFBVV95cUxOTzY0VHRMYTFjbjNtOGVXVGtlUUJtS3gtc045endOejNZbXQ4WHpTYWEtRzRSMTlXemFiTWd0Zl81NU9UVzFvMWVGaXVlSkZOVUVIdEs1WjNkMnd3bXNKNjVkckdxVUlZWllCR1QyMGFMSkRLaHB2WkcyYUNUcDJteXd0YnNkU2dwS3RhMV9DajlVSTNKM2JaTTZTQy1VM2hRcHpLZQ?oc=5,Reuters via Google (Top),2026-06-01T04:05:50+00:00,,,2026-06-01T02:19:23+00:00
reuters_via_google:f71f3bfddc0e,reuters_via_google,Tesla withdraws termination notice on graphite supply deal with Australia's Syrah - Reuters,https://news.google.com/rss/articles/CBMi2wFBVV95cUxQcFZMTy1wd0lzMFAxR1NLM3gzcjR6XzdDRXdvMFRqdFZsOTBJLXhSbGNwSVUzQmhnOVgxZE1UaGtyVEdUY3lTSXhJbVBQVHRGN3ViZ0VCbEEzVVlBTVhyNF9obnljd0l2bEFzQUZ5a2VJVkVFTlgyYXROVXRLNlRJT1hIbGkzT0JnbjVDMXVmQlpNRURnX0EzR1NXbnpQdHhuSnJGQVEzWm1RUVVnS1lLYnBiN2hPbGt3NkpEWS1IS3lCYzl4LTFjQVloTEZUWUI4eUlVU3Nqb2JUWjQ?oc=5,Reuters via Google (Top),2026-06-01T04:51:43+00:00,,,2026-06-01T02:19:23+00:00
reuters_via_google:e9e4e7046942,reuters_via_google,Colombia right winger De La Espriella nearly tied with leftist Cepeda in presidential vote - Reuters,https://news.google.com/rss/articles/CBMivAFBVV95cUxOb29NNXhFVVZiQTVSV1FSTHgtdERxWG5OeDJMSkxJTXVVbTNUMFlCNnl6RFc1M2lNcjZ0YUZ0M3JJc1NQYTIyS1BUUW5jNkVnS3FmcXdseFFleV83Rl9iRElZRFdWLWE2NWN3R09meE83UGpHT3EyMXozVmRNNEM3UXZjenNNdVJHVzVoaWh4Y1IwUmZjdWlHSFJzMmVrSFNzZ2NUTHYwZFNLdVRzOWZMLVVkX2NfazM1TFVWdA?oc=5,Reuters via Google (Top),2026-06-01T02:49:43+00:00,,,2026-06-01T02:19:23+00:00
reuters_via_google:2a72edd7047f,reuters_via_google,US takes step to halt Nvidia AI chip shipments to Chinese firms outside China - Reuters,https://news.google.com/rss/articles/CBMiuwFBVV95cUxPbURTRGdXd0FJdXdDeHdxbHFpdWdiSUZ4eG0tZ1E1UmVOSHpZbnpiNEhweC1HclNuZkt1bmd2RVowVnRvZnliTjktcGNkb3JENmRXTVJqN3lXTWNnWE5zWjV4R0dqU050Z2p2ZnJxb1N1ZTlhci0tUndRbFNPdVctOVFNM2pWcUtNZExrSFV6cjhhV2VLSGtQWTRLbTNxZjdtNFJjVTQzS0YtOXNFQWllVUJrS2dGSkxpTG4w?oc=5,Reuters via Google (Top),2026-06-01T01:09:00+00:00,,,2026-06-01T02:19:23+00:00
reuters_via_google:e037cdcfd014,reuters_via_google,Dell unveils $699 XPS 13 laptop in challenge to Apple's MacBook Neo - Reuters,https://news.google.com/rss/articles/CBMipwFBVV95cUxNOVhudnVRRDRwbjRIQXFYek5uYjB4Q191SFRVQzdpTExYamx6WjNITkpmSnppWjlDZFJ4bGVOUFo0TElfeUlGZXlIV1NCai1nM1FQQ3pGTnF5bVFpMU9nOXgxc2lqZzBoRFYtWWlQWmJIT1Z6Z0JZekpyelUwcDdtNGRnSklrZzNrV3QydlRCT0UtSGszWDhPT3ctSkI4TnNTVlNJT19Vcw?oc=5,Reuters via Google (Top),2026-06-01T04:33:30+00:00,,,2026-06-01T02:19:23+00:00
reuters_via_google:4a2669826ff2,reuters_via_google,"Syria's Sharaa holds phone call with Trump, Syrian presidency says - Reuters",https://news.google.com/rss/articles/CBMiugFBVV95cUxQXzRITzhyOHlrZkN3RUZ6eVkxY3lBQkZIbTNvWG9WWUxzenVZaTZzNTVxUDBWYTV6cmtCTDBDdU5fbE1GZjNsaGszSklXWDF3OW5hdTJSVDdSeF8wM0I2bDVCUTYxZ3JzM0h1S2hINlZhcVlvUWc5cDlSV0dvWERMeUlsZUh0NlJNaVdSNkhXc0lWNEtzczRILXdNbXZKczZBUU5LR3h4VS1DQTdjSzd2N2JwZndsU0h6d0E?oc=5,Reuters via Google (Top),2026-06-01T01:12:02+00:00,,,2026-06-01T02:19:23+00:00
reuters_via_google:bd3434a074eb,reuters_via_google,"Israeli strike kills at least two at Gaza seaport cafe, medics say - Reuters",https://news.google.com/rss/articles/CBMiswFBVV95cUxNaXhacHAzNzRXeG5EajJtUVpEVWlvX1lZR0d5S3pIczlFSGotbVFLNFE3WmRHRGVVOE9TbmhnTHZ1UElKVC05MEc5Zzh0QmZvSmRRSUhWRDkweDdlMWxfbFJjS0h6TnZUdDByQUJCUUl6VlRmTTNBcDBpTnFudnlCeTh0ZmxsTzNXcGZjNW9KSmRrZXFvQTQ3N1NmMXpocHlIdGFZMzJKN0dDdG5VaVBhek5RRQ?oc=5,Reuters via Google (Top),2026-06-01T03:31:51+00:00,,,2026-06-01T02:19:23+00:00
reuters_via_google:b6b78597b2a5,reuters_via_google,Berkshire Hathaway to buy Taylor Morrison for $6.8 billion in cash to expand in housing - Reuters,https://news.google.com/rss/articles/CBMivAFBVV95cUxNa3F2dWJCMmY3aHhrMEJieXdUcTVwZEhNTWdBVEltdkJUdUZYSzRRbThTMGRScVJBNEVMTUY2VHZLdGVqZTd0LUtVajBCcEFjTzZXYzc0VHFEV2QzSHZMckF0dXd1S1RkNFNvQUpBRjNJelRLc1dzTVc4ajVwX3pFNGxhY3ltcERwUUpZam4wVE5EZFlCMGt3NC00WkxpV3RPbHFYcnk3RGRmNkdVMm9OMmJUc1dXTkV4YmtrMA?oc=5,Reuters via Google (Top),2026-06-01T04:50:01+00:00,,,2026-06-01T02:19:23+00:00
reuters_via_google:3c8626329883,reuters_via_google,Blast in Myanmar village reportedly kills 55 and injures dozens more - Reuters,https://news.google.com/rss/articles/CBMioAFBVV95cUxNalI3YnZRbVZ0VER4eUVqRHFqSHlfVWJlUjdlbkV0WV8tYUZ6SU1aT2lEVlZSWkw1dmg1SGZ1N2RQLUdadnFoTElBa2xuTl9mWE5mMW1zLWE3cUQzUE5qdFFxRjR5ZFpyNEJDcDlodG5CM0syRnhWSHphTDRaZUY4NEpFc05PaGNMYUFtWUVkY0h5OGlibEdYd1VLYXoyalNu?oc=5,Reuters via Google (Top),2026-05-31T23:41:34+00:00,,,2026-06-01T02:19:23+00:00
reuters_via_google:658cbea75648,reuters_via_google,Two hundred hurt in post-game violence as Paris hails second Champions League triumph - Reuters,https://news.google.com/rss/articles/CBMiyAFBVV95cUxOd2stSW1GRC1BS3NDdjBUd1pIVmpuR3dITUJrWVE3bXJxdm5NM1BrNjYxcUk3ZTdnSF9pUHJaUUkxTnhJbjAzLXdva2VIOEhiN3dQY0NwbnZQalAzUlpUVm5YV1I5QUJMRzZrTWlvWkNYVnVsamRPQU5VQzJlZmtNSTZxN1A2cnZrUDJjYTRsT0hoQUtoUFBPRHQ0RHVQMzV4TmMzY2xzSlJTS1BNRTVKWHFhaWVPcWVyOFlEZmMtNV9SUnUxR0ZWRQ?oc=5,Reuters via Google (Top),2026-05-31T19:33:43+00:00,,,2026-06-01T02:19:23+00:00
reuters_via_google:8905078fdf4f,reuters_via_google,"Stablecoin demand may soon fade, BoE's Greene says - Reuters",https://news.google.com/rss/articles/CBMiowFBVV95cUxOX2RKY1lIZEwtYzlBSXN2Mkx2RU9YYXVqZmlFaWZ5V2piVTRyWWtud0E4UXByUzh2RU94WGZ2R3RVallTTmhkakFVQ21scXI4X3hMOThkT3BxSHp3UzBjaV8tLUFvcEUzbUpRX1JMNkMtTmpyeEZvWFFjQmR5R2ZXc21MejVHZGV5cFVyZVpUclRudkdOWkhQV1hoODdnZ2tNTHF3?oc=5,Reuters via Google (Top),2026-05-31T20:30:09+00:00,,,2026-06-01T02:19:23+00:00
reuters_via_google:55ccb6a80df9,reuters_via_google,Ebola recoveries bring signs of hope in DRC as suspected cases emerge outside Africa - Reuters,https://news.google.com/rss/articles/CBMi4gFBVV95cUxQZ1JnY0kyR2Y5cXQ5N3pNSFhQRmFldk11djBqTXhJTVVyNTV4dGdCSXpuNVRTVVhOYkUxWGdBdVFFTmlva0g0c05lcndjSERIdnRXZVl6ckpDX2dvZElnLURDT2FaWlZRTjlybExnNExqYVpCSnp0MEptZWVDMy14aHdmaGVzVWlFbmdTX3lYQVdqcng2MkZOd1JuNFRLclo1aHJyUnRQWVhmbzM0NzZKRGM2d1RVakJoWnZ0eVl4T0FBUkpfT3p5NmlWMTVzOVVQQm55NktSdS1Qc0JwTDF6SWVR?oc=5,Reuters via Google (Top),2026-05-31T18:39:00+00:00,,,2026-06-01T02:19:23+00:00
reuters_via_google:0e53e5b9ff98,reuters_via_google,"Colombian right-wing candidate De La Espriella, leftist Cepeda head to presidential runoff - Reuters",https://news.google.com/rss/articles/CBMiywFBVV95cUxQVzVjcmFaRWxEVWQtdW1hYWZQbVh1RENsSThxN2VPWFZKbmI1U2Izc2dJWjhVMUc0aDJCNnhmbThSRGg5VzY0Tk9wVTdBUjduQjlHdUJQNUw4SmtJd29RR0taZlFCWmJuVzBKdWRYUk0wZXpDcURYSzZtUjAwYlFlVmtid2VrWVpwZVg3QXlaYlgzTTNLdWJxemltOWxPcWNuaW02dDZyYmtYaGJBRzZJdWpHUzNGZHdUZ3QyWkphY0ZwVzdwcWdMVVlQRQ?oc=5,Reuters via Google (Top),2026-06-01T03:41:52+00:00,,,2026-06-01T02:19:23+00:00
reuters_via_google:9987ec217bf3,reuters_via_google,"Revolution's pancreatic cancer drug doubles survival, boosts quality of life - Reuters",https://news.google.com/rss/articles/CBMi2wFBVV95cUxOdDJZTVZ0dmlQVFNZYUZ2YXBoS19DaE1FZjktOHdrYWt6NE10NEJGUEdNRTJvUXFTWTdwdXZEYlNXdW93Z1lncDB4NGhnajZId0h6T2NDSHpNS0pyWmxfQ0dJVkpTVmlETEJNQjN3bXdxcDhiVWs0M04zalJ6ZGNEc1dDVWhSNVZfMlBNR2JZZHFRNFZTSzN1MDloUXE1RjVmb1k3cTVvdjVzbWU5bWRia2duemp5UGZFMEw5eUMteWVzcGxkRFFnc1VqOGZ3N05wNjk2aGdyUmpTOFE?oc=5,Reuters via Google (Top),2026-05-31T17:02:00+00:00,,,2026-06-01T02:19:23+00:00
reuters_via_google:437ccf5294ea,reuters_via_google,How Trump’s Ukraine aid cuts undermine justice for Russian war crimes - Reuters,https://news.google.com/rss/articles/CBMiwwFBVV95cUxQc3owaFpGUmRoeDZ3enhUbXJ2YVJndVdaUmo2M0F5Ujk5NEFkZzhVdFJvb01ORWlxbzhRdzl2ckY2ekxKNmJTTEJTZklJLUs4UEtrVzRaU1JUX1liWUtpUWdxVXpObER1YXQ4MnN5N3dNSXZSQVpadWhqalpKWnFwS2VHTUV2LXRTdFRUcHA4bjRNNXR3TkNJaHF2blJMYU8zWE5XQ2FWNnNWaXZ3Xzh3RzZpSTkyMTZRUGlZMDBpdWZ6ZnM?oc=5,Reuters via Google (Top),2026-05-31T15:54:28+00:00,,,2026-06-01T02:19:23+00:00
reuters_via_google:377e82d852ef,reuters_via_google,"Saudi shares gain, Qatar slips on Iran-US deal uncertainty - Reuters",https://news.google.com/rss/articles/CBMirAFBVV95cUxNZE5ycVlXQ2lyWmppTS1UaElHQzhyOEROU0hwMTBxeno2bWkzZFVxdVJIa2hRYUpRVE9nanBHNV9qTGVrMEk5ZVZ3ajRBcGpKNVJMbElKalFwQndfeDlubTlvM2J2dndOZ1lkR3RrbExaYW5BenM3TWFseHZ2RXV1cGk4enVfXzlkM3gyUUpxWXZtT1ZEWHFfYVJNbGpHU3BDSlRJTTNjdFoxdEF4?oc=5,Reuters via Google (Top),2026-05-31T18:09:33+00:00,,,2026-06-01T02:19:23+00:00
reuters_via_google:82646f14b4f8,reuters_via_google,"Colombia right wing candidate De La Espriella, leftist Cepeda poised to head to run-off - Reuters",https://news.google.com/rss/articles/CBMiywFBVV95cUxNOVZ1QjlDdk5sWXg0c2JVS0JMYjdhX2NHQXJVQnM3andDV1hJNFdoSkNlY1pYWDNPQVM3OVZCWXlNTGhzMHRJWjRueTE3LXUySV9SWTZQZng2ZjEzc25oLWt4MUpJNE9vVjBIOWotVU54SDBtZXctSGdhWlNGRjdIV1lXaUFRWERRVW1IUGk0Mmd3Y041bDVBaXJpZGY4Vkl0eXo4cW5GWnVIaDJyVkE5SW9BSGZ3eUZnN2c3ZmNBbF9Od1JaOGlDeXNNTQ?oc=5,Reuters via Google (Top),2026-06-01T03:04:09+00:00,,,2026-06-01T02:19:23+00:00
reuters_via_google:fc8c47827a5e,reuters_via_google,Malta's Labour Party wins record fourth term in parliamentary election - Reuters,https://news.google.com/rss/articles/CBMirAFBVV95cUxOVzZTLUFHeE9RLW5IOC0wbVY4OWhuSTlGbXZIWUZ5aFM5TUxtWGJ3MEdCZW0yWVFfdHlwQ0xCMkxpSThpZHFZcmdhcUtnRHN1aEFzYmJVUnJpRjZmT0plNi1RUHpKRnB5MHNiTDZHbEkwM05Tc25PQi01N3hEUzZfTE5ENzVaLTlpUF9NMldNdEF3OUU5aHpreEk3WWJPUkxSSm93a2UzeU10dUlM?oc=5,Reuters via Google (Top),2026-05-31T20:42:06+00:00,,,2026-06-01T02:19:23+00:00
reuters_via_google:22e618fd9972,reuters_via_google,How the Supreme Court is reshaping the US midterm elections - Reuters,https://news.google.com/rss/articles/CBMipwFBVV95cUxQLWZMeWNHVGx1MXZNOXFDTnNuNTVXVlI3aER3XzVRdkJsejBMOUNhQ1hzN09tZkgxNXE5eUNJWnZuajYxQlpxTWxXX3cwaWprOTlVMU1BV1NJV2c5cXljT1QtbmV1NjhVY040SnZkMDRJazRLWW9fcm9ycTdFZXRMTEgyNUZSa2NINm1sWG12VENQMUhscDdIZy1ZaERTRWdkTk9GcFJmTQ?oc=5,Reuters via Google (Top),2026-06-01T04:39:52+00:00,,,2026-06-01T02:19:23+00:00
reuters_via_google:584578b0cdd9,reuters_via_google,"Kanye West performs to 118,000 in Turkey despite bans elsewhere - Reuters",https://news.google.com/rss/articles/CBMitgFBVV95cUxNQmZlaWU5UlpGYzZwYWVCb2R5dkhMSFVBanB4bmN6bVpYRVNTZ2RZUVVZcHdwMWl3TW0wMERfTFdfSEl5azBMMklON0hod0dVTEpkNjN6ZFgxc1pmWk5nNUJLTy1TTl94cVIzQVVSVGZjV1ltRm5hRjczSlJ3dklXa2tPVkxkeERQODNYdm8yM3hRY3U4aXFiWVpnUDBlYkNPbjlneW4xcExERjRNeVZSX19zdzdjdw?oc=5,Reuters via Google (Top),2026-05-31T13:49:43+00:00,,,2026-06-01T02:19:23+00:00
reuters_via_google:6d6be0e707ee,reuters_via_google,South Africa's World Cup departure delayed in visa 'debacle' - Reuters,https://news.google.com/rss/articles/CBMipgFBVV95cUxQTEpZaVprSnBjeXc1Qjc1SEs0Q3FIa056NmZmVl9TbFdiVTZwMWRxVkQzbEZPRF92OXo3TnJNUUthMVk3TnhRd3MxdzhjWUh0YmEzWWRqNU1VdjNiMkJIdXdjbGphV25vMWtTWEpjNElKU3hZRHh1LWVOM01XYThYS0htUHY2SWxpZnpzT1o0eThjRndMVnpLTkJxWVpQcjJnQWJCR2d3?oc=5,Reuters via Google (Top),2026-05-31T22:18:50+00:00,,,2026-06-01T02:19:23+00:00
reuters_via_google:553f3875cd11,reuters_via_google,Netanyahu orders deeper Israeli incursion into Lebanon to hit Hezbollah - Reuters,https://news.google.com/rss/articles/CBMi1wFBVV95cUxQZ19uYndNRDdIVlVObEJCQjhHUnhNUTRqWTM3NFppenBsU01tWU5ILXU2ZHA3QmVHYllWU0ZQeU1nVzlITlhsUDlFTkJoU19OUXJPUFFyMDBYZ2l2a3EtSVo0YkFRQUF0bTlvOVJ3Vm40dHFGTUoyNm9ZTnlBQWltYXZxak1xLXdOQ29XR05ZNzd3cTF1MWtuZjZRZW14dWZlLWhEcHJfRzVMTlZTMVhhbHdsQ2I0S3hIY2NqdWZMUlZWNjJteVhRd19QVEpJVFBVMjdPd0NtRQ?oc=5,Reuters via Google (Top),2026-06-01T01:13:36+00:00,,,2026-06-01T02:19:23+00:00
reuters_via_google:60c6f0d4617a,reuters_via_google,Horses bolt through Rome after policeman lights fireworks at parade rehearsal - Reuters,https://news.google.com/rss/articles/CBMitwFBVV95cUxNTDEteGVLZFRqcDlfam5wQmpycnY3bDhlQU1SYnhKTHdBVnVQMXRCR1JONFZ1ZUlJdDJwNTVUNFJvU2xFSGQ1RjdXaktlajB4bFV2MmFwYWdZR0Z6eGJOZ0h0UWFNS1QyR28xVEVQcjBGX1ByUGdkM211eXhldF9rQ3hFQTFWZi1OMjcyTlRMdmlfS2ZpczEzTnNxRGhWUVVKcnkxYi03WmxFSTBwdDlTeVRmX3NXcUE?oc=5,Reuters via Google (Top),2026-05-31T13:01:43+00:00,,,2026-06-01T02:19:23+00:00
reuters_via_google:23a15e8b08fc,reuters_via_google,US castigates Europe over defence spend as NATO reassures Asia - Reuters,https://news.google.com/rss/articles/CBMivwFBVV95cUxQeW5Rc1FldFFIVWxqVFhMLW45WGM4TWlvNmhFUTdVdE9DMW1veEdxaUg2cm0zbm4xOEJ0a2pYVWZsOF9ueHB3VndHTVNIb2ZuLV9TaWF3eHREN2w5MDRNV1FSTGN6VzJwdUJVcFlTQnVDOTFiLTR5ODRvWnhvV0dLVnZVSUNzaU9HdnI0SjFjTm4wTXprRlRraGpodEMtdVEtSjl1eGxhR2ttVlZlUU16TEUxMXRDQ1BmY2g0cTNqMA?oc=5,Reuters via Google (Top),2026-05-31T14:31:54+00:00,,,2026-06-01T02:19:23+00:00
reuters_via_google:d3dbd9810b49,reuters_via_google,China criticizes Czech Senate President's trip to Taiwan - Reuters,https://news.google.com/rss/articles/CBMiogFBVV95cUxQX2VTSHZwelZuVGFleS1McnN5VVd3dUo3Nk9jTjg4Skd2RGwyMGhKOW1rRjk0RXR2bUw5WkRvSkdVNG1hSUpMNlVsYmVjNFBReU5VaDZuTkFXMUVYeVhxZ2RvT282ZThtb2l4Q0hsdDQ3aF9HTDBKZ1o0WGJIRWhIYV9zMlBrWXdOcEJaRk9ERVhEdTBGa3pnNHd3UTdtSTZrOUE?oc=5,Reuters via Google (Top),2026-06-01T00:59:43+00:00,,,2026-06-01T02:19:23+00:00
reuters_via_google:724bfc9efe45,reuters_via_google,The great Indo-Pacific hedge - deeper defence ties as US doubts grow and China ascends - Reuters,https://news.google.com/rss/articles/CBMivgFBVV95cUxNRTBQc0NzWnJaUkU5UmtiRV9yUzNVdjA1MzYxUVd5cXpEUVhqZUdsVVZTazBPX3N4UVJQWFFqYmhKelJzbGtUdjBSOHpvV1BtTlpFTG1TVEM0TUtEeXJoSWVkM0pSQ184bGc4c1hyWXRCdWdxOGlOWTZnZmFiWmRTRVdIdHN4N1d1UmZuQmZjNWhQUnRnTEVJWHB5bmZHNUFCcU80MERuQWt3ZG8wV3J2d1RUVlZFb2FWV0JiT0pn?oc=5,Reuters via Google (Top),2026-05-31T12:34:00+00:00,,,2026-06-01T02:19:23+00:00
reuters_via_google:e9066fb7fd65,reuters_via_google,"Ukrainian drones hit pipeline, refinery, fuel depot in overnight strikes on Russia - Reuters",https://news.google.com/rss/articles/CBMirAFBVV95cUxNc29NbGRQTERqM0hUOU9zc1ZhVlFIaGktVUNkRjAtbVoydV9uRGlrSDkwemFHcTQ2ZFh6WUVOd3hwb2xYTWJ3NnpKSGZ1YW8yVjI1NEk5bk5HRDY1b1B0Q1ZycWVmYktIMWVhOEdxdVlXSUc2LWtsTy1TNzUxYVh1ZjloM3NsOFR1TEVaVVVWZHFxQlk4UlRBMnpoWElnYWlxZ01OVUNhbUVCYUVt?oc=5,Reuters via Google (Top),2026-06-01T03:05:01+00:00,,,2026-06-01T02:19:23+00:00
reuters_via_google:c7f2b1de8c67,reuters_via_google,"Meteor fireball triggered loud boom across New England, NASA confirms - Reuters",https://news.google.com/rss/articles/CBMiwwFBVV95cUxNTDVFSUhTNWNzOVk5TnM0aGNpNHd0RGhXUkJVOUV6UUhtaWxRemJ6SEZVOWtsazFGaGw2N0E0dWJKWC03djVteTlCQ0R0aXR0b2pvQWVzUHViM1FEcVlfZ2s2RktxNTV1UEQxeFNNekdZdUFnTnl6aFNqcDFNd2ZfTXc5MHNMSXVrbjFrQU1yaUdyYVQ4Y3Y1UDZNN0ZtRmVuNEtpZ3RQV1N3UG9XbGpCbHd1M19hQjgwRllrZmF5NnNLZGc?oc=5,Reuters via Google (Top),2026-05-31T10:38:00+00:00,,,2026-06-01T02:19:23+00:00
reuters_via_google:739c8c78b6b5,reuters_via_google,China patrols Scarborough Shoal after Philippines warns of threat - Reuters,https://news.google.com/rss/articles/CBMirwFBVV95cUxOWDNJV0pRSjRicjNGNks3WDdjOUFDejlwSER0dng1MlBRNlVXS1BSNjgzN1hleWVPOExnM3d3QU5YYmU1Ulh2b0k5Q3hKTjlWSnNaOHBkN3BTTGU2Rml4a1d1ZGg1c2JFNVZyYlRGY2xFdk9RYmN0YmFPeGpwam42VndxMlNYWlNEUllRclFkVjZOd1NMUV8zTU5JVVBNajJrQkJUSXlTZ3hCTm1zV3lv?oc=5,Reuters via Google (Top),2026-05-31T11:20:00+00:00,,,2026-06-01T02:19:23+00:00
reuters_via_google:da846954768a,reuters_via_google,"Eleven confirmed dead in Washington state chemical accident, all bodies recovered - Reuters",https://news.google.com/rss/articles/CBMivwFBVV95cUxORXRfa21Kc2IwUXFjRTRBeVE5cTlSTWUxS0psMFZtVFNBZlIxZmh3TzdQU1lqb29JaVRaZWY2WndERHY5bVpEY2lyRkpScUdEbXREYVB3STJWbkJYMDFPcmVWQURlUVpDMWlOX0NLRUt2MHQwQVp6Q05iNC1CTHA2UUxaSENJclRtSS1tc2hfa3I0MHBvTklpRklZVzkyU0xIOURWSUlkaGdoT29nNFZxUzdkOGhnNVJTdWpoak55dw?oc=5,Reuters via Google (Top),2026-05-31T09:47:00+00:00,,,2026-06-01T02:19:23+00:00
reuters_via_google:9fbca5681408,reuters_via_google,"Japan rejects 'new militarism', accuses China of rapidly arming - Reuters",https://news.google.com/rss/articles/CBMiogFBVV95cUxPdmlJTHUyX0Z5aVh2RXE3aThmbDRINlhvcTNoMElRRHoxaXpnT1JNR0NUWnppNE5DSEdsaGFGQVM3ZWtmV0ZmWHVuV09RRTlPemFqcEJNWWEwSURpSW80WVdTT1pjOEFhVHEtQ3JyTWx2MGQwX0JxME5sTjUweXZKRTY1SFh5ZjlnX3NkVXpka3VHZjd3UXlzRzFIbDdOZGR6YVE?oc=5,Reuters via Google (Top),2026-05-31T06:50:00+00:00,,,2026-06-01T02:19:23+00:00
reuters_via_google:c32447cb9d8b,reuters_via_google,"US says it struck another vessel in eastern Pacific, killing three - Reuters",https://news.google.com/rss/articles/CBMipwFBVV95cUxOTTkybGdjbkdKMmItNnF2MEpOczJiOUdERGhEMDcxMlRuUG5mRFJYbHRBQlV4VXJoVTZ4RjlEd3c3ZzBpNFVsYU5kZW5jTkdSSVVCRWtsYUZMQUpvZmhBMzVWamZsMjQ3aV9qTTVuNEszTERrbW4yWVRwdGJ1bVgyaWl6NHNPTFZVQ0ZwZ1dCZWc1NWhidGlDYU1JMjlBY3BMNUluMG9ZZw?oc=5,Reuters via Google (Top),2026-05-31T07:29:00+00:00,,,2026-06-01T02:19:23+00:00
reuters_via_google:057971d1959e,reuters_via_google,China factory activity stalls in May as demand weakens - Reuters,https://news.google.com/rss/articles/CBMinAFBVV95cUxPanZKQzNsZFNEVm1SdlpJbnhFOWdvMUJaWFdHWHdtNkVJcFc2VUtSM2tDMHJDdG56ZkJMNXJQTGVJNmkteTZzOU5SNkFaSTVveFExU2xWdk0yT0JCbjE2RzdzNE41ZUJOX3hrNEVZOU42c1pqcFkwZ29naEFtYXhwalZ5QjVsMC1qNHJua1h5blIzejNudEFBRWFIOG4?oc=5,Reuters via Google (Top),2026-05-31T06:59:00+00:00,,,2026-06-01T02:19:23+00:00
reuters_via_google:50226004ad1e,reuters_via_google,Ukraine's Zelenskiy seeks progress on peace talks before winter - Reuters,https://news.google.com/rss/articles/CBMivwFBVV95cUxNbnY5NVdWZkNIUVdoRlo2a1lucWFHVkZHOXNWLXYwU0lOMTJQZGg1bGVRLXZQNHkzOXRXM1U2V1R0UExjNEVTdDctdkxrb3NYSmkyUXFKNmlJWlNtVXJpZjA0SVc2STVMWTIzNDZNMVlqVkx0R1F5RURGN1R4OHhPVzBaeGFIb3FYalVDdE5XX1VjTTVoRmZfc0EzUVhHMWlaTThXRVY0T3pjYmk0UVcya216YnlvMUt2TGNWLXJyNA?oc=5,Reuters via Google (Top),2026-05-31T23:01:41+00:00,,,2026-06-01T02:19:23+00:00
reuters_via_google:99c875b03515,reuters_via_google,"Jubilant PSG supporters spill onto Paris streets, some clashes with police - Reuters",https://news.google.com/rss/articles/CBMiwAFBVV95cUxQby1nOU1lYnhGZE8xREtXZVVEOXA2VkxtV2RVTEtQbnRBa0NZWEpMaExIb2h0WW9KUjhFZm1KTFMyZlBIR0ZVQUphNTc2Q3ZZdGJBdHlReHk3TE1jRlJtbzhpX1Z6d0R6TzlVTjliRHdDVktESzZmMFVZbnFKR2RoTnJyOHRrQmpNYzJEM2xXT1NqSEJtSS1SNGZfM19wUXQ4QW9tMlQ3ZXR3b2YzZHUxdVJNei14V1dhRklrNW1yLUM?oc=5,Reuters via Google (Top),2026-05-31T04:12:09+00:00,,,2026-06-01T02:19:23+00:00
reuters_via_google:29d3c6bf53b4,reuters_via_google,Taiwan condemns China after New York Times reporter expelled after presidential interview - Reuters,https://news.google.com/rss/articles/CBMi1AFBVV95cUxOSlhzRWhpQU9paWNoYkZoTUxvVWtUaUdaaW1nUWljWFdzdTM5MFJCNWR6c0lVY1ozMnM1cUZCaU82OEZXdDU1X016UjE2TVlqUWpFZlFKT0MzUDFYRHY3Z241bUx1ME9NOU5NYlA4WmRjQ2U4c0JRd2ZpTWcxSG51Q2xwWng5Y0NHODBxQ0VXWlkwODBtejVrNV8wRjhwcU90bHduWXdaQzZlajFvWmh4TTBLQzJzNGNnTUgzdWZzSHA2YkxKMjNkaHhzd0lURC04Zk9nOQ?oc=5,Reuters via Google (Top),2026-05-31T19:26:13+00:00,,,2026-06-01T02:19:23+00:00
reuters_via_google:3ab57670a33c,reuters_via_google,UK foreign minister due to visit China and India to discuss global issues - Reuters,https://news.google.com/rss/articles/CBMisAFBVV95cUxNS0R6TVd5S0tXWE5KZDIxSXhyZzJvb2tjNkNyQU1fWm1KcTJsMHZLbmFuSDcxR1EySG5ZaWhPdk1Ta1pkRTIyNHhrWEpSbXFzQUdEYUFrVVFPZS0wajZFQ3RnaWdpYWdhRkFqOGFYNmtxam9wRWZpdlBJeENxQ1VkT3Uyc0M2SlhMNnVES1YwMldBZnk0V0puem1GdUlVVHFqUVMzNHp6cUwyaXRoSlNnWQ?oc=5,Reuters via Google (Top),2026-05-31T04:05:50+00:00,,,2026-06-01T02:19:23+00:00
reuters_via_google:00a6b6f4c7c8,reuters_via_google,"India cuts export duties on petrol, diesel and aviation turbine fuel - Reuters",https://news.google.com/rss/articles/CBMisgFBVV95cUxQR0w3cW9DenowOE8wSVYtbko2azJGcFhrWXdSSGtGYnNpMXktSjRiZDREZXBXVlZIdUtCZ3o2Y2pGWFJsd1dHcFNUX0pjOVpFdE9mWWM2djQtb1RwanoxaTVqM0EyRHdOTjZyUk9RMGg5YmwyektkV3pPQ1MwdUkxWmxHT2R0eUZBOUJWZmVqb0d0M1ZwSkdUT1pxSl9KRXRJb050eEUyTVIyeGZLcHR5ak5n?oc=5,Reuters via Google (Top),2026-05-31T01:59:43+00:00,,,2026-06-01T02:19:23+00:00
reuters_via_google:09b5f9bc24d3,reuters_via_google,PSG forge modern dynasty with Champions League shootout triumph over Arsenal - Reuters,https://news.google.com/rss/articles/CBMitgFBVV95cUxNZk1HYmhocE13Y3NoUGdPWTJIeDJGUDFUQ2ROZFVKY0I0eDcwWFh3WWRSVmNNNGp6WXpNYlJkSjNQRlpJczJHTnZkVDEybjZUOVJrUmF2RjFUdmhDTFJkblZRNXBYZExmbm5ualVSd1RSck5MWWlGTGdZa0ZWa3VnVV91c3g1REZqdG9mRUZRV3ZpdjRnWkZ4cXlaN1A5VUxHaTZkaUdzWXJQMGJoRzZkVC16N2NkQQ?oc=5,Reuters via Google (Top),2026-05-31T01:20:49+00:00,,,2026-06-01T02:19:23+00:00
reuters_via_google:f1ce8a4173ef,reuters_via_google,"South Korea, Japan discuss military-logistics support deal, Seoul says - Reuters",https://news.google.com/rss/articles/CBMiwAFBVV95cUxPdUVteXZfX2g4REVVOTN3VVZ1U3Q5aGZJWEphUDZSSFdFeVdhQUZaUVpxSWNHVk95WjRaNmppaU9BeDNOM0VRbGxhd2I3VTJGRzYxd0RjRHRPelJhcVYtcWE0STctMmkwSUJDQ21zVTVpYUp2VjdWYUtyV0JOdVNaeW5EVE5YQjduTnJ2ZTU3Tm1fZlZUZENucjZGUTZ0QW91NDUwWUhhS3Y3M3lTa3YzZEJEb3NsbGRtWFk2dHFHQWs?oc=5,Reuters via Google (Top),2026-05-31T11:06:00+00:00,,,2026-06-01T02:19:23+00:00
