id,source,title,url,author,posted_at,hn_score,hn_comments,fetched_at
npr:8a11f1bce581,npr,House Democrats accuse Trump of 'hijacking' America's 250th birthday for his own gain,https://www.npr.org/2026/07/02/nx-s1-5879162/freedom-250-report-house-democrats-controversy,Rachel Treisman,2026-07-03T02:47:30+00:00,,,2026-07-03T02:13:15+00:00
npr:4dcc0ad172fa,npr,Christian missionaries have found a new (virtual) mission territory,https://www.npr.org/2026/07/02/g-s1-131124/christian-missionaries-have-found-a-new-virtual-mission-territory,Fiona Murphy,2026-07-03T01:06:53+00:00,,,2026-07-03T02:13:15+00:00
npr:bad5888aea63,npr,Even fans who don't speak Spanish are watching the World Cup on Telemundo. Here's why,https://www.npr.org/2026/07/02/nx-s1-5876380/telemundo-world-cup-fox,Mandalit del Barco,2026-07-03T00:59:34+00:00,,,2026-07-03T02:13:15+00:00
npr:048dc9fb9f8f,npr,"What to know about the Society of St. Pius X, the schismatic group excommunicated by the Pope",https://www.npr.org/2026/07/02/g-s1-131791/what-to-know-about-the-society-of-st-pius-x-the-schismatic-group-excommunicated-by-the-pope,Noah LaBelle,2026-07-02T23:26:43+00:00,,,2026-07-03T02:13:15+00:00
npr:45f83c8ef1e2,npr,Photos: Fans gather in the Bay Area for the World Cup match between the U.S. and Bosnia-Herzegovina,https://www.npr.org/sections/the-picture-show/2026/07/02/g-s1-131712/photos-fans-gather-in-the-bay-area-for-the-world-cup-match-between-the-u-s-and-bosnia-herzegovina,Meredith Nierman,2026-07-02T22:51:50+00:00,,,2026-07-03T02:13:15+00:00
npr:99b1d40d8812,npr,"The days are hot, but so are the nights. That's a problem, experts say",https://www.npr.org/2026/07/02/nx-s1-5879113/heat-wave-nighttime-climate-change,Scott Neuman,2026-07-02T21:55:50+00:00,,,2026-07-03T02:13:15+00:00
npr:69fe1c9a6008,npr,"Trump denies conflict of interest over crypto. And, Vatican excommunicates rebel group",https://www.npr.org/2026/07/02/g-s1-131702/up-first-newsletter-trump-crypto-earnings-society-pope-pius-venezuela-world-cup,Brittney Melton,2026-07-02T16:23:10+00:00,,,2026-07-03T02:13:15+00:00
npr:c612ea2448ef,npr,Former ethics lawyer says Trump's crypto poses 'clear conflict of interest',https://www.npr.org/2026/07/02/nx-s1-5877487/trump-crypto-earnings-ethics,A Martínez,2026-07-02T15:44:01+00:00,,,2026-07-03T02:13:15+00:00
npr:00a2446b4cde,npr,Going outside in this heat? Follow these guidelines to stay safe,https://www.npr.org/2026/07/02/nx-s1-5878429/heat-wave-stroke-exhaustion-prevention-safety,Carmel Wroth,2026-07-02T15:00:00+00:00,,,2026-07-03T02:13:15+00:00
npr:f8bdaed65ab4,npr,The U.S. healthcare system is in crisis. A Supreme Court ruling could make things worse,https://www.npr.org/2026/07/02/nx-s1-5878415/haitian-tps-healthcare-immigration-supreme-court,Vanessa Romo,2026-07-02T14:00:00+00:00,,,2026-07-03T02:13:15+00:00
npr:fc617e011427,npr,The Continental Congress wrote the Declaration. Is its modern descendent living up?,https://www.npr.org/2026/07/02/nx-s1-5871170/the-continental-congress-wrote-the-declaration-is-its-modern-descendent-living-up,Sam Gringlas,2026-07-03T01:42:19+00:00,,,2026-07-03T02:13:15+00:00
npr:1d9736905679,npr,"Trump raked in more than $1B through crypto ventures, federal filing shows",https://www.npr.org/2026/07/02/nx-s1-5878394/trump-raked-in-more-than-1b-through-crypto-ventures-federal-filing-shows,Linda Kenyon,2026-07-02T15:44:06+00:00,,,2026-07-03T02:13:15+00:00
npr:8f1db94f6abf,npr,Democratic socialists pose a challenge for the party as midterms approach,https://www.npr.org/2026/07/02/nx-s1-5877755/democratic-socialists-pose-a-challenge-for-the-party-as-midterms-approach,Elena Moore,2026-07-02T13:48:05+00:00,,,2026-07-03T02:13:15+00:00
npr:cd8daf9f445e,npr,The rise of democratic socialists and what it means for the party,https://www.npr.org/2026/07/02/nx-s1-5877489/the-rise-of-democratic-socialists-and-what-it-means-for-the-party,A Martínez,2026-07-02T13:47:53+00:00,,,2026-07-03T02:13:15+00:00
npr:edd4dcfa05eb,npr,Trump takes first flight on new Air Force One gifted by the Qatari government,https://www.npr.org/2026/07/02/nx-s1-5877618/trump-takes-first-flight-on-new-air-force-one-gifted-by-the-qatari-government,Joel Rose,2026-07-02T13:47:26+00:00,,,2026-07-03T02:13:15+00:00
npr:1363ed1e319a,npr,How was the new Air Force One prepared for flight?,https://www.npr.org/2026/07/02/nx-s1-5877490/how-was-the-new-air-force-one-prepared-for-flight,A Martínez,2026-07-02T13:47:19+00:00,,,2026-07-03T02:13:15+00:00
npr:7c4f7ac5684b,npr,Democratic socialists are on a winning streak. Here's what that means for Democrats,https://www.npr.org/2026/07/01/nx-s1-5872747/democratic-socialists-are-on-a-winning-streak-heres-what-that-means-for-democrats,Elena Moore,2026-07-02T01:44:06+00:00,,,2026-07-03T02:13:15+00:00
npr:8785d1cd934b,npr,Trump's crypto earnings far outpace the businesses he spent decades building,https://www.npr.org/2026/07/01/nx-s1-5877483/trumps-crypto-earnings-far-outpace-the-businesses-he-spent-decades-building,Michelle Aslam,2026-07-02T01:11:37+00:00,,,2026-07-03T02:13:15+00:00
reuters_via_google:1c49b3d1c1ce,reuters_via_google,"Taylor Swift and Travis Kelce have married in private, NY Post reports - Reuters",https://news.google.com/rss/articles/CBMivgFBVV95cUxNaFZYSk9DZEFtOFl5SE85dFUtVDZWODE5U2t2R1poTjNmcGp0dkU3TXFsdWhudzVRNkNhNTN2ZjZRRVFMTXpVWDRYSktRdDVjVzRjbzR0Y1hoSlJOdndMal8wYWhWaU5kelZBSUthRVJ6Zi1NYnpQLVlMb2dqX3ctNC1qZjQzbFJnVlJ2LU5kbFVwSDItSmtteURHV3RNdVp5Ni1uNUcxMDZwNVdSQ1dMLW55UklXQ2p4NERHdGFB?oc=5,Reuters via Google (Top),2026-07-03T02:00:01+00:00,,,2026-07-03T02:13:15+00:00
reuters_via_google:f78c8105e690,reuters_via_google,EXCLUSIVE: Meta's Zuckerberg says AI agent tech progressing slower than expected - Reuters,https://news.google.com/rss/articles/CBMirAFBVV95cUxOdGNldFRXdDZERDRIN2R3QnRmV1JuUW9saEVNdDVmTEZwdXZLSlM0MHRzN21IMlN2RTNTaDBYa1Z1YS1kVE11SUZJLUhlQktoTm1nVVp0a0x0UzFNbW5nQnhOSXJRRlkwMjY1NEVyRFVHVk5aTktfeDZ5YjRqWWxKbm5EZU1zaHFjVkh1U3hNQVBORWtVaWFyOTZUSkI1V2pfMHEyMS1pcXFwN1lN?oc=5,Reuters via Google (Top),2026-07-03T04:05:13+00:00,,,2026-07-03T02:13:15+00:00
reuters_via_google:f427aa173d5e,reuters_via_google,Trump Jr.'s 'Amazon of guns' could make millions under new proposed firearm rule - Reuters,https://news.google.com/rss/articles/CBMixAFBVV95cUxORWZydEVhQ0dMR2lfUm96Q2RXeWNvMUxDdENuXzJ4VVNZcC1PREFrVlA5U3J3NkxEaHpZaUgyamZkN0VjYmNUZzJiOTQwVjJIQ1NrS0RPeTdSX3RPcTdvWG55V3lnNkRTVUtmMEVuZzUxTmc0TlAtNDk2NTVXb2xDbmY5VElNQl9rNTZtd2FHaEhZX2VXV3RqcVMzSmZCdmdVX3U3S1JnX2xyU09STjVsZVhLNkJsTTRFU3NkZmVNbzdzLU9I?oc=5,Reuters via Google (Top),2026-07-03T00:32:00+00:00,,,2026-07-03T02:13:15+00:00
reuters_via_google:d1b901f0dbb9,reuters_via_google,Tesla launches six-seater Model Y L in US to boost sales - Reuters,https://news.google.com/rss/articles/CBMitwFBVV95cUxQdTRDeXl6RDA1TlMyYURzdkxlXzhkRzRaZS1EcFlHS2NPeXUzVlE2V3lSX05VOFhTUmtVMTdRODd6X0xLeU9kZ3dsVU81cG94RGk3dkR3UF9UMVlUQ1V5Tm1VVzZlMGhsdXUxZXJrc1Uxblk2YS0tOXJMeWJuaVhrWjR1WF84d3VFbS05VWhKRmxNN2FQQi1FUnIyaGlpekgwNDFlbTZrUmJsOG90R09GWWdzOGl4X0E?oc=5,Reuters via Google (Top),2026-07-03T02:19:48+00:00,,,2026-07-03T02:13:15+00:00
reuters_via_google:d744cfbad0ca,reuters_via_google,Tesla driver charged with manslaughter over crash into Texas home - Reuters,https://news.google.com/rss/articles/CBMirwFBVV95cUxQMjEzdnpWWEtnRzdfZkZhMGtMc0p3aTVuQlprX0FiMm1uSVVaV2s2bGtTOVkweUhGTDdRNDQ1SWhQUlprVlZtdEc2ZjN4ei1nRmdoQ0czMHIzOVFCcl9BTHBGUUxxZThBTjBpTzlYa3ZrN3h2X3otU3Vzd3NPcVNOeTBiSEZkT0tBVHRJaG1LN1hKdmpDbk5kUVM0c1dlUEVmWFZTRnJRSXNVU1kwMzdB?oc=5,Reuters via Google (Top),2026-07-03T03:21:35+00:00,,,2026-07-03T02:13:15+00:00
reuters_via_google:615be93e4308,reuters_via_google,Improving Spain outclass Austria 3-0 to ease into World Cup last 16 - Reuters,https://news.google.com/rss/articles/CBMipgFBVV95cUxPRkl3T2g0eXg0d0oxQUMtV3VfbDFLVHR5WGxrcWdVanlEOXRjZVg1MDNuaW5NWjR5ai1qUnNLTl9HNXE1WjFxZWY3VWJ1R2kybmV5QlVwU2pVcWNRLVZIdXVTZGRwRnBveEpueEhNLTVFZUxHTjJVXzdSUjg0OF9VeGJxWTFmQUdWNFBiTlhWQ1gwRHhqWk9GWWVoY1ZoQjNyOUxmTVVB?oc=5,Reuters via Google (Top),2026-07-03T03:27:10+00:00,,,2026-07-03T02:13:15+00:00
reuters_via_google:b177558a5c65,reuters_via_google,"Hungary revokes refugee status of fugitive minister, Poland says - Reuters",https://news.google.com/rss/articles/CBMipAFBVV95cUxNSUZ5NjAzaEhPR2JIbkNQR2pCRUdDYS16TEhueUM3NVR6eElEVklGVnAzYmdpVDExLTBlTTdzQWpma1lSblFOYWR5N2g5MENPM29WVUhaVWdtOEFnTllBd3VWc21JaDFrMGxZMjFrYzBiWF8wOUpwU01BU0pFcEFQSzBqbk0tVFI3MG9VX3JYQVh2dDBOTWtjQktiRkhtVFdrdDdPMQ?oc=5,Reuters via Google (Top),2026-07-02T22:25:47+00:00,,,2026-07-03T02:13:15+00:00
reuters_via_google:b5808a10a675,reuters_via_google,EXCLUSIVE: Canada aims to announce 10 countries backing global defence bank at NATO summit - Reuters,https://news.google.com/rss/articles/CBMitgFBVV95cUxOZ1JFOEl5RnFBT0phSHFEdGYzeURhcUJCNHM3MFI1czF5Q1d0Y0JXOVNUaEt6cGtTeWowSl9yRjFGNFZrbC02enRzQmpFbUMtNnNrcTVlZ1BfSzdEelAtLTEyS2kyTDhieFJSck5STmFKcWtXU3Rwdzdkb0pKUDVOb0hGOFBpQV85aHNGNFFXakREaXc2dHdLcnYzRVprV0d1aTN1LXMydlZuMFFFbmhPckJRZk5MZw?oc=5,Reuters via Google (Top),2026-07-02T22:42:16+00:00,,,2026-07-03T02:13:15+00:00
reuters_via_google:3ab6b1d52f14,reuters_via_google,Amazon to start initial Leo internet service this year as network nears 400 satellites - Reuters,https://news.google.com/rss/articles/CBMi2wFBVV95cUxQMXBabjNzR3lMMnlJcEhWbUpxNGtLMUVqcmJRcW1Ubno0elRZUXBtQ1gwblhoOFVzZEN6dUJGdmlJeEtWVFhnY3NpSmpXTGZ4MFRmS0hQTVVFTVJ6bGVJNFRoQjVtZWkzVklubVN2STZZZHhVUWp2amFjTjNMQjZqQVoxSEJ2bFpVdzVXWEN6ZTlkVjg5azlWbmVZYTgtUk5rTmZUX25KNndNZVFDb3R2VVBERTRER3lvOGRSTVFoZkVraU5kUlQ5cjJjRU5XWXROUmVIUXp0NmxlN2M?oc=5,Reuters via Google (Top),2026-07-03T00:08:34+00:00,,,2026-07-03T02:13:15+00:00
reuters_via_google:b5d98b34727c,reuters_via_google,"JPMorgan cannot stop paying Charlie Javice's legal bills, Delaware judge rules - Reuters",https://news.google.com/rss/articles/CBMiyAFBVV95cUxNb25mbTRZZFVXbW45amJzV0FWN3lBdnVBUG9nODdEVnpTS1RzRm5BNDdJSFQtWENFMmRtc2M0QUR5a2xtSjNPODBGbDFfcGpRNlZLN09vZk1kRVZxcTdNSm5xV3dPU0lUSnBaRWZWT240MU5wSUNHU2pDeDRZSTdwQ2EzXzdPYm04dmNqbXRPRzhKaVNYU1FxYlI3bm5rRl9zbjduU1VnQkxRSlBVWXVhTW42MmJDai1kaGE1LWhvdi1NVjZyZFJWWQ?oc=5,Reuters via Google (Top),2026-07-02T23:56:00+00:00,,,2026-07-03T02:13:15+00:00
reuters_via_google:38bfe83a4614,reuters_via_google,Excommunications show a Pope Leo unafraid of making firm decisions - Reuters,https://news.google.com/rss/articles/CBMipgFBVV95cUxQWXFPQUpqMEZMcTdiRE1MNEtJaUh0ekxxbFJRa1UzS0FTVDZ3TTF5ZUE2c0VUZzFmWm5WSS1QVnREb3YzZUVxYnladEs4QWNIY0tkMzRFRWZOaDA0Znc4WkI2WXVJdUZTRk5ad3hvX21LNWVwcC14blJ4WHd2bUhZWmJDaDRhYTI5UDdrM1laZ3pzYWE5SEhKOUpuRDJxcEI1Z1JGZlJB?oc=5,Reuters via Google (Top),2026-07-03T00:28:21+00:00,,,2026-07-03T02:13:15+00:00
reuters_via_google:55b2dd2c979e,reuters_via_google,Rescuers save trapped man from Venezuela mall rubble nearly eight days after quakes - Reuters,https://news.google.com/rss/articles/CBMitAFBVV95cUxPSGpodTFFdm9hM1VIbUJVM18tS1RpT2lFQlVjMmNMTExTNUZnenJlV0pWZGZYak1mR0ZLYmg4VnVUSTVxdFBfbXBqMDlWS1J2eTlBcUZXekQyd1I1NzhhUnBGWE9leG0tYUNnTFFZTGpkOGFmYm1GZ18ycS1nbDVCcUhFZDY4Qy1HcjROZmtweDVmQnh4VzhvdkFpa1B1R0hqRGdhMnJoU25jTUs1TGZucHpOZGc?oc=5,Reuters via Google (Top),2026-07-03T04:14:49+00:00,,,2026-07-03T02:13:15+00:00
reuters_via_google:b48ec8074b1b,reuters_via_google,"Trading Day: Chips are down, and so are payrolls - Reuters",https://news.google.com/rss/articles/CBMimwFBVV95cUxQLXd6N2hYVEtXSklabi1QdDBWMEU0ZW1OUExWR1hhSDNJNGFrMkNKalRHcXlOdnFVLVVYTldrVlBOTXNzWml6MEY2RHVxcGI4Wl9NRlM3R2U1ZkJFbGQ4RVJFQkU4MXQzbG5UVDlVSTBleEpYQUdvaWFJSG9ydHFtRlBhM0ZwT3kxOGEteGxlQVJ4Q0p6RmdGYVBIUQ?oc=5,Reuters via Google (Top),2026-07-03T02:11:28+00:00,,,2026-07-03T02:13:15+00:00
reuters_via_google:6e2092d2c2f5,reuters_via_google,"Weak jobs, declining labor force, could renew Fed debate over state of labor market - Reuters",https://news.google.com/rss/articles/CBMiwAFBVV95cUxPdUpDX2luM3c3a29IMjNVQXk5dC1ueC1YUTNPeHVyUE1HSHN4d3hDUnItSjgwMmRZUW1ncjd0UWVXTFVIR2s0YThWbFEzSUtzVGI0NWloc1ZEdXMwUVl1aGFLTURkSVEwWGdTbGw3OS0zOW1pRVlGV0l0RUN3cTM1UTRfcjIzZ2wzSEtUbjhBVVpmbXlyazRtLTZ5akR5U2dNOTU1YzhJdTJNdzdHWlVLT2pITUhienp6ZXotYVBqX1Q?oc=5,Reuters via Google (Top),2026-07-02T21:28:14+00:00,,,2026-07-03T02:13:15+00:00
reuters_via_google:592d28590dba,reuters_via_google,Google disrupts NetNut proxy network used in malware operations - Reuters,https://news.google.com/rss/articles/CBMiuwFBVV95cUxPMXVETV9LX2tTaWpfLVBTcURPVXlnTi1vLUxYcnhqclRvQ3RJalpMdXBFSTROblplMXNGOU5VTDduMWNDeTk2cDMwcWNnYVA3TUVnTzRaU2ItazU4R0JYXzRabEx0LWJfNU9ndHhUSjVHU2dLYjRjLUJoc2JUeUJrVHY2MkZkRXpLQzBvX2NIbFJIUllaTHdyY21OLUxfclZ5b1J4aFViT0F6a2FnUW45Y2J1MHdfNzY4RmRB?oc=5,Reuters via Google (Top),2026-07-03T02:43:31+00:00,,,2026-07-03T02:13:15+00:00
reuters_via_google:b364e83fda91,reuters_via_google,US job growth slows sharply in June; labor force participation rate at more than 5-year low - Reuters,https://news.google.com/rss/articles/CBMirwFBVV95cUxPcC1JUDBLdzUyXy1CSEd3TV8tc3BUcUVheXREal9lcXhza1NIVlVHcHZrYWZmYmtSV2Q2SmdpdW9KbHIzTzFpeElNUGlNTG5MTnN0WFpwN2tCVjBpRGZzbTk2Y0VwMzQ0WDA5dTdkclhmVndRZnB0YTN3QXVzcUtvMl9qMXhSMHJ0RUY0WjJlN2h2RTZIWi1yaXZCOC1qcVAwS1RRcWxyckQyeXR4VW53?oc=5,Reuters via Google (Top),2026-07-02T22:43:00+00:00,,,2026-07-03T02:13:15+00:00
reuters_via_google:e4e5c6eb8485,reuters_via_google,Peru declares state of emergency in 40% of districts ahead of El Niño rains - Reuters,https://news.google.com/rss/articles/CBMisgFBVV95cUxQTjQtWGhzT2hhQ016X1d6Z1BCRFBLUnBrQ0dtV04wS2xtLXN1SkhseGRUdE9uS3pQWmU0S1JPN3h4UHBieDZLOWNCd0J5Vk9weGx2Wk9ZUW1WVkpHekNrcGdGQmt1d3RKd2NhdmZzTm5XZUJpb2NvNnVLYVNLTlRfbWI3UE5sNjFxcmlMS2k2VndWaUFUUU5kYjZyOTU5cGxsMUZSNDVteHcycE9nNUNpa1BR?oc=5,Reuters via Google (Top),2026-07-02T18:44:57+00:00,,,2026-07-03T02:13:15+00:00
reuters_via_google:934caf92917b,reuters_via_google,Microsoft launches firm to help companies adopt AI with $2.5 billion - Reuters,https://news.google.com/rss/articles/CBMiwgFBVV95cUxObWVCMGFFWk1NRWJKRmI5T0hzWmxuNXZoUUM3VUJlNjY4RzZuU2tVRWNwZXliQlRNNDZZbFhSdHlBc2dQUzl5TS05YjBjOENFVTExaU0xMGp0TU1WemlYNDlEazNMSTRSXy1MSDJ2RnZZcHMzcDZiTVFQaDBPWUhYQWhDalUtUFE0Z21YRVltY29jR205dVc0Q3JiOWE1UTdwanR0VGlhRkJqYTZRVVJyUXZzODltSUNlZkJkS3RDelR6Zw?oc=5,Reuters via Google (Top),2026-07-02T18:01:58+00:00,,,2026-07-03T02:13:15+00:00
reuters_via_google:f5fae9d00aca,reuters_via_google,"What to know about SSPX, the Catholic traditionalists in new schism - Reuters",https://news.google.com/rss/articles/CBMiqAFBVV95cUxNYmdaSWlxVEE0SjJjVllXSE5xWUhmOW9pc25IWGVsYWxLYXQxcXJRaWw2SXpZazRNVzVpZnFHMVhqTzg3b2FIUlNrdGw3SlA5NVd2NDluVDBRUkpWb25PLVF6a3c2eExFTjNIdUYyZGFFT1EtUUNXeWRNRVNyQ3Buejd3NjI0ZnRBdXFEYWF6aXdKRVlkaGZjbjYtRGJlWGZpOGU3bFVUYW8?oc=5,Reuters via Google (Top),2026-07-02T17:25:44+00:00,,,2026-07-03T02:13:15+00:00
reuters_via_google:a46be083cc72,reuters_via_google,Tesla quarterly deliveries set record; European recovery raises hopes of annual growth - Reuters,https://news.google.com/rss/articles/CBMi0AFBVV95cUxPeWZHTktUcmFRU1MwcGdiZVRlajZncTROdU1wTHg5MkN3aFZFQ3NuYWZFV1A4eWtnRTk5cEFBWUVEMlJoUmRjZl9TbEF3MHkxNUFiY0puWlh2enZxLURfRFVPRjV3MlNoQndBYlY2TjhfSi1QUG80bDdQRjl2cmljTTE3a0UyNkhQUTd6NWlXVTJuVXV0NS01Y29YTWJlQ1NKR1JQVHFYN2RSUUtFb21iQUc3SmVQc1o4UlZqdHpJbzB4RTVMT1VfOFJMck5lN25K?oc=5,Reuters via Google (Top),2026-07-02T18:07:00+00:00,,,2026-07-03T02:13:15+00:00
reuters_via_google:04e3a70ced8f,reuters_via_google,Iran prepares to bury slain supreme leader with week of mass mourning - Reuters,https://news.google.com/rss/articles/CBMiuAFBVV95cUxNZDFZb2Q4bXdRa0pnRGtueDdUd3ZWQ1VyMHFsVlp5WGx6aGdtM2dxRW5YWDhLQVhSNV9CUFBNLWMwTnp4NTZ5NHN1UmxCR1RBYW12V0NEcE40NUZTNWI5NjhlNkx0TmFHV2NfTk5YWmtuczdEUGdEU1lpQlg3YmJmNkJ1OUthT0E3V2pKNGVmSmF2QTdnR2hhVzV3Q3pqTkhQdlBjc1hrZS1fdDE0UHVJNzkyOWVBNVpP?oc=5,Reuters via Google (Top),2026-07-03T04:14:03+00:00,,,2026-07-03T02:13:15+00:00
reuters_via_google:35fafed2445a,reuters_via_google,Watchdog faults Secret Service for missing 102 radio calls during 2024 Trump shooting - Reuters,https://news.google.com/rss/articles/CBMiwwFBVV95cUxQRkZDeEN2OFd5OWtVNmhGMDlWaWo4aGd3TGtiMnBUYXNCM3lyWC1la2V5REJ4YnROT1RQNnpOOG5BVXhwRm5pd1BkUjdVbkNrenh0OXFaYk1lQjJ6UWEzbVZaWFAtX0pBREJEdUlOVkdvdzRnOUppdEpwZXV0a1FIZzRhV0l2TEZQV3VwTnM4bUIxNHdVLTdiUFRvdnhmSmk0S0FjbUJ4SnZuZklZcXpFVFVpMDRyRF9ULU1WZXZnMExicWs?oc=5,Reuters via Google (Top),2026-07-03T04:19:54+00:00,,,2026-07-03T02:13:15+00:00
reuters_via_google:e4f23714c2ee,reuters_via_google,"NATO plans to replace AWACS with Saab GlobalEye jets, sources say - Reuters",https://news.google.com/rss/articles/CBMiuwFBVV95cUxQTlhnNGJETDB0b3N2bjA1MF9YUEpzNGVsdTVTeEt0NGRXVnc2azR0ZnZhWjhfcHZVV2NuOXU3eXROR0hURkZjcmJTOGI3NWFhUjF2ZWJfY1VhanQ1R3pkTTQ0VTktZk5mdHhVeUtUVmdPUlFJYlByUGQwOWd2bFkyUE9mMWFSUDNGRWNkNXE0OE5lVjVmWGFFcDFpRTBrQ0FVZGtOM1FQeVM1UEQ0ankxemxOWWtSeFlWN1g4?oc=5,Reuters via Google (Top),2026-07-02T22:13:56+00:00,,,2026-07-03T02:13:15+00:00
reuters_via_google:4e035ee9843d,reuters_via_google,"Trump administration and Anthropic have not discussed the government taking a stake in it, source says - Reuters",https://news.google.com/rss/articles/CBMiwgFBVV95cUxQbmxpNnJVaWFGeUpNcXgtMUpYSGxwblVfTkM2TTluOFduQWF4X2VJM2g5Qkw5dEl0X3ZWTmNOUWJDUTVZVTBaenp0TklNcWp3ZzZNRnFqSmhjSXZ3d3Aza0hVUXA1Y2VMUnI3MzhCalhUV2lzRUtESmxyOTNKakF2TjBvaVpLZDdKVlVoVm1MSk5TTG9CalBySkxvc2hnVU92ejVMOXlWbTJnYlRScWV6d3VfeGFuYlBpb3NjcDZkV3MwUQ?oc=5,Reuters via Google (Top),2026-07-02T22:33:09+00:00,,,2026-07-03T02:13:15+00:00
reuters_via_google:a1958118353c,reuters_via_google,"EV maker Rivian raises 2026 delivery forecast on strong demand, shares soar - Reuters",https://news.google.com/rss/articles/CBMiwwFBVV95cUxPaFpBcEVDMklWQzdOZDQyQUxjejNST21mTUZXaW5SVGFRclVBQVZaWjJLSVh4LW9zc20wUXc3UkN1UDRUaEt1bzFNUi1PNERiMzNYcUlvQ2pnbkZkXzhGQVQ2d0NJZTZ6dDVnVGxiMXduREJOdncteFhZOEtnVGpTejIycnhMWjJtRUFtQXFxTkluSWpKanJtOURvV0FGeUtBbTRDVVhidmNtbGZnNzBhQW1rME0zVzllVEtjeEZSeGtnYUE?oc=5,Reuters via Google (Top),2026-07-02T19:56:10+00:00,,,2026-07-03T02:13:15+00:00
reuters_via_google:056902d73f57,reuters_via_google,"Blast at Damascus cafe kills nine, wounds 20, Syrian interior ministry says - Reuters",https://news.google.com/rss/articles/CBMiswFBVV95cUxNQ1FuZFNuTEZTUUhkZmNuOFJ1VXBOR3JCNTJSeWE1bzlGUm5LSGZ4aGVWREdueU9uckxILVUzMzlyZWprdDc0cXBzQnVBR3h0YXJta2hBdG0yS3IyS3cwYWozN3UzNV9xTUpySFVkQW5FR2sxUmIxbmRabml3RTh1eGduZDF5RmtaZkZKT2hRQXNZYXBvc1UtbUhvT25rSHRMY0RkSHRYOHp1cUtOempvQWZ1WQ?oc=5,Reuters via Google (Top),2026-07-03T02:26:41+00:00,,,2026-07-03T02:13:15+00:00
reuters_via_google:b7d3330705b5,reuters_via_google,"Germany's Merz unveils pension, tax and labour reforms - Reuters",https://news.google.com/rss/articles/CBMiowFBVV95cUxPeC12SkJFeXFXYUY5eDhRMnV6TUloNWtndnExTVpQaUxlaVY3eUExR2Fxc21IeVNLYy14Q3pxemtTVVBydlZ4S3AyN1JVU1MydDZPakN1S3VsekVnRFJIVkN1RFVLcjBWb0prckdBU3BETlBJN192NERFV2RqblJ4dWc1d3pSV1pIZ1l1eUdzd3BZVXlNcnk3cFNUaUVPR0xKVGFR?oc=5,Reuters via Google (Top),2026-07-02T15:51:43+00:00,,,2026-07-03T02:13:15+00:00
reuters_via_google:53e371bf05eb,reuters_via_google,VIEW Job growth falls short of expectations in June - Reuters,https://news.google.com/rss/articles/CBMilAFBVV95cUxNWUUzbG92ZDFRNk1abkpzdGdBU1BfRmxodElHS1FQanBnNXUwTDZMQ1M0VGlsWFdRNGVhcTlwalZCQ1dyVmdlMEdzam80cUI5YktvVW1uVGZYTTlqMWdvSlhDV01ObGxRT0M5ODFjT2lkQ1ZGOU1LNlpHS2hIMEZzQWQ3U081X2tQUEl4bkxaN3A0S211?oc=5,Reuters via Google (Top),2026-07-02T18:28:58+00:00,,,2026-07-03T02:13:15+00:00
reuters_via_google:efa4870e87f5,reuters_via_google,Rebel Catholic group in Switzerland unrepentant over excommunication - Reuters,https://news.google.com/rss/articles/CBMiqwFBVV95cUxQbE4xcUNabERUSTRoNVlsNzJXZ181c1BVTDlMSnh1M19uaFRTOWl2azBzOUkzOE5SSDYzWFVlRlpTT0xnc08yTDFadlRfWWxjMTItdFRGazFIblVKVU4xU1NmbkMxMUFvTjl4cTFsQlkyNmRoUFFWdGVaWk5oMzkwVHJ4YnM5Q3VUU2NBRWFIOEZFSjBSV2l0SlgyZkhoTldXeFR1TXh1Y3FJWDA?oc=5,Reuters via Google (Top),2026-07-02T21:55:43+00:00,,,2026-07-03T02:13:15+00:00
reuters_via_google:929761b92657,reuters_via_google,Trump administration says the ICC has no jurisdiction over Americans - Reuters,https://news.google.com/rss/articles/CBMirgFBVV95cUxQTEIzRlZrYVhrNkJiOGhSZEJCdGs4U3doRWMxYkxtcnE2TklHVmc1ajBELXdQX2hBdzNKVG5ZU1ZZeWRvN2laTXhNR2NGZ0V3RjlsUy1BelRGZEJoLWFmWEdxZzE5ZnhKUUFKVUNfV1RHYnBKOW91ektWWDUxdHdDSGVQaHl0cFowemYxT1hYbHIxSG50aWdCVHVSQnZXVUo2cTk3Y3RsV0dVajg3aFE?oc=5,Reuters via Google (Top),2026-07-02T22:21:57+00:00,,,2026-07-03T02:13:15+00:00
reuters_via_google:457ae5424ba7,reuters_via_google,"Rebels in Indonesia's Papua kill American pilot, burn plane, spokesperson says - Reuters",https://news.google.com/rss/articles/CBMi0AFBVV95cUxNWThBR2drem1BZlZ3X2l3cUNHOXZuc3NlOUNpaWpQQm5kZDlZTDdMa2pTZ1JQb2lBUzVwNGp5MzZkYnAxSk9fN0pCVUJQQ281S0Q4ZHBQS285RFhxaTAzcWI1YjZZREZabmRQX3RqX0VEZ1dLc1J1M0R3UGhpUldOMmpqZkFCbUV1bEx1cjlEd2RoTWE1RC1BQkxGcVZYa2Rxa2tuUllPQ2JiU1VrZHA0WDV4cWtjV3RUMFFxdzZzcUNVR042VERILURhd25kUmxR?oc=5,Reuters via Google (Top),2026-07-02T16:36:50+00:00,,,2026-07-03T02:13:15+00:00
reuters_via_google:2de302f01634,reuters_via_google,"In Mojave Desert, startup JetZero builds novel plane to take on Airbus and Boeing - Reuters",https://news.google.com/rss/articles/CBMixAFBVV95cUxQODlBMGR6ekk0QjBFTDFZZVdSWWF4UTV0UnBIQ0J1QW4wWmJJZFZKX21jSGFJSWtzSGw2cVFBcVNJdGlHVkpkNUNZcTVRSHFBQmpNcS15TjZQbG9kbEN1aGhMaGQxelBocEtsMFFETlhpN2N5TlBZSzZodDhDYnBySkhGS3dNei1heTlONjZ6ZUhjMzdMcjFQVkhidHZOVWYxRmFLci1ndmhwVFNJeE9oNDZaSXhKVFdvUlQwTWt2X0JZLUhv?oc=5,Reuters via Google (Top),2026-07-02T15:23:44+00:00,,,2026-07-03T02:13:15+00:00
reuters_via_google:a8ff8a3a8e40,reuters_via_google,Cooling US jobs data buys the Fed and stock market more time - Reuters,https://news.google.com/rss/articles/CBMingFBVV95cUxQTGg2SFp1b01MWjdIT3J0dDdEd2ZkRkNnZmJDQkVzQ2tTa0hubXN6cmthRjVWd2FGUE1fcHNpQjhWYlY3UXdodjNiUGFQaXlnSVc1TmFudURlLVduQTlOakEwMFk2MG16WWlKM0hySnpUNlNtd3RHdWtjSEU2bEN4VlVSc1F5dFRqdHFKcnNoWVJ1N2xlbEtUMm15RWNKdw?oc=5,Reuters via Google (Top),2026-07-03T00:59:29+00:00,,,2026-07-03T02:13:15+00:00
reuters_via_google:c8a19f26d95b,reuters_via_google,"Trump wins court reprieve from restoring slavery, climate park exhibits - Reuters",https://news.google.com/rss/articles/CBMiuwFBVV95cUxNNTVXSHdXOGVoM2ItOWVvdllJTENuM2xsQkkzdk1ST2hXTUcwSUFZY1AxUFJkWVRMTGthSHgzbW1TVWRXaFp1VHhGVmQtTldGek56bkpYNVd3M1VhdjdpRmt3NVhsWTlhSnQxTkJ6WGcyTFhiRHlCNTZQa01lenFjM0h2bFAxd2hqbDNZX0VQTGdvT1FhY2dxa3dWeHYxaU9TV1d5bmRkY0FDYXl1YnJycnBkczJQSjhjMkFV?oc=5,Reuters via Google (Top),2026-07-03T00:36:30+00:00,,,2026-07-03T02:13:15+00:00
reuters_via_google:d355e0f29293,reuters_via_google,Trump biofuel goals hit reality as US plants lag - Reuters,https://news.google.com/rss/articles/CBMinwFBVV95cUxNNVg2eFE2c2lWUWZnVElTOGZlQlBHbTJhdFBSamM5MGpDNVlVSzVxYThLeEhDTW4yYllrZTBuWXdTeWFzNGlWYlJ2dmM0S0djcnF5UWY1TFRSUVN6VFZiQW9KZDNIS1d3OVRuVFVLRWp5SDkyRzkzMWo4bjdPUS1DZTNXcWFqdjZ3MHJQOTNDaGo2VFgxd1NJNVRQN3g2S00?oc=5,Reuters via Google (Top),2026-07-02T22:00:43+00:00,,,2026-07-03T02:13:15+00:00
reuters_via_google:d554246ba009,reuters_via_google,"Genuine Parts receives bid from O'Reilly for auto unit, Bloomberg News reports - Reuters",https://news.google.com/rss/articles/CBMiwAFBVV95cUxPMUZ3VUZqU0RGZi00U21SY3V1MDh3cUVhSmZPd2lYSjJGNm55ZTh2d3lNWGh5d1hjdC1jNU1fYWVJWG12Y0JEaFJReWc2aHJEWnRwek03cFRfYmdZdkxyQzMzbk5QNjJZMDZib3VHZDZ0TmQ1bjI0ZVhiN1ljTmtKYmh4eVpQdXA3M1ZCWEhMZ1pCQkFIVmZremVURHdvc1hXY01IV0xQQ1VKa0pJU0wyUThpUjE1Z09RclFXTzJtQ0g?oc=5,Reuters via Google (Top),2026-07-03T03:01:46+00:00,,,2026-07-03T02:13:15+00:00
reuters_via_google:770f1485b825,reuters_via_google,Eight monks killed in Thailand after 11-year-old boy crashes truck - Reuters,https://news.google.com/rss/articles/CBMiugFBVV95cUxObFhJeE8ybVRRSUtRU2xKdWlIUU55aEdkSFlxM0I4YW1NcEFvd2JuUF9BZHZFcnU5Ym02eG42RGtjZl9DR0UxSFMwWXpsSEY1NWZiOUczNkJ4ZkEwb0FPUnUzWVlQNElrWVo5SjFUOElrdF8tZFJuYU9pZjI3YzRMTnhRd2l1OVBHUk9fcmlYcC14VDZXRjA1bG02dHpJT1psN0hrTUlNZDZ1dHBDcENqWTkwSEltdlFjeVE?oc=5,Reuters via Google (Top),2026-07-02T18:51:49+00:00,,,2026-07-03T02:13:15+00:00
reuters_via_google:38de6010ee01,reuters_via_google,"Dow jumps to record closing high after soft US jobs data, Nasdaq down with chip shares - Reuters",https://news.google.com/rss/articles/CBMinAFBVV95cUxQNmlSQU1CX2FPdk85U1ZHQjBSbHFXZDZ3VjUxNDg3THFOeUFyM0tiQURWczlyLUVxYm9QR0g5ZW5mcVA2bXVEc2QydjlQdkpfNHkxeTFzbXdxRkZVQ21lS2lXVVJQSktrWUVrY1pqUXdRN2VJdmpyWnRhT0ZncG1MT1RvZmpOcF9QcV91RXJ2SzBiQmpHd0ZHbkZNQzE?oc=5,Reuters via Google (Top),2026-07-03T04:11:39+00:00,,,2026-07-03T02:13:15+00:00
reuters_via_google:241914b1dac8,reuters_via_google,California man admits sending fake ransom notes in Nancy Guthrie abduction - Reuters,https://news.google.com/rss/articles/CBMiwgFBVV95cUxPRU40R0JTZjJmdDJ4Uk00RHR2NWFSSEFXVE10OFhLRGNTRW5RbXZaYm52YVVEZG1xbkhmc2t2ZFREX3dxbFZzOXgxdXZtSThmamNOV2FJUG9YXzhxSEJ2U29NYXJOWmtxRHVNN3ZaSHBJc19sQnVGNmw1b1psZmJUTWRnWF9kTTRIYXZMWkd4bjQxSVpnTkZWMDBHUmRSRFdnT05mOHZ0SnAxcTZnNFpXVktObXphYW9VM1RRb3ZHOHVQQQ?oc=5,Reuters via Google (Top),2026-07-03T04:51:00+00:00,,,2026-07-03T02:13:15+00:00
reuters_via_google:26db373a32b2,reuters_via_google,"Russia, after heavy strike on Kyiv, says it will keep increasing pressure on Ukraine - Reuters",https://news.google.com/rss/articles/CBMiugFBVV95cUxPMkhON3lDMVBhSDBIYVBMX09vTUZqdWIwUkRUWkNFaEVFY21Gd0tBMVpscER0YzhMZDBtUjdWQVd3YWR6bzRxNjlyRUZVaUswMHFZNGtFeVBZVVFLVlRtUWJaampkb2dWWGxFaGdtb3NGeE9BeXgtNUo4Q0R0ZU1iNHhkTlNLc1NTVVNwOE4tbEgxREcwYXcydGNieXpRUkVfbXdYZVFhc2pQRTZlTnI3ZnFZS21sc2ptbWc?oc=5,Reuters via Google (Top),2026-07-02T15:02:34+00:00,,,2026-07-03T02:13:15+00:00
reuters_via_google:3a7077d16266,reuters_via_google,Lithuania moves to end nuclear weapon ban as 'situation getting worse' - Reuters,https://news.google.com/rss/articles/CBMiogFBVV95cUxOUmplNlV3ckJjbDhxWE1ZcXVkUTFZaENXenhBMWFwU3l0QWt0bUtVb3A2Sl9CNlBJVFR1d21VejBMMEszUHI2NkZXNUw1amxNMUlkb0x5Y1I0dlpLbUpfd2VGbVpJT2NPRnBlc1JmNFgtTTVwQXVZeHNCaG0xY0UyYjlRYlR3UXBlTEFuRFR3UU5RR1N1Vy1tdEZFaVVza1M2d2c?oc=5,Reuters via Google (Top),2026-07-02T16:35:17+00:00,,,2026-07-03T02:13:15+00:00
