id,source,title,url,author,posted_at,hn_score,hn_comments,fetched_at
npr:a95d9623478e,npr,I wrote about George Santos. Then he made a violent threat and lied about it,https://www.npr.org/2026/06/04/nx-s1-5846966/george-santos-kalshi-threats,Bobby Allyn,2026-06-05T04:39:40+00:00,,,2026-06-05T02:00:51+00:00
npr:d19cfc31fdca,npr,Republicans' sweeping election overhaul fails in the Senate,https://www.npr.org/2026/06/04/nx-s1-5751145/save-act-senate-vote-trump,Miles Parks,2026-06-05T04:19:56+00:00,,,2026-06-05T02:00:51+00:00
npr:6528a891a078,npr,Weakened public health powers raise outbreak risks,https://www.npr.org/2026/06/04/nx-s1-5846943/public-health-mandates-limits,Rob Stein,2026-06-05T01:36:34+00:00,,,2026-06-05T02:00:51+00:00
npr:efaff79dbf17,npr,NTSB says United jet was too slow and too low in Newark landing accident,https://www.npr.org/2026/06/04/nx-s1-5846909/ntsb-united-767-landing-accident-newark,Russell Lewis,2026-06-05T01:10:47+00:00,,,2026-06-05T02:00:51+00:00
npr:4c7cfdfae62c,npr,"New York City reshapes mass transit system to handle World Cup, NBA finals crowds",https://www.npr.org/2026/06/04/nx-s1-5846797/new-york-city-transit-metro-mta-world-cup-nba-finals,Brian Mann,2026-06-05T00:16:22+00:00,,,2026-06-05T02:00:51+00:00
npr:d8352d7758c1,npr,North Korea unveils a new plant to produce fuel for nuclear weapons,https://www.npr.org/2026/06/04/g-s1-126041/north-korea-unveils-a-new-plant-to-produce-fuel-for-nuclear-weapons,The Associated Press,2026-06-04T21:33:54+00:00,,,2026-06-05T02:00:51+00:00
npr:3d9f8a539a5b,npr,"Embedded: ""We Keep Us Safe"" from NPR, KUOW and The Seattle Times",https://www.npr.org/2026/06/04/g-s1-120825/seattle-chop-zone-murder-antonio-mays,NPR Top Stories,2026-06-04T20:48:49+00:00,,,2026-06-05T02:00:51+00:00
npr:ce6627ae96f0,npr,What will it take to get a vaccine for the Ebola strain driving the current outbreak?,https://www.npr.org/2026/06/04/g-s1-125822/vaccine-ebola-democratic-republic-congo,Jonathan Lambert,2026-06-04T19:12:46+00:00,,,2026-06-05T02:00:51+00:00
npr:4b2e286251c4,npr,Gun control group sues ATF over records release,https://www.npr.org/2026/06/04/nx-s1-5846418/brady-sue-atf,Jaclyn Diaz,2026-06-04T18:19:46+00:00,,,2026-06-05T02:00:51+00:00
npr:c7b1d8cf40e2,npr,Hezbollah rejects ceasefire deal agreed on by Israel and Lebanon,https://www.npr.org/2026/06/04/g-s1-125942/israel-lebanon-ceasefire,Jane Arraf,2026-06-04T18:00:18+00:00,,,2026-06-05T02:00:51+00:00
npr:3e748329ff7d,npr,Trump's attacks on the press often focus on women reporters who challenge him,https://www.npr.org/2026/06/04/nx-s1-5846590/trumps-attacks-on-the-press-often-focus-on-women-reporters-who-challenge-him,Tamara Keith,2026-06-05T01:02:56+00:00,,,2026-06-05T02:00:51+00:00
npr:c32adeb4c57c,npr,Republican lawmaker on why he voted to end the war in Iran,https://www.npr.org/2026/06/04/nx-s1-5846569/republican-lawmaker-on-why-he-voted-to-end-the-war-in-iran,Tinbete Ermyas,2026-06-05T01:02:54+00:00,,,2026-06-05T02:00:51+00:00
npr:dd3c0bc3c295,npr,"The Trump administration infrequently backs down, but it did this week",https://www.npr.org/2026/06/04/nx-s1-5844656/the-trump-administration-infrequently-backs-down-but-it-did-this-week,Linah Mohammad,2026-06-05T01:02:52+00:00,,,2026-06-05T02:00:51+00:00
npr:0812c16a6a0c,npr,Are Trump's controversies affecting his agenda?,https://www.npr.org/2026/06/04/nx-s1-5845049/are-trumps-controversies-affecting-his-agenda,Steve Inskeep,2026-06-04T21:26:54+00:00,,,2026-06-05T02:00:51+00:00
npr:4a6d6461050a,npr,"Senate to start debate on ICE funding. And, Israel and Lebanon agree to ceasefire",https://www.npr.org/2026/06/04/g-s1-125937/up-first-newsletter-ice-funding-package-trump-netanyahu-federal-workers-world-cup-weather,Brittney Melton,2026-06-04T17:03:42+00:00,,,2026-06-05T02:00:51+00:00
npr:31eb04112e91,npr,Rubio says white South Africans 'assimilate' easier when questioned about program,https://www.npr.org/2026/06/04/nx-s1-5844925/rubio-says-white-south-africans-assimilate-easier-when-questioned-about-program,Michele Kelemen,2026-06-04T15:46:49+00:00,,,2026-06-05T02:00:51+00:00
npr:087a4ee4e0d1,npr,In photos: a preview of the Obama Presidential Center,https://www.npr.org/sections/the-picture-show/2026/06/04/g-s1-125899/in-photos-a-preview-of-the-obama-presidential-center,NPR Staff,2026-06-04T14:00:00+00:00,,,2026-06-05T02:00:51+00:00
npr:312b407763ec,npr,"National Guard has done little to reduce violent crime in D.C., a new study finds",https://www.npr.org/2026/06/04/nx-s1-5845073/national-guard-washington-dc-crime,Kat Lonsdorf,2026-06-04T14:00:00+00:00,,,2026-06-05T02:00:51+00:00
reuters_via_google:3884c357859c,reuters_via_google,"US House backs Russia sanctions, Ukraine aid, in latest blow to Trump - Reuters",https://news.google.com/rss/articles/CBMiqgFBVV95cUxNYU8zSVNZN0FKTnFpdlNVNmdPVkZyTFNJanZsclRyNmNRaEozcnYwd093VVVrRzE1aWp3RlRDeUw0dXVqMk1KcURLZlptSGc4LVl1bkJLV0dlQjk2ZTlCY3BLTDQ1UFE0enk1VjJlMWJIM19WbmhMWlVvaEM0X0FJTDNPUHlUTGlNZGhPYWF4TmpaUEtjbmVPSGpQUnNaTEJLQkc2bTJxWVpQZw?oc=5,Reuters via Google (Top),2026-06-05T05:30:00+00:00,,,2026-06-05T02:00:51+00:00
reuters_via_google:4eefbab1f211,reuters_via_google,SpaceX blocked from early US benchmark index entry as S&P reaffirms existing rules - Reuters,https://news.google.com/rss/articles/CBMiuwFBVV95cUxPbTAzV2FHV3hsblRSbVVxemQxQmVUNHBpdEd2X0d6VkxYSkthM0R6RThacV9mNVNlWGg4NHM2NVZIZ0JHMTl0TjA1TTJOM2J0MGNab2FISlVDMkRLU1BPaUZLWkhicTFtdHIzOFBia1htbWxVVkM2Tk5BeTVJVnJONC1MVm9PLXpRdy1CXzYxNzVfWGJGZFBaYzY4SnVBNVpEaTU1LV9ZUkVEWEF5eU5aOVg3aklPY055SVNN?oc=5,Reuters via Google (Top),2026-06-05T03:13:00+00:00,,,2026-06-05T02:00:51+00:00
reuters_via_google:d8397284fb8c,reuters_via_google,Trump says he does not need deal with Iran to get enriched uranium - Reuters,https://news.google.com/rss/articles/CBMiqAFBVV95cUxPM01DUG5YdTR1eWk0WTA3MGlTcDh0Y1g0N0ZlYUEwQTAwRWNKc3hFenJncXJ4M2hwS2ZQMlV0d2dITVU5ak4tand0WEN0MHNEZTFCYnBxc0hiSE53cnBHcmdVYXpvSGFCUTVQMFJjR2hmenFjMWdxck5iXzdRV1Q5blUzT3RLT3BsZjZCcWo3WHBYamNNdzQ2WDE1Nmp2MGFDN0lsZ0hzdjI?oc=5,Reuters via Google (Top),2026-06-05T01:35:51+00:00,,,2026-06-05T02:00:51+00:00
reuters_via_google:f9a397eaacb3,reuters_via_google,China's solar majors charge into batteries as panel sales falter - Reuters,https://news.google.com/rss/articles/CBMisgFBVV95cUxPN0RpVVJWSTY4SUtGd2psVFFvMEVrN1dYTVhxYTZUSkVZTXZZczJaMkNSZ09XNlc0STdZVVJ6MW9wOHJmN09HRE9FYVFzbkJqRXU4VHVBZ3N4VWluaXZpeThPQ0FtUmMzbGpmQzJCM1VCRi1XVmFmZm1FeVpVbTdLbU9oR3hJeE9ycXFXMDV2MDNXekJLaWtDUWFlNHBqNTZNc25nWVEtcGlCVVQyU0xEeEpB?oc=5,Reuters via Google (Top),2026-06-05T04:32:31+00:00,,,2026-06-05T02:00:51+00:00
reuters_via_google:068eda12d07b,reuters_via_google,Trump says he will not nominate Pulte to be permanent intelligence chief - Reuters,https://news.google.com/rss/articles/CBMirgFBVV95cUxOMEhXWFFyc0llY0EwWDB1N1hmUUd1bkU4TXFSQ25nUlk0T3d1S21rZE5OV0ZFTHFBQnpDQlc5bk9ZWm5NeVdzeEZ0b0plcDBUMVVBNFZhN21vMWNXcjUxUmJTTHM4NDJPckJYQW5peVlCQzFrT1JIejFvR0pjREk5bW1EU3RsOGJZb3J2c3c4SGwxUDJwcUFtSk9WczBET1FTVjFPUUNLZy1DUktwVkE?oc=5,Reuters via Google (Top),2026-06-05T03:35:39+00:00,,,2026-06-05T02:00:51+00:00
reuters_via_google:5958d8c8dfaa,reuters_via_google,"US imposes sanctions on Cuban president, Treasury website shows - Reuters",https://news.google.com/rss/articles/CBMirwFBVV95cUxQNXk2ZUh2VE54ZXNtVkZXUmx4SmJFUnBqajhoRm85ak1lak5KVnc1cVQ0d19KalNsczFZV2F6ampHX2twNG1mcVpwWEZLRVlrRzJsVmtOMENocHNNWXVTU1FKN2NrcGtBY2MxcVlaTHJoVmJpRi1hWVB0akRuR2V2YXJoUFRaTXRRc2JFVzFkcElVdUdzWUt4U1pHQnVzVjMtMXRsc3JNMFRIX0Y5UlNj?oc=5,Reuters via Google (Top),2026-06-05T03:46:37+00:00,,,2026-06-05T02:00:51+00:00
reuters_via_google:1f43e86d9e24,reuters_via_google,Trading Day: Who needs tech? - Reuters,https://news.google.com/rss/articles/CBMipgFBVV95cUxQa1EyNXlRNjlFTlBFOXFHeVVZQk9selBMeUdNNVE4SE9tUlF1akdfX3VBX0RmQlhYZXFrZzZlZHViMFRaTE1TUWpxZUZqVDVyX1VCeXRnV1V5ZC1FQzdIRU5tTmFvSTZUaUVWUFlKOTFIV2VXYW5kZHdLanRTQlZNUE91YU0wdjF6eWZYbHR5RVptYTNqWmpOLWh0OU5ydjkyaDVDUUxn?oc=5,Reuters via Google (Top),2026-06-05T02:05:40+00:00,,,2026-06-05T02:00:51+00:00
reuters_via_google:53bc7d725c4a,reuters_via_google,"Putin sticks to hardline stance on war in Ukraine, but says Trump ideas could bring peace - Reuters",https://news.google.com/rss/articles/CBMijwFBVV95cUxOVDRlWGI2Vm5JaGFNQ2RNVUI4dzRQc1JBLWV0TllYalVTUEN6NnEtREpRdDFlTGJ6NFVfR3c3VElnODVHc2hLMXA2MXgtLUlzRzY3Z3h3bVh5ZVFYNkl6TV9DbU5INGlRUEpXWjdNM1A4cFRIRGJZc2dKaXVlcU1ueE1uNElGVDhjUzZWcWxjNA?oc=5,Reuters via Google (Top),2026-06-05T03:25:32+00:00,,,2026-06-05T02:00:51+00:00
reuters_via_google:6c5eda5977c8,reuters_via_google,"Qantas weighs order for 20 Boeing or Airbus wide-body jets, sources say - Reuters",https://news.google.com/rss/articles/CBMiyAFBVV95cUxOR0hUd0hYNVZmMk5YM0x4VU1GWlJCd0UtV3ExZEhWbVhBQTEwQkFianpyX1U0dENoaEQtWWR3M3lCNldxZ2JOU3Fjd2lBVHVNRld0bXZKeFZtNkxST0JrY04zUHlUamZRbkRQako0c0FLMF9MUjU3OE5RSzRUZGhHQk5ybUhhMGIxa1lSRU9aektSSzRDcmhSb3U0NjNoTnQ4UjhKVXMxMnhocmp5UXRtZmU4czg2NG92anRoclVSUlFaX0h3VzFYTg?oc=5,Reuters via Google (Top),2026-06-05T02:04:57+00:00,,,2026-06-05T02:00:51+00:00
reuters_via_google:e1a774d2c36c,reuters_via_google,Starmer calls for Elon Musk to stop interfering in UK politics - Reuters,https://news.google.com/rss/articles/CBMingFBVV95cUxOMWh1WGVEWXR4UFZkdEFWdlFvRTdNeUNtX1p4U0hNWnlvd1NlM1laZ243UFN2NTFMQ2FqUnhrcTVSbE9nVm9jYUJnR2FsbmpBZ1REc3RwbWMxdEhMQkY0ODREbXRuZXk0Mm42T0JqTHdTYk5jUmRxUnF2aWtFM2Y3WWJ4MjFpMmVzNlNpNkN4TWMtRTRiYTlnU2huZU1BZw?oc=5,Reuters via Google (Top),2026-06-04T22:13:44+00:00,,,2026-06-05T02:00:51+00:00
reuters_via_google:e5c3863d9b56,reuters_via_google,"Zelenskiy, in open letter, invites Putin to talks to end the war - Reuters",https://news.google.com/rss/articles/CBMinwFBVV95cUxQMkZhWnVxeU0zSy02QnlmbUFKeGtVUmNXM3NNWEtvc3RXOUZ5VUc4Rkw0WUlaS09FbGx4bkZfc3lMSnc1TEZSLXZOMTZQVHpZSnJSbktBWklGSGNKeDJlVk5CMjNsZEowRDRpOHlWb1Y4QUZNVkp5MzBrS1poWVVDMDYwS3ByMHBmRGxGS2c3VF9SUEo5bnBzeXhrMkhqZWc?oc=5,Reuters via Google (Top),2026-06-05T04:07:40+00:00,,,2026-06-05T02:00:51+00:00
reuters_via_google:028a56f3b86f,reuters_via_google,Explainer: How Trump's ceasefires are failing to stop Middle East violence - Reuters,https://news.google.com/rss/articles/CBMitAFBVV95cUxOSmpJX19sVWJhRlNTaXliaENGNERBNml5RjhpcVNoczhXVzRYeHloci1NNElZVTExd19kb01Tcmg3bGNXTVFxczFOTjlCaHlxUmo0SmNnZExwanBsaFN2YmFROWJSNnRNZ3J0R2ttRmFBSjJZRzlDendBQmMzUVlPUUw0ZjBSQ0lkZ0l6ZDZ5czFmX1V5WEpjZU9lZ2lzS243bmpvb3FKYV8zZGhuWExCRnJ0Zkc?oc=5,Reuters via Google (Top),2026-06-04T22:34:12+00:00,,,2026-06-05T02:00:51+00:00
reuters_via_google:9f98769336dc,reuters_via_google,"Canada says AI strategy will help create 250,000 jobs, boost GDP by 3% - Reuters",https://news.google.com/rss/articles/CBMixAFBVV95cUxNU3JZNXE3SUNxX2g1dWczV0ZKeGJCY2xGa3ZuUGZESHQyeGtWWS1oWkRFc0Nod192S0dBZzhURzREODlPOVRjbmZmaHAzRGxBaC1UeWtZWGlsOW50elBKdnQ5Zi1rUDdxU2JrQUllQXljYVN3bkVkZmNWdzBJMGh1OGRDZHJLdWN2MmVRcWl5OEx5UTkxUWphTWF1SDBLb3JyczJuRjNlMlVjSmgySDRBaXdyQkZnMXQ1M3RmVzZRWnBTV2Jf?oc=5,Reuters via Google (Top),2026-06-04T20:49:43+00:00,,,2026-06-05T02:00:51+00:00
reuters_via_google:72ffd09f0664,reuters_via_google,Trump directs hundreds of millions of dollars to support coal using emergency powers - Reuters,https://news.google.com/rss/articles/CBMiugFBVV95cUxNWmt4MmlhUHI0SjcweUxuY181M0VRa2I3cHNqZ3c0enFRN1N0a3AxYXB0TkFXM2E0M25mLWEwTjZ3ZDNUa0RQMVRhclB5MjR2bnpKMFlMbU5WTVVHT3FVUGowN3hNTjJ5eEQ0MzBhTGVrcVpmRy1ITVFIVG55aFp2M0J2Z1F3WjItMm1mUzkxS3o3a3lmZGxvSHllVUgyUkJhSzN5RW1zaEVnNDdmZ2NwYm9ldlljcmFvMFE?oc=5,Reuters via Google (Top),2026-06-05T02:51:43+00:00,,,2026-06-05T02:00:51+00:00
reuters_via_google:dcf9f468f14f,reuters_via_google,First IAEA report on Iran's nuclear programme since February shows little change despite war - Reuters,https://news.google.com/rss/articles/CBMiygFBVV95cUxOd0ljYkZKSjRhZ3B4bHVaYXY3eTdSUlhwWEJ5M1FFTmxMOU9NLUVVWVhuT1pZaDdPSmhlZGd3eUhoWkZ6OGx3UVU3SS13VVM3dnNnU2gzSkpMVXdfUU5NRU9DRVgxd2wxZk04UlNjalVScEtYdUlud3JUS3U5UUdsaF9UaXlRMkhrQVZKbGRRbUI5V2diNkZDaURDVndJS3NjSHJyRHBYYzFPUko2bGdsTGNoTmFJd2gweE1aNXRfUmNyVF9RdS1CcUpn?oc=5,Reuters via Google (Top),2026-06-04T20:32:34+00:00,,,2026-06-05T02:00:51+00:00
reuters_via_google:f776e6ae09f9,reuters_via_google,"Ex-Trump adviser Bolton to plead guilty in classified documents case, faces $2.25 million fine, sources say - Reuters",https://news.google.com/rss/articles/CBMiugFBVV95cUxNRzRzb3NwVzlKVWhRcEV3VXhlYUxLOGIyeDhqNDZCanlfNTVwNmlkMTd6TWMydHRoWWlLTUZ2LWhPM0J1Nm01WEstTkdab09LRmxvVHJ0TzM1a1c3aWRTNUFqNVdoTGMwaEg1Y3V2MXZaY1hhZGxPeFNBQXQxYTRyQU1DYW5SZVNmN0gxdDhBSWwySXRhZEdQUFA3NmdTclNCWjZPOVpBQ3dCWHhIR05GRVpwWm5HNzJxTUE?oc=5,Reuters via Google (Top),2026-06-04T19:36:00+00:00,,,2026-06-05T02:00:51+00:00
reuters_via_google:8ad5eecc2388,reuters_via_google,Trump 'anti-weaponization' fund sparks Republican infighting as Senate considers ICE funding bill - Reuters,https://news.google.com/rss/articles/CBMizAFBVV95cUxPV2JOTFZ0a2ladkRMdnhVMG1GN3Nvb2FUVmphb2F4djdZM0FORWU1ZXU4NG1YVmdJOWVNV0tXRVNTM3k4d0l6YTZVWl9kRzVoVUcydVlmVG1BSDNGcTgyem9XblhGZDFWRU5vaEdCZ2VGM25UbVVGOVN0RVZVbTh4eVhUa2g1MnpaZXRHVVM0Wk10WGpRSmRQSENFbWUweW5QX3pwZXdRN0MtSWFWOWJoNU5vQ05pUU92NzY0Smp1VWdjaDdqT0JRa0Q5NXc?oc=5,Reuters via Google (Top),2026-06-05T02:24:07+00:00,,,2026-06-05T02:00:51+00:00
reuters_via_google:67537255d23f,reuters_via_google,Several injured in Boeing 787 nose-gear collapse in Frankfurt - Reuters,https://news.google.com/rss/articles/CBMiwgFBVV95cUxQUHJsX2JOODQxbWRId183NVNZWFMwZmtQQ0Z4M1c3TEgxbXNMeTdyWmxvdGI1S1ZaRldEVjBNbzk2U0RFMHhWM210ck9rWTZmWEI5TFlxelpsYnRDRkd0bFNzMWtpR3FpYm1udnpoLThjcHZWWTg5a215ZmpISURlNVRZUG1ZTWhHSlhqMWlwWXRHVFNQaVg0MFp4b3NFTHl3YXFNU093UVk2X0F4X3IwRzVNUjAwakkxSnVHbmwzN2ZKUQ?oc=5,Reuters via Google (Top),2026-06-04T21:20:30+00:00,,,2026-06-05T02:00:51+00:00
reuters_via_google:0b387f02f495,reuters_via_google,US Supreme Court backs FCC in clash with wireless carriers over fines - Reuters,https://news.google.com/rss/articles/CBMiygFBVV95cUxOQUJ2Y1VPZDlraEFBV2k1b0hLdnJ6a0hVRV80Vzh4YU5MQnpJM29IMW1na3dBczdpbUhBVDkxV3RBUGNTT2VnZzcwb2M1bUtUbUk0cklELUs1YXBWc0s3Um9kVnVvUURkVEFibEFid3hMSDVWNDA0TGNfc1oxZnozQXJEY2JwdHpDM0hYV19VWUNjUV9XTjlHR24zV09hYUEzWklaV05Cdml5aEJaazdrTnZKTnVwLTQ4VmMzbEw4VklqeXBqQzRoRVln?oc=5,Reuters via Google (Top),2026-06-04T23:43:34+00:00,,,2026-06-05T02:00:51+00:00
reuters_via_google:f7bb108df106,reuters_via_google,"Germany and France pitch swifter benefits for EU hopefuls in Balkans, Moldova - Reuters",https://news.google.com/rss/articles/CBMiqwFBVV95cUxQa28xR1B3Uk5HMHkzeTYzMEFJN3lWbUJxSkVzQWVMTXcySlE5OTNVVXBGbV8wZGJjYThkd1Z4TG1qMEhJLW1mQnktbm40YlRJZmMyQnFPYlR6QzlXcUUxcWRVSDJHSWw1N0hFY0ZhZmpyR3RQbkJYb2RKeW55UHktN2oxYWxxU1plcHM2NXdFcW1CR3JPXzRfTnBaVTQxVGJfbktvd2tQdFhUVDQ?oc=5,Reuters via Google (Top),2026-06-04T19:33:43+00:00,,,2026-06-05T02:00:51+00:00
reuters_via_google:121c29da23aa,reuters_via_google,FIFA unveils Netflix World Cup game timed for 2026 tournament kickoff - Reuters,https://news.google.com/rss/articles/CBMitgFBVV95cUxQTU9DNWZMeXRSdlJTNUdLaTNIR1ZZNlYxSmlGeWxqOXA0czF0T2FFdFM0NVVQX1RMNExMRGxWX25Gek5WTndPeWxQNGtPaEVTV0pjYmhJbGx0cGR3QmdfSnIxUVJBTno5SEMtVFd0RnRJMWg5MWRsZDNsMDItTDI5Q0t4VXZvbnRPcWJFSjdzV1l1aTRhSERpT3RPRU81YVd1YmpKQWhoNEpsXzJyVmhodzJsMUs4Zw?oc=5,Reuters via Google (Top),2026-06-04T22:12:03+00:00,,,2026-06-05T02:00:51+00:00
reuters_via_google:63b6cd2f70f6,reuters_via_google,Sweden's Gripen faces moment of truth in Ukraine's air war with Russia - Reuters,https://news.google.com/rss/articles/CBMiwwFBVV95cUxPOHk3VjVNOTFKcUNHODctLUFYb1JGNTBKejd0Rkl2enFVTFhyTGVXNElLLXBfcTV4YkJDbFFSNGNPelAzQXBKVUlCNzQ4eDhacEh0VnNQbjMySUl0a3JMOEF0TUljV2JYM3k0Y3BKamdBT2NZVTFDQ2ZnYzlwRFhka29aZFA0ZUcwSWJEanV5emk0bkpNXzhTLUVTWlBydUhnbmJrdURrTDZ4TFFyUk5BeDRGci16UldubjlQNTNCMFVpWWc?oc=5,Reuters via Google (Top),2026-06-04T21:02:38+00:00,,,2026-06-05T02:00:51+00:00
reuters_via_google:3574c1cd59ef,reuters_via_google,Congo reports attack on Ebola burial team as cases rise - Reuters,https://news.google.com/rss/articles/CBMivgFBVV95cUxPOHkwT19LYjQ5TklxZ2hpZjh2ZGRCS0FTeWhfQkxJZUlacEZWOG1oMEdYODdtaGo5RloxakFOVVBSNENoUmduWVM1a1NtWnJUSm5JUG1jMmQzbjlSOVc0a1JhZy1NdHZXYmFFMUNnaS1qbXJxVWpyeGhENzBHZWlyQWxVUGJOYXdVTVBrU3VZNjEybnFWaG9OM3RwS29GZDJ3R3NKdWZ5UFJSNnZWNFVGbGl6UXhRa3VVLTNZQkVB?oc=5,Reuters via Google (Top),2026-06-05T00:27:13+00:00,,,2026-06-05T02:00:51+00:00
reuters_via_google:00f9d47a0ac5,reuters_via_google,Pinterest deepens Amazon partnership with $4 billion cloud deal - Reuters,https://news.google.com/rss/articles/CBMiswFBVV95cUxNekkyUG52N1ZxMVNaWWNqWVRkbUJubm5pUklIeFJtN1g0WndxRk1MZTBRRWlHQ1RERWUyM3UzLXJVWjFTc1EwNFZrVHlPT3F4aVhPTHd1aWFIbUhrc01YVzdoZXRXTDVPUGxIWXdRV3ZaTkpxaTh0NmMzRG01TXlQdUxXVWhsZ2YxdjlfbGZjREZTbjRoSUlQNFJrZjJlVkp4MUpEVldCOEJUTzgzNTY2ajJCOA?oc=5,Reuters via Google (Top),2026-06-04T19:59:43+00:00,,,2026-06-05T02:00:51+00:00
reuters_via_google:e212d21d9f1c,reuters_via_google,US weekly jobless claims increase to four-month high; worker productivity revised down - Reuters,https://news.google.com/rss/articles/CBMizgFBVV95cUxOT09NS0RiRDI4MHVvRDZEVTJUTkFYUHNtQjJIdjF3ZHNleEJPQndjYWdERE9aUXJSWms0QWFMTUlVU2JydEVEZnVnSG5TeW03WDhEZEVTQjdEWi04Ry00TkQzV1BLRDdkeHEzZEZ3dmV3cEJnWXE4blZWYWcxM3hqRm45UHd2NXFmMnQ1NG1lMmlBbklxS3dkaFlkV3h0YVV5WWJCTlJNZDA3ZnFTZGtnS3ZaT0hRRWNfX1Z4MzZ2X1RfaVBaRW83ZXlJWWxCQQ?oc=5,Reuters via Google (Top),2026-06-04T19:55:16+00:00,,,2026-06-05T02:00:51+00:00
reuters_via_google:de4abd424431,reuters_via_google,US Supreme Court backs generic drugmaker in 'skinny label' patent case - Reuters,https://news.google.com/rss/articles/CBMiqwFBVV95cUxPZllIOFNLRzBNQnNSWkd5ekVlYUgxNXp2TDh6WW4wWTBjb2xFWmhwVjRzV2tlVTE1RmdhWFpueTc2WWhCNm9LTHp3b2hMSDg1cnBNUnJIaHQwRWMxWVd5Y0I0UWs5N0hIcXNTcU5SeWp3U2swcllvNTRYcWdrM1R3MG1XZXpUX1dlMWZxM1NXMnZmNWlqd2Z0LUVaOWo2NW5SMFlvNDBtaHNoczg?oc=5,Reuters via Google (Top),2026-06-05T01:53:07+00:00,,,2026-06-05T02:00:51+00:00
reuters_via_google:8211d0e3a396,reuters_via_google,Blackstone private credit fund caps withdrawals as redemption requests jump - Reuters,https://news.google.com/rss/articles/CBMiowFBVV95cUxON1huNXhLMFFvODlLdHlNeXlQMkdld1FlbUM0MGswOHdTbjMzTFRKci1neXlLdGh1RG1Ra3ZqdXJKTXJaQWpFUk44dHlyTFhiRHdWOG5jTk9QSzlCY0xnUTByNEJvWVBIVjRrM0RqRUhLYmdpeEk3dFlkcnlmLTR0aFJFSW5DekVrX2RuUWktOGdrVFlwUy0yX2ZyX0NmNWxFaGdn?oc=5,Reuters via Google (Top),2026-06-04T22:08:10+00:00,,,2026-06-05T02:00:51+00:00
reuters_via_google:fbdd6b7a0c9e,reuters_via_google,Anthropic says AI labs need coordinated plan to halt development if risks rise - Reuters,https://news.google.com/rss/articles/CBMivAFBVV95cUxQTGoxa3dtZXpiZGo2TmpRNTJoeHY5TXV2U2VQN3Z3M0l0TDB1Mm5SSkZMOElLNlR0TGFRWDZzTXZKNU0wS3N5dEZaaUFQenE5OXYtc0RycnUwOE8wMm82TXJqTFlUdi1zV0ZrQzlPaUY4eHQ1MWEwYllGdmVhczZlb0JXeHFVLU1BU2tZdThBd2ZDNi1pUjlNclJLSlRQXzNHWFRjM1VBU2FpZGVpNmxEaVVsZ3NQY1BNU2doTQ?oc=5,Reuters via Google (Top),2026-06-05T04:39:15+00:00,,,2026-06-05T02:00:51+00:00
reuters_via_google:19b94dbb1b92,reuters_via_google,EU considers limiting protection for Ukrainian men of fighting age - Reuters,https://news.google.com/rss/articles/CBMiowFBVV95cUxONkhrX3BaeUsxQ0lvQ09tWGFNQ01MWUExQ2YyeEtFV3VQVHEtSFpsbUFSWTlQZEVZTkZoc2lHSm8tU19kSDF0dzdNSEtqRTFmeVBDTkFCX2p0cTZ0NjhXSGxJTVpNNmZ3MXFsOFExamdKaG1pYTR6WXJsMHFWNC1XSnFWQV9WZjVnSWFtMzFvOFpNOWVkcGVmMkdXcEFCRlhXMXNB?oc=5,Reuters via Google (Top),2026-06-05T03:12:04+00:00,,,2026-06-05T02:00:51+00:00
reuters_via_google:8d08c41c4599,reuters_via_google,"Marjane Satrapi, Iranian-French author of graphic novel 'Persepolis', dies aged 56 - Reuters",https://news.google.com/rss/articles/CBMizwFBVV95cUxPVUV6WWw0Smx4TF9DRzdYdVJTdlJHMnlWWlAxLXlMSWpjQ1dNWjkyTmlrN0d2RFluZGQzWmFjYTBLZWYwdlFjNmduNDFhTElYM1VoRDRyZTRoMEoxX19UNm1DdDQwT3I4Z3FSMWMwUGp4WEprdldtV29SaUFVYnMySk1Vb3NGN1BCVEtqczhnOXFwb3ZLd3JZZUFPYW9OZHRfTmVhMjQtRmlrU21HaGRBMHBhZmpoS2R2VHZuQUhaVXZXdUlCYTNleVJTR1VuTFU?oc=5,Reuters via Google (Top),2026-06-04T16:36:13+00:00,,,2026-06-05T02:00:51+00:00
reuters_via_google:f827358e35ca,reuters_via_google,Airbus delivered 81 jets in May after China logjam eases - Reuters,https://news.google.com/rss/articles/CBMitwFBVV95cUxQNU9FZ1otVTFsNVM0ekJ2ajZYQmlwUDVnYUJvanNXU2ItSHFJc054MDNJMElDWlhiS20xamxabERvRVFTNnRTaUxoeHFkdVVMZDIwd0FNeU00UTFjRTd4SVR4TGx4ZHEyejZQS2lpcFNBZFpYTjlXN2RMQ09LZ3I0eGFBaEJSY1NyQTFlcGdGWHZ3cHE4VGpXdXVNV01qZ1JmVVZfbUlJTFFRM2FOM0VNaWNpNUFHbVk?oc=5,Reuters via Google (Top),2026-06-04T18:25:11+00:00,,,2026-06-05T02:00:51+00:00
reuters_via_google:07e46ab715c4,reuters_via_google,Clashes break out at Belgian protest against education reforms - Reuters,https://news.google.com/rss/articles/CBMiowFBVV95cUxQNl9aMEVHU3VOTmQzMFdQRnpqaTFhY2NHUmE4V3k2eGRBeE9lLVhMVEtjN0JtSEhfRGhLa2N2alFkdF9SQ2w0MkQyOHdNYXozMjNNSEk0Vl9hTG5GZ2RPdktvVjY1Y0FrcUVOVGJPcVZ1M2k0SFM2TGNNQ1Jua0dRb0pVS09fZ2p1bFJFQkNRS0Z2ekp4LWRPVHhSU19IT2xZUUVr?oc=5,Reuters via Google (Top),2026-06-04T22:08:45+00:00,,,2026-06-05T02:00:51+00:00
reuters_via_google:97403312bcb4,reuters_via_google,Sweden urges EU to tighten rules on tourist visas for Russians - Reuters,https://news.google.com/rss/articles/CBMimgFBVV95cUxOcmpNakJaY1Boc0NpTEdMQ1BJTlY5YXNqdEViSEpYTTVvNk5fYVh1UFUwN3gycVpIOFRtQXpYNWw5a2IzNlhtR19rM0NDNTRERGU0TFM3VkdVaDhKNFFKSnNfQ2NDUTEyWGk4TVIzNHFSVzc1Tno1c01HbmJUNU9tLU0xNXRjcU9aZDZyUVF1M1BiZTVma3NWLVhn?oc=5,Reuters via Google (Top),2026-06-04T18:56:08+00:00,,,2026-06-05T02:00:51+00:00
reuters_via_google:7ae01a9a9331,reuters_via_google,"Goldman Sachs expects SpaceX's AI revenue to surge 100-fold by 2030, FT reports - Reuters",https://news.google.com/rss/articles/CBMizgFBVV95cUxOTlQzVjlXc3RCUDlrd3JWVTcyV1ZPcm1VWnpTeFl3VldTOTY5b3EtaXdFS3Jidmp3RktsLXloQ19KdTNCV21EMnZfNzM4V3lEUVdfaG9jT2oxTm1DNG5hLWJFQTdjdVJ3eURCMG5DNk5zZGM4TndVR3QzczZRc2NSUTBpVmplYWJjZm9BYWJLRlUzb3ExLTNjUUxsUGtGMWN2OGRfa2QtM05PYVhEcnhCUjhramEtREJlVjVzU01CTU1tRG12ajRicnhXVVlwdw?oc=5,Reuters via Google (Top),2026-06-04T20:46:46+00:00,,,2026-06-05T02:00:51+00:00
reuters_via_google:f67d76480b52,reuters_via_google,"Singapore Airlines in talks for major new jet order, sources say - Reuters",https://news.google.com/rss/articles/CBMiwAFBVV95cUxPLTJ2THZJWHl2OGF1aVFmbGFfV01ZeFNxYzhYRGVPc1Z6eGFxNWRHVDJfbGhYZS1rdEg0ZTZfLWUxbXRBcGZ4ZHJ6RERmWEIxN2JpSGRackdPUzdma0dGZUNXemRlYXViUXltQTM3RGNTYThacHBnV1lDVXZQYmVJMnhfRF9ad1FWcnRpeWdYamRzenB1NldocjlPeVd6NGdvS2EyUmhSbUF0eHlLWW1LanJaOHlUalowdDFGVmFDc0s?oc=5,Reuters via Google (Top),2026-06-04T17:11:15+00:00,,,2026-06-05T02:00:51+00:00
reuters_via_google:79392188fc6a,reuters_via_google,"US races to contain flesh-eating parasite screwworm, reports no further cases - Reuters",https://news.google.com/rss/articles/CBMirwFBVV95cUxQNHpEZTNTbzV6TUNwX2dsQlotNEVYZElrMW9wbUp0RmpObHVWZXhCSEJnM0c0MnFtdWtVdzBKRW5GRWl5Q1NQZTY0a0pjT2hVWWh5U1dMcjlfM3dTSWtyZ1p2X1cwRERuenJXZlM2Y2ZXcVRCLUZZZTNtZk5QUzBGSW9RY1YyQjJBWmNReGFocUw1VmRYeU9uazhWWVdXam1JY19laThycGhZaVJ1VFZN?oc=5,Reuters via Google (Top),2026-06-04T21:53:00+00:00,,,2026-06-05T02:00:51+00:00
reuters_via_google:15914246abe7,reuters_via_google,US House lawmakers release draft bill to prohibit state AI rules - Reuters,https://news.google.com/rss/articles/CBMimgFBVV95cUxPcG5Sb0owaXRhbUlnSGpYRWV3c3lYOTRva2FsdE1ZYjZDYTRmU2FYS0wwa2VNYTBSblB3cHRsbjJOXzNMQllnU1QzNjU0THJmZ0ZhVmllV2hGZllQU2NZaEVhOTlYWTJxeVZPa2psOG5kOFdEaEx0MU9vSzlhemRycGotbkJUWE95aElJbjVweFhMaXZGS0tMdFRn?oc=5,Reuters via Google (Top),2026-06-05T02:44:57+00:00,,,2026-06-05T02:00:51+00:00
reuters_via_google:183fab4af520,reuters_via_google,Several people killed in plane crash in Croatia's Istria region - Reuters,https://news.google.com/rss/articles/CBMinwFBVV95cUxQTmNPQmVqaUV3S1Z0cV9yaE02S2trZmFaU25COUR4RDZsdzdtRXNVY0VmVnowZUwxYTB4NkN5cWllbU1PRGZ0OEtWRXhJS1JoQVdZWGxqek1fVXBvYkh1aVNHb0tEZDQxQjdOR1Jub1c1WERoZ0FxQTN3X3M0UDZvdWl2MVN1dXNQcktlNzNzR20xLXAzM0JtOElONGVoNEE?oc=5,Reuters via Google (Top),2026-06-04T18:35:38+00:00,,,2026-06-05T02:00:51+00:00
reuters_via_google:88d2a6e8b05f,reuters_via_google,Putin faces rival visions of war and peace at Russia's 'Davos' - Reuters,https://news.google.com/rss/articles/CBMimgFBVV95cUxOTTJRTHBCTURmWWtXSlBDdjlVMGhSN3FIN0hISnNMSjhJZnFJdXhQeXlabVB2TVl4M19uUDFMYW5xTDROUl9USzRHZ05ZbnpHM1JfMEl0cmZDQ2tSVkJOV3NFSmdXRHZxbTZ4cnNwa2VGQ282Z3JWTzB2NGpRdG1qMTZQZXRTZHEyQ2JrNDllWHJoTnVNMFItanJ3?oc=5,Reuters via Google (Top),2026-06-04T23:40:09+00:00,,,2026-06-05T02:00:51+00:00
reuters_via_google:b007d645a377,reuters_via_google,"Exclusive: Satellite images show suspected structure at disputed South China Sea atoll, but later gone - Reuters",https://news.google.com/rss/articles/CBMixAFBVV95cUxPUllzdmNweFJPQzdIWTdaeVlHcEt2VjRveTMxYU5NUUVxOFJJWV9YeFZ3UzVfcFV1NzlCUGdjM2g5MWg0ZjdLRUU3WnBJekgtNEE5b1V1SDBZaDBQTGtjdTI1bHlpZ29lei1RYThIY1NDbWNWcWFXOTdPZXJJTndqeXl2S0VEUXc3enYtXzFxd0dOTkVnbzJzU3pxRGFDNldqVUg1aVQybGVuZEw3MUp3Sm45M0k5SHhxVkhCZTZNWHZDRXZM?oc=5,Reuters via Google (Top),2026-06-04T18:17:00+00:00,,,2026-06-05T02:00:51+00:00
reuters_via_google:cf16794cb514,reuters_via_google,Honeywell's Quantinuum valued at $17.6 billion as shares rise in Nasdaq debut - Reuters,https://news.google.com/rss/articles/CBMiugFBVV95cUxOUDhiWmdEaFMzb05UYVVQY2tTOEZpb2c1eEdGRUlwbDlRVE1HSXNSd0pTTS1WT1R2U0ozU0poM0xIUXpRSHd0elFfWFphSmthbXVJS2hOVWNlUGtIaThaOVFRZVA0U2VoS3lKYlRqaEhTYmoydGM5WFN2VHBvOUd5VFVRS1l4OTRCSGNyWngtMU5qbjFWSTVrTkRoQ1NkYnFOXzkxOEM5aFExT3dfa3ZROWhNVWFMU1Q2elE?oc=5,Reuters via Google (Top),2026-06-05T03:59:43+00:00,,,2026-06-05T02:00:51+00:00
reuters_via_google:b320c1bf7b3e,reuters_via_google,Hezbollah rejection clouds Lebanon ceasefire and prospects for ending Iran war - Reuters,https://news.google.com/rss/articles/CBMipAFBVV95cUxQaC1FUm1UYy1rOVFvcUI1MGY3T1U2VVQtMkVKandMNGZ1WHIxSC00blRhLWhtdDFUellNNXBJTWpMOUV5SmlfbkRmV0FGYkptYnBUZ3pndldld2VvYnF5TGtUN2cxLVhsVG9kcXlLaGRwbThxdTIzS1pOOEZLT2NJTV9WaG9GMG5aWEJTSGhfcXJGeUpic1VQY0Q2bGM0YWQyYVRtYg?oc=5,Reuters via Google (Top),2026-06-05T00:20:17+00:00,,,2026-06-05T02:00:51+00:00
