id,domain,title,authors,published,abstract,url,categories
2605.03932,Quantum,Magic-Informed Quantum Architecture Search,"Vincenzo Lipardi, Domenica Dibenedetto, Georgios Stamoulis, Mark H. M. Winands",2026-05-05T16:20:46Z,"Nonstabilizerness, commonly referred to as magic, is a fundamental resource underpinning quantum advantage. In this paper, we propose a magic-informed quantum architecture search (QAS) technique that enables control over a quantum resource within the general framework of circuit design. Inspired by the AlphaGo approach, we tackle the problem with a Monte Carlo Tree Search technique equipped with a Graph Neural Network (GNN) that estimates the magic of candidate quantum circuits. The GNN model induces a magic-based bias that steers the search toward either high- or low-magic regimes, depending on the target objective. We benchmark the proposed magic-informed QAS technique on both the structured ground-state energy problem and on the more general quantum state approximation problem, spanning different sizes and target magic levels. Experimental results show that the proposed technique effectively influences the magic across the search tree and notably also on the resulting final circuit, even in regimes where the GNN operates on out-of-distribution instances. Although introducing a problem-agnostic magic bias could, in principle, constrain the search dynamics, we observe consistent improvements in solution quality across all problems tested.",https://arxiv.org/abs/2605.03932v1,"quant-ph, cs.AI"
2605.03930,Quantum,Time-dependent variational Monte Carlo without bias,"Wladislaw Krinitsin, Markus Schmitt",2026-05-05T16:20:02Z,"When combined with highly expressive ansatz functions such as neural quantum states, variational Monte Carlo (VMC) constitutes a versatile numerical approach to tackle the quantum many-body problem in and out of equilibrium. However, its traditional formulation exhibits a subtle estimation bias leading to inaccuracies, which can be particularly detrimental when addressing real time dynamics. In this work, we investigate two avenues to circumvent said estimation bias. First, we propose an unbiased variant of time-dependent VMC using self-normalized importance sampling with respect to a cutoff-based deformation of the Born distribution. We demonstrate the feasibility and accuracy of the approach in pathological and generic cases of quench dynamics. Furthermore, we explore an alternative sampling strategy based on active learning via the tensor cross interpolation (TCI). While we find that our choice of tensor network architecture lacks the required low rank property, the proposed TCI-based algorithm complements the conventional importance sampling paradigm, providing an alternative perspective that may be further explored in future work.",https://arxiv.org/abs/2605.03930v1,quant-ph
2605.03910,Quantum,Inverse-designed release-free optomechanical crystal with high photon-phonon coupling,"David Hambraeus, Paul Burger, Johan Kolvik, Philippe Tassin, Raphaël Van Laer",2026-05-05T16:07:30Z,"Interactions between light and mechanics provide a powerful interface between optical and microwave-frequency signals, with applications spanning classical signal processing and quantum technologies. High-performance optomechanical devices require both strong photon-phonon coupling and tolerance to parasitic laser heating. Release-free optomechanical crystals provide improved thermal anchoring compared to suspended nanobeams, but have so far exhibited weaker vacuum optomechanical coupling rates, leaving a trade-off between coupling strength and thermal robustness. Here, we largely close this gap: we design and experimentally demonstrate a release-free silicon optomechanical crystal with a record vacuum optomechanical coupling rate of about $g_\text{OM} / (2 π) = 800$ kHz, comparable to suspended state-of-the-art devices. The resulting optomechanical scattering rate $Γ_\text{OM}/(2 π)= 1.1$ kHz is nearly twice that of previous release-free implementations. This performance is achieved by combining physics-guided human intuition with a multiphysics inverse-design algorithm introduced here for resonant optomechanical structures. Beyond the specific device demonstrated, the inverse-design framework is applicable to co-optimizing optical and mechanical resonances and eigenmodes more broadly. These results strengthen release-free optomechanical crystals as a platform for fast, low-noise classical and quantum optomechanics.",https://arxiv.org/abs/2605.03910v1,"physics.optics, quant-ph"
2605.03906,Quantum,Variational Joint Magnetometry and Gradiometry on Dipolar Spin Chains,"Priyam Srivastava, Xin Jin, Junyu Liu, Gurudev Dutt, Tom Purdy, Kang Kim, Kaushik P. Seshadreesan",2026-05-05T15:59:22Z,"Estimating a uniform magnetic field B0 and its spatial gradient g on a dipolar-coupled spin chain calls for a multiparameter figure of merit. The GHZ state, optimal for single-parameter Heisenberg-limited sensing, has a rank-one quantum Fisher information matrix with det(Q^GHZ) = 0 at every chain length N, ruling it out for the two-parameter problem. We present a variational framework that takes det(F) as the objective and a hardware-motivated layered dipolar circuit as the ansatz. Both encoding generators are diagonal in the computational basis, which reduces the search for the quantum Fisher information benchmark to a probability-simplex optimization and yields a tractable best-found benchmark det(Q*) against which variational performance is compared. The same diagonal structure makes the classical Fisher information depend only on basis-state probabilities under any single-qubit decoder, so encoder and decoder parameters are co-trained with CMA-ES in a single run. Decoder optimization past fixed Ramsey adds at most a few percentage points across the grid, in contrast to the persistent decoder gains seen in our prior single-parameter work. Variational probes at L = 3 reach 0.92 of the best-found benchmark at N = 5, a 4.2x SQL advantage in det(F), and concentrate on a four-string motif of the two GHZ extrema and two half-chain-flip strings whose structure follows from the Dicke-sector decomposition of the two generators.",https://arxiv.org/abs/2605.03906v1,quant-ph
2605.03901,Quantum,Graph Neural Networks in the Wilson Loop Representation of Abelian Lattice Gauge Theories,"Ali Rayat, Gia-Wei Chern",2026-05-05T15:55:21Z,"Local gauge structures play a central role in a wide range of condensed matter systems and synthetic quantum platforms, where they emerge as effective descriptions of strongly correlated phases and engineered dynamics. We introduce a gauge-invariant graph neural network (GNN) architecture for Abelian lattice gauge models, in which symmetry is enforced explicitly through local gauge-invariant inputs, such as Wilson loops, and preserved throughout message passing, eliminating redundant gauge degrees of freedom while retaining expressive power. We benchmark the approach on both $\mathbb{Z}_2$ and $\mathrm{U}(1)$ lattice gauge models, achieving accurate predictions of global observables and spatially resolved quantities despite the nonlocal correlations induced by gauge-matter coupling. We further demonstrate that the learned model serves as an efficient surrogate for semiclassical dynamics in $\mathrm{U}(1)$ quantum link models, enabling stable and scalable time evolution without repeated fermionic diagonalization, while faithfully reproducing both local dynamics and statistical correlations. These results establish gauge-invariant message passing as a compact and physically grounded framework for learning and simulating Abelian lattice gauge systems.",https://arxiv.org/abs/2605.03901v1,"cond-mat.str-el, cs.LG, hep-lat, quant-ph"
2605.03891,Quantum,Parameterized Families of Toric Code Phase: $em$-duality family and higher-order anyon pumping,"Shuhei Ohyama, Takamasa Ando, Ryan Thorngren",2026-05-05T15:48:37Z,"Within the toric-code phase, we study parameterized families of topologically ordered states. We construct $1$- and $2$-parameter families of local Hamiltonians and confirm their non-triviality via topological pumping. For the $1$-parameter family, we show that the $em$-exchange defect is pumped into the bond Hilbert space of a tensor-network representation. For the $2$-parameter case, we construct a ``pump of a pump'' that transports an $S^1$-family of a system in one lower spatial dimension. Using similar methods, we also present a $1$-parameter family with a higher-order anyon pump that produces corner-localized anyon modes. These constructions provide explicit lattice realizations and concrete diagnostics of family-level topology. We use recently developed boundary algebra methods to study the non-triviality of these families.",https://arxiv.org/abs/2605.03891v1,"cond-mat.str-el, hep-th, math-ph, quant-ph"
2605.03864,Quantum,The power of entanglement in distributed quantum machine learning,"Yerim Kim, Kiwmann Hwang, Hyukjoon Kwon, Yosep Kim",2026-05-05T15:26:11Z,"The quantum internet aims to interconnect distant devices and enable large-scale computation through distributed quantum algorithms. One of the key obstacles is communication latency during computation. Even separations of a few hundred kilometers introduce millisecond-scale delays, which exceed the coherence times of many solid-state qubit platforms. In contrast, entanglement can be established beforehand and used as a practical resource to reduce communication complexity between remote nodes. Here we examine the utility of entanglement in distributed quantum machine learning for binary classification tasks. Drawing an analogy with the CHSH game, we show that entanglement improves classification accuracy across all datasets considered. We also find that excessive entanglement may degrade performance by reducing the effective dimension of the parameter space. This highlights the importance of using an appropriate amount and structure of entanglement in data embedding. Our findings bridge nonlocality and machine-learning advantage, providing a pathway toward distributed quantum computation beyond coherence-time constraints.",https://arxiv.org/abs/2605.03864v1,quant-ph
2605.03854,Quantum,Space-Time Tradeoffs of Pauli-Based Computation in Distributed qLDPC Architectures,"Naphan Benchasattabuse, Michal Hajdušek, Rodney Van Meter",2026-05-05T15:19:56Z,"Pauli-based computation (PBC) provides a universal framework for executing fault-tolerant quantum algorithms using Pauli measurements and magic states. In monolithic architectures, the serialized nature of PBC directly ties runtime to a circuit's T-gate count, making it slow on metrics like circuit depth. However, in distributed quantum computing (DQC), the primary bottleneck is remote Bell pair generation. We investigate the tradeoff between error-correcting code block size and execution time of PBC within the Q-Fly architecture at intermediate scale, limiting individual node capacities to reflect near-term constraints while supplying abundant network nodes to minimize routing and compilation effects. We find that large qLDPC code blocks outperform the surface code baseline in terms of execution time by up to an order of magnitude when evaluated against quantum optimization algorithms. By moving groups of qubits to free nodes to bypass the sequential bottleneck of PBC, the large-block architecture minimizes network operations and achieves faster overall execution. This demonstrates that PBC is a competitive model in the distributed regime, establishing it as a practical compilation baseline for qLDPC systems before invoking more efficient transversal or homological gates.",https://arxiv.org/abs/2605.03854v1,quant-ph
2605.03836,Quantum,Path integral quantization of the electromagnetic field in nonlinear dielectric materials,"Arman Kashef, Oscar Perearnau Herrero, Alexander Szameit, Marco Ornigotti, Stefan Scheel",2026-05-05T15:03:07Z,"We construct a quantum theory of light in nonlinear dielectric media with dispersion and absorption. We employ a mesoscopic model for the light-matter interaction that include a fourth-order nonlinearity in the material response. Quantization is performed by constructing an effective action in a path-integral formalism by integrating out matter and bath degrees of freedom. We show how a nonlinear response function associated with Kerr nonlinearity is obtained through the model and, after full field quantization, we derive the Feynman rules from this theory.",https://arxiv.org/abs/2605.03836v1,"quant-ph, physics.optics"
2605.03831,Quantum,"Reply to Comment on ""Controlling the Dynamical Evolution of Quantum Coherence and Quantum Correlations in $e^{+}e^{-} \to Λ\barΛ$ Processes at BESIII""","Elhabib Jaloum, Mohamed Amazioug",2026-05-05T15:01:23Z,"We thank the Commentator for his detailed critique, which provides an opportunity to clarify the physical foundations of our work. While we appreciate the emphasis on rigor when applying quantum information concepts to high-energy physics (HEP), we respectfully disagree with the assertion that our assumptions lack a physical or operational basis. In the following sections, we address each point raised, demonstrating that our modeling is grounded in the established physics of QCD fragmentation and production dynamics in $e^+e^-\to Λ\barΛ$, as supported by recent experimental and theoretical advancements. Our approach treats the system as an effective open bipartite system during the intrinsic production stage, rather than during post-production propagation, which aligns with the analyses cited in our references.",https://arxiv.org/abs/2605.03831v1,"quant-ph, hep-ph"
2605.03829,Quantum,A Berry-Esseen Bound for Quantum Lattice Systems,"Marcus Cramer, Fernando G. S. L. Brandão, Mădălin Guţă, Álvaro M. Alhambra, Matteo Scandi",2026-05-05T14:58:16Z,"It is expected that the statistical fluctuations of local observables in large quantum systems obey the central limit theorem, and approximate a normal distribution as their size grows. Here, we prove a version of the Berry-Esseen theorem for quantum lattice systems, which strengthens that central limit theorem by providing a rigorous convergence estimate towards the normal distribution for large but finite system size. Given a local quantum Hamiltonian on $N$ particles and a quantum state with a finite correlation length, the result states that the measurement of local observables such as the energy follows a normal distribution, up to an error scaling as $\mathcal{O}\left(N^{-\frac{1}{2}} \text{polylog}(N)\right)$, which is optimal up to logarithmic factors.",https://arxiv.org/abs/2605.03829v1,"quant-ph, cond-mat.stat-mech"
2605.03826,Quantum,Coherent transport in non-Abelian quantum graphs,"A. V. Poshakinskiy, L. E. Golub",2026-05-05T14:54:24Z,"We study quantum charge transport in two-dimensional networks in the presence of a magnetic field and spin-orbit interaction. The interplay of the corresponding Abelian and non-Abelian gauge fields leads to an intricate behavior of the conductance, which has different periodicities in the diffusive and ballistic regimes. We classify all configurations of magnetic and spin-orbit fields where a logarithmically divergent weak-(anti)localization correction appears in the diffusive regime. The conductivity of topologically distinct configurations is the same in the diffusive regime but different in the ballistic regime. The proposed setup provides a feasible realization of quantum graphs with non-Abelian gauge fields.",https://arxiv.org/abs/2605.03826v1,"cond-mat.mes-hall, cond-mat.dis-nn, quant-ph"
2605.03807,Quantum,The Geometric Part of Decoherence: Quasi-Orthogonality in High-Dimensional Hilbert Spaces,Karl Svozil,2026-05-05T14:31:58Z,"We isolate a geometric mechanism that complements the dynamical suppression of macroscopic interference: In a high-dimensional Hilbert space, almost all state vectors are nearly orthogonal, accommodating an exponentially large reservoir of mutually quasi-orthogonal environmental records. This geometry explains why macroscopic alternatives fail to exhibit visible interference once such records are populated. The argument is conditional and finite-dimensional, and it leaves the interpretive core of quantum mechanics untouched: geometry alone does not select a pointer basis, does not guarantee that a given Hamiltonian drives the system into typical regions of the accessible subspace, and does not turn an improper mixture into a proper one. It merely supplies the vast Hilbert-space capacity that makes decoherence so overwhelmingly effective for all practical purposes.",https://arxiv.org/abs/2605.03807v1,quant-ph
2605.03794,Quantum,Caustics and catastrophes in strong-field physics -- Picard--Lefschetz theory as a universal approach to saddle-point methods in attosecond science,Anne Weber,2026-05-05T14:21:49Z,"Ultrashort laser pulses on the attosecond timescale are typically achieved via high-order harmonic generation (HHG), a nonlinear process in which atoms interact with intense light fields to emit a broad spectrum of harmonics. HHG is commonly described in terms of a `quantum orbits' model based on several interfering electron trajectories, thereby incorporating both quantum-mechanical effects and an intuitive picture of classical dynamics. By tuning the parameters of the driving laser field, the interplay between these trajectories can be controlled, shaping the emitted light. Mathematically, this model expresses the harmonic response as a highly oscillatory integral. Applying saddle-point methods to this integral allows it to be decomposed into contributions from distinct saddle points of the semi-classical action, thereby linking quantum dynamics to classical trajectories. However, a general framework for applying these methods across arbitrary parameters and laser configurations has been missing.   In this thesis, we introduce Picard--Lefschetz theory and develop practical numerical methods for its application. These enable the evaluation of oscillatory integrals and identification of contributions from individual critical points.   We apply these techniques to strong-field ionisation and HHG, focusing on caustics -- enhancement features where trajectories coalesce and standard approximations fail. Our methods remain valid in these regions, allowing systematic analysis of parameter regimes and revealing previously inaccessible features. This work improves the understanding and control of ultrafast light--matter interactions.",https://arxiv.org/abs/2605.03794v1,quant-ph
